,time,author,comment,header
20,11月30日 ,安徽股友,"今日<span class=""showStock"" id=""stock_sh600346"">恒力股份</span><span id=""quote_sh600346""></span>主力净流入额达657.75万元，净占比5.12%， 其中超大单净流入额838.24万元,净占比6.90%， 大单净流入额-180.49万元，净占比-1.49%。       <span class=""showStock"" id=""stock_sh600346"">恒力股份</span><span id=""quote_sh600346""></span>资金流向数据    类型 流入(万元) 流出(万元)   超大 1146.03 -307.79   大单 3561.90 -3742.39   中单 4053.13 -4225.50   小单 3380.03 -3865.42      资金解读   <span class=""showStock"" id=""stock_sh600346"">恒力股份</span><span id=""quote_sh600346""></span>收盘涨幅1.57%，  其中，成交最活跃的价格分别为13.61、13.58、13.57，成交密集的手数区间分布于300-500、500-700、200-300手，中单介入居多。   成交活跃统计 9:30-15:00 成交均价 13.46    成交价格 主买累计成交量 主卖累计成交量 主买占比 主卖占比   13.61 426000 64800 4.48% 0.68%   13.58 331000 79700 3.48% 0.84%   13.57 195500 75500 2.05% 0.79%   13.60 220500 0 2.32% 0.00%   13.59 115600 64500 1.21% 0.68%     成交手数分布 主买累计成交量 主卖累计成交量 主买估算笔数 主卖估算笔数   300-500 328867 366602 658  733    500-700 564154 107500 806  154    200-300 284495 266400 948  888    150-200 286356 120800 1432  604    700-1000 80200 0 80  0      左右拖动表格，可查看剩余表格内容 行业个股资金流    化纤行业成分股主力净流入排行   序号 代码 名称 涨幅 主力净流入   1 600810 <span class=""showStock"" id=""stock_sh600810"">神马股份</span><span id=""quote_sh600810""></span>  7.36% 2976.64万   2 600346 <span class=""showStock"" id=""stock_sh600346"">恒力股份</span><span id=""quote_sh600346""></span>  1.57% 657.75万   3 002493 <span class=""showStock"" id=""stock_sz002493"">荣盛石化</span><span id=""quote_sz002493""></span>  -1.28% 500.98万   4 002254 <span class=""showStock"" id=""stock_sz002254"">泰和新材</span><span id=""quote_sz002254""></span>  0.19% 246.89万   5 000955 <span class=""showStock"" id=""stock_sz000955"">欣龙控股</span><span id=""quote_sz000955""></span>  1.15% 164.28万     数据来源:<span id=""show_stock_str"" ></span>",恒力股份11月30日资金揭秘
21,11月30日 ,江苏股友,"股市上有句名言，新手死于追高,老手死于抄底,高手死于杠杆。抄底不是好玩的，一波牛市的末尾，基本都是大量的抄底盘被套，很多甚至是躲过了高 点，躲过了暴跌，躲过了股灾的，但却死在了抄底了路上，那么问题来了，抄底不应该吗?有没有抄底的绝招呢?自从有了股市，试问有谁不想抄底和逃顶？那为什么说不愿意抄底和逃顶呢？理由分析如下：理由一：机构的大资金是无法抄底的，也是无法逃顶的。他们建仓是分批的，减仓也是分批的。他们强调是一个区域理由二：抄底和逃顶强调发挥股民的主观能动性，而且顶部和底部的形成是在不知不觉中产生的，主观的想象往往又是不正确的理由三：特别是牛市和熊市还不能确认之时，把握阶段底部和顶部更是难上加难底部和顶部是不能发挥主观能动性，完美的预测抄底和逃顶是不可能的，但在盘面上通过技术形态信号发觉抄底和逃顶信号还是可以的，接下来分享下三金叉见底和见顶信号：",资深操盘手自述如何判断抄底
22,11月30日 ,吉林股友,11月29日恒力股份沪股通持仓数据     收盘价： 13.40 涨跌幅： -0.81%   持股量： 748.78万股 持股变化： 4.27万股      数据显示，截至11月29日恒力股份于沪股通持股量为748.78万股，占其A股股本比例为0.81%，比上一交易日增加4.27万股。据数据统计，该股近一个月内累计涨幅为-4.29%，沪股通累计减仓105.62万，沪股通持仓累计变化比例为-12.36%，近三个月内累计涨幅为-17.80%，沪股通累计加仓45.33万，沪股通持仓累计变化比例为6.44%。  数据来源:,恒力股份11月29日获沪股通加仓4.27万
23,11月29日 ,安徽股友,"今日<span class=""showStock"" id=""stock_sh600346"">恒力股份</span><span id=""quote_sh600346""></span>主力净流入额达-1055.89万元，净占比-7.06%， 其中超大单净流入额-680.27万元,净占比-4.60%， 大单净流入额-375.62万元，净占比-2.54%。       <span class=""showStock"" id=""stock_sh600346"">恒力股份</span><span id=""quote_sh600346""></span>资金流向数据    类型 流入(万元) 流出(万元)   超大 853.66 -1533.93   大单 2795.54 -3171.15   中单 6197.42 -5482.22   小单 4947.51 -4606.83      资金解读   <span class=""showStock"" id=""stock_sh600346"">恒力股份</span><span id=""quote_sh600346""></span>收盘涨幅-0.81%，  其中，成交最活跃的价格分别为13.68、13.69、13.70，成交密集的手数区间分布于200-300、300-500、2000-3000手，中单介入居多。   成交活跃统计 9:30-15:00 成交均价 13.49    成交价格 主买累计成交量 主卖累计成交量 主买占比 主卖占比   13.68 367024 102466 3.32% 0.93%   13.69 283500 81200 2.57% 0.74%   13.70 261400 56100 2.37% 0.51%   13.72 18700 0 0.17% 0.00%   13.71 3800 0 0.03% 0.00%     成交手数分布 主买累计成交量 主卖累计成交量 主买估算笔数 主卖估算笔数   200-300 300200 180300 1001  601    300-500 187800 141181 376  282    2000-3000 0 200000 0  67    1000-1500 142500 0 95  0    700-1000 81200 0 81  0      左右拖动表格，可查看剩余表格内容 行业个股资金流    化纤行业成分股主力净流入排行   序号 代码 名称 涨幅 主力净流入   1 000936 <span class=""showStock"" id=""stock_sz000936"">华西股份</span><span id=""quote_sz000936""></span>  4.82% 14756.43万   2 002254 <span class=""showStock"" id=""stock_sz002254"">泰和新材</span><span id=""quote_sz002254""></span>  -0.56% 132.28万   3 002064 <span class=""showStock"" id=""stock_sz002064"">华峰氨纶</span><span id=""quote_sz002064""></span>  -0.49% 65.75万   4 000949 <span class=""showStock"" id=""stock_sz000949"">新乡化纤</span><span id=""quote_sz000949""></span>  -0.35% 46.22万   5 000782 <span class=""showStock"" id=""stock_sz000782"">美达股份</span><span id=""quote_sz000782""></span>  -3.61% -5.03万   23 600346 <span class=""showStock"" id=""stock_sh600346"">恒力股份</span><span id=""quote_sh600346""></span>  -0.81% -1055.89万     数据来源:<span id=""show_stock_str"" ></span>",恒力股份11月29日资金揭秘
24,11月29日 ,吉林股友,"11月28日<span class=""showStock"" id=""stock_sh600346"">恒力股份</span><span id=""quote_sh600346""></span>沪股通持仓数据     收盘价： 13.51 涨跌幅： 4.57%   持股量： 744.51万股 持股变化： 5363股      数据显示，截至11月28日<span class=""showStock"" id=""stock_sh600346"">恒力股份</span><span id=""quote_sh600346""></span>于沪股通持股量为744.51万股，占其A股股本比例为0.80%，比上一交易日增加5363股。据数据统计，该股近一个月内累计涨幅为-3.29%，沪股通累计减仓98.56万，沪股通持仓累计变化比例为-11.69%，近三个月内累计涨幅为-16.37%，沪股通累计减仓5.85万，沪股通持仓累计变化比例为-0.78%。  数据来源:<span id=""show_stock_str"" ></span>",恒力股份11月28日获沪股通加仓5363
25,11月28日 ,安徽股友,"今日<span class=""showStock"" id=""stock_sh600346"">恒力股份</span><span id=""quote_sh600346""></span>主力净流入额达-868.98万元，净占比-3.25%， 其中超大单净流入额-1292.94万元,净占比-4.90%， 大单净流入额423.96万元，净占比1.61%。       <span class=""showStock"" id=""stock_sh600346"">恒力股份</span><span id=""quote_sh600346""></span>资金流向数据    类型 流入(万元) 流出(万元)   超大 1420.86 -2713.80   大单 9320.72 -8896.76   中单 10864.31 -8660.23   小单 4796.13 -6131.22      资金解读   <span class=""showStock"" id=""stock_sh600346"">恒力股份</span><span id=""quote_sh600346""></span>收盘涨幅4.57%，  其中，成交最活跃的价格分别为13.68、13.67、13.69，成交密集的手数区间分布于300-500、500-700、700-1000手，中单介入居多。   成交活跃统计 9:30-15:00 成交均价 13.31    成交价格 主买累计成交量 主卖累计成交量 主买占比 主卖占比   13.68 116400 56400 0.58% 0.28%   13.67 79300 58700 0.40% 0.29%   13.69 59800 22800 0.30% 0.11%   13.70 51500 0 0.26% 0.00%   13.66 12400 19500 0.06% 0.10%     成交手数分布 主买累计成交量 主卖累计成交量 主买估算笔数 主卖估算笔数   300-500 832000 749002 1664  1498    500-700 151000 437500 216  625    700-1000 0 400800 0  401    1000-1500 100000 260800 67  174    1500-2000 0 192100 0  96      左右拖动表格，可查看剩余表格内容 行业个股资金流    化纤行业成分股主力净流入排行   序号 代码 名称 涨幅 主力净流入   1 002493 <span class=""showStock"" id=""stock_sz002493"">荣盛石化</span><span id=""quote_sz002493""></span>  -0.10% 1273.52万   2 000955 <span class=""showStock"" id=""stock_sz000955"">欣龙控股</span><span id=""quote_sz000955""></span>  4.75% 456.96万   3 000677 <span class=""showStock"" id=""stock_sz000677"">恒天海龙</span><span id=""quote_sz000677""></span>  2.43% 274.02万   4 600063 <span class=""showStock"" id=""stock_sh600063"">皖维高新</span><span id=""quote_sh600063""></span>  0.77% 134.05万   5 002042 <span class=""showStock"" id=""stock_sz002042"">华孚时尚</span><span id=""quote_sz002042""></span>  0.52% 109.20万   20 600346 <span class=""showStock"" id=""stock_sh600346"">恒力股份</span><span id=""quote_sh600346""></span>  4.57% -868.98万     数据来源:<span id=""show_stock_str"" ></span>",恒力股份11月28日资金揭秘
26,11月28日 ,吉林股友,"11月27日<span class=""showStock"" id=""stock_sh600346"">恒力股份</span><span id=""quote_sh600346""></span>沪股通持仓数据     收盘价： 12.92 涨跌幅： 3.44%   持股量： 743.97万股 持股变化： -51.22万股      数据显示，截至11月27日<span class=""showStock"" id=""stock_sh600346"">恒力股份</span><span id=""quote_sh600346""></span>于沪股通持股量为743.97万股，占其A股股本比例为0.80%，比上一交易日减少51.22万股。据数据统计，该股近一个月内累计涨幅为-7.52%，沪股通累计减仓99.10万，沪股通持仓累计变化比例为-11.75%，近三个月内累计涨幅为-17.92%，沪股通累计加仓5.15万，沪股通持仓累计变化比例为0.70%。  数据来源:<span id=""show_stock_str"" ></span>",恒力股份11月27日获沪股通减仓51.22万
27,11月27日 ,吉林股友,"11月26日<span class=""showStock"" id=""stock_sh600346"">恒力股份</span><span id=""quote_sh600346""></span>沪股通持仓数据     收盘价： 12.49 涨跌幅： -3.92%   持股量： 795.20万股 持股变化： 26.05万股      数据显示，截至11月26日<span class=""showStock"" id=""stock_sh600346"">恒力股份</span><span id=""quote_sh600346""></span>于沪股通持股量为795.20万股，占其A股股本比例为0.86%，比上一交易日增加26.05万股。据数据统计，该股近一个月内累计涨幅为-10.59%，沪股通累计减仓47.87万，沪股通持仓累计变化比例为-5.68%，近三个月内累计涨幅为-19.13%，沪股通累计加仓96.26万，沪股通持仓累计变化比例为13.77%。  数据来源:<span id=""show_stock_str"" ></span>",恒力股份11月26日获沪股通加仓26.05万
29,11月25日 ,河南股友,"回购之后股价必定会被压盘，之前有关注过<span class=""showStock"" id=""stock_sz300098"">高新兴</span><span id=""quote_sz300098""></span>的回购是不超过8元，股价当时一碰8元就下，目前还是未有起色，我觉得回购应该设置最低价，只设置最高价不超过多少元不太合理，也应该设置回购价不低于多少元，不过回购虽然是利好，但是变成了人人皆知的事情，股价被打压是必然的<span id=""show_stock_str"" ></span>",回购之后股价必定会被压盘
30,11月24日 ,吉林股友,11月23日恒力股份沪股通持仓数据     收盘价： 13.00 涨跌幅： -4.76%   持股量： 769.15万股 持股变化： 17.43万股      数据显示，截至11月23日恒力股份于沪股通持股量为769.15万股，占其A股股本比例为0.83%，比上一交易日增加17.43万股。据数据统计，该股近一个月内累计涨幅为-8.26%，沪股通累计减仓45.15万，沪股通持仓累计变化比例为-5.54%，近三个月内累计涨幅为-16.31%，沪股通累计加仓75.36万，沪股通持仓累计变化比例为10.86%。  数据来源:,恒力股份11月23日获沪股通加仓17.43万
31,11月23日 ,安徽股友,在几重利好中，恒力股价无动于衷。回购资金总额：不低于人民币10亿元，不超过人民币20亿元，后发赶超，势不可挡。回购股份的数量：按回购资金总额上限人民币20亿元、回购价格上限18.00元/股进行测算，若全部以最高价回购，预计最大回购股份数量约为1.11亿股，约占本公司截至目前已发行总股本的2.20%。具体回购股份的数量以回购期满时实际回购的股份数量为准。2018-09-30每股资本公积: 4.049 营业收入(万元):4383152.10 同比增 　34.43%｜2018-09-30每股未分利润: 0.513 　净利润(万元): 365251.65 同比增 　98.94%，每股净资产5.6421元，业绩好，完全有高送转能力。,恒力股份10--20亿大回购已启动，高送转10送10在路上
32,11月23日 ,<a href='/u/5052507249' title='小芝的午后198408'>小芝的午后198408</a>,"【早盘核心概念】    　　1.上海经信委要求梳理推荐拟挂牌科创板企业，相关高新企业受关注：<span class=""showStock"" id=""stock_sh603108"">润达医疗</span><span id=""quote_sh603108""></span>、<span class=""showStock"" id=""stock_sz300347"">泰格医药</span><span id=""quote_sz300347""></span>、<span class=""showStock"" id=""stock_sz300067"">安诺其</span><span id=""quote_sz300067""></span>、<span class=""showStock"" id=""stock_sh600571"">信雅达</span><span id=""quote_sh600571""></span>    　　2.“独角兽”天境生物获上海市委副书记调研，相关公司受关注：<span class=""showStock"" id=""stock_sh600668"">尖峰集团</span><span id=""quote_sh600668""></span>、<span class=""showStock"" id=""stock_sz002393"">力生制药</span><span id=""quote_sz002393""></span>    　　3.开启AI物联新时代，小米 AIoT开发者大会下周开：<span class=""showStock"" id=""stock_sz300458"">全志科技</span><span id=""quote_sz300458""></span>、<span class=""showStock"" id=""stock_sz002705"">新宝股份</span><span id=""quote_sz002705""></span>、<span class=""showStock"" id=""stock_sz002681"">奋达科技</span><span id=""quote_sz002681""></span>    　　4.工信部多举措支持工业互联网 ，政策红利持续释放：<span class=""showStock"" id=""stock_sz300166"">东方国信</span><span id=""quote_sz300166""></span>、<span class=""showStock"" id=""stock_sh600845"">宝信软件</span><span id=""quote_sh600845""></span>、<span class=""showStock"" id=""stock_sz300353"">东土科技</span><span id=""quote_sz300353""></span>、<span class=""showStock"" id=""stock_sz300213"">佳讯飞鸿</span><span id=""quote_sz300213""></span>  综合解析：        在相关热点相继落幕之后，沪深两市出现明显缩量调整。盘中证券一度出现短暂性上攻，在跟风不足的情况下，后劲明显不足。涨停家数目前虽仍维持近50余家，但热点明显分散。加之成交量持续萎缩，预计市场在新的热点出来之前，难有太大作为。晚间消息：10月外汇占款21.3万亿，环比骤降915亿；财政部暂免境外机构投资境内债券利息所得税和增值税；央行连续20日暂停逆回购创纪录，降准+降息呼声渐起；　上期所：调整原油SC1812、SC1901合约涨跌停板幅度。消息面看，管理层仍倾向于呵护市场，但在成交量持续萎靡。11.21布局002210   <span class=""showStock"" id=""stock_sz002210"">飞马国际</span><span id=""quote_sz002210""></span>  继续冲高<span class=""face-img face-wb-3-13"">[鲜花]</span><span id=""show_stock_str"" ></span>",精准解析：民间高手在线讲解，想赚就跟上★
33,11月23日 ,吉林股友,11月22日恒力股份沪股通持仓数据     收盘价： 13.65 涨跌幅： -0.73%   持股量： 751.72万股 持股变化： -2.94万股      数据显示，截至11月22日恒力股份于沪股通持股量为751.72万股，占其A股股本比例为0.81%，比上一交易日减少2.94万股。据数据统计，该股近一个月内累计涨幅为-4.88%，沪股通累计加仓12.01万，沪股通持仓累计变化比例为1.62%，近三个月内累计涨幅为-13.01%，沪股通累计加仓57.60万，沪股通持仓累计变化比例为8.30%。  数据来源:,恒力股份11月22日获沪股通减仓2.94万
34,11月22日 ,吉林股友,11月21日恒力股份沪股通持仓数据     收盘价： 13.75 涨跌幅： -5.69%   持股量： 754.66万股 持股变化： -106.31万股      数据显示，截至11月21日恒力股份于沪股通持股量为754.66万股，占其A股股本比例为0.82%，比上一交易日减少106.31万股。据数据统计，该股近一个月内累计涨幅为0.81%，沪股通累计加仓52.42万，沪股通持仓累计变化比例为7.47%，近三个月内累计涨幅为-12.64%，沪股通累计加仓68.23万，沪股通持仓累计变化比例为9.94%。  数据来源:,恒力股份11月21日获沪股通减仓106.31万
35,11月21日 ,<a href='/u/5946098230' title='蝉羽微弱思纬'>蝉羽微弱思纬</a>,"<p>如果你整日沉醉在研究不同的方法、理论与理念中，迷惑在妄图找到天下无敌的招数以横扫股市的境地而没有切实加强你的心性层次修养的话，舍本逐末，焉能不败？</p><p>老徐一介散户,有自己的公司有自己的事业,入市十几年,喜欢交朋友,喜欢坦荡做事。在资本界略有人脉,相当多时候还是能做到事前诸葛,股票是一定要炒的,无论做不做财经编辑,权当副业。通过对股市的研究，现总结了以下四条卖出股票的法则，希望能给大家一些帮助。</p><p><br/></p><p>法则1：低于买入价7-8％坚决止损?</p><p>第一个和最重要的一个卖出规则对于许多投资者来讲是很困难的。毕竟对许多人来说，承认自己犯了错误是比较困难的。投资最重要的就在于当你犯错误时迅速认识到错误并将损失控制在最小，这是7％止损规则产生的原因。 通过研究发现40％的大牛股在爆发之后最终往往回到最初的爆发点。同样的研究也发现，在关键点位下跌7-8％的股票未来有较好表现的机会较小。投资者应注意不要只看见少数的大跌后股票大涨的例子。长期来看，持续的将损失控制在最小范围内投资将会获得较好收益。 因此，底线就是股价下跌至买入价的7-8％以下时，卖掉股票！不要担心在犯错误时承担小的损失，当你没犯错误的时候，你将获得更多的补偿。当然，使用止损规则时有一点要注意：买入点应该是关键点位，投资者买入该股时判断买入点为爆发点，虽然事后来看买入点并不一定是爆发点。</p><p><br/></p><p>法则2：高潮之后卖出股票</p><p>有许多方法判断一只牛股将见顶而回落到合理价位，一个最常用的判断方法就是当市场杀上所有投资者都试图拥有该股票的时候。一只股票在逐渐攀升100％甚至更多以后，突然加速上涨，股价在1-2周内上涨25-50％，从图形上看几乎是垂直上升。这种情况是不是很令人振奋？不过持股者在高兴之余应该意识到：该抛出股票了。这只股票已经进入了所谓的高潮区。一般股价很难继续上升了，因为没有人愿意以更高价买入了。突然，对该股的巨大需求变成了巨大的卖压。根据对过去10年中牛股的研究，股价在经过高潮回落之后很难在回到原糕点，如果能回来也需要3-5年的时间。</p><p><br/></p><p>法则3：连续缩量创出高点为出货时机?</p><p>股票价格由供求关系决定。当一只股票股价开始大幅上涨的时候，其成交量往往大幅攀升。原因在于机构投资者争相买入该股以抢在竞争对手的前头。在一个较长时期的上涨后，股价上涨动力衰竭。股价也会会继续创出新高，但成交量开始下降。这个时候就得小心了，这个时候很少有机构投资者愿意再买入该股，供给开始超过需求，最终卖压越来越大。一系列缩量上涨往往预示着反转。</p><p><br/></p><p>法则4：当一只股票突破最新的平台失败时卖出股票</p><p>大家都知道春夏秋冬四季变化，大牛股的走势也有相似的循环。这些股票经历着快速上涨和构筑平台的交替变化。一般来讲，构筑平台的时间越长则股价上升的幅度越大。但这也存在着股价见顶的可能，股价有可能大幅下挫。通常，股价见顶时盈利和销售增长情况非常好，因为股价是反映未来的。无疑，股价将在公司增长迅速放缓之前见顶。当有较大的不利消息时，如果预计该消息将导致最新平台构建失败，应迅速卖出股票。</p><p>有几点是不用怀疑的。第一,老徐不会做到百分之百,真的做不到。第二,老徐还是能做到稳定收益,偌大的股市,不会让一个人获利,也不会让一个人亏损。而是让一部分人稳定获利,让一部分人持续亏损。但是不是每时每刻都会交易,规避风险是第一位的,本金安全大于一切收益。第三,老徐略有能力,有自己的核心优势,有自己的吃饭根本,可以分享给有缘的人,但不是所有人。第四,也许你不懂技术,不会操作,没有经验,但是尽量相信老徐教给你的和告诉你的。信任老徐的人很多,不信任的老徐的人也有,但是老徐还是会继续做好自己的事情,为那些信任老徐的人创造价值。</p><p><br/></p><p>想要学习的找我，信任来自实力,不是只言片语,不是可以人为出来的客观。谁都愿意结交有能力的人,连尝试的魄力都没,你又怎么能发现，人人机会平等，不要再继续观望别人如何成功，可以找我，带你低位埋伏布局，给账户一次改变命运的机会</p><p><br/></p>",恒力股份三大迹象表明接下趋势将在此开启反弹，详看本文
36,11月21日 ,吉林股友,11月20日恒力股份沪股通持仓数据     收盘价： 14.58 涨跌幅： -2.67%   持股量： 860.96万股 持股变化： -103.45万股      数据显示，截至11月20日恒力股份于沪股通持股量为860.96万股，占其A股股本比例为0.93%，比上一交易日减少103.45万股。据数据统计，该股近一个月内累计涨幅为6.89%，沪股通累计加仓158.73万，沪股通持仓累计变化比例为22.60%，近三个月内累计涨幅为-3.95%，沪股通累计加仓192.42万，沪股通持仓累计变化比例为28.78%。  数据来源:,恒力股份11月20日获沪股通减仓103.45万
38,10月16日 ,辽宁股友,赛轮股东中过签的签个到了，看看赛轮的股东都有,赛轮股东中过签的签个到了
