,time,author,comment,header
39,12月24日 ,河北股友,新浪财经讯 “第二十届北大光华新年论坛”于2018年12月23日在北京举行，主题为：“美好中国：敢当与前行”，中国工程院院士倪光南出席并演讲。　　其表示华为联想这30年来犹如龟兔赛跑，在1988-1995第一阶段，联想的“技工贸”胜过了华为的“贸工技”，在1995年，联想销售额67亿元，是华为的4.5倍。　　从1996-现在第二阶段，华为的“技工贸”胜过了联想的“贸工技”，2001年，华为销售额超过联想，截至2018年12月22日，联想市值81亿美元，据估值华为价值已超4000亿美元，二者差距接近50倍。　　以联想来说，官方的说法是，它是从计算所分离出去的，是在改革开放的时候，从计算所分离出去的一部分。当时中科院推行“一院两制”，计算所创办计算所公司，不是简单的创办，而是把一个实体分离出去，是在很短的时间内投入了130余名有经验的科技人员，带着上亿元价值的知识产权，以及带着工资、场地、设备，还有计算所的商誉和贷款担保能力等等，计算所公司是依托这样一个强大创新实体发展起来的，不是某个人创造出来的。这个要讲清楚，联想的前身计算所公司就是从这样的历史背景下发展起来的。　　接下来是讲联想公司股权的变迁问题。最关键是2000年左右实行的股改，这是以管理人员为主，通过“职工持股会”持股35%。原来有一个协议，按这个协议，联想公司股权分配，科学院是20%，计算机是45%，员工35%。通过这个股改，科学院变成65%，计算所变成0。　　这个股改采取“职工持股会”的“MBO”（Management Buy-Outs）方式，买国家资产，这缺乏法规依据。据称，“职工持股会” 系用未分配的历年利润1.5亿元购得，但在股改前联想公司的利润也是国有资产，如何能用国有资产买到“职工持股会”的股权？另外，当时1.5亿元根本买不到公司35%的股份。更成问题的是，计算所的股权归零，说是计算所的股权归到科学院了，但是计算所股权中包括了科技人员的知识产权，而归到科学院的股权，就是“中国科学院控股有限公司”的资产，不包含任何科技人员知识产权。显然，联想股改的最大问题是将科技人员知识产权归零。　　联想股改结果是高管获得了很大股权，而投入知识产权的计算所科技人员没有股权。联想控股2018年的财报显示，现在公司高管占主要的股份。可见将计算所科技人员投入的知识产权归零，这是联想股改的突出问题。　　我们看一下中外的高技术企业的股权变化。苹果股权最初是，投入知识产权和资产的乔布斯为45%，最后他是0.45%。华为股权最初是，投入资产的任正非为80%，现在是1.4%。计算所公司最初是，投入知识产权的科技人员的股权包含在计算所的股权中，但股改后，随着计算所股权的归零，也被归零了。柳传志没投入资产和知识产权，最初是副总经理，是0%。股改后他的股权不断增加，现在是15.9%。一个没投入知识产权和资产的公司高管，拥有那么多股权，这在中外高技术企业中是很特殊的。　　我们看联想股改前后的情况，股改之后投入知识产权的计算所科技人员股权为零，没有话语权了，发展路线就从“技工贸”转为“贸工技”，公司的创新能力和在行业中的地位也下降了。联想公司利润过去是靠创新产品，但是现在靠什么？现在它最稳定的利润来源是融科智地房地产，而它是靠获取计算所6万多平米科研用地起家的。如果房地产能带动一些地方的发展是很好的，但是不能影响科技发展。融科拿了计算所科研用地之后，使计算所发展受到影响，中关村寸土寸金，计算所科研用地被人拿走，影响了计算所吸引人才、留住人才。　　和华为比，我觉得华为是很成功的。华为成功有很多的原因，例如华为对科技人员的股权问题就做的比较好。改革开放之后，外部环境是一样的，华为是坚持研发，再加上给科技人员持股做得好，所以华为的创新能力很强。所以我认为联想股改后的问题，一个是发展路线，一个是科技人员知识产权保护问题。　　所以我们今后吸取教训，应该尽可能加强对科技人员的激励、保护科技人员知识产权，充分激发科技人员的创新。希望在知识产权体现方面，政策能更加明确，保证我们的科技创新能力更快地增长。　　谢谢大家。,“联想为什么不如华为”对万华的启发
40,12月23日 ,河北股友,"<span class=""showStock"" id=""stock_sh600309"">万华化学</span><span id=""quote_sh600309""></span>新材料事业部通过汽车质量管理体系认证2018年12月18日 星期二来源：<span class=""showStock"" id=""stock_sh600309"">万华化学</span><span id=""quote_sh600309""></span>我来说两句保存为书签环球聚氨酯网讯：12月5日，<span class=""showStock"" id=""stock_sh600309"">万华化学</span><span id=""quote_sh600309""></span>新材料事业部IATF16949:2016汽车质量管理体系认证颁证仪式在<span class=""showStock"" id=""stock_sh600309"">万华化学</span><span id=""quote_sh600309""></span>烟台工业园举行。<span class=""showStock"" id=""stock_sh600309"">万华化学</span><span id=""quote_sh600309""></span>副总裁陈毅峰、英国标准协会(简称BSI)中国区市场和销售总监全振军、生产管理中心总经理李庆、新材料事业部总经理黄岐善等领导出席。本次认证范围涵盖了<span class=""showStock"" id=""stock_sh600309"">万华化学</span><span id=""quote_sh600309""></span>新材料事业部热塑性聚氨酯弹性体（TPU）产品及其改性产品，聚碳酸酯（PC）产品及其改性产品，认证内容为上述产品的设计开发和制造。IATF16949:2016作为国际汽车行业最新质量管理体系标准，其针对性和适用性非常明确：此规范只适用于汽车整车厂和其直接的零配件制造商。这些厂家必须是直接与生产汽车有关的，能开展加工制造活动，并通过这种活动使产品能够增值。对所认证的公司厂家资格，有着严格的限定。凡是通过认证的企业，质量管理系统上已达到了国际标准，表明企业能持续稳定地向顾客提供预期和满意的合格产品。颁奖仪式上，<span class=""showStock"" id=""stock_sh600309"">万华化学</span><span id=""quote_sh600309""></span>新材料事业部质量管理部经理杨莉简要回顾了项目实施概况。1）2017年7月完成了体系建立2）2018年2月完成内审和管理评审3）2018年6-10月接受现场审核4）2018年11月9日正式通过认证BSI认为<span class=""showStock"" id=""stock_sh600309"">万华化学</span><span id=""quote_sh600309""></span>是中国化工行业的先进代表，在国际上享有盛誉，本次<span class=""showStock"" id=""stock_sh600309"">万华化学</span><span id=""quote_sh600309""></span>新材料事业部通过IATF16949:2016认证，是万华进入高端材料市场的一个良好开端。<span class=""showStock"" id=""stock_sh600309"">万华化学</span><span id=""quote_sh600309""></span>新材料事业部总经理黄岐善博士接受证书并致辞。<span class=""showStock"" id=""stock_sh600309"">万华化学</span><span id=""quote_sh600309""></span>新材料事业部将加强培训和内审，切实确保质量体系的合规执行和持续改善，聚焦客户需求，打造标准体系，实现高效运营，为客户提供高质量的产品和服务。最后，<span class=""showStock"" id=""stock_sh600309"">万华化学</span><span id=""quote_sh600309""></span>副总裁陈毅峰表示，此次<span class=""showStock"" id=""stock_sh600309"">万华化学</span><span id=""quote_sh600309""></span>新材料事业部获得IATF16949体系认证证书只是一个开始，<span class=""showStock"" id=""stock_sh600309"">万华化学</span><span id=""quote_sh600309""></span>将持续提升管理水平、提高产品质量和服务意识，努力达到以及超越客户的期望，创建受社会尊敬，让员工自豪，国际一流的化工新材料公司！<span id=""show_stock_str"" ></span>",万华化学新材料事业部通过汽车质量管理体系认证
41,12月23日 ,河北股友,"编辑有话说丨想不到的是 鞋底原液用改性MDI约30万吨2017年10月12日 <span class=""showStock"" id=""stock_sz002291"">星期六</span><span id=""quote_sz002291""></span>来源：PUWORLD独家发布我来说两句保存为书签PU鞋底材料具有舒适、轻便、防滑、弹性好、强度高、耐磨、耐油性能好等特点，相较于其他鞋底材料，如：PVC、RB、TPR、EVA，更具备全面性和广泛适用性。鞋底用聚氨酯原液可分为聚醚型和聚酯型两类，两种类型各有优缺点。聚酯型的强度、耐磨、耐撕裂、耐油性能好，而聚醚型的耐水解、耐霉菌、耐挠曲、耐低温性能好。目前，市场上仍以聚酯型鞋底原液为主，但随着国内聚醚原料及工艺配方的不断优化，聚醚型鞋底原液的市场份额越来越大，应用优势也越来越明显。PU 鞋底原液的多采用预聚物法制备生产，一般由A、B双组份或A、B、C 三组分构成，厂家配套出售或单独出售某一组份。其中A组分为多元醇组分，主要成分为聚酯多元醇、扩链剂、匀泡剂、发泡剂等。B 组分为预聚物组分，即聚酯多元醇与异氰酸酯反应制得的端异氰酸酯低分子物，其中异氰酸酯主要是纯MDI 及少量液化MDI，纯MDI和液化MDI的比例大概为9：1。通常意义上讲鞋底材料中的改性MDI就是此MDI预聚物，预聚体关键是控制NCO的含量，通过控制异氰酸根，来控制鞋底浇注反应时的发泡速度。C组分为催化剂组分，主要是固体胺和乙二醇。图表1：鞋底原液工厂出厂鞋底原液实物图据率捷咨询统计，2016年国内鞋底原液厂家总计20 家左右，其总产量50万吨左右，其中聚酯型与聚醚型的比例大概在9:1，B组份MDI预聚体产量大概在30万吨左右(参见图表2)。图表2：2016年PU鞋底原液聚酯/聚醚类产量情况 单位：百分比鞋底原液企业主要分布在浙江、福建、广东、江苏、山东等地，由于近年国内鞋底原液产能过剩严重，下游需求增量有限，出口也仅在少数企业如浙江华峰、旭川、禾欣等，出口量在8万吨左右。整体行业开工率偏低，随着原料价格高涨，竞争日益激烈，国内产能越来越集中。大型企业相对平稳，行业订单也逐步向大企业集中，而小型企业因行业竞争以及环保压力而面临淘汰的危机。其中华峰仍是国内鞋底原液最大的生产厂家，其市场份额将近50% 左右，而华峰、旭川化学、浙江恒泰源、无锡双象、华大化学等前五家的产量超过总产量的75%(参见图表3 )。图表3：2016年国内鞋底原液主要生产厂家产量情况 单位：元/吨虽然近年来制鞋产业转移、外贸市场增速减缓、环保要求越加严格，部分鞋材企业生产经营经历困难，但PU聚氨酯鞋底材料具有舒适、轻便、耐磨、弹性好、强度高等优点，成型工艺简单，可以有多种密度和硬度的刚性优势仍然会是国内外大多数人的选择，因此整体需求量仍不会有太大的波动(参见图表4)。图表4：2014-2016年国内鞋底原液预聚体产量及2017-2019年趋势预测 单位：万吨但不容忽视的是鞋底原液的技术研发也在不断深化发酵，人们对高性能鞋底需求也在不断提升。例如，由于欧美国家对鞋类产品技术指标的提高，低密度聚氨酯鞋底原液需求量日益提高，国内厂家研究和生产的也越来越多。此外其他类型的鞋底料的发展潜力也在逐步凸显，例如BASF研发生产的ETPU以及时下火爆的3D打印鞋都在吞食传统PU鞋底原液市场份额，因此优异性能的PU鞋底原液研发仍将不断持续。<span id=""show_stock_str"" ></span>",想不到的是 鞋底原液用改性MDI约30万吨
42,12月23日 ,河北股友,"朗盛在亚太地区启动重大投资项目2018年12月13日 星期四来源：PUWORLD编辑报道我来说两句保存为书签　未来5年内将投资近2.5亿欧元中国是最重要的市场环球聚氨酯网讯：2018年12月13日，上海――特殊化学品公司朗盛今日在上海召开“质新而上，立臻以远”2018年发布会，宣布将启动一个综合投资项目，以加强其在亚洲增长型市场的影响力。公司将在2023年前在亚洲投资约2.5亿欧元，其中大部分会投入中国市场。“对朗盛而言，亚洲尤其中国是业务增长的关键市场。借助这项重大的投资方案，我们将更加努力以充分发挥潜能。”朗盛集团董事会成员冯鹄博(Dr. Hubert Fink)说道。　朗盛将利用该笔资金加强其在华影响力。公司自2005年正式成立以来，业务量一直保持稳定增长，生产基地和营业额不断扩大。如今，朗盛在大中华地区拥有逾1,900名员工，遍布13个城市。截止至2017年，朗盛大中华区的销售额相比2005年翻了近三倍，达12亿欧元左右，约占全球总销售额的13%。近几年来，中国一直在追求高质量发展和产业升级。朗盛通过在机动化、城镇化、洁净水和健康领域的一系列产品，积极地支持中国的发展。“受消费升级的驱动，中国市场正在进入一个新的发展阶段。因此，朗盛的特殊化学品组合仍将有持续增长的巨大潜力。”朗盛亚太区总裁钱明诚表示。朗盛的产品包括应用于汽车和电子产业行业的高性能塑料，应用于汽车和建筑行业的阻燃剂，以及针对水处理和水净化行业的离子交换树脂和反渗透膜。朗盛旗下10个业务部门全已进驻大中华地区。在2017年4月收购科聚亚后，朗盛进一步扩大了在该地区的规模――新增3处生产基地。如今，朗盛中国拥有9处生产基地、9个研发中心和5个办事处(包括上海总部)，逾1,900名员工，员工人数是2005年公司成立时的三倍。朗盛中国成立13年来，已6次获得由全球杰出雇主调研机构(Top Employers Institute)颁发的“中国杰出雇主”认证。关于朗盛朗盛是全球领先的特殊化学品供应商，2017年销售总额为97亿欧元，在全球拥有约19,200名员工，分布在25个国家的73个生产基地。朗盛的核心业务包括开发、生产并销售化学中间体产品、添加剂、特殊化学品与塑料。朗盛已被纳入领先的道琼斯可持续发展指数(DJSI全球及欧洲)和富时社会责任指数(FTSE4Good)中。朗盛中国2005年1月31日，朗盛股票首次在法兰克福证券交易所挂牌上市，公司也正式开始在中国运营。时至今日，朗盛在大中华区的员工人数约 1,900 名，拥有17家下属企业(含3家合资公司)，9处生产基地及9个研发中心。朗盛与当地的合作伙伴密切合作，开发以市场为导向的解决方案以满足当地市场需求。我来说两句（109人参与）纠错分享到　　点评：朗盛久经商场，绝对不傻，注意这段：　公司将在2023年前在亚洲投资约2.5亿欧元，其中大部分会投入中国市场。“对朗盛而言，亚洲尤其中国是业务增长的关键市场。借助这项重大的投资方案，我们将更加努力以充分发挥潜能。”朗盛集团董事会成员冯鹄博(Dr. Hubert Fink)说道　“受消费升级的驱动，中国市场正在进入一个新的发展阶段。因此，朗盛的特殊化学品组合仍将有持续增长的巨大潜力。”朗盛亚太区总裁钱明诚表示说明中国化工市场潜力巨大。再注意 这句：朗盛的产品包括应用于汽车和电子产业行业的高性能塑料，应用于汽车和建筑行业的阻燃剂，以及针对水处理和水净化行业的离子交换树脂和反渗透膜。说明朗盛的市场也是万华的市场，因为万华也向高性能塑料，水处理和水净化行业的离子交换树脂和反渗透膜发展，既是机遇也是竞争。抢占别人的份额从来是商业的王道，比的是过硬的实力，没旁门左道可走，好处也是大的：立马牢牢地占住利润！　",朗盛在亚太地区启动重大投资项目
43,12月23日 ,河北股友,排名 上年排名 名称　　销售额（百万美元）利润（百万美元）国别497　427　　新华人寿保险股份有限公司　21795.7　　743.9　　中国498　437　　威廉莫里森超市连锁公司　　21741.4　　406.4　　英国499　467　　途易　　21655.4　　1151.7　　德国500　--　　AutoNation公司　　21609　　430.5　　美国　可见500强并不按利润大小来排名，没有利润参照意义，只是名誉。,《财富》杂志2017世界500强最后四名
