,time,author,comment,header
44,03月26日 ,湖北股友,"2018年对于<span class=""showStock"" id=""stock_sh600309"">万华化学</span><span id=""quote_sh600309""></span>来说，是比较艰难的一年，业绩显示营业增收净利润却下降。因为全球MDI在一整年当中处于不断下跌的态势，总跌幅超过50%。在此环境下<span class=""showStock"" id=""stock_sh600309"">万华化学</span><span id=""quote_sh600309""></span>逆流而上，在去年9月吸收合并<span class=""showStock"" id=""stock_sh600309"">万华化学</span><span id=""quote_sh600309""></span>，产能将超过巴斯夫，坐拥全球MDI第一宝座。进入2019年，主力产品MDI价格飙升。或许，<span class=""showStock"" id=""stock_sh600309"">万华化学</span><span id=""quote_sh600309""></span>终于迎来了收获之时。2017年，<span class=""showStock"" id=""stock_sh600309"">万华化学</span><span id=""quote_sh600309""></span>股价连续飙升令人印象深刻，这一次，<span class=""showStock"" id=""stock_sh600309"">万华化学</span><span id=""quote_sh600309""></span>能再现飙升神话么？上周，MDI产品上涨9.89%，领涨整个化工行业。作为全球MDI行业龙头，<span class=""showStock"" id=""stock_sh600309"">万华化学</span><span id=""quote_sh600309""></span>势必因主力产品涨价受益。3月21日，盐城响水化工厂爆炸事件震惊全国，惊愕之余人们对化工厂的安全防护工作也充满质疑。有分析师指出，此次事件或将引发苏北地区新一轮安全大检查。不过，MDI是一个寡头垄断的市场，各大巨头在苏北地区均没有布局。因此，<span class=""showStock"" id=""stock_sh600309"">万华化学</span><span id=""quote_sh600309""></span>受此次事件影响比较小。而随着3月传统旺季的到来，房地产竣工回暖，化工品旺季需求逐渐启动。近期，MDI产品的涨价幅度最为猛烈。根据生意社信息显示，2018年12月25日至2019年3月25日，3个月时间内，聚合MDI华东经销商价格从11575元涨至15000元以上。此前万华方面称，15000元~18000元/吨的MDI价格对市场、企业和终端客户而言都是一个比较舒适的价格区间。主力产品的价格暴涨，也助力<span class=""showStock"" id=""stock_sh600309"">万华化学</span><span id=""quote_sh600309""></span>股价不断走高。2018年12月28日，上市公司仅收报27.99元，而截至2019年3月26日收盘，已报41.03元，年内股价大涨46.59%。低谷20183月1日，<span class=""showStock"" id=""stock_sh600309"">万华化学</span><span id=""quote_sh600309""></span>发布的2018年业绩快报中显示，公司2018年全年营业总收入606.2亿元，同比增长14.11%。然而，2018年营业利润却相较去年同期下滑5.16%。这其中主要原因是全球MDI在去年一整年都是跌跌不休的态势，根据山东地区MDI价格（主流价）显示，2018年年初MDI价格27300元/吨，下降到年底11500元/吨，下跌幅度约58%。<span class=""showStock"" id=""stock_sh600309"">万华化学</span><span id=""quote_sh600309""></span>所属行业是化工行业，公司主营来自三大业务板块：聚氨酯业务板块（主要就是MDI）、石化业务板块、精细化学品及新材料业务板块。这三块业务是互相紧密联系的，这样的好处就是提升了化学原料的使用效率，进而降低成本。2018年度，公司实现营业收入606亿元，较上年增长14.11%；营业利润160亿元，较上年减少5.16%；利润总额159亿元，较上年下降4.61%；归属于上市公司股东的净利润106亿元，较上年下降4.71%。来源：市值相对论营业收入增长，净利润却下滑，两者并不同步。营业收入增长的原因是化工业务销量有了较大增长。但净利润下滑的主要原因是2018年MDI价格持续的下滑，根据山东地区MDI价格（主流价）显示，2018年年初MDI价格27300元/吨，年底下降到11500元/吨，下跌幅度接近58%。这一度给<span class=""showStock"" id=""stock_sh600309"">万华化学</span><span id=""quote_sh600309""></span>带来很大的压力。来源：市值相对论业务板块中MDI产品依旧是万华的主要收入和利润来源，2017年MDI产品的营业收入约298亿元，占比57%；毛利约165亿元，占比79%。虽然石化产品是公司第二大收入来源，营业收入约为153亿元，占比29%，但是利润贡献度低，毛利润只有约19亿元，仅占比9%。作为化工产品，其上游价格特别容易受到原油价格以及国际市场环境的影响，因为MDI主要原料纯苯是从石油中提炼出来的。下游来说，MDI最大使用领域为冰箱、冰柜，并且公司产品在国内聚氨酯外墙保温材料中占30-40%的市场份额，也容易受到房地产领域的调控和环保政策的影响。底部收购2015 年以来，全球化工行业发生了若干起大型跨国企业的并购案，包括陶氏化学与杜邦合并为陶氏杜邦，德国拜耳收购孟山都，中国化工收购先正达，这些世界级的并购案正在深刻影响着全球化工产业的版图，<span class=""showStock"" id=""stock_sh600309"">万华化学</span><span id=""quote_sh600309""></span>为了有效应对全球化工行业的并购变化，也做了自己的布局。2018年9月14日，<span class=""showStock"" id=""stock_sh600309"">万华化学</span><span id=""quote_sh600309""></span>发布公告，<span class=""showStock"" id=""stock_sh600309"">万华化学</span><span id=""quote_sh600309""></span>拟吸收合并控股股东万华化工100%股权， 发行价格 30.43 元/股，合计发行股份数量为 17.16 亿股。值得注意的是，彼时聚合MDI价格正处于下行周期，<span class=""showStock"" id=""stock_sh600309"">万华化学</span><span id=""quote_sh600309""></span>可谓是行业底部时启动的吸收合并。<span class=""showStock"" id=""stock_sh600309"">万华化学</span><span id=""quote_sh600309""></span>在2018年9月份逆流而上吸收合并万华化工，使总产能达到210万吨/年，一举超越了巴斯夫，成为全球最大的MDI（聚氨酯主要原料）生产商。同时也解决了与控股股东下属BorsodChem集团（以下简称“BC”公司）同业竞争的问题。2018年<span class=""showStock"" id=""stock_sh600309"">万华化学</span><span id=""quote_sh600309""></span>通过重组上市，扩大了主力产品MDI产能，成为全球最大的MDI生产商。如今，交易完成，MDI价格便接连猛涨。照此看来，<span class=""showStock"" id=""stock_sh600309"">万华化学</span><span id=""quote_sh600309""></span>这笔交易并不吃亏。来源：卓创资讯本次收购前，国丰投资通过万华化工间接持有<span class=""showStock"" id=""stock_sh600309"">万华化学</span><span id=""quote_sh600309""></span>的股份。万华化工直接持有<span class=""showStock"" id=""stock_sh600309"">万华化学</span><span id=""quote_sh600309""></span> 13.10亿股A股流通股股份，占<span class=""showStock"" id=""stock_sh600309"">万华化学</span><span id=""quote_sh600309""></span>总股本的 47.92%，为<span class=""showStock"" id=""stock_sh600309"">万华化学</span><span id=""quote_sh600309""></span>的控股股东。烟台市国资委通过全资子公司国丰投资持有万华化工39.50%的股份，为<span class=""showStock"" id=""stock_sh600309"">万华化学</span><span id=""quote_sh600309""></span>的实际控制人。本次收购后，本次吸收合并完成后，万华化工注销。<span class=""showStock"" id=""stock_sh600309"">万华化学</span><span id=""quote_sh600309""></span>控股股东由万华化工变为国丰投资，实际控制人保持不变。万华化工持有的 100%BC股份、万华宁波25.5%和万华氯碱热电 8%的股权将注入到上市公司中，实现万华旗下化工类资产的整体上市。在市场地位上，收购之后<span class=""showStock"" id=""stock_sh600309"">万华化学</span><span id=""quote_sh600309""></span>以210万吨/年总产能一举超越巴斯夫，成为全球MDI第一大生产商（产能计算）。另一方面，与控股股东下属BC公司之间潜在同业竞争问题也将消失。这里重点说下BC公司，匈牙利BC公司是中东欧最大的MDI和TDI制造商，具备MDI产能30万吨和TDI产能25万吨，业务范围涵盖欧洲、中东及非洲地区，为全球第八大聚氨酯生产企业。BC原大股东是欧洲最大的私募基金Pennira,实力非常雄厚，当时万华实业收购BC公司一度吃了对方闭门羹，并对万华实业发话过两三年之后再谈。万华实业收购被拒，不甘心就这样回国，后面出现转机是盟友合成国际的发现，当时BC公司一共负债10亿欧元，其中高级债7.5亿欧元，另外一部分是次级债，一共2.5亿欧元，当时次级债在市场里很低迷，2.5亿欧元次级债只值5000万欧元左右，假设万实业控制次级债三分之二，就可以推翻原先大股东计划的重组预案。合成国际巧妙地使用了这张牌，当夜打出了电话给BC公司，让事件有了转机，双方重新坐回了谈判桌，万华实业后面也顺利地完成了对BC公司的收购。<span class=""showStock"" id=""stock_sh600309"">万华化学</span><span id=""quote_sh600309""></span>VS科思创科思创是拜耳的子公司，总部位于德国北莱茵-威斯特法伦州勒沃库森。是全球领先的高级聚合物和高性能塑料生产商。2015 年 9 月从拜耳集团拆分并独立上市，演变为现在这家拥有逾1.6万名雇员的全新化工企业。在世界化工50强榜单中科思创排名第１８，公司年收入1４６亿欧元（１１１０亿元），净利润为１８亿欧元（１３６亿元）。<span class=""showStock"" id=""stock_sh600309"">万华化学</span><span id=""quote_sh600309""></span>最新业绩快报显示，公司2018年全年营业总收入606.2亿元，营收仅为科思创一半左右，净利润１１８亿元，两者净利润却相差并不大。这就需要引出了两者生产成本方面的对比，<span class=""showStock"" id=""stock_sh600309"">万华化学</span><span id=""quote_sh600309""></span>的MDI生产成本低于科思创，主要是由于<span class=""showStock"" id=""stock_sh600309"">万华化学</span><span id=""quote_sh600309""></span>的MDI产业链中，后向一体化程度更大，包含了能源供应，后向一体化程度更高使得其成本更低。由产业链后向一体化布局的差异可以看出，<span class=""showStock"" id=""stock_sh600309"">万华化学</span><span id=""quote_sh600309""></span>的业务布局显得更加宽广，以LPG为源头，不仅可以实现聚醚上游原料的后向一体化，还为丙烯下游布局有更多的选择。相比之下，科思创更聚焦于产业链的中后端，其产业链后向一体化仅到环氧丙烷环节，而且环氧丙烷也并非完全实现一体化配套，仍需要部分外购环氧丙烷，而环氧丙烷上游的丙烯，以及更上游的乙烯裂解或者丙烷脱氢等上游的原料一体化配套并未涉及。销售额组成分析来看科思创的聚氨酯材料占整年销售额的比例分别是 2015 年 50.39%，2016 年 49.79%，2017 年 54.18%， 2018 年前 3 季度是 50.82%。2017 年聚氨酯材料价格上涨较多，所以17年显得稍高一些，其他年份基本是一半的样子。说明聚氨酯材料的行情变化对科思创的影响同样是不可小视的。<span class=""showStock"" id=""stock_sh600309"">万华化学</span><span id=""quote_sh600309""></span>的聚氨酯材料占比从2015年的84.76%已经下降到2018年前三季度中占比的 52.95%。 由此可见，<span class=""showStock"" id=""stock_sh600309"">万华化学</span><span id=""quote_sh600309""></span>的业务组成部分在纵向方面继续深耕，万华的石化系列和精细化学和新材料系列的占比在上升，将逐步会占据半壁江山。（来源：环球老虎财经的财富号 2019-03-26 18:12） [点击查看原文]<span id=""show_stock_str"" ></span>",主力化工品疯涨
45,03月26日 ,重庆股友,"聚氨酯产品：需求良好、货源有限，MDI价格继续上涨；竞争趋缓，长期产品盈利可维持合理中枢。本周纯MDI价格涨0.11万元/吨至2.39万元/吨（周环比 4.8%），聚合MDI价格涨0.14万元/吨至1.63万元/吨（ 9.4%）。三月进入尾声，目前纯MDI需求仍处于相对旺盛阶段（PU浆料、鞋底原液以上半年为旺季，氨纶市场需求近期有所回暖），聚合MDI需求由较高水平略有趋弱，后续或可随天气转好与气温回升而逐步走强（最主要下游冰箱以3-6月为旺季；管道、板材与喷涂旺季于3月下旬陆续展开）。在需求相对较好的背景下，货源收缩预期进一步推动市场向上：周一韩国锦湖三井35万吨MDI装置意外停车，日韩MDI进口货源停报；后续19Q2有MDI装置密集检修，如4月1日东曹精馏装置检修（计划20天），上海联恒二期24万吨与一期35万吨装置分别于4月10日、5月10日停车检修（分别计划2个月、1个月），上海科思创50万吨装置与东曹日本装置也于5月有检修计划，MDI货源将维持偏紧状态。本周初，亨斯曼提前公布4月聚合MDI挂牌价达1.62万元/吨（月环比 0.1万元/吨）高于市价水平，科思创随后亦上调本周挂牌价；市场情绪有所提振。科思创启动了涉及全员的奖金考核制度要求销量、现金流、回报率三者并重，行业可预见的将投产项目有限且主要把握在<span class=""showStock"" id=""stock_sh600309"">万华化学</span><span id=""quote_sh600309""></span>手中，行业竞争有望持续趋缓，MDI长期盈利可维持合理的中枢水平。<span id=""show_stock_str"" ></span>",聚氨酯产品：需求良好、货源有限
46,03月26日 ,山西股友,回复某股友“昨晚美股亨斯曼跌成屎”进而万华化学“好不了”的言论：1. ，收盘比昨日跌一毛多钱，一个点不到，不存在“跌成屎”。2. 18年业绩大幅下降DD营业收入同比增长一成半，净利润同比下降近五成DD不跌才怪！还得跌！3. 低成本优势、高研发投入的万华，不断开拓疆土，不断抢占市场，不论主产品还是新材料，处处在挤压业界传统龙头DD赌徒为股票价波动忧喜，而投资者追求的，是企业内涵价值的升降…… 若看好，就握住股份，静等花开； 不看好，赶紧卖筹码，远离股吧。 不要学万华吧里的无知股神瑟本无弦和瘪三胖子、无耻青霉之流，如牛皮癣般，每逢万华股价低迷时就出来不咸不淡地说几句浅薄无知的评价DD癞蛤蟆爬脚背，不咬人但恶心人DD他们的见识，丝毫悟不出投资的真谛。 本韭是赌鬼，目前持有融资买入的85手万华浮动仓位。 本人是价投，百手万华底仓雷打不动坚定持有。 赌鬼加价投，万华坚定唱多者，爱谁是谁。,回复某股友“昨晚美股亨斯曼跌成屎”进而万华化学“好不了
47,03月25日 ,内蒙古股友,经过今日的震荡，不论是大盘还是万华基本按照预期进行震荡整固到了一个合理位置，只待明日加以确认。　细节上，根据之前的预期，我们希望大盘可以在3030之上结束整固震荡，特别不能有效跌破3000关口。因为之前也说了，这波整固震荡只要不跌破3000，其实就是新的5分钟级别中枢的3买。　虽然，在理论上来看，当下这个可能的5分钟3买的价值显然不如之前说的第一个5分钟中枢的3买，但是因为这个3买距离第一个3买位置2924并不远，而且前期的某些强势股票经过大盘这次震荡可能是刚好形成5分钟级别的3买，因此，短线这个3000之上的3买一旦明日，最晚周三得到确认，那么其实参与价值仍然不低。从这几天的震荡蓄势来看，不排除大盘有冲击3300附近的能量。当然，如果迟迟不能新高，或者新高后明显疲态无力，那么大盘就会再次对3000位置进行考验，这大概就是大盘本周和下周的整体演化态势。　万华基本上也如此，我们也是希望在40.32之上再次确认新的5分钟中枢的3买。综上，短线就是看3000/3032，40.32的支撑位置能否确认再次的3买，3买确认后，就是要看大盘和万华是否能尽快有力度的向上突破，不能，一定要适当降低仓位，因为随后更大级别中枢的扩展震荡必然要再次考验3000关口。,连载-3月25日-大盘和万华整固震荡基本到位
48,03月25日 ,四川股友,"现在茅台的股价太高了 风险很大 相反<span class=""showStock"" id=""stock_sz000799"">酒鬼酒</span><span id=""quote_sz000799""></span>股价很低 机会和潜力来了<span class=""showStock"" id=""stock_sz000799"">酒鬼酒</span><span id=""quote_sz000799""></span>大黑马分析：有10倍的潜力 酒中自有大黑马 下一个<span class=""showStock"" id=""stock_sh600519"">贵州茅台</span><span id=""quote_sh600519""></span>就是<span class=""showStock"" id=""stock_sz000799"">酒鬼酒</span><span id=""quote_sz000799""></span>　机会来了你能把握吗！唱空的人很多 你有定力吗？现在品质好的股票一旦调整完毕很快会大升 因为现在网络发达 信息传播快 不会像以前慢慢给你机会让世界品味中国独特的馥郁香味道 取代茅台酱香味－－<span class=""showStock"" id=""stock_sz000799"">酒鬼酒</span><span id=""quote_sz000799""></span>的豪气冲天富豪曹德旺私人酒窖白酒只有茅台（酱香型）和000799<span class=""showStock"" id=""stock_sz000799"">酒鬼酒</span><span id=""quote_sz000799""></span>（独一无二的馥郁香型）是“浓、清、酱”三香和谐共生，一口可品 “前浓、中清、后酱”馥郁三香。因此，<span class=""showStock"" id=""stock_sz000799"">酒鬼酒</span><span id=""quote_sz000799""></span>被业内赞为“酒中妙品 ，鬼斧神工”。物以稀为贵－－国家授权<span class=""showStock"" id=""stock_sz000799"">酒鬼酒</span><span id=""quote_sz000799""></span>公司制定馥郁香酒标准！<span class=""showStock"" id=""stock_sz000799"">酒鬼酒</span><span id=""quote_sz000799""></span>酿酒工艺地理环境无法复制 馥郁香...<span class=""showStock"" id=""stock_sz000799"">酒鬼酒</span><span id=""quote_sz000799""></span>的魅力所在1独特的地理环境 北纬30度（Latitude-30N）是指北纬30度上下波动5度所覆盖的范围。北纬30线贯穿四大文明古国，是一条神秘而又奇特的地理纬线，形成了无数神奇的自然景观和文化奇观，也在中国境内形成了全球唯一的白酒酿造黄金带，是中国二大白酒体系诞生纬度带：产生以贵州省茅台酒为代表的酱香型白酒，以湖南省<span class=""showStock"" id=""stock_sz000799"">酒鬼酒</span><span id=""quote_sz000799""></span>为代表的馥郁香型白酒。2独特的酿造工艺――中国馥郁香型白酒首创者<span class=""showStock"" id=""stock_sz000799"">酒鬼酒</span><span id=""quote_sz000799""></span>股份有限公司独创中国馥郁香型白酒酿酒工艺，旗下品牌<span class=""showStock"" id=""stock_sz000799"">酒鬼酒</span><span id=""quote_sz000799""></span>、内参酒、湘泉酒、洞藏酒均为馥郁香型白酒。馥郁香型白酒酿制技艺是在传承湘西民间酿酒工艺秘方基础之上，大胆吸纳现代大、小曲工艺各自优点，将三种工艺有机结合形成的创新白酒工艺，在中国白酒业独树一帜。独一无二的馥郁香..<span class=""showStock"" id=""stock_sz000799"">酒鬼酒</span><span id=""quote_sz000799""></span>　第一目标位100元 长线必到200元茅台已经飞上了天　<span class=""showStock"" id=""stock_sz000799"">酒鬼酒</span><span id=""quote_sz000799""></span>的潜力巨大 机不可失现在融资标的的股风险大 因为一旦大跌融资的人心态不稳 怕跌多了暴仓并且融资盘每天要交利息 不是融资的标的 反正是自己的钱可以长线持有 无后顾之忧<span id=""show_stock_str"" ></span>",大黑马分析 对比茅台 酒鬼酒的品质口感工艺不输茅台 酒鬼
49,03月25日 ,天津股友,"今天两地市场下跌，毕竟市场不能总是上涨，牛市还经常暴跌呢，重点在于持股情况。根据2018年度业绩快报，<span class=""showStock"" id=""stock_sh600309"">万华化学</span><span id=""quote_sh600309""></span>2018年总营收同比增长14.11%；净利同比下降 4.71%。报告期内，各业务板块销售规模均有所增长，但由于聚氨酯板块产品市场价格下半年开始回落，全年经营业绩同比略有下滑。尽管业绩略有下滑，可<span class=""showStock"" id=""stock_sh600309"">万华化学</span><span id=""quote_sh600309""></span>依旧是一家优秀的行业龙头；有人总拿万华与华为相比，可以说两家都是全球龙头，但无法评论谁强谁弱。不在一条跑道上；万华是搞化工的，华为是搞通讯的；如同打拳击的与搞体操的，没法比......1、行业天花板相比于大消费（食品饮料家电），金融（银行保险券商），化工行业的研判要更费精力，一连串的材料名词......<span class=""showStock"" id=""stock_sh600309"">万华化学</span><span id=""quote_sh600309""></span>的主营收入来源于以下两类系列：聚氨酯系列（TDI和MDI）营收占比57%；石化系列（PO/AE、乙烯）营收占比32%；万华18年TID自主工业园投产TDl后，合并上欧州博苏万华，一跃成为世界第一。MDI 的技术壁垒极高，目前也只有德国巴斯夫、德国科斯创(拜耳)、美国亨斯迈、美国陶氏、日本NPU，这几家掌握技术，具备生产能力，合计占据全球90%份额。万华MDI总产能达到180万吨/年，世界第二德国巴斯夫56万吨/年，世界第三德国科思创50万吨/年，远大于老二与老三的总和。MDI主要用于TPU、合成革浆料、冰箱、建筑保温材料等领域。宏观来看，MDI应用领域多集中在建筑、家具、汽车等行业。根据相关数据，MDI的消费量将继续稳步增长，预计2018-2020年全球MDI需求增速将保持在6%左右。MDI主流生产工艺光气法具有较高的技术壁垒和资金壁垒，导致MDI供给端整体呈现寡头垄断的竞争格局。国内MDI行业将在2018-2020年迎来新一轮扩产高峰期。未来三年内，国内MDI产能有望迅速扩增至422万吨/年。其中最为重要的增量来自<span class=""showStock"" id=""stock_sh600309"">万华化学</span><span id=""quote_sh600309""></span>。除中国外，未来几年全球MDI拟扩增项目主要集中在北美及欧洲，扩产企业包括<span class=""showStock"" id=""stock_sh600309"">万华化学</span><span id=""quote_sh600309""></span>、科思创和巴斯夫。若各大巨头的扩产计划顺利实施，全球MDI产能将从2017年的848万吨/年增至2020年的1,030万吨/年，增量为182万吨/年，年均复合增速为6.7%。其中来自<span class=""showStock"" id=""stock_sh600309"">万华化学</span><span id=""quote_sh600309""></span>的增量为120万吨/年，大约占总体增量的2/3，其产能全球占比将从约25%提升至32%，在亚洲、北美及欧洲均有产能布局，全球化布局将愈发完善，龙头地位将得到巩固，全球话语权将进一步增强。也就是说在聚氨酯系列，<span class=""showStock"" id=""stock_sh600309"">万华化学</span><span id=""quote_sh600309""></span>的龙头地位并不局限在中国，而是全球。2、基本面对于任何上市公司而言，无论是虫还是龙，拖出来财报溜溜；一定要观察长期经营情况。从经营数据观察，<span class=""showStock"" id=""stock_sh600309"">万华化学</span><span id=""quote_sh600309""></span>是存在化工行业周期性的；化工原料的价格周期，难以反抗......近十年平均总营收同比增长25%；近十年平均净利同比增长37%；近十年平均扣非净利同比增长38%；近十年平均净资产收益率30%；近十年平均毛利率32%；近十年平均净利18%；当前48%负债，历年来现金流大于净利。2017年是个意外，原因在于扩大营收，应收票据从36亿增长至113亿。不过放心，钱收的回来，不会坏账，都是银行承兑。毕竟是全球龙头公司，这点底气还是有的。不是银行承兑还要什么货，回家玩去吧......不发货。3、估值<span class=""showStock"" id=""stock_sh600309"">万华化学</span><span id=""quote_sh600309""></span>PE明显位于低位，最低6倍，当前12倍，最高161倍。不过对于周期性行业，由于价格周期的原因，重点在于PB。<span class=""showStock"" id=""stock_sh600309"">万华化学</span><span id=""quote_sh600309""></span>PB当前3.8倍，最低2.5倍，最高疯到25倍。参考化工板块PB估值，最低1.5倍，最高7倍。化工不是嘴巴股，只要这一行的产品原料没有出现替代迹象，那么估值有效。（来源：时空复利的财富号 2019-03-25 15:39） [点击查看原文]<span id=""show_stock_str"" ></span>",世界龙头万华化学（第三百一十三期）
