,time,author,comment,header
34,05月27日 ,内蒙古股友,根据上周五的贴文分析，如果本周初不新低或者新低后呈现区间套背驰结构，那么大盘将探底或者筑底成功。　显然，今天早盘在低位震荡后略微跌破2838一点出现新低后，从1分钟到60分钟的macd-K图都呈现明显的背驰或者盘整背驰结构，因此今日低点就可以当下确认为之前说的5分钟盘整的第3段的起始点。　而第3段的反弹高度如何，这并不能准确预测，只能根据走出的力度去逐步预判。不过，能不能突破之前说的2929仍然是明天的观察关键。　由于这个5分钟盘整第3段起点开始走出至少3根线段后，理论上就可以随时结束盘整向上或者向下突破，当然也可以继续盘整直到盘整级别变大。　因此，又回到从前提到过的今日低点是否是相对于2440的30分钟级别买点的2买这个问题。　由于今日的背驰是区间套背驰，根据经验，第3段1分钟级别的反弹在时间持续上一般比单纯的滞后判断的盘整震荡的相应反弹要长一些，在这个意义上说，今日低点成为30分钟级别的概率应该要大于50%了。　因此如果短线反弹能够依次突破并站稳2929，2956，那么这个概率就会进一步增加。特别如果本周或者说本月收盘可以收在前面的缺口之上，例如3066之上，那么今日低点成为30分钟级别2买的概率就会急剧增大。　但是不管怎样，本周四收盘前可以站稳至少2929的话，今日低点开始的第3段反弹搞出日k向上一笔还是没有什么问题的。反之，如果连2929都不能有效突破，那当然就有随时再次探底的可能。　预测方面，如果谈判有什么好消息，本周到下周初回补上面缺口当然就机会非常大了。　至于万华，如果本周可以回补并站稳分红除权缺口，那么，一旦大盘回补向上缺口，万华当然也会回补向上的相应缺口。短线来说，万华就是争夺40关口或者说年线的突破站稳的问题。,连载-5月27日-明日大盘有望争夺2929
35,05月27日 ,福建股友,"　　一、价格走势　　根据生意社价格监测：今日环氧丙烷持稳运行，目前国内环氧丙烷主流报价9100~9500元/吨，与上周一相比上涨了0.36%。　　二、影响因素分析　　产品：环氧丙烷市场持稳运行。近期国内环氧丙烷供应略有减少，整体市场供需基本平衡。今日<span class=""showStock"" id=""stock_sh600309"">万华化学</span><span id=""quote_sh600309""></span>山东主流市场现金送到价格为9200元/吨，华东主流市场现金送到价格为9500元/吨。　　产业链：上游丙烯市场价格小幅上涨。下游聚醚市场新单逐步减量，入市采购环氧丙烷能力逐步减弱。　　三、后市预测：　　据生意社预计：短期内环氧丙烷市场或将弱势整理运行为主。（来源：生意社的财富号 2019-05-27 15:31） [点击查看原文]<span id=""show_stock_str"" ></span>",生意社：5月27日环氧丙烷市场持稳运行
37,05月26日 ,青海股友,把你关在我帖子外，是受不了你唐僧般的墨迹。炒股的路千万条，各走各的就是。大家也能看到，现在的万华收盘在3月的开盘价（41.02元）之下，也就是说，3.4.5月份以来，你在万华吧写的帖子合起来能出一本书，但账户并没有因你的劳动有所增加。。。所以你可以省省对别人的“指导和劝解”了，把自己账户增值放第一位吧，，，,致万鲁风华：咱俩不是一路人，没话聊是一定的
38,05月26日 ,重庆股友,"致白发渔樵老庄： 刚刚拜访你的帖子，见到你对<span class=""showStock"" id=""stock_sh600366"">宁波韵升</span><span id=""quote_sh600366""></span>五月走势的喟叹以及借此引出的评价和“良言”，在此发帖回复一下（因我对你追涨杀跌炒票投机“必定血本无归”的“恶”言相劝，你拉黑了我，无法在你帖中回复）： 1.股市生存的正确方法，是选择一些优质企业，在这些企业股价被低估时买入，长期持有待高估时或企业基本面发生不良变化时卖出（中间当然可以根据经济形势、国策、市场情绪等因素做些小仓位的买入卖出降低成本的赌鬼游戏）。 2.看图划线、追涨杀跌、抓妖打板等等，都是所谓看“势”，韭菜思维老套路，大A玩死了其中的大多数。蜡烛图技术要是有用，中国能出100万个巴菲特。你的长园你的莱美你的东土，不都是“k线完美得让你手痒”吗？！不要为赌正了几只就沾沾自喜DD盈亏同源，赌鬼没一个有好下场。不知你混股市多少年了，我敢断言，你绝对不会是获益者DD因为理念，你继续炒下去必血本无归。 3.<span class=""showStock"" id=""stock_sh600366"">宁波韵升</span><span id=""quote_sh600366""></span>，和<span class=""showStock"" id=""stock_sz002407"">多氟多</span><span id=""quote_sz002407""></span>、长园一样，从几年来的财务数据看，经营管理水平垃圾透顶。因为五月份稀土永磁概念的炒作，有了一波近40个点的拉升，你于是就不淡定了，呵呵。请去股吧看看那些接棒哀嚎的韭菜吧DD<span class=""showStock"" id=""stock_sz300353"">东土科技</span><span id=""quote_sz300353""></span>股吧里也一片咒骂，你星期一要不要加入？！ 老庄，谢谢你的好意。我是赌鬼，但我绝对不会“进步”到你和无弦、小胖子之流每天关注几百只股票、追涨杀跌频繁操作止盈止损的韭菜行列中的。用几万块钱赌博，不是见小利就跑，就是挨小套就割，这样玩下去，最后只能意淫仓位和玩嘴炮了。 明天你们又可以追热点了，大数据，人工智能DD快找标的吧，玩对了，混个涨停吹一下，玩错了，套上几个点割肉，您继续。<span id=""show_stock_str"" ></span>",致白发渔樵老庄： 刚刚拜访你的帖子
39,05月25日 ,天津股友,,《货基扑街
40,05月25日 ,江西股友,"昨天和前天共减持万华6W股,前天的价钱减持的较高,在41.03元的价位减的,昨天是在40.4元的价位减的.收盘还持有2万股,减持的目的是为了规避大部份红利税,等除权后我会伺机再买入,我的买入时间会等6月份万华的MDI挂牌价公布后再买,或者安排5月30日那天再买,因为5月份市埸的MDI价钱已经跌至1.4W元左右了,估计六月份的挂牌价会下调,预计下调幅度比较大,5月30日买的理由是,本日是富时A50的期货交割日,估计股指会下跌.我一直看好万华,所以分红时我还保留了2W股,以后也一定会加仓,最少保证有5W股的仓位.",为了避税股权登记日之前减持了6万股
41,05月24日 ,广西股友,这是搜索到的关于分红有没有意义的解释，我觉得挺好，很多人可能说分红没有意义，本来是公司的钱，还要除权，对于偶尔分红的公司，分红之后要除权，的确是不能影响公司的，但是对于一个业绩优良，而且有持续高比例分红历史的公司来说，分红对股价的影响还是很正面的，我喜欢做一些放大化的例子，来说明，假设一个公司股价是十块钱，盈利保持稳定的话，每年分2块钱红利的红，假设除权没用，4年之后，股价被除权成2块钱，分红率就是100%，让你今年2块钱，就买一只股票，今年立刻分给你2块钱，你干不干？5年之后，股价就被除权为0了，但是这个时候公司的盈利能力还是一样的，也就是说，你不用花钱就可以买下这个盈利跟现在每股10块钱的公司，你说分红有没有用,这是搜索到的关于分红有没有意义的解释，我觉得挺好
42,05月24日 ,内蒙古股友,大盘在连续三天才走完一根回跌线段后，今天终于加速走出3根线段，当然，筑底震荡并没有能够绝对确认结束，也就是说，5分钟盘整第3段上仍然不能确认已经开始。　但显然，如果下周一还不能新低或者新低后呈现明显的区间套背驰结构，第3段上就可以随时开始。　总之，在大盘触及3153之前，对于当下进行当中的5分钟盘整震荡，还需要耐心的观察2-3周，以判断30级别2买是否成立。　至于万华，尽管最新mdi产品价格下跌，但走势仍然主要依赖大盘。所以，主要大盘下周一止跌，万华下周大概率走出填权反弹行情。,连载-5月24日-下周初将确认筑底成功与否
43,05月24日 ,甘肃股友,螃蟹在2018有3个账号有600309，去年在7月18逃跑了2个账号的600309，还有1个账号留50%的600309，当时认为效益好，不会怎么样跌的，而且股吧去吧是多头，我就没有全部跑了，后面600309趋势坏了还是抗，最后跌到20多。让我明白了随便怎么样好的票。趋势如果坏了 ，赶紧出来休息，在2019年600309在29多的时候加仓了，这次趋势坏了 ，有了上次教训，毫不犹豫在46.8附近全部清了3个账号。今天发了其中1个账号在2018年清的。螃蟹祝福大家！！大家都能够赚钱,我真实操作600309体会！！！
45,05月23日 ,重庆股友,"股东权益回报率分析公司应当为股东创造价值，股权价值增加表中的净利润即为股东的回报。因此，我们计算股东权益回报率来分析公司为股东创造价值的能力。股东权益回报率的计算公式如下：股东权益回报率=净利润/股东权益100%公式中的分子为股权价值增加表中的净利润(包括标准利润表中的其他综合收益)，分母股东权益可以用期初数、期末数或者期初和期末的平均数。如果在分析期间存在跟股东之间的交易，比如股东增加资金投入或者给股东现金分红，则需要对股东权益进行相应调整，计算股东权益的加权平均数。我们可以将股东权益回报率和股东的预期回报(股权资本成本率)做比较。前者高于后者，公司创造了股东的超预期回报，则公司股权价值增加值为正数；反之，前者低于后者，公司没有满足股东的预期回报，则公司股权价值增加值为负数。我们以<span class=""showStock"" id=""stock_sh600309"">万华化学</span><span id=""quote_sh600309""></span>为例，采用股东权益期初和期末的平均数以及表9-23中的净利润，计算其股东权益回报率如表10-1所示。表10-1　<span class=""showStock"" id=""stock_sh600309"">万华化学</span><span id=""quote_sh600309""></span>的股东权益回报率从表10-1中可以看出，虽然<span class=""showStock"" id=""stock_sh600309"">万华化学</span><span id=""quote_sh600309""></span>的股东权益回报率最低为16.34%，高于股东的预期回报，股权价值增加值为正数，但是<span class=""showStock"" id=""stock_sh600309"">万华化学</span><span id=""quote_sh600309""></span>的净资产收益率在2013～2015年度有比较明显的下降。那么，为什么股东权益回报率会发生上述变动呢？我们可以采用因素分解法做进一步分析。股东权益回报率=净利润/股东权益100%=息税前利润/营业收入营业收入/资产总额税前利润/息税前利润资产总额/股东权益净利润/税前利润100%=息税前经营利润率资产总额周转率财务成本效应比率财务杠杆倍数企业所得税效应比率100%=息税前资产回报率财务杠杆效应企业所得税效应比率100%从上述公式中，我们可以得出，股东权益回报率受到息税前经营利润率、资产周转率、财务成本效应比率、财务杠杆倍数、企业所得税效应比率五个因素的影响。这五个因素与公司创造价值的活动在逻辑上是一致的。息税前经营利润率和资产周转率反映公司的投资和经营活动效率，财务成本效应比率和财务杠杆倍数反映公司的筹资活动效率，企业所得税效应比率反映政府的税收以及公司的税务管理活动。很显然，上述比率越高，则股东权益回报率越高，给股东创造的价值就越高。因此，我们需要从上述五个方面着手，来提升股东权益回报率。我们以<span class=""showStock"" id=""stock_sh600309"">万华化学</span><span id=""quote_sh600309""></span>为例，计算分析<span class=""showStock"" id=""stock_sh600309"">万华化学</span><span id=""quote_sh600309""></span>股东权益回报率发生变动的原因，具体如表10-2所示。表10-2　<span class=""showStock"" id=""stock_sh600309"">万华化学</span><span id=""quote_sh600309""></span>股东权益回报率因素分析从表10-2中可以看出，各个因素对<span class=""showStock"" id=""stock_sh600309"">万华化学</span><span id=""quote_sh600309""></span>2013～2015年股东权益回报率的影响是：资产周转率、财务成本效应比率和企业所得税效应比率大幅下降，导致股东权益回报率下降；财务杠杆倍数上升，提升了股东权益回报率；而息税前经营利润率略有下降，但影响不大。（来源：谢克超的财富号 2019-05-23 17:04） [点击查看原文]<span id=""show_stock_str"" ></span>",股东权益回报率分析-股东赚钱的股票才是好股票
46,05月23日 ,云南股友,"每种有用的投资信仰，都将使人受益~！时间总是可以验证一些东西~！致各位投资人：不要被简单的涨跌,搅得自己的脑子唏乱~!价值投资的逻辑很简单，便宜买好货~!时间是好公司的朋友，坏公司的敌人~！折扣价期间，总有一些价值投资人，懂得把握机会~！行情总是在绝望中产生，犹豫中成长，希望中成熟，憧憬中毁灭~！投机总是被市场无情打脸~!赌徒终将在市场灰飞湮灭~！操作策略：继续看好，减轻仓位~！在已过去的2018年中，投机者受到足够多的教训，价值投资人开始潜心修炼提升认知~！股市的剧烈波动,使得投机者脑子唏乱~!",公司质量总是会在价格上表现~！
47,05月23日 ,云南股友,"每种有用的投资信仰，都将使人受益~！时间总是可以验证一些东西~！致各位投资人：不要被简单的涨跌,搅得自己的脑子唏乱~!价值投资的逻辑很简单，便宜买好货~!时间是好公司的朋友，坏公司的敌人~！折扣价期间，总有一些价值投资人，懂得把握机会~！行情总是在绝望中产生，犹豫中成长，希望中成熟，憧憬中毁灭~！投机总是被市场无情打脸~!赌徒终将在市场灰飞湮灭~！操作策略：继续看好，减轻仓位~！在已过去的2018年中，投机者受到足够多的教训，价值投资人开始潜心修炼提升认知~！股市的剧烈波动,使得投机者脑子唏乱~!",每种有用的投资信仰
48,05月23日 ,湖北股友,"近日，600271<span class=""showStock"" id=""stock_sh600271"">航天信息</span><span id=""quote_sh600271""></span>股份有限公司“覆盖交通领域全要素的人工智能融合创新应用示范”项目获国家发展和改革委员会批准立项。　　此次获批立项，是<span class=""showStock"" id=""stock_sh600271"">航天信息</span><span id=""quote_sh600271""></span>在人工智能、大数据、云计算与产业应用结合前瞻性规划的具体落地，也是<span class=""showStock"" id=""stock_sh600271"">航天信息</span><span id=""quote_sh600271""></span>在“AI 交通”领域的突破。<span id=""show_stock_str"" ></span>",信息科技股龙头...航天信息 业绩优秀 符合国家高新产业方
49,05月22日 ,贵州股友,"5月21日近百家投资机构到小新调研                                                                                                                                                                                ◆                                                  ◆                                                                                                                                                                                                                                                                                                                                                                                                                                                                                    <span class=""showStock"" id=""stock_sz002001"">新和成</span><span id=""quote_sz002001""></span>资讯                                                                                                            发表于 2019-05-22 19:02:21                                                                                                                                              [<span class=""showStock"" id=""stock_sz002001"">新和成</span><span id=""quote_sz002001""></span>吧] <span class=""showStock"" id=""stock_sz002001"">新和成</span><span id=""quote_sz002001""></span>:2019年5月21日投资者关系活动记录表                                                  公告日期：2019-05-22证券代码：002001 证券简称：<span class=""showStock"" id=""stock_sz002001"">新和成</span><span id=""quote_sz002001""></span>浙江<span class=""showStock"" id=""stock_sz002001"">新和成</span><span id=""quote_sz002001""></span>股份有限公司投资者关系活动记录表编号：2019-003投资者关系活动类别<span id=""show_stock_str"" ></span>",5月21日近百家投资机构到小新调研[赞][赞][赞]
50,05月22日 ,四川股友,,MDI、TDI暴跌！万华猪坚强
51,05月22日 ,河北股友,"<span class=""showStock"" id=""stock_sh600309"">万华化学</span><span id=""quote_sh600309""></span>2018年国外主营利润42.92亿元，占利润比例为百分之20.93，国外利润的毛利率为百分之20.91。万华万学和中国的原子弹一样，从无到有。从国内向国际发展，民族之骄子！我这名小散和<span class=""showStock"" id=""stock_sh600309"">万华化学</span><span id=""quote_sh600309""></span>的员工站在一起，共亨民族工业发展的红利，共同承担<span class=""showStock"" id=""stock_sh600309"">万华化学</span><span id=""quote_sh600309""></span>发展曲折风险！<span id=""show_stock_str"" ></span>",万华化学2018年国外主营利润42.92亿元
52,05月22日 ,海南股友,,《沪港深三地
53,05月22日 ,安徽股友,=隔夜外盘欧美股市涨势如虹全线大涨 道指连续六连涨近200点纳指涨逾1%，A大盘W底探明重拾升势这波将突破前高向3500点进军，大部分股票创今年反弹新高今天将在生物医药带领下高开高走瑞普生物兄弟同股本同行业（冠昊生物万孚生物）比较现价位低价低估值低涨幅上升空间大绩优盘小年报季报大幅增长加上公司大利好2亿元回购本股票看好属于价值投资成长发现，瑞普生物昨假摔量能充沛换手充分短线严重超跌今天低开高走发力拉升红色或涨停长阳反包大概率低价低估值低涨幅今年接下来必创新高目标价25一30元加仓捂好持股待涨小心踏空。,=[牛][牛][牛]隔夜外盘欧美股市涨势如虹全线大涨 道指连
54,05月22日 ,福建股友,2019年05月21日 10:51来源：生意社　　华南地区聚合MDI价格低位震荡。市场整体交投气氛清淡，持货商随行就市，一单一谈，观望厂家指导价格。报盘：万华货报价15000-15500元/吨附近；上海货现货报价12500-13000元/吨附近。(桶装含税送到价),MDI价格已经跌回2月份的价格
56,05月21日 ,内蒙古股友,大盘今日继续筑底震荡，最近的3根日k线再度形成底分型结构，不过由于之前的第一段上的反弹并没有走出日k向上一笔，所以分型上沿仍然是2929，结合第一段高点2956，那么本周后半段的震荡重点就是看能否突破2956并站稳至少2929，站稳2929，那么第3段向上就滞后确认从昨日低点开始。虽然从今日分时走出一上一下两根线段来看，昨日低点为5分钟盘整第3段上的起点概率已经明显增大。　反之，不能站稳2929，大盘仍然可以随时探底。　至于万华，在分红刺激下今日分时走势相对强势，今日再次筑底后走出日k向上一笔的概率急剧增大。预计本周万华以震荡走高为主，下周一分红除权后如果可以站稳今日高点，万华后面就有望去冲击上面的下跌缺口。,连载-5月21日-2929仍然是再次筑底后的争夺关键
57,05月21日 ,甘肃股友,"<span class=""showStock"" id=""stock_sh600309"">万华化学</span><span id=""quote_sh600309""></span>：每股分红2元，看上去很诱人，但除权后卖出还得缴税，外加股价必定下跌，所以，会得不偿失。高送转则不同，除权后即使股价下跌，也不打紧，因为股票增多了，会有填权暴利机会，所以，游资喜欢高送转标的，不喜欢高分红标的，<span class=""showStock"" id=""stock_sh600309"">万华化学</span><span id=""quote_sh600309""></span>公司管理层还没学到这一课。<span id=""show_stock_str"" ></span>",万华化学：每股分红2元，看上去很诱人，但除权后卖出还得
58,05月21日 ,吉林股友,核心题材：化工、绩优大盘股、行业龙头周线：boll带中轨附近止跌企稳，存在持续上涨的可能；日线：岛形反转后缩量回调至半分位附近；120分钟线：参考支撑位39.48元、36.49元、31.64元，macd底背离形成；60分钟线：macd底背离，上涨参考压力位43.42元、45.09元、46.76元、49.46元；,万华化学分析交流贴
59,05月21日 ,广西股友,"002166 <span class=""showStock"" id=""stock_sz002166"">莱茵生物</span><span id=""quote_sz002166""></span>　　收盘在　　9.77　　目标12元左右　5月16日晚 立帖为证！《该股走势向来活跃，庄家操盘凶狠，常走出旱地拨葱行情。该股近期于平台整理到位开始暗流涌动，加之题材刺激，很可能短期内走出一波狂飚行情》　我的买入点都在拉升阶段不在最低点。 在拉升阶段的股票是最节省时间，以最短的时间换取最快的利润。<span id=""show_stock_str"" ></span>",我一眼就看出这是一只牛股！不废话
0,05月21日 ,山西股友,,如何分析一家上市公司？
1,05月20日 ,江西股友,关于股价说一个最极端的想法给大家听，基于目前的行业格局，万华已经公布的在建工程，假设寇总股东大会上说的营业收入4：4：2、利润三分天下能否实现。未来十年营业收入和净利润会以年复合百分之15～20的增长。如果每年分红大于净利润的百分之50。股价这几年是25，30块，甚至20块都无所谓。,关于股价说一个最极端的想法给大家听，基于目前的行业格局
2,05月20日 ,山东股友,Boll下降趋势，KDJ还没到底。MACD绿柱继续加长。下档第一支撑36元，但是36元低于前期最低点，所以支撑力度有限。中期：万华股价跌破BOLL中轨。MACD绿柱出现。且死叉。基本面：MDI几个继续下跌，且没有止跌迹象。TDI价格也继续下跌。6月大概率MDI挂牌价大幅下调。而5月底之前，大盘表现不会太好。在内外交困之际，北上资金大幅流出，主力资金大幅流出。而散户不断涌入（股吧人数大幅增加）。挥动股价上涨的动力全无，一旦风吹草动，股价暴跌。6月底之前，万华股价会跌破30元。8月会跌倒25元之下。不是危言耸听，是事实结果。信者回避，坚持者买单。,万华下跌还没到反弹点
