,time,author,comment,header
24,08月26日 ,青海股友,"8月26日上午，由人民日报、新华社、中央广播电视总台等13家组成的中央媒体“推动高质量发展调研行”采访团一行，来到大连市长兴岛<span class=""showStock"" id=""stock_sh600346"">恒力石化</span><span id=""quote_sh600346""></span>产业园区，就我省及大连市高质量发展进行深入采访。恒力集团于2010年落户大连长兴岛，总投资1500亿元，目前正在全力建设<span class=""showStock"" id=""stock_sh600346"">恒力石化</span><span id=""quote_sh600346""></span>（大连长兴岛）产业园，产业园全部投产后可实现年产值3000亿元、利税650亿元。<span class=""showStock"" id=""stock_sh600346"">恒力石化</span><span id=""quote_sh600346""></span>2000万吨/年炼化一体化项目于2017年4月开工建设，2018年12月投料开车，2019年5月17日全面投产。采访团先后来到园区污水处理场、年产450万吨的芳烃装置、联合运营中心调研采访，<span class=""showStock"" id=""stock_sh600346"">恒力石化</span><span id=""quote_sh600346""></span>坚持安全发展、绿色发展、创新发展、可持续发展的理念引发了央媒记者的浓厚兴趣。曾对<span class=""showStock"" id=""stock_sh600346"">恒力石化</span><span id=""quote_sh600346""></span>产业园进行过多次采访的经济日报记者苏大鹏说，总投资1500亿元的<span class=""showStock"" id=""stock_sh600346"">恒力石化</span><span id=""quote_sh600346""></span>长兴岛产业园项目始终以建设“最安全、最环保、内在优、外在美”的世界一流石化园区为目标，还是全国首批“绿色工厂”。毫无疑问，在推进大连经济增长的同时，<span class=""showStock"" id=""stock_sh600346"">恒力石化</span><span id=""quote_sh600346""></span>无疑将是助推辽宁和大连实现高质量发展的重大项目。<span id=""show_stock_str"" ></span>",恒力石化：建设世界一流石化园区
25,08月24日 ,上海股友,"原公司半年报的现金流量表附表中“经营性应收项目的减少（增加以“－”号填列）”项目金额为-86.90亿元，与资产负债表主要相关科目之间的勾稽不对应，披露有误，金额应为-49.13亿元。差异原因主要系<span class=""showStock"" id=""stock_sh600346"">恒力石化</span><span id=""quote_sh600346""></span>试算合并过程中，对于经营性资产负债的内部抵消仅抵消资产负债表科目，未抵消现金流量表科目，导致现金流量表附表中“经营性应收项目的减少”和“经营性应付项目的增加”项目，同时存在差异。差异系现金流量表内部科目一增一减未抵消所致，经营性现金流总额不发生变化，对财务报表不产生任何影响。<span id=""show_stock_str"" ></span>",关于2019年半年报修订的解读！！！快来看啊！！
26,08月22日 ,重庆股友,"文/华商韬略 伊然“之前，民企是最后的选择。到今天，很多的博士首选工作地点是民企。”<span class=""showStock"" id=""stock_sz000876"">新希望</span><span id=""quote_sz000876""></span>集团董事长刘永好用简单的一句话，描绘了民营企业在国家、在社会上的地位的提升。8月22日，“2019中国民营企业500强”榜单及《2019中国民营企业500强调研分析报告》在青海西宁发布。总体来看，2018年，营业收入超过3000亿元的中国民营企业有12家，比上年增加3家；资产总额超过1000亿元的企业有76家，比上年增加15家；500强企业纳税总额达1.31万亿元，占全国税收总额的8.38%。华为投资控股有限公司年营业收入突破七千亿元，蝉联民营企业500强榜首。海航集团、苏宁控股分别以6182.93亿元和6024.56亿元的营业收入排名第二和第三位。正威国际集团、恒大集团、京东集团、碧桂园控股、恒力集团、联想控股、国美控股进入前十。需要注意的是，包括阿里、腾讯在内的一些知名公司，因为外资背景，并不在评选范围内。在此次榜单的前十名中，对普通消费者而言，营收超过3700亿元的恒力集团可能是最陌生的名字。但是在行业内，恒力的实力和名气则数一数二。恒力集团是以石化，聚酯新材料，地产和织造等四大板块为主业，热电、机械、金融、酒店等多元化发展的国际型企业。恒力集团的创始人陈建华是江苏吴江人，吴江自古便“日出万匹、衣被天下”，被称为“绸都”。13岁时，陈建华因为家贫辍学。他原本是想学习当一名泥瓦匠，但命运还是把他带回了丝绸业。靠着走南闯北收生丝，陈建华在20岁就已经挣得上百万家产。1994年，年仅23岁的陈建华认购濒临破产的南麻镇办集体织造厂，这个厂子成了吴江第一家正规民营企业。陈建华收购后的第一件事，就是全部淘汰落后的有梭织机，借债引进先进的1200锭网络车。新设备提高了产量和质量，使得工厂第二年就盈利1000多万。陈建华用“什么时代做什么事情”形容自己，但和别人做一样的事情不是他的性格，他要做的是行业的领头羊。“做企业要做就做大的，做世界领先水平的。”2008年，经济危机让恒力遇上了跨跃式发展的机会，也让陈建华看到了现有产业单一、转型空间有限的弊端。陈建华有一套“猫蛇论”：猫在冬天虽然缩在洞里取暖，但始终看着外面的机会；而蛇钻进洞里就只会冬眠。企业要过“猫冬”，不能过“蛇冬”。织造下游是服装产业，上游是石化产业。虽然我国是第一纺织大国，但化纤产业大部分产能集中在中下游，行业利润最丰厚的上游PX却被国外巨头垄断，无法掌握核心定价权。不想被别人卡脖子的陈建华最终决定进军上游，由此开辟了一条越来越重的大化工扩张之路。大连长兴岛，只有一条小路，没水没电，手机信号时有时无。陈建华却看到这里有做精细化工区位条件得天独厚。不仅是PTA，还是未来PX的理想生产基地。对于石化企业来说，规模就是王道。即使背上了沉重的债务包袱，陈建华也要把我战略布局的最佳黄金期，抢占核心资源。2012年9月，恒力一期440万吨PTA项目正式投产。陈建华又迅速上马二期项目，建成全球单体产能最大、工艺最先进、综合配套最全的PTA工厂之一。不仅如此，恒力还启动耗资740亿元的炼化一体化项目，直接攻上游，深耕全产业链。预计在2020年，总投资1500亿的大连长兴岛<span class=""showStock"" id=""stock_sh600346"">恒力石化</span><span id=""quote_sh600346""></span>产业园将基本建成。在建项目全部投产后，产业园将实现年产值3000亿元。有专家分析，未来三到五年内，会有9000亿资金注入炼化行业。尽管前景看似一片光明，但陈建华和恒力仍要时刻为下一轮竞争做准备。参考资料：《恒力陈建华：敢为人先的人生不平庸》――END――图片均来自网络欢迎关注【华商韬略】，识风云人物，读韬略传奇。版权所有，禁止私自转载！（来源：华商韬略官方账号的财富号 2019-08-22 17:10） [点击查看原文]<span id=""show_stock_str"" ></span>",中国民企500强发布，华为蝉联榜首
28,08月12日 ,辽宁股友,"一季度和二季度不管是销售产品还是原材料价格都比较稳定，业绩增量来源于2000万吨项目的投产，根据营业数据整理了一下，可以发现二季度PTA尚不如一季度。所以2000万吨项目的利润超乎想象，而且这个可以不断保持，我认为明年国金预测140亿的净利润都是保守。恒力往年30亿的净利润 2000万吨80亿的净利润（方正，申万预测考虑周期） 30亿新增产能的净利润（150万吨乙烯，500万吨PTA，还有几十万吨的聚酯），明年140亿是非常保守的，每股2块钱，参考<span class=""showStock"" id=""stock_sz002493"">荣盛石化</span><span id=""quote_sz002493""></span>明年10倍，<span class=""showStock"" id=""stock_sh600346"">恒力石化</span><span id=""quote_sh600346""></span>保守估计是20元。<span id=""show_stock_str"" ></span>",二季度相比于一季度，PTA和PX价差都比较稳定
29,08月12日 ,广东股友,"选什么样股最好？<span class=""showStock"" id=""stock_sh600346"">恒力石化</span><span id=""quote_sh600346""></span>有潜力分红高业绩好，这样就走对了百分之九十五，不达目的不换股，这样的股不用天天看盘，主力压价吸股时不用理，因分红和业绩在那，没什么担心，高枕无忧。每天百分之3.7以下不下车。赚7倍利润<span class=""showStock"" id=""stock_sh600368"">五洲交通</span><span id=""quote_sh600368""></span>，抄底上车了必大发特发。<span id=""show_stock_str"" ></span>",选什么样股最好？恒力石化有潜力分红高业绩好
30,08月12日 ,江西股友,"涨停解读封板时间：打开涨停8月9日晚，<span class=""showStock"" id=""stock_sh600346"">恒力石化</span><span id=""quote_sh600346""></span>(600346)发布2019年半年度报告，公司上半年实现营业收入423.33亿元，同比增长60.04%；归属上市公司股东净利润40.21亿元，同比劲增113.62%，半年度业绩就超过了去年全年盈利水平。这是恒力2000万吨/年炼化一体化项目全面投产后的业绩首秀，向市场递交了一份超预期的成绩单。数据回测：近两年中出现涨停次数：0 次涨停次日上涨概率：0.00%涨停次日平均涨跌幅：0.00%打板上涨概率：0.00%打板平均涨跌幅：0.00%打板上涨概率表示历史上该个股涨停后次日收阳线的概率打板平均涨跌幅表示历史上该个股涨停后次日以开盘价格买入至收盘时的平均收益数据来源:<span id=""show_stock_str"" ></span>",上半年净利40亿同比翻倍
32,08月12日 ,北京股友,唱多的都是有票的，各种唱空的都是没买的。具体怎么走，看入主恒力的主力怎么玩了，如果属于强庄，连续拉几个涨停不无可能。如果都是普通鸡狗，今天借利好出个货，放个量赚个5个点也就完了。关键是这只股前期没有大涨。今天出货谁都赚不到钱。,唱多的都是有票的，各种唱空的都是没买的
33,08月11日 ,天津股友,"8月8日晚间，“2019年中国最佳董事会50强”榜单揭晓，<span class=""showStock"" id=""stock_sh600346"">恒力石化</span><span id=""quote_sh600346""></span>股份有限公司（以下简称：<span class=""showStock"" id=""stock_sh600346"">恒力石化</span><span id=""quote_sh600346""></span>）强势上榜，成为化工行业内仅有的三家上榜企业之一。此次入围榜单充分彰显了市场对<span class=""showStock"" id=""stock_sh600346"">恒力石化</span><span id=""quote_sh600346""></span>企业管理和公司运营的高度认可。2019年“中国最佳董事会50强”榜单由《财富》（中文版）和怡安翰威特共同发布。它以今年中国最大的500家上市公司（即《财富》中国500强上榜公司）为候选池，以净资产收益率（ROE）、市值增长率和绝对值、独董占比、董事会构成质量等作为维度，最终评选出综合得分最高的50家公司。<span id=""show_stock_str"" ></span>",8月8日晚间，“2019年中国最佳董事会50强”榜单揭晓
34,08月09日 ,四川股友,"《投资时报》记者 杨帆8月9日，<span class=""showStock"" id=""stock_sh600346"">恒力石化</span><span id=""quote_sh600346""></span>（600346）发布2019年半年度报告。今年上半年，<span class=""showStock"" id=""stock_sh600346"">恒力石化</span><span id=""quote_sh600346""></span>实现营业收入423.33亿，同比增长60.04%；归属上市公司股东净利润40.21亿，同比劲增113.62%，半年度业绩就超过了公司去年全年盈利水平。值得一提的是，这是恒力“2000万吨/年炼化一体化项目”全面投产后的业绩首秀，向市场递交了一份超预期的成绩单，吸引了投资者的高度关注。从半年报披露内容看，<span class=""showStock"" id=""stock_sh600346"">恒力石化</span><span id=""quote_sh600346""></span>半年度经营业绩能够实现爆发式增长的原因主要在两个方面：一方面是PTA行业供需格局明显改善带来价差与盈利区间的快速上行，<span class=""showStock"" id=""stock_sh600346"">恒力石化</span><span id=""quote_sh600346""></span>拥有年产700万吨PTA产能规模，在本轮PTA-PX价差扩大中充分受益；另一方面，也是市场最为关注的，恒力2000万吨/年炼化一体化项目于今年3月打通生产全流程，5月份就实现了全面投产。<span class=""showStock"" id=""stock_sh600346"">恒力石化</span><span id=""quote_sh600346""></span>大幅领先同行业，率先迈入从“一滴油”到“一根丝”的全产业链业务实质性经营，是国内首家全产业链布局的民营炼化龙头。据悉，公司全资建设恒力炼化项目是全球一次性建设规模最大、技术工艺最复杂、加工流程最长、业务一体化程度最高、产业配套最齐全的重大石油炼化项目，创造了全球多项行业之最。该项目建设内容包括2000万吨常减压、1150万吨重油加氢装置、960万吨重整装置、450万吨芳烃装置、130万吨混合脱氢装置等大型工艺装置。恒力炼化项目由法国Axens、美国CLG规划，选用世界上最先进的全加氢和沸腾床加氢工艺，用最劣质的原油，生产最高品质的成品油与化工品。其中每年生产汽煤柴油600万吨，比例30%。该项目在辅助配套与产能一体化方面具有得天独厚的优势，主要配套包括自备燃煤热电厂、自建煤制氢联产甲醇、醋酸装置及自备原油码头（2个30万吨规模）、成品油码头、原油罐区等，年节省成本预计在30-40亿元。同时，恒力炼化项目生成出来的450万吨PX和35万吨醋酸直接利用管道输送到项目毗邻的PTA工厂，与国外进口相比，能够节省大量的运费、关税、损耗等中间成本。炼油、化工、煤化工相辅相成、互为依托，加上原料、产品储存运输系统优势，大大增强了项目的经营弹性空间与综合成本优势。按目前达产情况测算，2019年预计该炼化项目将实现产值超1500亿元，利税380亿元。目前，<span class=""showStock"" id=""stock_sh600346"">恒力石化</span><span id=""quote_sh600346""></span>150万吨/年乙烯项目和250万吨/年PTA-4项目建设均已全面进入设备安装高峰期，计划于今年10月投料开车。另外，250万吨/年PTA-5项目、135万吨/年多功能高品质纺织新材料项目和20万吨/年高性能车用工业丝技改项目也将于明年陆续投产。到2020年，在建项目全部达产后，<span class=""showStock"" id=""stock_sh600346"">恒力石化</span><span id=""quote_sh600346""></span>预计将实现产值3000亿元，利税650亿元。（来源：投资时报的财富号 2019-08-09 17:21） [点击查看原文]<span id=""show_stock_str"" ></span>",恒力石化：上半年实现净利润40.21亿元
35,07月30日 ,四川股友,"《投资时报》记者 杨帆近日，<span class=""showStock"" id=""stock_sh600346"">恒力石化</span><span id=""quote_sh600346""></span>（600346）子公司<span class=""showStock"" id=""stock_sh600346"">恒力石化</span><span id=""quote_sh600346""></span>（大连）炼化有限公司（简称“恒力炼化”）顺利获得原油进口权。国家商务部通过了对恒力炼化原油非国营贸易进口资格的申请，<span class=""showStock"" id=""stock_sh600346"">恒力石化</span><span id=""quote_sh600346""></span>成为国内首家“原油双权”（进口原油使用权和原油进口权）在握的民营炼化一体化企业。图1：商务部公示7月3日，2019年第二批原油非国营贸易进口配额下放，配额总量为5685万吨，叠加第一批进口配额（含追加共计9625万吨）截至目前累计下放总量高达15310万吨。其中国家商务部向<span class=""showStock"" id=""stock_sh600346"">恒力石化</span><span id=""quote_sh600346""></span>子公司恒力炼化下放1280万吨的原油进口配额，加上第一批次获批的400万吨进口配额，全年累计原油进口允许量达到1680万吨。<span class=""showStock"" id=""stock_sh600346"">恒力石化</span><span id=""quote_sh600346""></span>表示，目前公司基本实现了进口原油双权的并轨，可以满足炼化一体化项目日常生产加工需求，未来有望助推企业新一轮业绩爆发。记者注意到，<span class=""showStock"" id=""stock_sh600346"">恒力石化</span><span id=""quote_sh600346""></span>曾与中化集团在新加坡成立了恒力油化股份有限公司，负责炼化项目的原油进口采购、成品油和石化品出口销售以及在此基础上的原油、成品油国际第三方转口贸易。随着原油非国营贸易进口资格的获取，未来<span class=""showStock"" id=""stock_sh600346"">恒力石化</span><span id=""quote_sh600346""></span>在进口原油采购上将具备更大的自主选择权。借助现有成熟的原料采购和产品销售平台，<span class=""showStock"" id=""stock_sh600346"">恒力石化</span><span id=""quote_sh600346""></span>或将率先享受到炼油行业的高景气，增强盈利能力与核心竞争力。图2：恒力炼化一体化项目现场图（来源：投资时报的财富号 2019-07-30 16:32） [点击查看原文]<span id=""show_stock_str"" ></span>",恒力石化子公司获原油进口权 成国内首家“双权在握”民营
36,07月30日 ,重庆股友,"建国以来，首家，首家，首家，重要的事情说三遍<span class=""showStock"" id=""stock_sh600346"">恒力石化</span><span id=""quote_sh600346""></span>获原油进口权 成国内首家“双权在握”民营炼化企业近日，<span class=""showStock"" id=""stock_sh600346"">恒力石化</span><span id=""quote_sh600346""></span>(600346)子公司<span class=""showStock"" id=""stock_sh600346"">恒力石化</span><span id=""quote_sh600346""></span>(大连)炼化有限公司(简称“恒力炼化”)顺利获得原油进口权。国家商务部通过了对恒力炼化原油非国营贸易进口资格的申请，<span class=""showStock"" id=""stock_sh600346"">恒力石化</span><span id=""quote_sh600346""></span>成为国内首家“原油双权”(进口原油使用权和原油进口权)在握的民营炼化一体化企业。<span id=""show_stock_str"" ></span>",建国以来，首家，首家，首家
37,07月29日 ,辽宁股友,"近日，<span class=""showStock"" id=""stock_sh600346"">恒力石化</span><span id=""quote_sh600346""></span>（600346）子公司<span class=""showStock"" id=""stock_sh600346"">恒力石化</span><span id=""quote_sh600346""></span>（大连）炼化有限公司（简称“恒力炼化”）顺利获得原油进口权。近日，<span class=""showStock"" id=""stock_sh600346"">恒力石化</span><span id=""quote_sh600346""></span>（600346）子公司<span class=""showStock"" id=""stock_sh600346"">恒力石化</span><span id=""quote_sh600346""></span>（大连）炼化有限公司（简称“恒力炼化”）顺利获得原油进口权。国家商务部通过了对恒力炼化原油非国营贸易进口资格的申请，<span class=""showStock"" id=""stock_sh600346"">恒力石化</span><span id=""quote_sh600346""></span>成为国内首家“原油双权”（进口原油使用权和原油进口权）在握的民营炼化一体化企业。 图1：商务部公示7月3日，2019年第二批原油非国营贸易进口配额下放，配额总量为5685万吨，叠加第一批进口配额（含追加共计9625万吨）截至目前累计下放总量高达15310万吨。其中国家商务部向<span class=""showStock"" id=""stock_sh600346"">恒力石化</span><span id=""quote_sh600346""></span>子公司恒力炼化下放1280万吨的原油进口配额，加上第一批次获批的400万吨进口配额，全年累计原油进口允许量达到1680万吨。<span class=""showStock"" id=""stock_sh600346"">恒力石化</span><span id=""quote_sh600346""></span>表示，目前公司基本实现了进口原油双权的并轨，可以满足炼化一体化项目日常生产加工需求，未来有望助推企业新一轮业绩爆发。记者注意到，<span class=""showStock"" id=""stock_sh600346"">恒力石化</span><span id=""quote_sh600346""></span>曾与中化集团在新加坡成立了恒力油化股份有限公司，负责炼化项目的原油进口采购、成品油和石化品出口销售以及在此基础上的原油、成品油国际第三方转口贸易。随着原油非国营贸易进口资格的获取，未来<span class=""showStock"" id=""stock_sh600346"">恒力石化</span><span id=""quote_sh600346""></span>在进口原油采购上将具备更大的自主选择权。借助现有成熟的原料采购和产品销售平台，<span class=""showStock"" id=""stock_sh600346"">恒力石化</span><span id=""quote_sh600346""></span>或将率先享受到炼油行业的高景气，增强盈利能力与核心竞争力。图2：恒力炼化一体化项目现场图（来源：投资者网的财富号 2019-07-29 13:57） [点击查看原文]<span id=""show_stock_str"" ></span>",恒力石化子公司获原油进口权 成国内首家“双权在握”民营
38,07月29日 ,<a href='/u/6867776434' title='用户3417405948'>用户3417405948</a>,"<p><span style=""color:rgb(51,53,60);font-family:BiaodianProSansGB,HelveticaNeue,Helvetica,Arial,pingfangsc,HiraginoSansGB,MicrosoftYaHei,微软雅黑,STHeiti,SimSun,sans-serif;font-size:15px;"">商务部近日对<span class=""showStock"" id=""stock_sh600346"">恒力石化</span><span id=""quote_sh600346""></span>子公司恒力炼化申请原油非国营贸易进口资格材料进行了审核，恒力炼化顺利获得原油进口资质，成为国内首家“原油双权”(进口原油使用权和原油进口权)在握的民营炼化一体化企业，恒力炼化在进口原油的采购上将具备更大的灵活性，可借助成熟的原料采购和产品销售平台率先享受炼油行业高景气度影响，进一步提升盈利能力和核心竞争力。</span></p><span id=""show_stock_str"" ></span>",成为国内首家“原油双权”在握的民营炼化一体化企业
39,07月25日 ,海南股友,恒力是家大型民营企业，新项目上马本应获得股民的期待。但是，持续3周的天天跌，这是庄家挟持上市公司走向地狱的节奏，这严重损害了股民持有该股的信心，玷污了恒力的形象。我们不奢望像潜能恒信那样严重亏损却8连板，只希望恒力拿出负责任的态度，给股民以信心。,恒力连跌4周！
42,07月04日 ,河南股友,据商务部消息，6月28日，印度商工部发布公告，宣布对自中国进口的尼龙合成纤维长丝纱线产品发起反倾销调查。本案被调查产品被列在印度海关编码540231、540232、540239、540245、540249、540251、540259、540261和540269项下。,据商务部消息，6月28日，印度商工部发布公告
45,06月28日 ,四川股友,"《投资时报》记者 张嘉6月28日，上市公司<span class=""showStock"" id=""stock_sh600346"">恒力股份</span><span id=""quote_sh600346""></span>（600346）变更为恒力石化（600346）。基于目前主业变化，恒力石化通过参考行业情况，将证券简称变更，能够更准确反映公司主营业务特点，提升上市公司在资本市场上的辨识度和影响力。据悉，6月24日晚间，<span class=""showStock"" id=""stock_sh600346"">恒力股份</span><span id=""quote_sh600346""></span>（600346）发布《关于变更证券简称的实施公告》，公告称，经公司申请，由上海证券交易所核准办理。恒力石化此次更名，是实施完毕重大资产重组，即注入PTA石化经营性资产和炼化一体化项目后的既定步骤。根据2018年度财务数据，公司PTA石化业务营业收入已占到上市公司总营业收入的50%以上。注入的恒力2000万吨/年炼化一体化项目，已经于2019年5月17日实现全面投产，各装置运行稳定。更名为恒力石化（600346），是公司完成重大资产重组“长跑”的既定“终点”，又是率先进入民营炼化全产业链时代的新起点。恒力2000万吨/年炼化一体化项目是列入国务院文件的第一个重大民营炼化项目，也是国内首家民营大型炼化项目、新一轮东北振兴的战略项目。项目以 “10年不落后”的理念建设，高起点战略、高标准规划、高质量建设、高水平开车、高效率管理，创造了世界石油化工行业工程建设速度、全流程开车投产速度和达产速度最快的行业记录，成为行业高质量发展的标杆。上市公司产业链条也由现有的“PTA―聚酯化纤”产业链进一步延伸至更上游的芳烃、炼化业务环节，并率先在行业内打造并实现从“原油―芳烃―PTA―聚酯化纤”的全产业链发展模式。恒力石化表示，未来公司炼化、石化业务比重将进一步提升，营业收入贡献将达到80%<span id=""show_stock_str"" ></span>",今日“恒力石化”亮相资本市场！ 炼化、石化业务比重超80%
47,06月28日 ,<a href='/u/5346373166' title='梦中有朵'>梦中有朵</a>,一天3毛，也是醉了，阳离子线少，长纤维卖不掉,一天3毛，也是醉了，阳离子线少
