,time,author,comment,header
36,04月14日 ,山东股友,标题：增幅超60%，海螺集团1季度业绩领跑安徽国资企业！水泥内参今天记者近日从安徽省国资委获悉，省属企业经济运行开局良好，一季度累计实现营业收入2086.7亿元，同比增长19.4%；利润总额达151.4亿元，同比增长22.4%，实现“开门红”。3月末，省属企业资产总额达16332.2亿元，同比增长9.8%。截至2月底，与全国省级监管企业相比，省属企业资产总额居第11位，营业收入居第6位，利润总额居第4位。一季度，18户省属企业实现同比增长，占比达62%，省投资集团、合肥煤炭院、海螺集团、省旅游集团、皖中集团5户企业同比增幅超过60%。24户省属企业实现盈利，较2月末增加2户，盈利面为82.8%。截至目前，有14户企业利润总额超亿元，其中，海螺集团、省交通控股集团、淮河能源集团3户企业利润总额均超10亿元。今年以来，省属企业发展质量不断优化，债务风险防控有效。一季度，省属企业营业利润率、收入利润率、成本费用利润率分别为7.1%、7.3%、7.7%，同比均提高0.2个百分点；3月末省属企业平均资产负债率为60%，较上年末下降0.7个百分点。,标题：增幅超60%
37,04月14日 ,山东股友,"水泥内参今天水泥股近两个交易日陷入调整，<span class=""showStock"" id=""stock_sh600801"">华新水泥</span><span id=""quote_sh600801""></span>、<span class=""showStock"" id=""stock_sz000789"">万年青</span><span id=""quote_sz000789""></span>、<span class=""showStock"" id=""stock_sz000672"">上峰水泥</span><span id=""quote_sz000672""></span>等个股持续下跌。但另一方面，行业旺季特征明显，上市公司年报业绩接连“报喜”。对此，机构人士表示，目前行业处于季节性的良性向好状态，价格抬升、库存降低、盈利向好。短期调整更多来自市场情绪面影响。产品价格普涨本轮水泥股行情主要驱动力来自产品涨价。从3月下旬起，随着市场需求恢复正常、库存下降，水泥价格企稳并有所回升。4月起，水泥市场需求正式进入旺季，各企业水泥发货均实现产销平衡，企业第二轮推涨熟料价格。数据显示，4月4日京津两地水泥价格上调20元/吨；4月8日上海、南通和苏州、无锡、常州地区水泥价格上调20-45元/吨；4月9日起，杭州、绍兴地区水泥价格将上调30元/吨，各地已开启涨价模式。对此，业内人士表示，水泥价格上调，一是，天气转好，企业日发货表现良好，企业市场信心增强；二是，熟料价格已经上调，对本次水泥价格上调起到带动作用。“3月底4月初，国内水泥市场供需关系持续向好，南方地区相对保持稳定，北方地区继续恢复，水泥价格延续上行态势为主。”中泰证券行业分析师张琰表示，从价格曲线形态上看，预计一季度大部分企业仍然将保持较高盈利水平，在高基数作用下，预计2019年一季度南方地区的水泥价格仍将同比小幅提升。估值仍处修复通道经历前期的持续上涨后，近两个交易日水泥板块调整明显，这是否意味水泥股估值修复已达到合理区间？后市还要哪些驱动力？<span class=""showStock"" id=""stock_sh601688"">华泰证券</span><span id=""quote_sh601688""></span>表示，近日水泥企业大涨，主要原因在于需求验证带动悲观预期修复，进而带动水泥企业估值修复。从当前时点来看，预计水泥企业2019年盈利仍具稳定性，对应2019年估值仍处低位，仍处估值向上修复的通道中。<span class=""showStock"" id=""stock_sh601788"">光大证券</span><span id=""quote_sh601788""></span>分析称，需求端基建投资重回稳增长引擎，房地产投资增速会有回落，新开工和施工面积增速预计在上半年仍然保持较高增速，水泥的需求边际改善。一季度，华东和中南区域的水泥价格较去年同期高40元/吨至50元/吨，且煤炭价格较去年同期降幅在100元/吨以上，能源成本下降亦改善水泥成本压力。“近期水泥股虽然业绩普遍超预期但是股价却出现下跌，主要是短期获利资金（2016年以来超额收益非常明显）基于经济大趋势的不确定性，选择获利了结。”张琰表示，今年市场普遍担忧的问题很明显，地产需求趋于降温，今年水泥需求是否会出现明显的下滑导致业绩缺乏支撑。虽然从当前的投资、新开工、施工数据而言，整体需求仍然具备较强韧性，今年水泥行业的盈利在高位维持稳定的确定性仍然很高。<span class=""showStock"" id=""stock_sh601162"">天风证券</span><span id=""quote_sh601162""></span>表示，基建落地加速，2019年水泥基建需求较强的区域如京津冀将存在结构性机会，而西北地区因基建补短板政策带来的边际改善值得期待。<span id=""show_stock_str"" ></span>",水泥内参今天 水泥股近两个交易日陷入调整
38,04月14日 ,河北股友,"上边是上证指数走势图，从上我们可看出，上周大盘是持续大涨，本周是持续下跌。归期原因还是上周涨势过猛，短期获利盘过多，形成抛压，造成了A股本周的调整。但周五收盘后，市场迎来了二大利好事件：一大利好中国央行在周五收盘后公布了3月份金融数据：1、中国3月份人民币贷款16900亿人民币，前值8858亿人民币，啥？快多出一倍了！2、3月份社会融资规模2.86万亿，前值7030亿，啥？翻3倍了！3、M2货币供应比8.6%，创13个月新高，预期8.2%, 前值8.0%。这意味着三项最能体现货币投放程度的金融数据，远超市场预期！货币放水明显。在此利好刺激下，代表A股50只优质股票的A50指数在周五三点后是直线拉升；香港恒指尾盘也快速飞升；二大利好周五晚间欧美股指集体大涨上周美股、欧股、中国股市都有调整，只是周五晚间美股、欧股强势反弹到前高附近，把上周调整的跌幅全部收复了。美股上涨原因是摩根大通等财报靓丽，一起提振了市场的风险情绪。欧股的上涨是因经济数据、第一季度初的业绩和英国延迟退欧缓解了对该地区经济的担忧。我在文章里经常说一个问题，美股、欧股和中国股市在今年是同步上涨的，在没有超级利空出现的情况下，这种同步会持续下去。用美股欧股的走势来看我们的大盘趋势不是唯一指标，但一定是一个重要指标。如果A股的上涨趋势还会延续，哪摆在我们股票投资里最大问题是后期的主流行情到底是谁？近期有个情况，白马股走的异常凶猛，几乎延续了2017年的牛市行情，很多股票都创了新高，我前期统计了下，沪深300里的300只股票，创历史新高和在历史新高附近的就有61只股，占了20%。如白酒行业的<span class=""showStock"" id=""stock_sh600519"">贵州茅台</span><span id=""quote_sh600519""></span>、<span class=""showStock"" id=""stock_sz000858"">五粮液</span><span id=""quote_sz000858""></span>等，金融业的<span class=""showStock"" id=""stock_sh600036"">招商银行</span><span id=""quote_sh600036""></span>和<span class=""showStock"" id=""stock_sh601318"">中国平安</span><span id=""quote_sh601318""></span>等，家电行业的<span class=""showStock"" id=""stock_sz002032"">苏泊尔</span><span id=""quote_sz002032""></span>，水泥行业的<span class=""showStock"" id=""stock_sh600585"">海螺水泥</span><span id=""quote_sh600585""></span>，走的非常强。在白马股这种强势下，创业板近期走的并不理想，很多股票都在持续调整。前几年入股市的朋友应该知道，2016年、2017年白马股带领的沪深300指数走的很强，但2016年、2017年创业板指数是调整的。所以，在这两年布局了白马股的肯定是赚的，而一旦布局的是创业板股票被套的概率是极大。这叫结构性行情。现在问题是后期行情的延续是白马股和创业板股同步走强，还是只有白马股唱戏？很多白马股都创新高了，而很多创业板股还在底部遨游。白马股业绩稳健，估值合理，创业板里很多股票业绩没那么稳定，但是今年国家政策层面对科技发展非常支持。我们可以找出无数种理由说这事，但判断依旧只是判断，行情要走出来才知道。一旦判断错误，站错了队，可能你的收益又会延续2016、2017年的窘境。作为操盘，我是觉得可以通过仓位配置解决上边问题。白马股和创业板股一个都不放过，当然，我们只配置龙头股，白马股主要是一些传统行业的龙头股，创业板股主要是科技领域的龙头股。对于我来说，投资主要还是要追求确定性、风险低的稳健回报。（来源：刘峰解牛的财富号 2019-04-14 13:15） [点击查看原文]<span id=""show_stock_str"" ></span>",A股利好又来了！
39,04月13日 ,青海股友,"004问<span class=""showStock"" id=""stock_sh603505"">金石资源</span><span id=""quote_sh603505""></span>公司做为锂电池和氢燃料电池上游采矿企业、萤石是否有应用于新能源汽车中的锂电池和氢燃料电池？翔振公司现在什么进展了？投资者您好！603505<span class=""showStock"" id=""stock_sh603505"">金石资源</span><span id=""quote_sh603505""></span>公司做为锂电池和氢燃料电池上游采矿企业所产萤石作为锂电池与氢燃料电池初级原料、销售给下游氟化工企业用于制作氢氟酸等基础化工品，下游氟化工企业产品再销售于锂电池和氢燃料电池企业1.公司生产的酸级萤石精粉，主要销售给下游氟化工企业用于制作氢氟酸等基础化工品，氢氟酸主要用于制冷剂以及作为新能源、新材料、国防、航天航空等领域的含氟聚合物、含氟中间体和电子级氢氟酸等。从萤石中提取的氟，可用于生产锂电池的电解质六氟磷酸锂及氟石墨电极，氢燃料电池的质子交换膜（如全氟磺酸树脂）等，2根据内蒙古翔振矿业技改进展情况：原定技术改造工作已基本完成。进一步提高资源利用率，遂进入了技术升级改造阶段。升级改造完成后有望延长全年有效生产时间，提高采矿回收率及选矿回收率。预请关注公司将于4月18日发布的2018年年报。谢谢您的关注和理解！<span id=""show_stock_str"" ></span>",004问金石资源公司做为锂电池和氢燃料电池上游采矿企业、
40,04月12日 ,陕西股友,"长三角自贸区不论设在哪，<span class=""showStock"" id=""stock_sh600585"">海螺水泥</span><span id=""quote_sh600585""></span>和尖峰水泥是最先直接受益。不信看看上海市长的讲话:。。。已经进行基础设施的规划和建设。。。。今后几年江苏、浙江、安徽省的水泥产量都保持在5%以上的增速水平。展望未来需求，短期内基建托底，浙江有大湾区建设、亚运会配套建设。<span id=""show_stock_str"" ></span>",长三角自贸区不论设在哪，海螺水泥和尖峰水泥是最先直接受
41,04月12日 ,广东股友,国际货币基金组织上调中国经济增长预期。国际货币基金组织首席经济学家吉塔戈皮纳特：预计到2020年以后，全球经济增长将稳定在3.5%左右，这主要得益于中国和印度的经济增长，以及两国在世界收入中所占比重不断上升。此外，国际货币基金组织将今年中国经济增长预期上调0.1个百分点至6.3%，同时预计明年中国经济增速为6.1%。国际货币基金组织认为，中国的减税等财政政策将刺激经济增长,国际货币基金组织上调中国经济增长预期
42,04月12日 ,河南股友,如果总是关心一两天的行情，不仅意义不大，而且容易坏了心态，这样做投资是不太容易快乐的。我自认为看盘比较有天赋，也有一定经验，我画过K线图，计算过技术指标，对证券软件设计原理也比较了解，但我也强迫自己少看盘，因为看多了真没好处。股市投资尽量做到主动投资，盯盘数K线特别让自己情绪波动而进行被动交易。,如果总是关心一两天的行情，不仅意义不大，而且容易坏了心
43,04月12日 ,重庆股友,"公司自上市以来季K图,已上涨超过20倍本轮行情启动以来公司走势图一、行业公司所属行业为水泥建材行业二、目前产品产能1、熟料:2.48亿吨2、水泥：3.44亿吨3、骨料:3090万吨4、商品混泥土:60万立方米备注:熟料是水泥的半成品三、覆盖区域1、东部:江苏 浙江 上海 福建 山东2、中部:安徽 江西 湖南3、南部:广东 广西4、西部:云南 贵州 四川 重庆 陕西 新疆 甘肃四、优势公司是全国产能最大的行业绝对龙头,公司目前水泥产能3.44亿吨,占全国总产能23.2亿吨中的近15%的市场份额,由于水泥的商品属性,物流费用占比过大,销售半径一般不会太大,而公司在全国都有布局,已经占有了绝对优势,而由于供给侧改革,水泥新的产能建设已经非常难以被审批.公司2018年水泥综合成本为172.22元/吨.五、财务指标从指标可以看出,公司营业收入稳步上涨,而且相对其它水泥公司公司在产品价格下跌时周期性不是特别明显,凸现了公司的成长性和管理能力,周期处于低谷时利润也有保证,而高峰时利润能大涨,近十年<span class=""showStock"" id=""stock_sh600585"">海螺水泥</span><span id=""quote_sh600585""></span>最低利润也达到了60亿以上,而最高时候的2018年净利润达到298亿.六、个人点评A股市场像600585(<span class=""showStock"" id=""stock_sh600585"">海螺水泥</span><span id=""quote_sh600585""></span>)这么优秀的公司实在不多,10年来净资产收益率全部都在10%以上,20%以上也是常见的事情,每一次的下跌都是最佳的入场时机,近日已经创出历史新高,把它比作成水泥行业中的茅台一点都不为过.（来源：石木见的财富号 2019-04-12 12:09） [点击查看原文]<span id=""show_stock_str"" ></span>",周期股系列介绍: 水泥行业中的茅台600585(海螺水泥)
44,04月12日 ,安徽股友,"氢能车和加氢站是国家扶持产业大胆买入！买入！买入！，虽然你们一而在，再而三的失去了6元多，7元多可一次性满仓买入的良好机会，今天如果你们能果断13元多买上？5个交易日过后，<span class=""showStock"" id=""stock_sh600218"">全柴动力</span><span id=""quote_sh600218""></span>的股价一定在19元左右！到那时你们才觉得13元多买入的<span class=""showStock"" id=""stock_sh600218"">全柴动力</span><span id=""quote_sh600218""></span>价格很低！很正确前天就推介大家上车了,今年氢能源是重点发展元年,<span class=""showStock"" id=""stock_sh600218"">全柴动力</span><span id=""quote_sh600218""></span>和<span class=""showStock"" id=""stock_sz300471"">厚普股份</span><span id=""quote_sz300471""></span>将会超越<span class=""showStock"" id=""stock_sh600776""><span class=""showStock"" id=""stock_sz300379"">东方通</span><span id=""quote_sz300379""></span>信</span><span id=""quote_sh600776""></span>成为两市妖股总龙头!<span id=""show_stock_str"" ></span>",全柴动力 厚普股份 今天重点关注
46,04月11日 ,黑龙江股友,"红刊财经    受访人  艾古艾古：这轮行情起来以后，有价值的信息太多，出于轻重取舍的考虑，有些想法没有及时拿出来讨论。最近有点闲下来了，可以回过头来梳理一些既有价值又不是特别紧迫的想法了。比如关于券商股的问题。　　主持人：是啊，作为这轮行情打头炮的券商股，你居然视而不见，一句也不提，毫无道理的事。　　艾古：在金融行业的大三领域：银行、保险和证券里面，银行和保险都有我非常重视和高度认可的品种，唯独券商，以前我也谈过（相关观点我就不重复了，有兴趣的可以找出以前的有关文章来看看），我是完全看不上，贬得几乎一文不值。　　主持人：可是这轮行情，券商表现最好，你不能否认。　　艾古：我以为，券商本身是没有什么价值的，这一点毫无疑问。券商走强，不外乎两点原因，一是牛市券商必直接受益的概念，这也说明了这轮行情的性质就是政策市，否则不能确认一定是牛市就不可能提前拉券商股。二就是合资券商概念。因为目前国内券商肯定全都是毫无价值的，但是在国外成熟市场券商的地位是强大而崇高的，合资概念会给人带来很大的幻想空间。这个就好比国内的汽车公司，如果没有与国外汽车巨头的合资，它们本身是没什么价值的，而一旦摇身一变成了上汽大众广汽丰田，就一个个都土鸡变凤凰身价百倍了。　　主持人：摩根大通野村证券获准设立合资控股券商，意义很重大？　　艾古：更多的是象征意义吧。如果真有好事，我估计到时也肯定会搞一副新马甲作为合资主体，跟现在的那些上市券商股一毛钱关系没有。券商行情的主要原因，还应该是牛市受益概念。从大家能够接受的逻辑上来说，这还是比较有说服力的，所以虽然即使券商并无价值，主流资金拉升它们也还是有恃无恐的。　　主持人：这么说你还是看不起券商股？　　艾古：看不起，很low。事实上，我觉得到目前为止，所有主流热点基本都很low。　　主持人：那什么才符合你这不low的眼光？　　艾古：我问你，人们找对象一般都什么标准？　　主持人：俗一点说，男的主要得有钱，女的主要是要长得漂亮，大概这么个套路吧。　　艾古：女的主要看颜值，男的主要看实力，这个说法，谁都不反对吧？　　主持人：可以接受。　　艾古：选股票的道理与此完全相同！我们前几期把行情分为牛市行情和非牛市行情，把正常的股票分为价值股和非价值股，其实都好比是阴阳定性。既然股票分为价值股和非价值股，那么就可以把价值股比作男，非价值股比作女。选价值股，主要看重的是内在的实力，而选非价值股，唯一重要的就是要漂亮、形态好看！所以我多次谈到审美观的概念，因为形态丑的，肯定不赚钱。反之，则基本稳赚。　　主持人：不同人会有不同审美观，怎么办？　　艾古：不会的。托尔斯泰有句名言“幸福的家庭大都相似，不幸的家庭千奇百怪”，股票也是这样，好股的都样子差不多，烂股则丑得各种奇葩。股票的审美和人的长相美丑以及风景的好坏完全是一模一样的，都以动态均衡为美，以僵硬和失衡为丑，如果你看不出什么好看什么不好看，那一定是因为你看得不够仔细不够用心。你看看，<span class=""showStock"" id=""stock_sh600602"">云赛智联</span><span id=""quote_sh600602""></span>涨得多赏心悦目啊，“蝌蚪形调整形态完整+弧形出坑=确立见底转势”，要好好体会我说的这个话。蝌蚪形是一种非常根本的形态，它在理论上的地位，可以上升到很高很高，懂了它，你差不多就入门了，开始懂股票了，否则根本就盲无头绪。　　主持人：蝌蚪形和路线图什么关系？　　艾古：蝌蚪形是路线图的早期阶段基本单元的样子，就好比青蛙的早期是小蝌蚪。　　主持人：其实早期是蝌蚪形的似乎不仅是青蛙。　　艾古：没错，严格地说，人类最早期也是蝌蚪形。万物早期都是蝌蚪形。什么是蝌蚪形，为什么是蝌蚪形，最后如何演化，最终的结果是什么，我都有详细的无可争议的论述。　　主持人：那价值股的内在实力，又有何奥妙？最近青啤终于大涨，是否有何讲究？　　艾古：该涨的总归要涨。关于如何欣赏价值股的内在美，我建议关注一下<span class=""showStock"" id=""stock_sh600585"">海螺水泥</span><span id=""quote_sh600585""></span>的表现，有一定的代表性。价值股的走势，粗看不漂亮，其实很耐看。价值股和非价值股，是两套完全不同的评价体系，它们之间，同时又存在一种巧妙的相互关系。详情敬请关注艾古理论3.0版出炉时间。（本文已刊发于2019年4月6日出版的《红周刊》）（来源：红刊财经的财富号 2019-04-11 20:31） [点击查看原文]<span id=""show_stock_str"" ></span>",要么有实力
47,04月11日 ,<a href='/u/6567445808' title='用户6567445808'>用户6567445808</a>,"昨天说的拉高出货，果然今天大跌，算了，还是买点<span class=""showStock"" id=""stock_sh601857"">中国石油</span><span id=""quote_sh601857""></span>，抗跌强，且距离最低点才高5个百分点，其它股最少高30多百分点了<span class=""face-img face-wb-1-3"">[嘻嘻]</span>，而且即使牛市来了，它也一定会牛，只不过盘子大，来的慢，但风险性小的多！<span id=""show_stock_str"" ></span>",昨天说的拉高出货，果然今天大跌，算了
48,04月11日 ,黑龙江股友,"1、紫光国芯，日线级别回调还未到位，5、10日线以及MACD均出现死叉，短期要回踩20日线寻找支撑，目前这条均线价格43.49，逐日上行过程，可以考虑逢高减仓做T，44元附近接回。。差价降低持股成本。2、<span class=""showStock"" id=""stock_sh600585"">海螺水泥</span><span id=""quote_sh600585""></span>，今日收出一根倾盆大雨K线，5日线失守，短期要回补4月4号跳空缺口了，减仓是上策，股价处于历史高位，风险大。3、<span class=""showStock"" id=""stock_sh601890"">亚星锚链</span><span id=""quote_sh601890""></span>，业绩亏损，基本面差，股价涨幅巨大，首先不考虑做中长线。。短期关注下方20日均线支撑力度，不破情况下可以继续持股。。<span id=""show_stock_str"" ></span>",1、紫光国芯，日线级别回调还未到位
49,04月11日 ,湖北股友,2049该股近期说过，已经反弹到中期目标位，后市将震荡回落，操作，43附近加仓，持股46.15附近卖出（先反弹也要卖）600585已经破位，短线42.28卖出等待39.65回补。601890，该股进入高位震荡期，操作，7.75卖出，7.14技术回补。,2049该股近期说过，已经反弹到中期目标位，后市将震荡回落
50,04月11日 ,湖北股友,"百元大黑马｜国家科技最高奖｜<span class=""showStock"" id=""stock_sh600781"">辅仁药业</span><span id=""quote_sh600781""></span>600781大麻新贵和艾滋病新药 有小长春｜高新之称 抗真菌龙头百元｜<span class=""showStock"" id=""stock_sh600422"">昆药集团</span><span id=""quote_sh600422""></span>600422 抗真菌龙头　独一无二诺贝尔奖 光环耀眼！大麻新贵 有诺贝尔奖获得者屠呦呦与美国抗癌领军人物林文斌合作的抗癌药 可用本金买600781 用融资买600422 分担风险<span id=""show_stock_str"" ></span>",记住：抗真菌和大麻双龙头 业绩优秀 中国最高科技｜药中大
