,time,author,comment,header
49,03月14日 ,青海股友,"午评　　今日沪深两市股指双双低开，开盘后集体震荡杀跌走低，沪指跌破3000点，创业板指走势较主板更弱，大跌超3%。前期热点板块今天继续集体大幅调整，市场缺乏核心热点板块。今日最热话题：#水泥行业高景气延续#　　据中国水泥网研究院数据显示，2018年水泥行业利润有望创造新巅峰。<span class=""showStock"" id=""stock_sh600585"">海螺水泥</span><span id=""quote_sh600585""></span>相关负责人表示：“2019年水泥全行业的景气度将继续保持稳定。”龙一<span class=""showStock"" id=""stock_sh600720"">祁连山</span><span id=""quote_sh600720""></span>、龙二<span class=""showStock"" id=""stock_sh600449"">宁夏建材</span><span id=""quote_sh600449""></span>、龙三<span class=""showStock"" id=""stock_sz000789"">万年青</span><span id=""quote_sz000789""></span>。今日热门股吧话题再忙也要马上看懂这些，你就是股市真正的高手！更多话题网页端查看正确姿势：<br>再忙也要马上看懂这些，你就是股市真正的高手！更多话题APP查看正确姿势：　<br>　　昨日，证券时报记者从多家券商处获悉，监管部门近期密集召开相关会议，就券商外部接入和场外配资问题传达监管态度。3月8日，中证协在北京召集部分券商举行了专题会议，主要内容关于外部接入和严禁配资；同日，深圳证监局在深圳也召开了相关会议；更早前，证监会机构部2月下旬在上海亦举行了相关专题会议。<br>　　与此同时，已有地方证监局迅速行动起来，对辖区内证券公司场外违规配资进行现场检查。3月7日和3月8日，广东证监局和浙江证监局分别召集辖区相关证券营业部负责人座谈，内容均涉及严禁场外配资。　　中证协召开　　严禁配资专题会议　　昨日，一份关于券商传达上周五中证协专题会议精神的纪要在网上广泛流传，主要有六大要点：深刻反思并吸取2015年市场异常波动的教训；证券公司切实履行主体责任，要勤勉尽责；外部接入要严格规范，排查风险；管好营业部、从业人员，不得为配资提供任何便利；研究部门要客观理性谨慎发表言论，避免夸张、情绪性语言；加强舆情监测。　　证券时报记者从多家券商处获悉上述会议内容属实。据悉，参加上述会议的券商至少有<span class=""showStock"" id=""stock_sh600837"">海通证券</span><span id=""quote_sh600837""></span>、<span class=""showStock"" id=""stock_sh601211"">国泰君安</span><span id=""quote_sh601211""></span>证券、<span class=""showStock"" id=""stock_sh601878"">浙商证券</span><span id=""quote_sh601878""></span>、<span class=""showStock"" id=""stock_sh601108"">财通证券</span><span id=""quote_sh601108""></span>、<span class=""showStock"" id=""stock_sz002736"">国信证券</span><span id=""quote_sz002736""></span>、<span class=""showStock"" id=""stock_sh601688"">华泰证券</span><span id=""quote_sh601688""></span>和<span class=""showStock"" id=""stock_sh601555"">东吴证券</span><span id=""quote_sh601555""></span>等。　　据介绍，上述专题会议议题主要有两个，即券商外部接入和严禁场外配资。符合场外接入的证券公司悉数参加，证监会机构部相关负责人也参会并发表讲话。　　有券商人士称，部分券商网上交易系统本身有缺陷，可以被一些配资公司利用，破解相关接口后做一个配资平台。　　有参会券商在内部发布通知，要求经纪业务条线及各分支机构，严格执行中证协会议精神，规范执业、合规执业。　　各地证监局召开座谈会　　了解场外配资　　3月7日，针对近期市场反映场外配资有所抬头的情况，广东证监局召集辖区相关证券营业部负责人座谈，了解证券经营机构所掌握的场外配资的模式、对象、趋势等情况，并对证券经营机构防范场外配资风险提出明确要求：一是禁止与各类配资机构合作开展业务；二是加强异常交易监控和技术系统安全防护；三是深入开展投资者宣传教育等正面宣导工作。　　3月8日上午，浙江证监局召开辖区证券经纪业务合规风控管理座谈会，督促各证券经营机构增强合规风控意识，夯实内控，未雨绸缪，严格执行证券经纪业务及融资融券业务客户适当性管理，加强客户异常交易管理，做好技术系统安全维护，并重点强调了当前证券经纪业务合规风控管理的具体监管要求。　　该座谈会还提出四方面具体要求：一是全面落实“了解你的客户”原则；二是深入开展投资者宣传教育工作；三是切实做好交易信息系统安全防护；四是严格禁止参与非法场外配资活动。　　券商积极备战　　外部接入平台　　2月1日，证监会发文就《证券公司交易信息系统外部接入管理暂行规定》(下称《规定》)向社会公开征求意见。根据相关通知要求，此次公开征求意见为期一个月，截止时间为2019年3月2日。　　据证券时报记者了解，已有证券公司开始积极备战信息系统外部接入平台的筹备。　　<span class=""showStock"" id=""stock_sh601555"">东吴证券</span><span id=""quote_sh601555""></span>表示，关于信息系统外部接入的规范与流程准备已经基本就绪，接入平台后续相关技术优化正在紧锣密鼓开发中，计划5月底功能基本就绪。　　<span class=""showStock"" id=""stock_sz002736"">国信证券</span><span id=""quote_sz002736""></span>表示，交易系统外部接入的放开，有望进一步激发市场活力，提升市场风险偏好。此外，由于量化基金交易频率高且交易量大，券商交易佣金收入有望提升。　　  机构观点　　信达证券：强调，当前宏观基本面变化不大，但市场交易热情逐渐高涨，市场热点不断扩散。因而在当前市场环境下，低风险投资者可以逐步回归业绩与估值，适当选择具备成长性且估值不高的板块，高风险偏好可适当配置科技相关的主题板块，但应注意主题的持续性。<span class=""showStock"" id=""stock_sh601901"">方正证券</span><span id=""quote_sh601901""></span>：杨仁文认为，昨日创业板暴跌只是牛市里一次较大程度的回调；在这种牛市中，投资者整体恐惧而多疑，一旦下跌很可能当日出现较为猛烈的回调。2014至2015这轮牛市中，就存在股民常说的“牛市多长阴”的现象。<span class=""showStock"" id=""stock_sh601162"">天风证券</span><span id=""quote_sh601162""></span>：指出，监管加强预期的自我实现，导致指数层面后续以震荡为主。考虑长期主线逻辑和短期资金面、基本面的共振，继续看好成长的结构性机会，但各种主题投资过后是选择一季报高增长或者超预期的公司。国信策略：燕翔指出，A股市场底历来领先基本面底出现，几乎不会出现所谓的看清楚基本面拐点之后股市再开始启动。但当下A股上涨多少仍缺乏基本面的支持，估值修复、外资流入、利率下行、政策扶持是驱动本轮上涨行情的重要因素。<br>来源：证券时报 换手率有什么含义 怎样加仓永远不会亏 股市永远不变的真理 炒股赚钱核心的是什么 千万别搞错变盘与洗盘（来源：股吧的财富号 2019-03-14 15:39） [点击查看原文]<span id=""show_stock_str"" ></span>",监管联动严防场外配资 多部门近期召开专项会议
50,03月14日 ,陕西股友,"买入不急，卖出不贪，止损不拖，品种不散。各位好朋友，欢迎光临，在下严为民！脑经急转弯在证券市场是非常重要的一个操作心态，因为市场在变，咱们不能刻舟求剑。尽管昨天的暴跌完全在意料之外，为什么呢？创业板它的上涨逻辑就是因为科创板的推出，科创板的品种不赚钱，大家想都会飞到天上去，A股的上市公司就有了很大的比价空间。就这个逻辑，使得创业板暴涨。科创板还没有推出来，所以从惯性思维而言，这个巨大的套利空间存在，使得我们认为调整会有，但是不会太大。基于这个判断，我们立足于5G商用，也算作接地气了。我们在考虑有价值，不能只是讲故事，但是前一段时间出现的那些科学家操盘手，是有一些妖气释放出来。王老五改个名字叫王科技，它就具备科技了？但是市场认啊。这是一个疯狂的信号，但是疯狂什么时候结束很难估量。既然主流资金都在科技股，所以我们就稳妥一点，去选择优质的公司，有业绩的公司，有成长又有梦想的，以为这是比较稳妥的。当暴跌一来临，风格可能要切换，断头闸刀创业板至少要进入一个中期调整。既然如此，龙头倒了吗？不对，一轮牛市特别是大牛市，一定是多龙头轮动推进。高科技技术领先要怎么发财？是股票涨吗？股票涨，但最重要的是业绩要涨，买股票的本质还是买资产，要衡量资产的盈利能力，增值能力，所以还是带着业绩预期的。尽管这个市场炒的是未来，但有的未来你是看不见的，是完全在想象之中的，才会有市梦率。但是对待那些已经把钱赚出来，把业绩干出来的企业，牛市都来了，它们的估值还要在熊市里边待着吗？高位赚的盆满钵满，逢高出局的资金，因为断头铡刀意味着资金大量的出来了，甚至中线资金都跑出来了。那么有价值洼地躺在那里，是不是会得到这些资金的青睐？正因为这个逻辑，昨天下午敌变我变，市场变了咱不得不变。昨天鸦雀无声，无论是水泥、钢铁、煤炭、银行全都安安静静的。昨天跟大家讲了，价值洼地的重点在于二线蓝筹，市盈率水平低，股息率高。但为什么不是一线蓝筹？众所周知，曾经的抱团取暖，一般的活跃资金不敢去，被已经埋伏好的砸了怎么办？从价格的弹性和实战特点的综合考虑，因此给朋友们提出了风格转换转向业绩优良。估值水平还在熊市中待着的二线蓝筹股，以水泥钢铁煤炭为重点，因为这里面绩优蓝筹最多。早晨没有强势的收复失地创业板，风格切换成为定局，但我们要提前做好准备。我把今天的盘前早点分享出来，或许对大家会有启发：创业板昨日的动荡比2月26日那次严重得多，这俗称“断头铡刀”的大阴线极有可能是创业板中级调整的信号。盘面可见，部分“科技狂人”已开始撤离。主板呢？查场外配资直接浇灭券商“虚火”，指数自然无精打采。但我认为，这恰恰是市场转换热点的契机！不少二线蓝筹股价低得离谱，业绩好得流油。“猪仙”飞天是因为产品涨价，而价格稳涨、业绩优异的水泥板块接力“八戒”正当其时。<span class=""showStock"" id=""stock_sh600801"">华新水泥</span><span id=""quote_sh600801""></span>，<span class=""showStock"" id=""stock_sh600720"">祁连山</span><span id=""quote_sh600720""></span>，<span class=""showStock"" id=""stock_sz000789"">万年青</span><span id=""quote_sz000789""></span>，<span class=""showStock"" id=""stock_sz000672"">上峰水泥</span><span id=""quote_sz000672""></span>等二线优质公司建议追踪研究。为什么在那么多业绩优良的品种里边，我们首先认为水泥最有可能成为资金的关注点？因为水泥的涨价是最确定的，新基建国家战略。一旦春天来了，水泥又进入了旺季，它的业绩增长预期还会进一步的强烈。而且全国范围之内现在水泥的平均价格在六百块，这是一个高位。供给侧改革去产能环保等等使得留存下来的水泥企业，业绩纷纷大幅飙涨，这也是事实。所以牛市已经走到目前这个位置了，这一整个板块基本上都还躺在价值洼地。如果真是牛市，绩优蓝筹要不要补涨？五六倍能涨到十倍市盈率也不高，但是股价就有可能翻倍了。所以我认为作为游资从安全的角度而言，还是投机的角度而言，选择涨价预期强烈的版块作为接力，这个概率是比较大的。不好说确定，但方向告诉大家了，我没有选<span class=""showStock"" id=""stock_sh600585"">海螺水泥</span><span id=""quote_sh600585""></span>，选的全是二线绩优业绩优良的，就充分的考虑了资金的偏好和价格的弹性。当然我认为绝不仅仅是水泥，一旦水泥开始闻风而动，接下来钢材、煤炭，包括银行不是一样的吗？所以这个指数只是前期妖气太重，妖雾弥漫在创业板中，这是不正常的现象，要把妖气除净，未来健康的力量才会蓬勃成长！（来源：严为民的财富号 2019-03-14 13:48） [点击查看原文]<span id=""show_stock_str"" ></span>",严为民：安全的“倍增机会”来了！
52,03月13日 ,青海股友,"今日中午国指收报11397点，跌68点或跌0.6%。截至下午14：50分，国指报11403，跌64点，成交168亿元。国指成份股当中，下午录得升幅的个股分别有：<span class=""showStock"" id=""stock_sh601318"">中国平安</span><span id=""quote_sh601318""></span>（2318）升1.9%，中国财险（2328）升1.7%，<span class=""showStock"" id=""stock_sh600585"">海螺水泥</span><span id=""quote_sh600585""></span>（914）升0.9%，中国铁塔（788）升0.5%，邮储银行（1658）升0.2%。升穿20天线的中国财险，对国指升幅贡献点数约2.2点，位居排行榜第二，在<span class=""showStock"" id=""stock_sh601318"">中国平安</span><span id=""quote_sh601318""></span>贡献点数18.7点之后。中国财险已连升3天，今日股价一度升至9.27元，据系统数据分析，中国财险日内的第一阻力位9.5元。在其条款较理想的认购证产品中，升幅最大的有逾13%，实际杠杆比率6.2倍。同样连升3天的<span class=""showStock"" id=""stock_sh600585"">海螺水泥</span><span id=""quote_sh600585""></span>，成交达9.7千万元，对国指升幅贡献点数约1.1点。股价最高触及44.95元。据系统数据分析，<span class=""showStock"" id=""stock_sh600585"">海螺水泥</span><span id=""quote_sh600585""></span>日内第一个阻力位46.1元。投资者值得留意，<span class=""showStock"" id=""stock_sh600585"">海螺水泥</span><span id=""quote_sh600585""></span>已升穿20天线。10大活跃股之一的中国铁塔，下午对国指升幅贡献点数约1点，成交5.4亿元，股价最高触及1.89元，与系统分析的日内第一个阻力位1.9元相当接近。如投资者继续看好中国铁塔，可留意系统分析日内的第二个阻力位2元。以上内容来自融慧财经，仅供参考不作投资建议。著作权归作者所有。商业转载请联系作者获得授权，非商业转载请注明出处。（来源：融慧财经的财富号 2019-03-13 15:09） [点击查看原文]<span id=""show_stock_str"" ></span>",融慧财经： 午后国指跌0.6% 中国财险逆市扬
53,03月13日 ,湖北股友,"百元牛股<span class=""showStock"" id=""stock_sz002055"">得润电子</span><span id=""quote_sz002055""></span>002055的朦垄重大利好 据传大股东深圳市得胜资产管理有限公司正与深圳华为科技有限公司 商讨转让部份股权事宜　<span class=""showStock"" id=""stock_sz002055"">得润电子</span><span id=""quote_sz002055""></span>有芯片 OLED 5G 无人驾驶 创投独角兽 电子和互联网金融等大题材业绩优秀 高速成长<span id=""show_stock_str"" ></span>",深圳华为大题材 深圳总有神话 总是出特大黑马 必看！
54,03月13日 ,<a href='/u/6109446546' title='20110101fufbj'>20110101fufbj</a>,"为什么总是震荡，业绩这么好<span class=""face-img face-wb-1-14"">[怒]</span>",为什么总是震荡
56,03月12日 ,江西股友,"新一年重大项目开工的机器轰鸣声犹在耳旁，浪潮大数据产业园先期投入项目无锡城市大数据中心已有实质性进展――本月，作为城市管理“大脑”的大数据中心，软件部分开发基本完成，正式启动试运行。而一路之隔的雪浪数制“工业大脑”雪浪云，正在聚合越来越多的工业企业。“两个大脑”在无锡经开区加速孕育，与该区产业“中枢”“内核”的定位高度吻合，不仅将成为未来无锡产业发展的新动能，还将从政务、交通、能源等方面改变城市管理的方式，助推无锡在城市群竞争中占得先机。自2016年开始实施以来，无锡城市大数据中心目前已进入二期实施阶段，将交通、能源、供水等基础设施全部数据化，连接散落在城市各个单元的数据资源，打通“神经网络”。浪潮卓数大数据产业发展有限公司副总经理宋设介绍，当实现数据汇聚以及政府内部各部门数据共享之后，市民办理业务基本就只需要跑一次腿了。“浪潮大数据目前已拥有覆盖商品零售、企业画像、环境、农业、金融、交通等10个领域超过30多类数据资源。”相关人士介绍，中心已梳理了全市50多个部门、45TB的数据、上万个目录数，方便政府部门内部数据共享，未来中心将以立足无锡、应用全国、服务全球为战略方向，加快推动大数据应用推广和产业化发展，为无锡乃至江苏省实现经济转型升级提供有力支撑。另一个“大脑”同样在发力。不久前，无锡雪浪数制科技有限公司打造的“雪浪云”工业互联网平台被工业互联网产业联盟评为“四星”，这意味着雪浪云通过了全国性工业互联网联盟组织的测评。“如果说智能制造是给工业加上了机器臂和数字神经，工业云就是给工业安上了大脑。”公司副总经理姜其强如此形象“雪浪云”。目前，“雪浪云”工业互联网平台服务包括智能设备管理套件、智能生产管理套件、高级工具服务、工业物联服务等。“我们营造的是一个工业互联网生态，所有的集成商都可以聚集到这个平台来，这是一个超过4800亿元的蓝海市场。”利用有限的土地资源做大能级，打造无锡产业的“中枢”和“内核”，数字经济是无锡经开区产业发展的优先选项。“无锡经开区把物联网、大数据、人工智能、云计算等作为未来产业发展方向，抓住了数字经济的关键领域。”信息技术与科学专委会、物联网小组负责人冯翔如此评价。随着新一代信息技术和产业的蓬勃发展，物联网技术不断成熟、应用逐步推广、产业加速蓄力，不仅为传统生产生活场景赋予了强劲动能，也为新经济、新产业的诞生提供了强力助推。姜其强说，落户无锡经开区后，企业正步入一个高速增长期，“无论是产业政策还是人才政策，经开区都成为创新经济的最好选择。”雪浪数制目前已与双良集团在新型能源领域开展了合作，并延伸到合资公司的成立，“这就是良好产业生态的开端。”据透露，包括<span class=""showStock"" id=""stock_sh600370"">三房巷</span><span id=""quote_sh600370""></span>、阳光、<span class=""showStock"" id=""stock_sh600585"">海螺水泥</span><span id=""quote_sh600585""></span>等在内的企业也都表达了合作意向。（来源：共话互联的财富号 2019-03-11 22:27） [点击查看原文]<span id=""show_stock_str"" ></span>",浪潮城市大数据中心 “雪浪云” “两个大脑”加速孕育引领
57,03月12日 ,湖南股友,"一个正在崛起的，资本市场 春节后大盘一路上攻，大家耳闻目睹。我们的资本市场正在崛起，因为高层的意图就是发展壮大。众所周知落后就意味着挨打，。我们一个14亿人口的消费市场，深深地吸引着世界。中国具备着强大的潜质。 2会出现了亮点，在15个委员中都是讲完一片掌声，但是唯有探月总设计师，吴院士讲完一句就是掌声，连成了一片。屡次将会被打断：1明年发射火星探测器，2在月球南极设立中国为主导多国参与的探月研究站3中国将完成登月。中国人的强大已经是必然。既然要强大，要发展，这是需要资金的，是需要钱的，哪里来？股市来，所以慢牛上路了。经济的最高表现形式和社会资源配置的最基础最重要最便捷就是股市。他的地位不容忽视。 虽然周五大盘猛跌，我们下手渗透了。昨日我们的策略是大盘要阳收，支撑2950，没有人认可，更有人认为我们疯了，但是结果呢股指站上3000点，我们在猛跌之时下手是对的。事实已经摆在面前没有争议，大家记住真理只在少数人手里。通过数据显示我们发现北上资金开始松动，连续4个交易日流出，流入的资金切入了<span class=""showStock"" id=""stock_sh600030"">中信证券</span><span id=""quote_sh600030""></span>，<span class=""showStock"" id=""stock_sh600585"">海螺水泥</span><span id=""quote_sh600585""></span>，<span class=""showStock"" id=""stock_sz000333"">美的集团</span><span id=""quote_sz000333""></span>......周一电力板块集体爆发，整个板块66支股票，50支涨停板，可想此板块的合力，应该引起大家的重视，新的板块出现，新的热点浮出水面你还在做老热点，恐怕你将成为西湖瞰景的一员。芯片继续表演强势不改。 大盘今日应该收小阳，市场将在3000点稍作整固，大家不可过于激进，逢低下手渗透，不可追高，跌停板上的股票就是例子，哪个不是涨幅过大，哪个不是连扳上攻，所以这样的股票敬而远之，让他成为风景吧！！！！ 炒股之路漫漫旧长，每天的早策略和晚收评从未间断，无论是涨跌，更无论是牛熊，一如既往和坚持不懈的文章陪大家走过了春夏秋冬。对于每次的判断我们还是比较精准的。每日的苦口婆心，为的是让你在盘中有个合理的应对策略，以至于临阵不慌。在你眼中我们的付出即便是浮云，飘过就好，如果真的通过阅读能给你带来帮助我心足矣！！！！（来源：子剑战股海的财富号 2019-03-12 08:02） [点击查看原文]<span id=""show_stock_str"" ></span>",一个正在崛起的市场
