,time,author,comment,header
1,11月24日 ,<a href='/u/2166405295' title='幸运星2166405295'>幸运星2166405295</a>,"小心机构，往上派货，出局<span class=""face-img face-wb-1-3"">[嘻嘻]</span><span class=""face-img face-wb-1-3"">[嘻嘻]</span><span class=""face-img face-wb-1-3"">[嘻嘻]</span><span class=""face-img face-wb-1-3"">[嘻嘻]</span>",小心机构，往上派货
3,11月07日 ,山西股友,集中大涨！700元混凝土、300元砂石、600元水泥来了！据媒体报道，如今，看上去不起眼的砂石，价格一路涨了起来：在湖北黄冈，河砂价格从2018年1月的每吨68元上涨到今年7月的165元，上涨幅度高达143%；在广东，当地价格监测部门提供的数据显示，今年8月，该省河砂购进价已涨到了一立方米216元。据广东省价格监测中心提供的数据，广东省河砂价格已连续3个月上涨。8月，广东全省河砂平均购进价为每立方米216元，环比上升1.44%。今年1月以来，广东省河砂平均购进价就一直在200元/立方米的高位上徘徊。据市场反馈，自10月以来，广东多地混凝土主要原材料水泥、砂石经历了一次快速上涨，并且主要原材料出现供应紧缺现象，导致原材料成本大幅上涨，各搅拌站表示混凝土生产成本急剧增加，压力无法承担。受此影响，江门地区商混企业已累计通知上调混凝土价格40-50元/方左右，涨后目前C30含税非泵送价格在540-560元/方左右。,集中大涨！700元混凝土、300元砂石、600元水泥来了！据
4,11月06日 ,广东股友,巴菲特说过，人们对行业的期待没有任何价值，无论是什么产业，评估的标准都应该是统一的，所有的资产都应当被同样的估价。无论什么产业，最终都只有通过把销售转化为盈利以及盈利增长率来判断。所有企业的内在价值都应该取决于企业未来预期收益的折现值，而不应该根据人们对行业的期待来高估，或者低估企业的价值。卖酒的市盈率能够到30倍，40倍甚至更高，而水泥普遍只有6倍7倍，不到10倍的市盈率呢？难道水泥赚的是人民币，白酒赚的是美金吗？,巴菲特说过，人们对行业的期待没有任何价值，无论是什么产
5,11月05日 ,云南股友,"水泥作为非金属建材大宗商品之一，价格涨跌具有很强的周期性。自2015年底水泥的价格跌到谷底之后逐渐回升，一直到2018年末水泥价格触碰到历史高点之后小幅回调，2019年至今水泥价格维持于历史高位水平，水泥价格从每吨200多元，上涨到现在每吨450元左右，局部地区一度达到近十年来的历史最高价格每吨495元。据了解，市场处于传统旺季，随着各地大小项目开工，水泥需求销量明显向好，近期多地水泥价格开始全面上调。此外，错峰停产仅是本轮水泥价格上涨的原因之一，交通基建带来的高位水泥需求才是最主要的原因。9月中下旬以来，地方稳投资的力度加大，多地纷纷将着力点放在交通项目建设方面。据<span class=""showStock"" id=""stock_sh601377"">兴业证券</span><span id=""quote_sh601377""></span>数据，9月14日至9月20日，国家发展改革委基建项目申报20154.82亿元，环比上涨126.23%。据信达证券发布<span class=""showStock"" id=""stock_sh600801"">华新水泥</span><span id=""quote_sh600801""></span>的研报显示，下游需求具备支撑，水泥价格仍将维持高位。2019年我国房地产调控力度有所放松，房地产投资韧性十足，同时在国家基建补短板政策的指引下，基建投资增速有望逐步企稳回升，整体来看水泥下游需求具备较强支撑。而在供给端，企业协同力度在加强，环保限产大方向并未发生改变，产量难以大幅增长。综上判断，行业格局仍将偏紧，水泥价格将继续在高位运行。事实上，行业分析人士告诉财联社记者，水泥价格不排除进一步上涨可能。今年5月，我国P.O42.5散装水泥均价为66美元/吨，而国外大部分水泥产销大国水泥价格均较高，普遍在80美元/吨以上。从煤炭成本、环保成本以及人工成本多方面考虑衡量，水泥价格在未来一段时间的旺季还将在高位区间内震荡前行。<span id=""show_stock_str"" ></span>",水泥作为非金属建材大宗商品之一，价格涨跌具有很强的周期
6,11月04日 ,安徽股友,"<span class=""showStock"" id=""stock_sh600585"">海螺水泥</span><span id=""quote_sh600585""></span>，好股！为什么<span class=""showStock"" id=""stock_sh600585"">海螺水泥</span><span id=""quote_sh600585""></span>业绩比同行业其他公司好很多？因为公司实行了“T”型战略，沿着长江建立大型熟料生产基地，然后大规模收购沿海水泥厂，一横一竖就是“T型”。熟料沿着长江运到沿海发达地区，研磨成水泥。要知道，水泥死沉，长江水运便宜又实惠，而东部地区经济发达，水泥需求量巨大。所以说，<span class=""showStock"" id=""stock_sh600585"">海螺水泥</span><span id=""quote_sh600585""></span>成功原因之一，位置好！<span id=""show_stock_str"" ></span>",海螺水泥
7,11月04日 ,浙江股友,"从自动化到智能化 中国水泥走在前列　　智能化作为第四次工业革命的动力，越来越受到传统工业行业重视。作为重要基础性建筑材料之一的水泥行业更在追赶智能化的路上，不断尝试，努力将前沿技术与实际生产相结合，走在了各行业前列。和传统水泥强国相比，虽然起步晚，但是对于新技术的追求意愿更加强烈，特别是国内两大水泥集团。中国建材和<span class=""showStock"" id=""stock_sh600585"">海螺水泥</span><span id=""quote_sh600585""></span>先后在山东泰安和安徽全椒建成了泰安中联和全椒<span class=""showStock"" id=""stock_sh600585"">海螺水泥</span><span id=""quote_sh600585""></span>智能工厂。<span id=""show_stock_str"" ></span>",从自动化到智能化 中国水泥走在世界前列
8,11月04日 ,云南股友,作为逆周期调控的举措，专项债开始提速扩容，地方重大项目精准投资已接踵启动。《财经》记者从多个渠道了解，截至10月底，2019年新增地方政府债务发行规模已经完成30800亿元(其中，专项债务21500亿元、一般债务9300亿元)的全年计划额度，并已全部拨付具体项目，2020年部分新增专项债或将在今年第四季度提前下发。未来几年将是水泥行业的强周期！,作为逆周期调控的举措，专项债开始提速扩容
10,11月04日 ,山东股友,"水泥板块的80%的股票创近期新高，<span class=""showStock"" id=""stock_sh600802"">福建水泥</span><span id=""quote_sh600802""></span>受市场资金关注少？股价低的有诱惑感，但大资金不关注，也只能被市场冷落，这和公司证券市场监管人有关，不会利用市场增加资本价值？水平太差，包括老总在内不懂得股票市值对产业发展的影响！只抱着自己小九九迟早被市场淘汰！<span id=""show_stock_str"" ></span>",海螺可以收购福建水泥！
11,11月03日 ,湖南股友,"十多年前，6个身怀梦想的年轻人用大学基金办公室提供的1亿多元成立了高瓴资本，他们坚持价值投资理念，在张磊的带领下，目前资产2000多亿，成为亚洲最大的私募股权管理基金之一，张磊个人资产也有220亿，投资理念，弱水三千，但取一瓢，十几年买的股票就那么十只左右，<span class=""showStock"" id=""stock_sh600009"">上海机场</span><span id=""quote_sh600009""></span>，<span class=""showStock"" id=""stock_sh600007"">中国国贸</span><span id=""quote_sh600007""></span>，<span class=""showStock"" id=""stock_sz000401"">冀东水泥</span><span id=""quote_sz000401""></span>，洋河，美的，格力，泰格，<span class=""showStock"" id=""stock_sz300015"">爱尔眼科</span><span id=""quote_sz300015""></span>，海螺等。<span id=""show_stock_str"" ></span>",价值投资的典范高瓴资本
12,11月02日 ,云南股友,"柬埔寨马德望海螺、印尼北苏海螺等 2 条熟料生 产线及 4 台水泥磨相继建成投产，老挝琅勃拉邦海螺项目建设进入设备安装阶段，缅甸 曼德勒海螺项目已开工建设，老挝万象海螺、乌兹别克斯坦卡尔希海螺等项目前期工作有序推进。跟着一带一路的脚步越来越快，越来越远，<span class=""showStock"" id=""stock_sh600585"">海螺水泥</span><span id=""quote_sh600585""></span>的未来发展潜力巨大！<span id=""show_stock_str"" ></span>",柬埔寨马德望海螺、印尼北苏海螺等2条熟料生产线及4台水泥
13,11月02日 ,云南股友,"如果说水泥行业股票是周期股，那么未来二、三年水泥行业处于强周期之中。目前水泥股的估值就不应该是低估而应该是溢价！<span class=""showStock"" id=""stock_sh600585"">海螺水泥</span><span id=""quote_sh600585""></span>自上市以来业绩效益十分稳定，在A股几千只上市股票中，其经营管理的稳定性可以说数一数二，已经是一只穿越时间周期的周期股。<span id=""show_stock_str"" ></span>",如果说水泥行业股票是周期股
14,11月01日 ,湖北股友,"近日，<span class=""showStock"" id=""stock_sh601857"">中国石油</span><span id=""quote_sh601857""></span>长庆油田公司对外宣布，甘肃陇东发现10亿吨级庆城大油田并通过了国家自然资源部终审，新增探明储量3.58亿吨，预测储量6.93亿吨，形成了10亿吨级储量规模，并已在甘肃庆阳革命老区建成百万吨原油生产能力，未来3到4年里将建成具备300万吨的产油能力，目前该油田固井用油井水泥为<span class=""showStock"" id=""stock_sz000672"">上峰水泥</span><span id=""quote_sz000672""></span>宁夏基地供应。　　<span class=""showStock"" id=""stock_sz000672"">上峰水泥</span><span id=""quote_sz000672""></span>宁夏基地明峰萌成建材公司地处陕西、甘肃、宁夏、内蒙古四省区交界处，该区域拥有丰富的石油资源，固井用特种油井水泥用量较大，公司依托多年的专业经验和先进的生产工艺，开发了油井特种水泥，成为该基地的拳头产品之一。多年来，公司宁夏基地的油井水泥供应周边各油田建设项目区域，产品品质优良，顺利通过石油专业监督检验机构的审定，被<span class=""showStock"" id=""stock_sh601857"">中国石油</span><span id=""quote_sh601857""></span>公司指定为油田建设专用水泥，与长庆油田、川庆钻探、华北油田、延长油田、中原油田等广泛开展长期合作，具有丰富的售后服务经验。公司油井水泥在油井开发使用过程中稠化时间、强度、密度等指标均优于相关技术指标，深受各大石油施工单位的好评。　　<span class=""showStock"" id=""stock_sz000672"">上峰水泥</span><span id=""quote_sz000672""></span>宁夏基地处于“丝绸之路经济带”的重要经济发展区域，市场布局处于有利的位置，对公司在“一带一路”新布局具有重要的战略意义。未来，公司将积极开展与庆城油田项目的合作，提供优质的产品和服务，近期该基地还开工建设了上峰宁夏环保项目利用公司水泥窑生产线协同处置危废及危废填埋，年处理油井污泥、含油污泥、煤焦油残渣等40余类别的危固废共17万吨，填埋各类危废总量达109万方，计划明年8月投运，项目是目前宁夏地区唯一水泥窑协同处置项目，可大幅提升该地区的危废处置能力，使工厂化身为真正的环保企业。（文章来源：证券时报网）　[点击查看原文]<span id=""show_stock_str"" ></span>",上峰水泥助力庆城10亿吨级油田开发
15,11月01日 ,湖南股友,目前在卡尔西年产120万吨水泥厂的建设进展。并指出，建设工作正在按照批准的时间表进行，该厂将于明年年底投入使用。此外，他们计划在塔什干地区的 地区实施另一个年产220万吨水泥生产项目，并指出该项目的实施将促进乌兹别克斯坦的经济发展，并将成为“一带一路”全球倡议的一部分，并将加强两国之间的关系。乌兹别克斯坦投资机构，介绍了目前乌兹别克斯坦外资招商情况以及投资乌兹别克斯坦的可行性。会议上，中方宣布有意在2019年11月访问乌兹别克斯坦共和国期间，与乌兹别克斯坦共和国投资和对外贸易部与安徽省水泥有限公司签署投资协议。 随后，双方讨论了该协议的细节。,新建！安徽海螺布局乌兹别克斯坦年产340万吨水泥生产项目
16,11月01日 ,湖南股友,"消息称<span class=""showStock"" id=""stock_sh600585"">海螺水泥</span><span id=""quote_sh600585""></span>子公司货车超限率超过30%，将被约谈。(相关链接：<span class=""showStock"" id=""stock_sh600585"">海螺水泥</span><span id=""quote_sh600585""></span>子公司货车超限率超过30%，将被约谈并做进一步调查处理!)企业相关负责人第一时间联系水泥人网编辑部表示，此消息有误，希望堪误澄清，并详细说明了当日4台货车均为六轴车并非工作人员讲的四轴车，所以并非超限装载。同时，提供了安徽省马鞍山市公路运输管理局发布的《关于对<span class=""showStock"" id=""stock_sh600585"">海螺水泥</span><span id=""quote_sh600585""></span>有限责任公司涉嫌超限装载货物出场一案的调查结论》文件。<span id=""show_stock_str"" ></span>",海螺水泥涉嫌超载！调查结果出来了！
17,11月01日 ,<a href='/u/1605959824' title='手机用户1605959824'>手机用户16059598</a>,力挽狂澜，拜托了[污][污][污],力挽狂澜
18,11月01日 ,广西股友,"<span class=""showStock"" id=""stock_sh600585"">海螺水泥</span><span id=""quote_sh600585""></span>K线图呈现M头状态，今年升幅达百分之四十，获利盘丰富，短期调整也是正常的。股票上涨必须资金推动。年关将至，市场资金大撤退的节奏越来越明显。随着区块链主要龙头的全面低迷，下一步市场可能开始进入大规模调整展开阶段，这几天我们看到大批慢牛股，前期认为是抱团取暖的极品，业绩支撑的绩优股都突然出现崩溃，这一现象可能会一直持续，市场随时可能出现支撑不住的大规模崩塌，本人持有现金为主，现在不是参与股市的时机，不要为一些高高在上的板块一时走好而侥幸。个人看法。<span id=""show_stock_str"" ></span>",海螺水泥K线图呈现M头状态，今年升幅达百分之四十
19,10月31日 ,青海股友,数字水泥网10月31日水泥价格上调：湖北武汉及鄂东水泥价格即将发动第三轮上调河南郑州及周边水泥价格有所上调贵州贵阳地区水泥价格保持平稳辽宁辽中地区水泥价格上调福建地区水泥价格即将开启第五轮上调山东济宁和枣庄水泥价格出现上调河南郑州地区水泥价格出现补涨,传统旺季叠加基建投资
20,10月31日 ,湖南股友,"<span class=""showStock"" id=""stock_sh600585"">海螺水泥</span><span id=""quote_sh600585""></span>先后开发出水泥纯低温余热发电、利用新型干法窑处理城市生活垃圾、二氧化碳捕集纯化示范项目等节能环保新技术，实现了水泥主业产业链的深度延伸。仅2017年，<span class=""showStock"" id=""stock_sh600585"">海螺水泥</span><span id=""quote_sh600585""></span>投入节能环保改造资金就达到10亿元，为企业健康可持续发展构筑了绿色屏障。作为水泥行业的领军企业，<span class=""showStock"" id=""stock_sh600585"">海螺水泥</span><span id=""quote_sh600585""></span>始终坚持将传统水泥工厂打造成循环经济的示范点。其早年研发推广的纯低温余热发电技术，被国家列为水泥厂的建厂标准。利用水泥窑尾排出废气中的余热进行发电，使企业能源利用提高到95%以上，解决自身所需近2/3的用电，年发电82亿度，按照火力发电同口径计算，此一项每年就可节约标煤294万吨，减排二氧化碳达到783万吨。该技术被列为国家十大重点节能工程之一。　在坚持绿色可循环发展的道路上，<span class=""showStock"" id=""stock_sh600585"">海螺水泥</span><span id=""quote_sh600585""></span>从未停下过脚步，以“自主贡献”方式率先在行业内试水碳捕捉，投身二氧化碳减排行动。2017年在芜湖白马山水泥厂试点，投资6000万元建成年产5万吨级“水泥窑烟气二氧化碳捕集纯化示范项目”。“不仅降低碳排放，还能将收集的二氧化碳提纯后变废为宝，生产出工业和食品级二氧化碳。”项目工段长王文胜告诉记者，目前，项目正在积极推进当中，预计本月底可投产。<span id=""show_stock_str"" ></span>",海螺水泥走绿色发展路线 将垃圾“吃干榨尽”
21,10月31日 ,广东股友,海螺就是水泥中的茅台股，是主力一把拉上来的，论业绩有，但是靠分红远远不够资金的成本，主力要挣钱无非还是靠散户接盘，但是一只拉了三年翻倍，资金盘子如此大的股票，未来成为妖股可能性是零，多数小散绝对不会碰的，但是一千个散会总有胆子大的，哈哈，坐看其变化就好，每天看看就当是学习了,海螺就是水泥中的茅台股，是主力一把拉上来的，论业绩有
23,10月30日 ,山东股友,所有的上市公司都梦想成为白马股，能成为白马的不过百分之几，投资者梦想抓住黑马变白马，这样的事情能有多少？成功的概率微乎其微。与其如此，不如抓牢低估白马，稳稳当当，假以时日，收益都不错。然人性之贪婪，自以为是，踏入的不过多是陷阱，穷其一生，耗其积蓄，最后落得老来无靠，都是咎由自取，什么短线博创业，博区块链，多数投资者都是换股打折，如此几个轮回，便再无机会收回本钱。 可悲乎？正态分布不变的法则，多数人都逃不出这样的结局，若不审视自己，谈什么投资？,所有的上市公司都梦想成为白马股，能成为白马的不过百分之
24,10月30日 ,青海股友,"　<span class=""showStock"" id=""stock_sz000802"">北京文化</span><span id=""quote_sz000802""></span>（000802）净利暴增84倍　借助爆款电影《流浪地球》，<span class=""showStock"" id=""stock_sz000802"">北京文化</span><span id=""quote_sz000802""></span>翻身了。前晚，<span class=""showStock"" id=""stock_sz000802"">北京文化</span><span id=""quote_sz000802""></span>披露了今年三季报，报告显示，前9个月，公司实现营业收入7.05亿元，同比增长99.56%，净利润（归属于上市公司股东的净利润，下同）1.17亿元，同比增长152.76%。今年上半年，<span class=""showStock"" id=""stock_sz000802"">北京文化</span><span id=""quote_sz000802""></span>仍然0.56亿元，营业收入只有0.62亿元。短短3个月，公司经营业绩实现了惊人大逆转。这主要得益于公司投资拍摄的爆款电影《流浪地球》。《流浪地球》是今年春节以来最为火爆的影片，票房高达47亿元。作为投资方之一，<span class=""showStock"" id=""stock_sz000802"">北京文化</span><span id=""quote_sz000802""></span>获益匪浅。三季度业绩大逆袭，就是因为投资《流浪地球》收益确认。单个三季度，<span class=""showStock"" id=""stock_sz000802"">北京文化</span><span id=""quote_sz000802""></span>营业收入高达6.43亿元，同比增长约12倍，净利润1.73亿元，同比暴增84倍。<span id=""show_stock_str"" ></span>",合同
25,10月29日 ,青海股友,"乔龙德：世界水泥看中国 中国水泥“学”海螺2019/10/29中国水泥网信息中心10月29日，由中国水泥网主办的“2019第七届中国水泥节能环保技术交流大会”在安徽芜湖海螺国际大酒店召开，<span class=""showStock"" id=""stock_sh601668"">中国建筑</span><span id=""quote_sh601668""></span>材料联合会会长乔龙德出席会议并作重要讲话。......　　10月29日，由中国水泥网主办的“2019第七届中国水泥节能环保技术交流大会”在安徽芜湖海螺国际大酒店召开，<span class=""showStock"" id=""stock_sh601668"">中国建筑</span><span id=""quote_sh601668""></span>材料联合会会长乔龙德出席会议并作重要讲话。......<span id=""show_stock_str"" ></span>",世界水泥看中国 中国水泥“学”海螺
26,10月29日 ,青海股友,"乔龙德：世界水泥看中国 中国水泥“学”海螺2019/10/29中国水泥网信息中心10月29日，由中国水泥网主办的“2019第七届中国水泥节能环保技术交流大会”在安徽芜湖海螺国际大酒店召开，<span class=""showStock"" id=""stock_sh601668"">中国建筑</span><span id=""quote_sh601668""></span>材料联合会会长乔龙德出席会议并作重要讲话。......　　10月29日，由中国水泥网主办的“2019第七届中国水泥节能环保技术交流大会”在安徽芜湖海螺国际大酒店召开，<span class=""showStock"" id=""stock_sh601668"">中国建筑</span><span id=""quote_sh601668""></span>材料联合会会长乔龙德出席会议并作重要讲话。<span id=""show_stock_str"" ></span>",乔龙德：世界水泥看中国 中国水泥“学”海螺
27,10月29日 ,青海股友,[独家]中国水泥将在海螺带头下实现超低排放2019/10/29中国水泥网特约评论员 冉冉世界水泥看中国，中国水泥看海螺，这已成为国内外共识。......　　2019第七届中国水泥节能环保技术交流大会在海螺本部芜湖召开，本次会议以“新工艺 新技术 新标杆”为主题，围绕水泥行业的节能降耗、超低排放、碳捕捉、水泥窑的协同处置等议题展开。　　要说水泥行业真是好样的。中国水泥协会会长、海螺集团委书记、董事长高登榜在会上致辞，高会长在致辞中对水泥企业要如何实现节能减排提出了明确的目标：......,[独家]中国水泥将在海螺带头下实现超低排放
28,10月29日 ,青海股友,[独家]中国水泥将在海螺带头下实现超低排放2019/10/29中国水泥网特约评论员 冉冉世界水泥看中国，中国水泥看海螺，这已成为国内外共识。......　　2019第七届中国水泥节能环保技术交流大会在海螺本部芜湖召开，本次会议以“新工艺 新技术 新标杆”为主题，围绕水泥行业的节能降耗、超低排放、碳捕捉、水泥窑的协同处置等议题展开。　　要说水泥行业真是好样的。中国水泥协会会长、海螺集团委书记、董事长高登榜在会上致辞，高会长在致辞中对水泥企业要如何实现节能减排提出了明确的目标：,独家]中国水泥将在海螺带头下实现超低排放
29,10月29日 ,青海股友,"世界水泥看中国 中国水泥“学”海螺2019/10/29中国水泥网信息中心10月29日，由中国水泥网主办的“2019第七届中国水泥节能环保技术交流大会”在安徽芜湖海螺国际大酒店召开，<span class=""showStock"" id=""stock_sh601668"">中国建筑</span><span id=""quote_sh601668""></span>材料联合会会长乔龙德出席会议并作重要讲话。......　　10月29日，由中国水泥网主办的“2019第七届中国水泥节能环保技术交流大会”在安徽芜湖海螺国际大酒店召开，<span class=""showStock"" id=""stock_sh601668"">中国建筑</span><span id=""quote_sh601668""></span>材料联合会会长乔龙德出席会议并作重要讲话。......<span id=""show_stock_str"" ></span>",世界水泥看中国 中国水泥“学”海螺
31,10月28日 ,四川股友,"感觉水泥股业绩好等于没业绩，这个板块今年不活，涨起来才2个点左右，一直瘟不瘟火不火的样子，看看业绩不错就买，可是买了又不涨，只能出，海螺股价高了一点到不说什么（但股价还是偏低很多），连小盘的<span class=""showStock"" id=""stock_sh600802"">福建水泥</span><span id=""quote_sh600802""></span>业绩也不错，也不涨，对比其他行业，感觉<span class=""showStock"" id=""stock_sh600802"">福建水泥</span><span id=""quote_sh600802""></span>有点可怜，所以没法再投资水泥板块！太瘟了！<span id=""show_stock_str"" ></span>",感觉水泥股业绩好等于没业绩，这个板块今年不活
32,10月25日 ,北京股友,"所有的理论，所有的技术指标对于<span class=""showStock"" id=""stock_sh600585"">海螺水泥</span><span id=""quote_sh600585""></span>来说都是一种笑话。他会找到哪个点，天知道，它会什么时候调整鬼知道。如果他调整了是一个机会。当然是周线级别的机会。要学会从周线级别看待股市的走势。周线级别低点连续抬高三周即认为回到原有趋势，但有一点没有有效跌破趋势。有效跌破趋势的定义是周线级别低点连续三周未有效收复。<span id=""show_stock_str"" ></span>",所有的理论，所有的技术指标对于海螺水泥来说都是一种笑话
