,time,author,comment,header
6,07月10日 ,吉林股友,"今天早上空仓了！                                                                                                                                                                                ◆                                                  ◆                                                                                                                                                                                                                                                                                                                                                                                                                                                                                    Lihongchen                                                                                                            发表于 2019-07-10 10:00:49                                                                                                                                              [<span class=""showStock"" id=""stock_sh600585"">海螺水泥</span><span id=""quote_sh600585""></span>吧] 大盘第二次探2912，这走势可以割肉了！                                                  大盘第二次探2912，这走势可以割肉了！<span id=""show_stock_str"" ></span>",今天早上空仓了！
7,07月10日 ,上海股友,"其实今天<span class=""showStock"" id=""stock_sh600585"">海螺水泥</span><span id=""quote_sh600585""></span>是想要上涨的，但是A股大肆出逃，港股也不得不跟跌，溢价也随之到达了3%，而3点以后港股开始反弹，溢价进一步扩大，搞得我只敢买港股，不敢买A股了。其实没有必要这样吧？人家都看好<span class=""showStock"" id=""stock_sh600585"">海螺水泥</span><span id=""quote_sh600585""></span>，外资、机构全部都挤破头也想涌进来，唯独我们把筹码拱手让人，溢价更大了，我应该开心才对，但是想到低价筹码要被外国人捡去了，我一点也开心不起来<span id=""show_stock_str"" ></span>",其实今天海螺水泥是想要上涨的，但是A股大肆出逃
8,07月10日 ,湖南股友,市场总是对的？但是市场也会有偏见！有偏见才有低估，才会有机会。市场觉得：如果水泥价格下降带来的是市盈率的暴涨，所以目前的估值需要动态的看。但是，但是，但是，海螺的对外扩张就是平滑周期的影响，然后会计上主动降利润储备收入。十年十倍，挣钱能力依旧，你们怎么就这么沉不住气呢？持有一年以后再来这个帖子看看。我目前的成本：35元/股。,市场总是对的？但是市场也会有偏见！有偏见才有低估
10,07月09日 ,广西股友,炒股很有趣、很刺激，但是如果你不下功夫研究基本面的话，那就会很危险。总想着一旦赌赢就会大赚一把，结果往往大输一把。每只股票后面都是一家公司，你得弄清楚你持股的公司基本面究竟怎样，这家公司到底是怎么经营的，你得弄清楚你持有这只股票的理由究竟是什么。,炒股很有趣、很刺激，但是如果你不下功夫研究基本面的话
11,07月09日 ,广西股友,面对股市的跌跌不休，我内心波澜不惊，心中诗意盎然，不禁想起王维的“行到水穷处，坐看云起时。”和陆游的“山重水复疑无路，柳暗花明又一村。”这些诗句，羡慕诗人豁达的心境，身处逆境中也能坦然面对。股市中的起起伏伏，也容易让人的心情跟着起起落落，其实只要你确认你买的是好股票，用的是闲钱，股票的短期波动何须理会。把心思放在工作上，放在生活上，不比每天在这里高抛低吸、追涨杀跌更好？主力和券商是不欢迎我这样的人的，他们喜欢的是那些炒短线，天天盯着K线图的人，这类人就是他们的衣食父母，他们眼中的韭菜。但是，韭菜们却不认为自己是韭菜，怎么可能是韭菜呢，谁割谁还不知道呢,面对股市的跌跌不休，我内心波澜不惊，心中诗意盎然
13,07月09日 ,广西股友,当你持有好公司的股票时，时间就会站在你这一边；持有时间越长，赚钱的机会就越大。小螺，你看，昨天，你表现不好时，我没有抛弃你；今天，你表现有所回升，我也没有抛弃你；明天，不管你表现如何，我依然紧紧抓住你的手。,当你持有好公司的股票时，时间就会站在你这一边；持有时间
14,07月09日 ,福建股友,"昨天是一个少有的暴跌,绩优也大跌,这就暴露了各类机构在关键时刻的表现了.收盘显示海螺水泥跌1.53元,上方并无套老盘,显然暴露使一些获利盘抛了走呵.公告显示港资趁机低位大吃,海螺水泥7月8日获沪股通净买入8492.40万.毫无疑问,又是内地机构及散户趁机抛售.不齐心协力,海螺水泥可放心持股,跑什么?.",又是港资进
15,07月08日 ,<a href='/u/1657143777' title='东方老山羊'>东方老山羊</a>,"已物有所值,可持但勿追涨!",已物有所值
17,07月08日 ,陕西股友,"46个重点城市加速推进垃圾分类,其中北京是首个立法城市, 　请新主力硬庄们去抄底菲达环保!最高点错杀下来仅1折股价附近!好筹码未来翻几倍都可 　　指数涨这么多,菲达这股才相当于1200点!筹码珍贵洗盘就抢!　超跌股最易被踏空机构抢筹. 　菲达有垃圾分类业务 　　浙江国资委整合概念 　国家十年环保工程　 业绩大订单（见下面附图） 月线大底　绝对几年跌出来的低价筹码　有大利好时一定要像丰乐种那样快速翻倍向上否则永远受穷!总受穷的庄稼一辈子抬不起头来 ！ 只会磨叽的股票还不如银行钢铁股.　　旧庄主力时间不值钱跌了48个月，欢迎新庄大资金进入　新庄大资金可随便买呀!大好环境不会上涨,青春时光等闲度, 再混一年再穷一年, 　踏空的散户就会越聚越多，霉股，上证50都涨了几年在高位!而中小创是低位,这回跷跷板该中小创涨。都等着买便宜货呢吧! 　反而现在有钱就可以买这种超跌的票。大好环境不会上涨,青春时光等闲度, 　再混一年再穷一年,踏空的散户就会越聚越多这票已跌了48个月　下跌预期很小，指数涨这么多,这股才相当于1200点!　筹码珍贵洗盘就抢!　现在买100万股价格才区区几百万Rmb!　4年前要3052万!跌了这么多年还没跌够么　　上涨预期强烈！ 　指南针公司的市场盈亏无穷指标不会作假!越跌越是抄底的良机，跌吧庄家跌了48个月了，爷怕啥？感谢庄稼哦，爷准备好了资金准备分期分批买了! 这个价位分期分批买 　根本套不住!　茅台万科这么大都几年翻几倍,这股怕啥?　政策扶植板块.业务大单不断!　利空出尽是利好!　　<span class=""showStock"" id=""stock_sh600150"">中国船舶</span><span id=""quote_sh600150""></span>以前ST时跌幅越大,后面涨幅越大!http://guba.eastmoney.com/news,600526,818858721.html<span id=""show_stock_str"" ></span>",低价小盘垃圾分类业务!请新主力硬庄们去抄底菲达环保!最高
19,07月07日 ,山西股友,"对于股票市场来说我算是一颗小韭菜，但是我也有一些自己的见解，如有不同意见请指正。 一.利好方面：水泥板块年后主要利好有两点：1是价格方面，2019年水泥价格在2018的价格产量基础上略有增长，这就保证了各企业的盈利水平。2是政策利好，这方面我所知道的也不多，国家出台了各种政策来拉动内需，棚改旧改大基建资金支持等吧，力度还是不小。二：补涨方面：年后大盘普涨后各版块都各有回落，水泥板块一样调整后也有回涨，但是属于慢牛式没有太激烈的操作，我觉得这挺好大的回涨还要等中报前后，现在我感觉还是高抛低吸的策略适当做提T三 ：爆雷方面：19年以来监管方面我感觉国家想整顿证券市场，这对于部分股民来说是阵痛，但对于以后我感觉是弊大于利，支持。今年出事的公司太多了，康美，康得新，辅仁，新城等等太多了。我感觉水泥板块前两年的盈利把公司的各项短板补得差不多了，可能还有些弱点也会不断的改进。小雷也许会有但是各公司只要低调点应该不会有大事四：环保方面：这是最近我关注的不太明白。错峰生产淘汰老旧产能等。希望高手补充下。五：个股方面：根据现在的股价我感觉都可以买进.个人看好<span class=""showStock"" id=""stock_sh600720"">祁连山</span><span id=""quote_sh600720""></span>，宁夏，天山希望高手指正<span id=""show_stock_str"" ></span>",水泥板块优劣点
20,07月06日 ,四川股友,需求欠佳 全国水泥市场价格环比继续下滑据数字水泥网最新统计，本周全国水泥市场价格环比降幅为0.7%。价格下跌区域主要有辽宁、福建、河南、江西、云南和贵州，跌幅为10-30元/吨；价格上涨地区主要是山西太原，幅度10-20元/吨。7月初国内水泥市场受持续降雨影响，下游需求表现依然欠佳，企业出货多维持在6-8成水平，水泥价格继续维持震荡下行态势。（中证网）,需求欠佳 全国水泥市场价格环比继续下滑据数字水泥网最新
21,07月05日 ,福建股友,"　打开k线图,<span class=""showStock"" id=""stock_sh600585"">海螺水泥</span><span id=""quote_sh600585""></span>创了新高,走势稳健.从盘囗看,主力采用缓慢上升不急拉的手法,每天涨几毛,叠加效应显著.主力不仅控盘,而且大部分筹码都压仓.由于企业实力强,资源[矿山]丰富,业绩极好,远比白酒类股强[除茅台],然而股价却差距很大,北向资金早发现其价值,天天在吸筹,股民拿住啊,不要嫌涨得慢,也不拉板,更要看到拿得安稳,几乎无风险.<span id=""show_stock_str"" ></span>",海螺水泥将一路向上!
22,07月05日 ,吉林股友,"目前全国河沙非常紧俏，特别是黄沙，各地车队排长龙等沙现象明显，虽然是现金交易，但也一车难求。其原因是国家为了保护生态环境与合理开采资源，出台了一系列的相关规定，与此同时在全国关闭了很多不合法大大小小的采沙厂，造成了目前河沙供应紧张的局面，的确是今后不能任意采集河沙。近来消息报道<span class=""showStock"" id=""stock_sh600585"">海螺水泥</span><span id=""quote_sh600585""></span>也开始生产矿石沙，利用沙石骨料经过磨研成沙。都知道矿石沙硅含量很高，硬度更强，是河沙很好的替代品。鉴于全国沙价一路走高和所带来的较高利润，非常期待<span class=""showStock"" id=""stock_sh600585"">海螺水泥</span><span id=""quote_sh600585""></span>在新业务拓展中能继续增厚业绩，为投资带来可持续的回报。<span id=""show_stock_str"" ></span>",目前全国河沙非常紧俏，特别是黄沙
23,07月05日 ,广西股友,"投资是严肃的工作，不要追求暴利，因为暴利是不稳定的，我们追求的是稳定的交易。做交易的本质不是考虑怎么赚钱的，而是有效地控制风险，风险管理好，利润自然来，交易不是勤劳致富，而是风险管理致富！<span class=""showStock"" id=""stock_sh600585"">海螺水泥</span><span id=""quote_sh600585""></span>大龙头，高盈利，就是稳！<span id=""show_stock_str"" ></span>",投资是严肃的工作，不要追求暴利，因为暴利是不稳定的
24,07月05日 ,湖南股友,中国建材联合会发布《2019年水泥行业大气污染防治攻坚战实施方案》，今年将压减淘汰产能7000万吨《方案》提出，大企业和上市公司要带头自我加压，主动降低污染排放量，实现减排。目标2019年水泥行业单位产品能耗和污染物排放全面达标，单位产品能耗达到先进值的不低于80%；实现水泥行业压减熟料产能（淘汰落后产能）7000万吨，进一步提升产能利用率，使全国平均产能利用率达到70%以上。2019年，前十家企业（集团）熟料产能集中度力争达到60%以上。调整产品比例，实现水泥产量32.5等级水泥产品占比降低到50%以下。鼓励创新企业间兼并重组模式，支持相互参股、委托经营、资产交换等方式的市场整合，以优化市场布局，提高市场集中度。,中国建材联合会发布《2019年水泥行业大气污染防治攻坚战实
25,07月05日 ,甘肃股友,"水泥板块里绝大多数处于估值洼地，按国家目前发行新股节奏和市盈率来看，绝大多数水泥股有涨3一5倍的潜力，但是真要具备千元潜值的话，泳者深挖了整个水泥板块，符合条件的不是海螺.华新及其它，而是600668<span class=""showStock"" id=""stock_sh600668"">尖峰集团</span><span id=""quote_sh600668""></span>，在这个吧能持有海螺的人一定是价值投资者，能否见证奇迹的诞生？让我们拭目以待...<span id=""show_stock_str"" ></span>",有人把海螺列入了千元梯队.反对｜
27,07月04日 ,辽宁股友,"明白人都看得出来，连续出售<span class=""showStock"" id=""stock_sz000619"">海螺型材</span><span id=""quote_sz000619""></span>资产变现，是为奇瑞借壳铺路，或者安徽国贸铺路，轻装借壳，明天加仓买入，下周一房租抵押款进去，成败在此一举。熊立武高价买入，李俊等都是牛散。公司还高位增持，海螺集团日渐日强。今后能否辉煌腾达在此一举，赢输无悔，敬每一个在海螺卧薪尝胆的人，不放弃，下周一资金进来锁仓，跟<span class=""showStock"" id=""stock_sz000619"">海螺型材</span><span id=""quote_sz000619""></span>共存亡！我能！我能！你们也能！<span id=""show_stock_str"" ></span>",明白人都看得出来，连续出售海螺型材资产变现
28,07月04日 ,江苏股友,"真牛！“砂石骨料”毛利逼近<span class=""showStock"" id=""stock_sz000858"">五粮液</span><span id=""quote_sz000858""></span>！水泥企业价值将重估！我国每年砂石骨料市场巨大！每年大约用量200亿吨，年产值1万多亿！以前是“河沙”“石子”随便捞哦！现在随着生态，环保，安全等治理政策，落后砂石企业不断淘汰，山不能随便挖，沙不能随便捞，“河沙”“石子”和二三十年前比也已经涨了好几倍哦！这可是给水泥上市企业带来了巨大的机会！年报显示：<span class=""showStock"" id=""stock_sh600585"">海螺水泥</span><span id=""quote_sh600585""></span>、<span class=""showStock"" id=""stock_sh600801"">华新水泥</span><span id=""quote_sh600801""></span>和<span class=""showStock"" id=""stock_sz000672"">上峰水泥</span><span id=""quote_sz000672""></span>“砂石骨料”业务毛利惊人！毛利率分别为 69.12%、63.84%、72.7%。不得了哦！“砂石骨料”业务的毛利接近百元的白酒企业<span class=""showStock"" id=""stock_sz000858"">五粮液</span><span id=""quote_sz000858""></span>哦！水泥上市企业用自有石灰石矿山天然具备部分资源用作骨料生产前景诱人，这高毛利的砂石骨料必将是水泥公司未来新的增长点！水泥的上市企业山上的石灰石资源，其实就是躺着的金山银山哦！可以预见未来水泥上市企业的价值必将迎来重估时代！<span id=""show_stock_str"" ></span>",真牛！“砂石骨料”毛利逼近五粮液！水泥企业价值将重估！
30,07月04日 ,广西股友,有一种心态叫放下；有一种境界叫舍得；有一种幸福叫守候；有一种智慧叫低调；有一种选择叫放弃；有一种明白叫糊涂；有一种心态叫包容；有一种快乐叫简单；有一种美德叫微笑；有一种幸福叫珍惜；有一种美丽叫自信；有一种感动叫分享；有一种真情叫关爱；有一种温暖叫感恩；有一种成功叫坚持,有一种心态叫放下；有一种境界叫舍得；有一种幸福叫守候；
31,07月04日 ,安徽股友,"完全和我预判的1样白酒股，体裁股票，4大银行股票回落中字头基建股票接力赛换岗上==============两只水泥股票<span class=""showStock"" id=""stock_sh600585"">海螺水泥</span><span id=""quote_sh600585""></span><span class=""showStock"" id=""stock_sh600801"">华新水泥</span><span id=""quote_sh600801""></span>创历史新高了大家想想，如果<span class=""showStock"" id=""stock_sh600068"">葛洲坝</span><span id=""quote_sh600068""></span>这样的基建公司没有业务的话，水泥又上谁在用呢还有工程机械股<span class=""showStock"" id=""stock_sz000157"">中联重科</span><span id=""quote_sz000157""></span><span class=""showStock"" id=""stock_sh600031"">三一重工</span><span id=""quote_sh600031""></span>创历史新高如果<span class=""showStock"" id=""stock_sh600068"">葛洲坝</span><span id=""quote_sh600068""></span>这样的工程公司没业务，那么水泥工程机械又是谁弄去用了的呢？？所以接下来涨多了的水泥股票等回调，没有涨的<span class=""showStock"" id=""stock_sh600068"">葛洲坝</span><span id=""quote_sh600068""></span>要补涨--必须的也许是一天个吧点也是是来个板，但在7.块以前卖一股就去了一股，不会再给做差价买便宜回来的机会了。。。。想赚大钱就抓紧满仓关机捂股不动<span id=""show_stock_str"" ></span>",..
33,07月03日 ,广西股友,办公费？07月04日由于北上资金和海外资金知道中国牛散，大户，和一批私募都开了大量期指空单，部分中户出现连续融证券股卖空现象，周四决定急速做多，逼空行情出现，猎杀牛散，大户，私募行动开始。带句话，不需要机构相信。,不规范的07-04
34,07月03日 ,四川股友,"17:32北上资金今日净流出4.89亿 <span class=""showStock"" id=""stock_sz000858"">五粮液</span><span id=""quote_sz000858""></span>遭净卖出6.41亿元财联社7月3日讯，北上资金今日净流出4.89亿元。其中，深股通净流出5.04亿元，沪股通净流入0.15亿元。个股方面，<span class=""showStock"" id=""stock_sh600585"">海螺水泥</span><span id=""quote_sh600585""></span>、<span class=""showStock"" id=""stock_sh600030"">中信证券</span><span id=""quote_sh600030""></span>、<span class=""showStock"" id=""stock_sz000860"">顺鑫农业</span><span id=""quote_sz000860""></span>净买入额居前，分别为1.35亿元、9798万元、6922万元；<span class=""showStock"" id=""stock_sz000858"">五粮液</span><span id=""quote_sz000858""></span>、<span class=""showStock"" id=""stock_sh601318"">中国平安</span><span id=""quote_sh601318""></span>、<span class=""showStock"" id=""stock_sz002415"">海康威视</span><span id=""quote_sz002415""></span>净卖出额居前，分别为6.41亿元、4.09亿元、4.07亿元。(来自财联社APP)<span id=""show_stock_str"" ></span>",17:32北上资金今日净流出4.89亿 五粮液遭净卖出6.4
35,07月03日 ,内蒙古股友,小螺，对不起！因为少不更事，抛弃了你。在外面转了一圈，经历了风风雨雨、花红柳绿，才明白万千股海中只有你最真，对我最好。所以我决定接你回来，从此以后生死相依，不离不弃！俗话说浪子回头金不换，小螺，你愿意原谅我吗？如果愿意，明天下午三点，在窗边挂条红布……,小螺，对不起！因为少不更事，抛弃了你
36,07月03日 ,海南股友,在福建省浦田县的林家，他们的上辈中，有一位老太太喜欢做善事，时常用米粉做粉团给穷人吃。只要有人向她要，她就立刻给，脸上没有表现出一点厌烦的样子。有一位仙人，变作道士，每天早晨向她讨六、七个粉团。老太太每天给他，一连三年，每天都是这样的布施，没有厌倦过，仙人晓得她作善事的诚心，就向她说：我吃了你三年的粉团，要怎样报答你呢？这样吧，你家后面有一块地，若是你死后葬在这块地上，将来子孙有官爵的，就会像一升麻子那样的多。　　后来老太太去世了，她的儿子依照仙人的指示，把老太太安葬下去。林家的子孙第一代发科甲的，就有九人。后来世世代代，做大官的人非常多。因此，福建省竟有一句：‘如果没有姓林的人去赴考，就不能发榜。’的传言。意思是讲：林家考试的人多，并且都能考中，所以到发榜，榜上就不会没有姓林的人。表示林家有功名的人很多。1,布施心诚恳
39,07月02日 ,福建股友,"600585实力雄厚,规模大技术装备先进,而且自身具有矿山资源,现在又配合一带一路在东南亚建厂,并投产.发展有后劲,市盈率最低!不管什么行业,都要讲效益,我国基建量巨大,不仅房子需用水泥,包括基楚实施如高速公路,港囗,桥梁,高铁,地铁,城规,危房改造,自然灾害后的重建,国防战备.....直至国外援建,等等,需求量巨大,担心周期性实为庸人自扰,杞人忧天!该股十分稳健,近期开始加速上涨,必定后来居上,可与白酒比一比!",海螺水泥必创新高
40,07月02日 ,天津股友,"一定要摸透个股走势脾气!不是他适应您!而肯定无误的，是您必须必定适应他!不然您就离开为好!任何骂娘都无关痛痒!与您没一毛关系!明白这点，是最幸运幸福的!否则痛苦万分!而且别扭透顶!好好反思反省!但<span class=""showStock"" id=""stock_sh600585"">海螺水泥</span><span id=""quote_sh600585""></span>绝对是好股票!蜗牛式上行股票!稳扎稳打的股票!不是大起大落的股票!<span id=""show_stock_str"" ></span>",一定要摸透个股走势脾气!不是他适应您!而肯定无误的
41,07月02日 ,广西股友,男人在网上花了不到50块钱，买了一把法拉利跑车的钥匙。进夜店喝酒时，男人就把车钥匙往桌子上一扔。这一招果然管用，各种漂亮姑娘都纷纷上前来搭讪。直到喝得微醉，几个姑娘扶着他出来，一个姑娘问：“你的车呢？”男人从容地说：“我喝酒从来不开车，打车回家！”,男人在网上花了不到50块钱，买了一把法拉利跑车的钥匙
