,time,author,comment,header
26,11月07日 ,湖北股友,四维骗子有家教．有修养．有脑子敢于用其发明创造-除权-来行骗；为其勇气点赞．喝彩-四维骗子就是有勇气．有家教．有神经，敢于做没有人敢做的事．敢说的事？发明创造出有自主知识产权的除权新方法？这除权的特点：一．这除权没有时间限止，多年间可以分另除权二．这除除权的交易，可以随意多年累计；可以利用除权除死你？敢给我除权吧？,四维骗子有家教有修养有脑子
28,11月06日 ,湖北股友,长电眼价涨，缺成交量；再持股．增持，就只能在长电等死，没出路的？长电二阶段下跌的期待有可能，就很有大大希望？-长电股价涨一点点，就非常缺乏成交量，此时再持股，再增持长电，就是飞蛾扑火，自寻死路；长电分三阶段下跌，第二阶段下跌到倍就有可能：一．第一阶段：下跌10％；已经到倍二．第二阶段：下跌到16.70元，已经到过＝17.28元，下跌幅度＝12％，跌到＝16.70元,长电眼价涨，缺成交量；再持股增持，就只能在长电等死
29,11月06日 ,湖北股友,"四维骗子快出来，用除权来行骗来报仇，此时此刻此情此景i比较容易行骗成功的；-四维骗子的这个除权，方法独特．有所创新；就是效果太好．使用地方，时间没要求？一．这个除权，我会相信二．这个除权，四维骗子会相信；三．这个除权，其它会有相信的？-四维骗子的这个""""除权""""，非常简单．非常好用．随时随地好用；没有什么条件限止；不仅可以对当年某个时间除权，就是一年后．若干年后，均可以进行除权累积，这个除权，最大特点，就是可以""""除死你""""为目的？所以这除权效果．可以常年累积；-四维骗子的这个除权效果是相当好的；把多年前股价＝11元多股价，累积除权到＝8元多；这个除权，没有时间．没有价格上的任何要求，想除就能除的；",四维骗子快出来，用除权行骗来报仇
30,11月06日 ,湖北股友,"长电业绩差，又没增长，涨什么股价；看上行业绩．业绩增长，就是会涨股价？-三年来，长电这垃圾凭借""""高分红""""骗术涨股价：长电100股三年来分红．业绩．转股；一．分红：所谓高分红＝0.728 0.68 0.68二．业绩：0.81元三．三年来，没有股本扩张-上行100股三年来分红业绩．转股一．三年来股本扩张＝136％二．业绩＝1.15元，这是股本扩张136％条件下，取得的；三．业绩在股本扩张＝136％，也能增长＝14％以上　四.上行第三年现金分红＝0.81元，超过长电0.68元/",长电业绩差，又没增长，涨什么股价；看上行业绩．业绩增长
32,11月05日 ,湖北股友,"长电傻瓜们，银行股不能买，银行股有大量不良资产，随时能暴发？让我买！-股高银行股34家，除去五大行；其中，业绩增长率在二位数增长的有＝20家；以本人没有持股的上海行为例：上海行：一．三年分红股本扩张＝136％二．去年中报，业绩增长＝22％；今年一-三季度业绩＝1.15元三．前三季度精练绩增长率＝14％长电：一．三年股本没有能力．资格扩张二．业绩：0.81元大大低于，上行＝1.15元三．长电没有业绩增长能力四．长电拥有""""高分红""""能力，长电傻瓜的最受动，只有长电有复利/",长电傻瓜们，银行股不能买，银行股有大量不良资产
33,11月05日 ,湖北股友,银行股有业绩，有增长．有转股，分红前股价前，从市净率考虑，股价有涨价-股市34家银行，业绩增长在二倍数以上的，队五大国有行，有20家银行主要与长电的差蝇是有：转股能力；一；南股长电没有能力二．转股长电没有资格-长电的死穴：业绩没有成长，就是没有未来，长电不可能有未来？,银行股有业绩，有增长．有转股，分红前股价前，从市净率考
34,11月05日 ,湖北股友,银行股最佳持股已过，当下，银行股价格，对于未来盈利．到分红前，不失好机会？--从银行股市净率考虑，对于业绩．业绩增长来分析；至少在分红前，银行股股价会普遍上涨股价无疑；因为银行股股价有业绩．的业绩增长．有转股能力．与资格的支撑，一点主是机会？,银行股最佳持股已过，当下银行股价格
36,11月04日 ,青海股友,孙正义！其实就是靠马云活着！今天，软银突然宣布，支付宝回归阿里后，阿里收到692亿利润。而阿里180亿，将计入软银第二季度利润。也就是说，一个季度，孙正义就从马云身上赚走上百亿。其实，如今的孙正义也只有靠马云活下去了。过去几年，孙正义接连失败，非常难受。他的另一张王牌WeWork，一年时间暴跌83%，2000亿蒸发。现在的软银，已不比昔日的软银，如果不是马云，孙正义可能早就岌岌可危。不过，也不得不佩服，当年孙正义的眼光，看中了被别人觉得是疯子的马云。不过，关于支付宝利润给阿里再给软银的问题，马云真的尽力了，不然一大半都要交给孙正义！其实大家总是觉得支付宝，腾讯都是外国人拿大头，但是你们有没有想过，正是因为这样，国际上才会信服阿里，腾讯，才会买他的股票，才会有更高的市值，如果全是中国人投资，也不见得有这么高的市值，这么说吧，一个乞丐突然得到比尔盖茨的资助，那么这个人就有钱了，大财团公司的子女都会有人嫁给他。,孙正义！其实就是靠马云活着！今天，软银突然宣布
38,11月02日 ,海南股友,长电三季度股东人数增加11000多人原因探析：谁在卖出？1.中石油集团，最近几年业绩不佳，原持有2亿股，可能大部分已退出甚至清仓。2.一小部分中长线大户将部分长电换EB可交换债配置，完善组合。3.科创板创立，打新需求大涨，部分中户分设帐户，将长电分仓。,长电三季度股东人数增加11000多人原因探析：谁在卖出？1.
39,11月02日 ,黑龙江股友,"安国数字中药都有限公司董事长闫希军谈到：　　现代中药，要有“顶天立地”的大作为。　　顶天：全力推动中药现代化、国际化，使现代中药成为世界大药；与化学药、生物药三足鼎力，成为人类共享医药。　　立地：推动中药材产业链重构，打造中药材上游种植、中间市场商贸和终端数字化共享共赢生态系统，将中药材产业带入国际化智能驱动变革时代。　　打造两大核心平台的运营模式：即全国数字农事资源集约平台和安国数字中药都聚商交易平台。以“三网合一”联动各服务系统，为政府监管用药安全、整治行业市场秩序，提供技术支持，为执法监管提供抓手。打破产业界限、区域界限，贯通产业链瓶颈，重组产业资源，重塑产业生态，担当区域结构和产业结构优化的新引擎。打造中国数字本草的价格指数、质量标准、信息指南，重塑安国“天下第一药市”的行业风向标地位。　　安国数字中药都始终秉承<span class=""showStock"" id=""stock_sh600535"">天士力</span><span id=""quote_sh600535""></span>大健康理念，致力于建设公共服务平台，把控好中药质量，推动产业升级，缔造我国中药材产业世界品牌。<span id=""show_stock_str"" ></span>",现代中药
40,11月02日 ,黑龙江股友,"以“创新驱动发展”见长的国台总是能给行业带来新动力和新机遇。今年，国台酒业酝酿已久的“大健康产品体验馆”招商布局也在如火如荼进行中。据了解，目前建成及申请在建的“国台大健康产品体验馆”已经有10余家，包括广东、贵州、河南、山东、福建等核心市场，其中面积超过500平米的有5家。那么，“国台大健康产品体验馆”究竟是什么？为什么要建设这样的体验馆？能给商家带来怎样的财富新商机？“国台大健康产品体验馆”是什么体验经济已经成为社会热词和产业趋势，通过产品与消费者线下互动可以带来巨大的有形与无形效益，其基本理念是运用创新体验营销 大数据分析 圈层传播效应，进行线下体验和线上服务，对传统业态结构固有模式进行重塑和升级。而“体验馆”则是链接商品与消费者，进行体验营销与新团购业务开发的重要纽带。国台的“大健康产品体验馆”是以消费者为核心，通过线上链接线下、店内链接店外、零售链接服务，形成国台大健康产品体验馆新模式，解决白酒传统零售困境，助力商家产品动销，实现创新运营驱动发展。需要指出的是，不同于传统品牌旗舰店和专卖店相对单一的形象展示及销售职能，国台“大健康产品体验馆”不仅向客户输出体验服务，更重要的是输出健康产品和场景化健康消费体验，这是国台“大健康产品体验馆”与前者的本质不同。另外，“大健康”是重要的关键词，也是国台能在白酒行业走出另一条创新之路的资本。众所周知，大健康已经成为我国未来发展的重要产业，新时代幸福生活的本质是对健康生活和健康产品的向往，相关产业潜力巨大。专家表示，预计到2020年，我国健康服务业规模将达到10万亿，占GDP比重达到6.5%。同时，目前我国拥有2.4亿老龄化人口，2050年将达到4.8亿，结构变化会进一步促进大健康刚需爆发。<span class=""showStock"" id=""stock_sh600535"">天士力</span><span id=""quote_sh600535""></span>控股集团是以大健康产业为主线，以全面国际化为引领，以大生物医药产业为核心，以健康保健产业和医疗康复、健康养生、健康管理服务业为两翼，形成产业与资本双轮驱动的高科技企业集团。依靠科研优势赋能大健康产品，<span class=""showStock"" id=""stock_sh600535"">天士力</span><span id=""quote_sh600535""></span>打造出了更健康的正宗酱酒国台，更健康的帝泊洱茶、更健康的金士葡萄酒，更容易被人体吸收的健康小分子矿泉水C胞活力水。因此，以国台酒为核心的大健康产品体验馆，是国台酒业构建体验终端――健康产品矩阵――核心消费者的重要平台，是以消费需求导向为核心的创新化经营模式。为什么要建设“国台大健康产品体验馆”<span class=""showStock"" id=""stock_sh600535"">天士力</span><span id=""quote_sh600535""></span>控股集团董事局主席闫希军在参加2018年国台经销商大会期间，通过在云南普洱考察，对推动大健康产业发展，推动健康矩阵产品组合设计进一步强化了信心。他表示，要寻求不同产业领域优势互补，寻求资本共享、平台共享、渠道共享的集群优势，在新时代条件下，把大健康产业推向高质量发展的新境界。国台“大健康产品体验馆”营销模式的雏形便是脱胎于此，而这，也是<span class=""showStock"" id=""stock_sh600535"">天士力</span><span id=""quote_sh600535""></span>遵循市场规律，按照消费趋势并结合<span class=""showStock"" id=""stock_sh600535"">天士力</span><span id=""quote_sh600535""></span>集团独有优势的战略选择，其理念则是嫁接在国台酒业创新驱动发展基因以及强大的产品力和发展势能之上。在白酒行业，国台酒的创新不仅体现在工艺创新上，也同样体现在消费者组织营销创新上。2018年，国台依托遍布全国的“国台健康饮酒顾问团”、“国粉健康饮酒俱乐部”等一线营销组织，走到消费者当中去，积极开展“大国酱香 引领健康”主题推广活动和“大国酱香 共享健康”国台健康饮酒中国行等主题活动，推动国台酒的健康价值观和健康品质更加深入人心，深得人心。酒业咨询著名专家卓鹏战略咨询董事长田卓鹏表示，通过国台大健康产品体验馆，采用“体验馆 俱乐部 新零售”国台核心商业模式，可以深度培育国台核心消费者，服务国粉俱乐部， 成为开展新团购、新零售、新营销的自建场景终端! 这是国台大健康产品体验馆的重要价值。另外，“大健康产品体验馆”营销模式的导入，是国台在既有渠道规模上的进一步升级。近几年，国台酒在常规渠道布局上力度空前，2018年，国台品牌专卖店（旗舰店）、形象店和专柜近1000家；与泰山名饮、名品世家等酒类连锁店合作；与沃尔玛、大润发、<span class=""showStock"" id=""stock_sh601933"">永辉超市</span><span id=""quote_sh601933""></span>等大型商超合作，国台核心终端数量快速激增，在产品能见度、购买便利性和品牌影响力上取得重大突破。“国台大健康产品体验馆”是国台常规终端布局上的战略创新升级版，其不仅通过体验功能赋能传统终端，增加消费者与国台及大健康产品近距离接触，同时自身也具备强大的造血功能和文化传播功能。强体验 快动销 准上市这样的财富风口谁不心动白酒行业竞争的本质是与消费者的有效沟通，取得消费者对产品和品牌的心理认同，这是动销和长久发展的关键，也是经销商在酒类行业实现快速成长的保障。“国台大健康产品体验馆”的核心是“体验”，是创新品牌认知，其效果直接影响到产品销售。据悉，“国台大健康产品体验馆”在空间布局上划分为产品展示区、同步酒窖、茶/酒吧、餐吧和沙龙场地等体验功能分区。其中，产品展示区主要用于国台产品和企业文化展示；同步酒窖是大坛定制酒、封坛酒和名人珍藏酒的放置功能区，与<span class=""showStock"" id=""stock_sh600519"">贵州茅台</span><span id=""quote_sh600519""></span>镇国台万吨酒库的温度、湿度保持同步；茶/酒吧环境优雅，文化气息浓厚，是品酒品茶区，并增设国台酒鸡尾酒调配区；餐吧主要用于举行小型品鉴会，有专业厨师研发与国台酒相协调的健康菜；沙龙区主要用于圈层沙龙聚会。千言万语比不上一次无声的体验，国台首创的体验馆五感系统，实现了健康产品矩阵的协调化推广。田卓鹏表示，国台“大健康产品体验馆”营销模式体现了一种更科学、更人性化、更尊重消费者认知规律的品牌营销思维，体现了国台更高层次的营销思考和营销实践。体验的核心是产品，是优秀品牌企业，是有保障能力的企业。国台酒业扎根茅台镇20年，累计投资40亿元，认认真真地以茅台为榜样，学习茅台，做好国台。在此基础上，国台酒业以<span class=""showStock"" id=""stock_sh600535"">天士力</span><span id=""quote_sh600535""></span>集团制药的理念、技术和标准，酿造了一杯更健康的正宗酱酒。所以，正宗 健康，是国台酒业差异化竞争力的核心标签和增长潜力的天然基因。新时代健康生活离不开健康酱酒，而更健康，更有科技含量、正宗品味及更高性价比的国台已经成为酱酒行业影响力品牌，短短数年的发展就确立了在酒圈中的重要位置。现在，国台聚焦核心大单品，国台国标酒、国台十五年、国台龙酒，加上新上市的国台酱酒，国台完善的主力产品矩阵清晰而坚定，奠定了企业发展基础，也是大健康产品体验馆的核心与财富平台。在记者看来，国台的大健康产品体验馆创新实践举措尊重了市场规律，尊重了消费者选择，影响到了有影响的人物，而这些关键要素综合效应的结果就是，动销顺理成章，营销不再犯难。所以，国台的“大健康产品体验馆”给很多致力于创新驱动发展的经销商带来全新选择。行业专家表示，好模式 好产品 好企业=财富机遇，的确，即将成为贵州省第二家主板上市企业， 中国资本市场第二支酱酒股票的国台，可谓机遇中的“白金股”。2019“酱酒热与国台火”已经成为行业现象，为经销商赋予了巨大能量，引发行业强烈关注。这一次，“国台大健康产品体验馆”坚持以消费者为核心的创新运营，有国台酒为核心的<span class=""showStock"" id=""stock_sh600535"">天士力</span><span id=""quote_sh600535""></span>大健康产品矩阵做保障，也一定能为经销商发展再次赋能，带来全新驱动。<span id=""show_stock_str"" ></span>",错过茅台专卖店
41,11月02日 ,黑龙江股友,"秋糖临近，无论是天津滨海国际机场，还是天津地铁六号线，都被国台“霸屏”了。但实际上，这并不是国台在此次秋糖唯一的看点。更关键、更重磅的是，这次，国台直接搬来了一间“超级展馆”。10月24日，国台大健康体验馆将全景“搬进”秋糖现场，立体展现好产品、深度分享好模式。同时，国台还将组织意向经销商走进<span class=""showStock"" id=""stock_sh600535"">天士力</span><span id=""quote_sh600535""></span>，举办大国酱香共创共享――国台大健康产品体验馆百名稀缺经销权招募会，释放100名大健康体验馆稀缺经销权。1<span class=""showStock"" id=""stock_sh600535"">天士力</span><span id=""quote_sh600535""></span>的国台酒，天津人的好酱酒今年秋糖，国台阵仗极大，可谓气势如虹 。熟悉国台的朋友都知道，贵州国台酒业股份有限公司，是我国现代中药领军企业<span class=""showStock"" id=""stock_sh600535"">天士力</span><span id=""quote_sh600535""></span>累计斥资40亿元、历经20年精心打造的政府授牌、行业认可、社会公认的茅台镇第二大酿酒企业。<span class=""showStock"" id=""stock_sh600535"">天士力</span><span id=""quote_sh600535""></span>，正是位于天津的龙头企业。因此，今年秋糖移师天津，国台自然而然地获得了主场优势。主场优势加身的国台，大动作不断。先看天津滨海国际机场。天津滨海国际机场，位于中国天津市东丽区，距市中心13公里，为4F级民用国际机场，是中国国际航空物流中心、国际定期航班机场、对外开放的国家一类航空口岸和中国主要的航空货运中心之一。天津机场年累计旅客吞吐量超2000万人次。目前，国台酒品牌广告已全面登陆天津机场。国台机场广告再看天津地铁六号线。地铁是时下竞争激烈的品牌主战场。在这样一个高流量的狭窄空间中，所有的品牌都想借机打造一次与众不同、留名青史的营销传奇。记者了解到，天津地铁六号线途经大半个天津城区，将水上奥城、鞍山西道、梅江、友谊路等众多商圈连接起来，可以实现了各商圈间的互通。于酒商而言，坐着国台专列逛秋糖，也是一种乐趣。国台地铁广告除了让参加秋糖的厂商叹为观止，“霸屏”的国台酒也将在消费者心中留下深刻印记。这正是国台此行的意义：给津城人民奉献一瓶来自茅台镇的更健康的正宗酱香白酒。2超级展馆来袭，国台亮出重磅武器国台的霸气不仅仅来源于主场优势，更重要的是还将携带“秘密武器”――国台大健康产品体验馆。大健康产业是全球资本热点和财富热点。“下一个首富，一定是在大健康市场。”马云曾这样直言。早在2016年，“健康中国”已上升至优先发展的国家战略。三年来，我国大健康产业呈现蓬勃发展之势。前瞻产业研究院发布的《中国大健康产业战略规划和企业战略咨询报告》显示，2017年市场规模超过6.2万亿元，2019年预计将达到8.78万亿元。依托<span class=""showStock"" id=""stock_sh600535"">天士力</span><span id=""quote_sh600535""></span>的坚强后盾，国台大健康体验馆创造了全新的营销模式和创富模式。这无疑是酒商切入大健康产业的绝佳机遇。国台地铁广告国台大健康产品体验馆以消费者为核心，通过线上链接线下、店内链接店外、零售链接服务，形成国台大健康产品体验馆新模式，解决白酒传统零售困境、助力商家产品动销、实现创新运营驱动发展，将构建起体验、专卖、专区一体化的渠道终端生态链条。目前，国台的营销模式已进入3.0阶段：以用户为中心，以厂商联盟、共创共享为基础，以品牌酒、文创定制酒、封坛珍藏酒三种产品形态构成的“一体两翼”的产品组合，满足不同的、个性化的消费需求；以国台大健康产品体验馆、专卖店（旗舰店）等专卖系统为主导销售渠道，以国台形象店、专柜、酒类连锁和高端商超为核心终端，以国台领袖会、健康饮酒联盟、健康饮酒顾问团、国粉健康饮酒俱乐部等自组织进行消费者培育和裂变，持续分销动销，通过线上 线下、店内 店外、销售 服务、体验 享受实现的数字化新零售新营销模式和厂商消费者新生态。现在，消费者追求的消费习惯已经变成了高效率、高品质、体验感，推行全品类更容易满足新生代消费群体的柔性需求。未来，体验馆模式比拼的不仅仅是铺货的门店数量和规模，还有在固定的空间里为消费者提供的极致体验。国台大健康产品体验馆打破了传统体验馆的常规格局，是一种以消费需求导向为核心的创新化经营模式。会展场馆周边广告　今年秋糖，国台将突破传统展馆模式，以大健康产品体验馆登陆秋糖。既是创新，又将品牌核心的模式进行全面展示，实现真正意义上的“所见即所得”。今年秋糖，国台必将带给合作伙伴新一轮财富。<span id=""show_stock_str"" ></span>",“霸屏”天津？还不够！
42,11月02日 ,黑龙江股友,只打新88　于 2019-02-09 08:06:08　长江之子wH，说我是小人，无赖，他才是，请看。说我国投以减百分之九十，还卖3万股，我从不说假话，国投我十五万股，先减七万股，又减3万股，再减后剩百分之九十，我发贴说过，最后卖亏了，最后果然涨了，因大盘大跌，国投反涨，卖后有感可能错了，错就错了，反正去年拿国投高兴，反之你的华水腰斩。,我数学不行
43,11月02日 ,重庆股友,债务每年减少百把亿，这样财务费用就每年减少3到4亿，此外折旧每年提个百把亿，也是隐藏的利润，折旧不可能一直提，再提个10多年，20年，帐面上固定资产要回零了，一旦不提折旧，利润每年要多百把亿，这些东西，连我都知道！,债务每年减少百把亿，这样财务费用就每年减少3到4亿
44,11月01日 ,甘肃股友,"在洞察到未来十年零增长滴情况下机构出现大幅减仓滴苗头，股东人数由上一期93800猛增至105000，企业长期终老形成。==============================长电凭借滚动开发三峡上游滴水能资源溪洛渡向家坝白鹤滩这些，又加上近几年机构疯狂追逐国企蓝筹，使得<span class=""showStock"" id=""stock_sh600900"">长江电力</span><span id=""quote_sh600900""></span>几年间猛涨了6倍，市盈率由原来滴8倍推高至现在近20倍。股票体现滴是未来，辣么长电未来还有神马预期捏？可以说未来十年内长电每股收益就钉死在1.00元这样了，长电滴水能资源开发仅剩白鹤滩乌东德，按以往注入收益增厚比，溪洛渡向家坝当时以1.1倍滴装机比注入，业绩增厚仅30％即从0.70增加至0.94。辣么未来白乌注入滴比例也大致如此，白乌与长电总装机占比仅58％，算下来就增15％1.15元。又由于国家为企业减压取消一贯沿用滴煤电联动机制电价木法上涨，费用增加电价木增，故届时实际收益就1.00元每股。至于白乌注入后就更加木有预期了，以后任何滴动作都是摊薄，就如这次秘鲁，加上水电越来越公益化木要指望提价。价值严重高估该回归了，回归至10倍市盈率10元左右。迈瑞今后滴三个成长空间都灰常巨大，一个是国内替代，一个是国外占领，一个是通胀红利。长电神马也木有，无法抵御高估值。对于以后至少十倍级滴涨幅空间，迈瑞现在股价还在深深滴<span class=""showStock"" id=""stock_sh601099"">太平洋</span><span id=""quote_sh601099""></span>底。OMG！<span id=""show_stock_str"" ></span>",曲终人散
45,11月01日 ,湖北股友,长电傻瓜，银行不良资产；只买没成长，业绩差．股价高长电垃圾，今天见分晓-银行股普遍，业绩好，一元以上．股价低，股价对应市盈率5-6倍．且成长性好，10％以上增长；具具有转股能力；-长电业绩差，一元以下，业绩缺乏成长性，缺乏转股能力，股价低，股价对应16-17倍长电只是徒有虚名：高分红；没有增长，何来高分红；对股民这个高分红，没有实际意义,长电傻瓜，银行不良资产；只买没成长，业绩差．股价高长电
