,time,author,comment,header
31,03月10日 ,青海股友,滴水足以穿石。您每一天的努力，即使只是一个小动作，持之以恒，都将是明日成功的基础。所有的努力，所有一点一滴的耕耘，在时光的沙漏里滴逝后，萃取而出的成果将是掷地有声，众人艳羡的“成功之果”。人生是一条没有尽头的路，不要留恋逝去的梦，把命运掌握在自己手中，就会充满希望和成功！ #文化传承#,滴水足以穿石
32,03月10日 ,湖南股友,早年上做文课那真是一个愁，50分钟也不知道是怎样渡过的，传记和散文的区别到现在也弄不明白。言归正传，虽然股龄11年，进股吧1年多，贴子发了不少，写作还是没见长进，颠三倒四。我吸收各家观点见议总结如下；中国经济当下如同日本90代时令，中小企业举步维坚，房市泡沫严重，大盘3000点是中轴，创指要回1000点一下，A股向港股靠，优质股票长牛，2400点是永久大底。再说长电，它是资本市场唯一的无风险标第，年涨2元(上网电价年涨2分），两河口年增加长电200亿度，和乌白同时建成，乌白注入时股价不低于30元，垄盘早晚得建，到时长电年又多发电300亿度，这500亿度电是长江的镇水之宝，东家既象周俞打黄盖，又似亚吧吃黄连。上游控股水库电站，下游拓展售电市场，迎接电力市场化，上网电价提高0.2元，增纯利720亿元，上加上正常收入300亿，年利润1020亿元,散文
33,03月10日 ,上海股友,长江电力暴力并购三峡水利，到底干了啥？　　周末，三峡水利一则停牌收购资产公告，却引发了隔壁家长江电力股东群里面的热议。自从前两年，长江电力以及其相关联企业成为了三峡水利的二股东，长江电力迟早拿下三峡水利，已经是司马昭之心路人皆知，但是，超出我的预期，长江电力并没有选择在二级市场持续增持，而是通过即将实施资产注入定向增发的方式，成功夺取三峡水利第一大股东的位置。　　我们看看即将定向增发前两大股东的实力（以去年3季度公布股东情况看）：实际第一大股东，实际控制人水利局地盘：　　新华水利11.18%、水利部9.89%、中国水务投资3.02%、长江水利水电开发总公司1.55%，合计25.46%　　实际第二大股东长江电力系：　　长江电力16.08%、三峡资本4.08%、长电资本3.92%，合计24.08%。　　定向增发前，长江电力以微弱劣势屈居第二大股东！　　我们再看看周五三峡水利的公告，公告称，长江电力将和另一国股东签署一致行动人协议，签署后，长江电力将成为实际第一大股东和实际控制人，但仍少于30%股权。这个有点意思。1）签署一致行动人后，仍不超过30%股权，没有触及要约收购，未来长江电力仍有可能继续增持到30%以巩固第一大股东地位。2）目前十大股东里面，除了私募基金，不是三峡系的就是水利部的，所以，长江电力这个一致行动人是谁，暂时不清楚，同时，这个一致行动人股权没有入前十，所以，股权数应该不多。如果考虑到长江电力4季度二级市场增持的股票，这个一致行动人持有股权数可能在1%不到。所以，一致行动后，长江电力可能以微弱的优势夺得第一大股东地位。3）水利部会放弃第一大股东地位吗？如果不会，将可能在二级市场继续增持，但是从目前公布的资产注入预案看，水利部应该是放弃第一大的地位了，这个也应该是顶层设计。看完股东情况，再看看这次资产注入的资产的股东情况。主要看看长江电力在目标资产中的实际权益到底是多少。先看长兴电力。三峡电能的股东是长江电力（70%）和三峡资本（30%），而三峡电能又持有长兴电力36%股权，所以，长江电力在长兴电力中实际权益是25.2%再看联合能源。长江电力直接持有8.05%股权，而长兴电力持有10.95%联合能源，所以，长江电力间接持有联合能源的权益为25.2%*10.95%=2.7594%。所以，长江电力在联合能源的实际权益为10.8094%。注：联合能源中披露的第八大股东“重庆长兴水利水电有限公司”我暂时查不到资料，好像也与长兴电力没有关联关系，所以，暂时不把它统计入内。所以，这次，长江电力相当于拿出25.2%的长兴电力和10.8094%的联合能源的实际股权，注入到三峡水利。定向增发大概率是长江电力以这个资产置换为三峡水利的新增股权，是一个资产换股权的过程，同时，定向增发后，长江电力实际持有三峡水利的股权很可能突破30%触及要约收购，一次性地控制了三峡水利。三峡水利定向增发后，长江电力原来不流通的长兴电力和联合能源资产，被装进三峡水利，换取了三峡水利流通的股权，不仅资产盘活了，享受溢价出售了，同时，换取了三峡水利的控股权。可以说，一箭三雕。同时，这个眼花缭乱的方案，必然会增加长江电力的一次性非经常性损益。另外，通过这个整合，长江电力继续在一统长江战略中再进一步！长江电力，大国重器，泽被苍生、文成武德、千秋万载、一统长江！,长江电力暴力并购三峡水利
34,03月09日 ,陕西股友, 指数周五以3038开出，日内大跌，最高3075，以最低价2969收盘，量能较上交易日收缩，日K线形态收出一带上影的大阴线。 周五指数大幅度跳空低开，早盘略反弹至上日最低价时继续向下回撤，全天弱势后呈单边形态，尾盘以最低价收盘。先来看看周线，本周指数收出一阴锤线，价格运行在所有周均价线之上，交易量能较上交易周放大，这个形态就是个中期反转形态，在形态上，指数在反弹到周线跳空窗口时，压力显现，这个压力将引起一个向下的回撤，过去的一周指数在到达周计算压力位3070一线时压力未能有效越过，这样中级这个价格就成为制约上行的阻挡，这个阻挡是需要回撤才能消化完毕，需要注意的是，在这个时期的形态中2440最低点的这根K线向上有一个小跳空窗口，理论上指数将回撤到这一线才能完成回撤，也就是空间相当的大。日K线形态，周五指数收出一带上影线的大阴线，价格运行到了10日均价线之下，交易量能较上交易日收缩，这个形态是个继续向下回撤形态，这根阴线已经发出了阶段卖出信号。在这个时期中，位于左边的跳空窗口虽然在周五被跌破了跳空窗口下沿，但这一线短期是有点支撑的，也就是接下来的惯性下行后指数将回升到窗口上沿一线，在回升中是短线票最后的卖出机会。这个时期的日线下行支撑位分别是3028、3001、2922、2794、2586一线，请注意在下行中这些支撑位，其中2794一线或是个暂停的位置。操作上，指数已出现中级阶段反转，这个时期还是以观望为主，因为一些反弹介入后将会非常难受，这个回撤空间大，不到位并有有效支撑就只能观望，做股票必须要掌握节奏，除非你融券操作。 2月CPI数据出炉，同比上涨1.5%，涨幅连续三个月处于“1时代”。2月PPI同比上涨0.1%。中国2月出口下滑20.7%，跌幅为三年来之最，进口也连续第三个月走软，跌5.2%，有春节停工因素，但显示其经济进一步放缓。证监会说，红筹企业上科创板 财务信披“就高不就低”。公募基金内部人士说，担心一季报出来的雷，一季度经济比较差，之所以股市会涨，是因为政策足够给力，不断地释放流动性。这一轮的上涨跟基本面没有关系，因此一季报披露时可能会出现个股闪崩，甚至出现‘洗澡’的情况。全国人大财政经济委员会副主任委员乌日图表示，房地产税法正抓紧完善草案、重大问题论证等工作，在条件成熟时，提请全国人大常委会审议，房产税可能就要快来了。科创板开户新规来了，上交所明确五关键点，一：投资者现在就可申请开通交易权限，二：50万门槛包括股票、基金、理财产品和贵金属等；三：2年证券交易经验如何认定；四：投资者开户时间充裕五：科创板前；5日不设涨跌幅，不实行T 0。外盘周五略跌，对市场会有影响。关注周未其他基本面信息。 长江电力（600900）日K线也随指数出现了剧烈震荡，不过收在了16.50一线以上，形态并未被 破坏。目前这个时期形态还是个震荡形态，或在再次到16.50一线时会继续向上反弹。周线收出一带上影线的大阳线，价格运行在所有周均价线之上，从这个时期的计算位来年地，17.10一线还未到达，那么 还会有继续向上运行的动能。中线还有继续向上反弹的动力，可继续持有待涨。同时关注一引起支撑位的运行情况 。个人见解，有局限，仅供参考！！！投资有风险，出入须谨慎！！！（来源：附骥尾的财富号 2019-03-09 11:06） [点击查看原文],中级反转形成 待回撤完毕
35,03月09日 ,甘肃股友,三峡水利(600116)8日晚公告，公司拟通过发行股份等方式购买联合能源控股权、长兴电力100%股权，同时募集配套资金，预计构成重大资产重组，股票自11日起停牌。此外，公司接到股东长江电力通知，获悉：公司股东长电资本(长江电力全资子公司)拟与公司某在册国资股东签署一致行动协议。长江电力及其一致行动人合计持股比例预计将超过公司现实控人水利部综合事业局所控制的持股比例。该事项可能涉及公司控制权变更。　,长江电力控股三峡水利！
36,03月08日 ,湖北股友,长电股价＝14.13元，指引未来长电股价正常方向！敲锣打鼓．欢天喜地希望长电股价这一天能早日到来！一．长电股价透支未来．物超所值，最合理，最简单就是价值回归；二．长电业绩没有成长，价值只能年年贬值，一年不如一年；三．长电的盈利能力在下降；只要一点业绩没有成长，就是没有长期投资价值；至少要超越ＣＰＩ；再超ＧＤＰ；好公司，应该最好能超载国企平均增长；长电什么指标也不行？这样的长电能有梦想．能有幻想？,长电股价＝14.13元
37,03月08日 ,甘肃股友,"<span class=""showStock"" id=""stock_sh600900"">长江电力</span><span id=""quote_sh600900""></span>3月6日的顶价是我做的；挂卖16.98没成交3月7日的底价是我做的；挂买16.52没成交今天挂买16.52已经全部成交。这波行情是美股带动的，美股3月4日进入空头，中国股市启动滞后、下跌滞后几天，还是属于老二类别。（多会中国股市能发动一波主导行情在国际上挺起腰杆啊？盼望中！）美股于2018年12月24日见底后，启动行情；A50于2018年12月25日见底后，启动行情；中国股市于2019年1月3日见底后，启动行情；<span class=""showStock"" id=""stock_sh600900"">长江电力</span><span id=""quote_sh600900""></span>我个人认为，17.17元一定会突破，但是17元一带一定会折腾，依此思维在16.98减仓；另外，我个人认为，有可能进行突破回抽确认，依此在近期两个高点16.50（加价0.02）16,52做加仓,昨天价到没给，今天全部成交。后面耐心等待它走出一波突破行情，（今天大盘开始回调更有利于<span class=""showStock"" id=""stock_sh600900"">长江电力</span><span id=""quote_sh600900""></span>走出独立行情）<span class=""showStock"" id=""stock_sh600900"">长江电力</span><span id=""quote_sh600900""></span>一定会让粉丝露出满意的笑容，只是时间问题！<span id=""show_stock_str"" ></span>",长江电力一定会让粉丝露出满意的笑容
38,03月08日 ,湖北股友,应该粉碎对长电股价任何幻想．梦想！现实一点；从长电复权价只有＝30我元看，长电没长期投资价值；对长电应该不应有幻想．梦想；长电雪上加霜的事，有几件一．长电盈利能力下降二．长电大股东相当于减持长电＝200亿元，大约在＝12.5亿股三．长电大股东的减持，与难兄难弟增发解禁＝37.40亿股一同减持；四．长电现金分红的忧虑：1.五年0.65元以上是个持续贬值过程；2.五年后再后五年70％，分红不一定于0.65元以上或增不多；没有业绩成产；能增多少？3.长电现部份业绩由卖出股权投资取得的；70％分红，可以不卖出股权操作；五．长电解禁．减持＝50亿股，对一个缺乏成交量的长电，股价能支撑在那里？,应该粉碎对长电股价任何幻想．梦想！现实一点；
39,03月08日 ,福建股友,吧里用专业知识唱多的，用技术指标分析唱多的，用意淫消息唱多的，评论区下方自吹自擂的等等，诱导小散买入接盘，这只票你就要小心了，不要盲目接盘被套，大家更要小心这些广告gou和腊鸡托，大家总结一下还有什么方式忽悠人的？,吧里用专业知识唱多的，用技术指标分析唱多的
41,03月07日 ,陕西股友,"<br><br> 指数今日以3103开出，日内震荡，最高3129，最低3074，收盘3106，量能较上交易日放大，日K线形态收出一阳十字线。<br> 指数早盘平开，全天震荡，尾盘近收平。日K线形态，指数收出一阳十字线，价格运行在所有日均价线之上，交易量能较上交易日放大，这个形态还是个多头形态，不过K线收出一十字线伴交易量能放大，这又一个待验证的反转形态，在日线计算位中，向上的3103左右一线是个较大的压力位，这个压力是需要震荡或回撤来消化的。再从这段时间反弹上来看，反弹形态已出现了3个跳空窗口，形态上已完成了反弹的过程，那么接下来在这一线位置或会出现震荡，震荡后将会出现一个回撤，这个回撤理论上深度有点深，所以目前在这个时期中只关注3103左右一线的有效支撑，若不能就要注意短线票或要出局，若支撑有效，则指数还将会有一个就的目标位，但这个概率实在是小。1小时K线形态，指数在这个时期中继续向上反弹，整个向上的多头形态保持 较好，可以看到，价格已运行到了3586下行回调以来的密集成交区中，这个地方有许多浮筹在等待逃命，所以这个区域会出现震荡下行。操作上，目前只关注日线计算位的压力压制情况，不能追涨，短线票逢高可出局，等待形态出现的变化。中长线可继续持有不动。 财政部说，今年实际减税的实际减负数额会高于2万亿元。证监会核准IMF人民币合格境外机构投资者资格。中国证监会副主席方星海3月7日在政协经济界别驻地接受证券时报记者采访时表示，放开股指期货的相关措施正在研究，“今年应该能出来。”监管部门强化考核，要求银行业金融机构加大涉农贷款投放力度。美盘上日微跌，继续关注。<br> <span class=""showStock"" id=""stock_sh600900"">长江电力</span><span id=""quote_sh600900""></span>（600900）上日涨过后，今日出现了回撤，在今日回撤中，16.52一线得到了一定支撑，只是还未有效回到16.50一线，这样明日或还有继续下行震荡的需要，从今日形态上可以看到，虽然收出一阴锤线，但交易量能在收缩，所以判定目前只是在震荡巩固，完毕后将向下一目标位17.97一线进发，震荡完毕后的上升速度将非常快。可继续持有。个人见解，有局限，仅供参考！！！投资有风险，出入须谨慎！！！（来源：附骥尾的财富号 2019-03-07 16:50） [点击查看原文]<span id=""show_stock_str"" ></span>",不追涨 观望变化
42,03月07日 ,湖北股友,四维骗了行骗特点，无视股民智力；只要能说的圆一点；一，四给骗子如此推销长电：四维骗子敢以二年股吧股令，向有四年多股令股民推销长电；为提高骗子的可乐性，添油加醋地加――是他向同学的朋友抢镜长电被单位同事认可为是骗子；因为四维骗子股令只有二年，推销对象有四年多的股令；二．炒股四维在黔源开始，有什么可能；四维骗子也能硬吹什么出来？谁给信？1．黔源被套从＝15.82元开始；被套清仓当天有公示．有证明；2．黔源二次清仓在＝20.80 20.88元差价，至少在＝4.98元3．长电同期有多股价上涨？长电从不没有半年．一年能涨4.98元以上；说明什么？---四维骗子吹的什么？有那个能住；你．我．他那个来信；三．四维骗子在上海行输的还不够多．还不能吸取教训；1．大规模进入上行是在解禁跌停的次日；正式开始四维骗子的恶梦，趴当天四维骗子来指导；2．奇怪的是，解禁跌停来一次后，不敢来下指导棋？不敢利用这大妈被套机会？3．上行很早开始填权行情；分的多，填权的困难就是，就是越填价格越高；4．长电至今没有墙根行情，只有贴权司徒行情，还能比什么？四维骗子还能什么？--四维骗子污辱上行，其实是在抵毁长电；贴权与好与填权的；四．四维骗子在长电没有好说的；家族利用多少倍盈利行骗？中骗子10倍．小骗子＝6倍1．长电几年能盈利多少倍有可能，就是没证据，自述条件受限或没有实现条件；2．凭借持股盈利多少倍；二骗子：中骗子＝四维，小骗子＝小民众；从复权价没有可能；3.二位骗子自述还在增持．收藏；更没有可能六倍．十倍盈利的可能；4.长电2016年起四年看，除死杠长电外，四维骗子能力不行或有限；除骂人，有什么？五．四维骗子的综合想象力很强．能力也大．也强？孙孢子的能力，二师兄的实力；1．你想盈利；四维骗子自认一定要得到其认可；2．四维骗子能把你的股票随意卖出；能知道持股量．成本等；甚至能让你暴仓；3．.四维骗子从外面看看上去：象一史猴子，其实从能力就是象二师兄；,四维骗了行骗特点
43,03月07日 ,湖北股友,四维骗子战斗力，没脑子，困兽犹斗的下场；四维骗子的战斗欲望虽然很强，吃亏在没有脑子这点，光凭这这点，只能是输惨．输大了？一．黔源在15.82元开始被套，四骗子没有声音；二．黔源在20.80 20.88元二次清仓，四维骗子没有什么声音；三．清仓黔源后，不知到那里四维驻假借它人名义，在黔源＝20元左右，撤销黑泥源；1四．四维骗子皮黔 皮厚，短线输了＝4.98元以――还要硬撑，强颜欢笑，故作镇静；四维骗子就是能充分利用好自己皮黑．皮厚的优势，无视股民的智力，行骗．愚弄股民；一．黔源泉短线重挫四维骗子＝4.98元以上；二．上海行再一次重挫四维骗子的时间，解禁跌停后一天的价格上；直到当下的上行；四维骗子虽然输的惨，还能自以为是，这行骗精神精实在难能可贵；只是行骗质量．技艺太粗糙．太不合理；四给骗子行骗没有与时具进的技艺；,四维骗子战斗力强，没脑子
44,03月07日 ,湖北股友,四维骗子悲剧，就是持续卖出上行的时间！一．今天上行大约＝12.80元，节后大约填权至少在＝1.50元以上价格；二．今天现价＝16.66元止胀＝0.31克，这是大盘上涨400多点，长电创造的一点价值；本人卖出上行的时间，应该就是四维骗子的悲剧时间；卖出一次上行，四维骗子悲剧一次；,四维骗子悲剧
45,03月07日 ,湖北股友,救命！上行再失手一笔，一卖创新高！，也比死在长电强；怪就怪在这里：一．上行创出填权新高；二．长电这垃圾，还在苦苦追求贴权――昨在盘中只是好象有填权，今天又贴权？从股价一看，那个有价值．那个是垃圾？上行在12.69元再次携手一笔，那是四维骗子的悲剧；,救命！上行再失手一笔，一卖创新高！
47,03月06日 ,海南股友,再次降低一般工商业电价10%的目标可以轻松完成北极星电力网新闻中心 　来源:配售电商业研究 　作者:先见君 　2019/3/6 13:50:39 　我要投稿 　北极星火力发电网讯:3月5日上午，李克强总理在政府工作报告中对电力行业提出了“深化电力市场化改革，清理电价附加收费，降低制造业用电成本，一般工商业平均电价再降低10%”的年度目标。由于2018年一般工商业电价已经降低了10%，此举引起了电力行业内部的轩然大波。有些同志感觉到压力重重，认为难以实现。(来源：配售电商业研究 ID：EDARBI 作者：先见君)为此，先见君根据公开资料，通过分析和计算，得到了再次降低一般工商业电价10%目标可以轻松完成的结论。详细过程如下：1、根据中电联快报，2018年，全国全社会用电量6.84万亿千瓦时。2、根据国家电网2019年工作会议报告，2019年国家电网计划完成售电量4.5万亿千瓦时，营业收入2.65万亿，实现利润830亿元。3、按照以上报告可以计算出国家电网2019年平均度电收入为0.5889元/千瓦时，按照增值税16%计算，增值税后度电收入为0.5076元/千瓦时。4、由于今年增值税将由16%降低到13%，以电网2019年计划完成售电量4.5万亿千瓦时计算，仅仅减税红利将达到685.26亿元。5、即使按照2018年全社会用电量6.84万亿千瓦时计算，按照5%的增速，2019年全社会用电量将达到7.18万亿千瓦时，增值税降低3%的全社会电费红利将达到1093亿元。6、目前一般工商业用电比例为14%，2019年全国一般工商业用电量约为10052亿千瓦时。通过2018年之后全国一般工商业平均目录电价为0.7018元/千瓦时，按此价格计算的一般工商业电费为7054.49亿元。降低10%的电价所影响的电费收入为705亿元。远低于全社会因为减税增加的改革红利。即使考虑到一般工商业电价存在峰平价差，因减税因素带来的降价传递也应该轻松完成降价10%的目标。值得关注的是，在再次降低一般工商业电价的过程中，应该注意以下问题：1、必须将减税红利按照政府工作报告的要求传递到每一个用电单位。严格防止不同经济主体侵蚀改革红利，在中间环节截留给一般工商业用户的利益，使得基层企业本应该降低的用电成本难以实施。2、在2018年降低一般工商业电价的过程中，有相当部分的地区虽然达到了电价降低10%的目标，但是转供电的终端用户电价却高于国家规定的销售目录电价。继续清理转供电中的不规范行为仍然是政府的重要任务。3、无论是2018年的十大降价措施还是2019年的全社会减税带来的红利，并没有从根本上解决完善电力体制的问题。尤其是转供电问题仍然在不断的蔓延和发生，已经成为全社会不得不解决的重大体制缺陷。所以总理要求的“深化电力市场化改革”才是使改革红利长期持续、有效的必经之路。,再次降低一般工商业电价10%的目标可以轻松完成
48,03月06日 ,湖北股友,长电涨了，就是长电风险来了，有风险了？慢牛变疯牛？长电股民全是真．假的价值投资者，持长电就是持未来；爱好长电跌股价，则投资价值加大；长电股价一涨，就是长电风险就来了，风险变大；慢牛变普疯牛了？大盘涨400多点，同期，长电股价不跌反涨；'今天，大盘再涨47点，长电股价撑不牢了，只好给长电股民涨风险了；长电股价不涨，就是长电没有风险；长电一涨，那就是给股民涨风险；',长电涨了，就是长电风险来了
49,03月06日 ,湖北股友,今，分批分期分价止盈长电，涨一点止盈一点；今天，随长电涨，持续止盈长电的操作，已经基本解除长电持股风险；达到持续盈利目标值；一．有这样的信心，参照长电2019年开盘0102日，股价＝15.88元．亏损＝-7998元二．今天，全面完成．构建对应佣金费率万1.5的短线交易持股量，可上天，可下地；三．全面完成对应融资交易的各类要求与条件；融资费率足够低，足够满意；四．对应今天2019年0306日收盘价，短线交易专用帐号持股成本＝15.50元；五．未来经过预期分红，短线交易帐户持股成本未来下降到1．自有资金持股成本＝14.85元2．自有资金持股成本＝15.06元六．长电仍然有被套的可能，被套处解套的要求，就容易多了，能力有的是；止盈长电，是止盈止出风险．止盈止来美好预期；止盈止来人民币！,今天，分批分期分价持续止盈长电
