,time,author,comment,header
40,06月17日 ,陕西股友,"震荡运行 <br> 指数今日以2880开出，日内震荡，最高2902，最低2877，收盘2887，量能较上交易日收缩，日K线形态收出一阳倒锤线。<br> 指数早盘平开，后向上反弹，午后窄幅度运行，近平盘收出。日K线形态，指数收出一倒锤阳线，价格运行在各日均价线之间，交易量能较上交易日收缩，这个形态是个继续震荡的形态。形态中可能看到，目前指数是围绕2884这个价格在震荡，这个价格是5178下行以来的一个支撑压力位，在近期中自反弹以来的支撑压力位是2851一线，短期这一线是还要继续接受考验的。今日的K线形态没有什么 判读意义，对整个震荡行情未出现影响。再来看看1小时线，今日的运行只形成一个平台，价格在均价线中纠缠，在独立形态中，价格还是需要继续向下震荡。操作上，目前行情总的还是在震荡中，这个震荡或将不日出现方向，现阶段还是继续观望，不要在反弹中追涨，不要主观抢反弹，等待机会的出现。<br> 发改委发布，深化股票发行制度改革 ，完善科创板相关制度安排。沪伦通17日正式启动！中 国 资 本市场双向开放再次迎来大动作。市场消息，中 国将 主导量 子密码国 际 标准制定。市场另一个新闻是，市场出现了一个每股0.18元的股票。继续关注外围市场变化。<br> <span class=""showStock"" id=""stock_sh600900"">长江电力</span><span id=""quote_sh600900""></span>（600900）今日K线收出一小阳十字形态，价格运行在２０日均价线之上，交易量能收缩，这个形态是个震荡形态，今日收出的K线与上日K线组合形成一个孕线形态，这个形态只是个暂时下跌停止，下行中注意２０日均价线的支撑。基本面上，国家再次下调供电价格。谨慎持有。个人见解，有局限，仅供参考！！！投资有风险，出入须谨慎！！！（来源：附骥尾的财富号 2019-06-17 16:24） [点击查看原文]<span id=""show_stock_str"" ></span>",震荡运行
41,06月14日 ,广西股友,"我国国家气候中心此前已确认2019年为厄尔尼诺年，目前天气情况与厄尔尼诺气象特征吻合度较高。近期南方降水较多，来水偏丰对水电板块构成利好，有望为其业绩表现增加阶段性弹性。分析人士还注意到，水电在我国可再生能源中占比仍有潜力可挖，为了满足能源转型的需要，水电发展步伐需进一步加快，行业基本面仍有较大提升空间。基本面向好近年来，中国能源坚持清洁低碳、安全高效的发展方向，大力发展清洁能源，能源结构调整步伐不断加快。国家能源局数据显示，2018年，中国清洁能源消费量占能源消费总量的比重达到22.1%，非化石能源消费占能源消费总量的比重达到14.3%。行业人士普遍认为，水电作为低碳能源的重要选择，低成本优势有望使其在未来的市场化竞争中占得先机。国家能源局6月10日发布的《2018年度全国可再生能源电力发展监测评价报告》称，截至2018年年底，我国可再生能源发电装机占总装机比重为38.4%，其中水电在可再生能源中占比48.3%。据水电水利规划<span class=""showStock"" id=""stock_sh603357"">设计总院</span><span id=""quote_sh603357""></span>院长郑声安介绍，为实现我国制定的2020年、2030年非化石能源占一次能源消费比重分别达到15%、20%的目标，到2020年，我国常规水电装机需要达到3.4亿千瓦；到2030年，我国常规水电需要达到4.1亿千瓦。有迹象显示我国水电增速已经开始加快，虽然当前电力需求仍处于偏弱态势，但水电因来水较好开工率大增。中国电力企业联合会提供的数据显示，1-4月份，全国规模以上电厂水电发电量2987亿千瓦时，同比增长13.7％，增速比上年同期提高12.4个百分点。中电联数据显示，前4个月，全国发电设备水电利用小时同比大幅上升13.5%至959小时；4月单月，全国发电设备水电利用小时为268小时，同比升29.5%。防御性凸显由于基本面稳中向好，个股分红和股息率更具有相对优势，水电板块在近期市场震荡中表现出较强的防御性，水电（申万）指数5月以来上涨2.46%。个股中，<span class=""showStock"" id=""stock_sz000993"">闽东电力</span><span id=""quote_sz000993""></span>、<span class=""showStock"" id=""stock_sz000883"">湖北能源</span><span id=""quote_sz000883""></span>领涨，<span class=""showStock"" id=""stock_sh600900"">长江电力</span><span id=""quote_sh600900""></span>近日还创出历史新高。<span class=""showStock"" id=""stock_sh601788"">光大证券</span><span id=""quote_sh601788""></span>认为，从板块业绩来看，2019年以来行业总体来水向好，水电业绩稳健增长。虽然行业规模高速增长期已过，“阿尔法”已不显著，但“贝塔”才是当下核心要素。建议在2019年厄尔尼诺年有助于水电利用小时提升，且整体市场方向不明之际，增加大型水电公司的配置。<span class=""showStock"" id=""stock_sh600030"">中信证券</span><span id=""quote_sh600030""></span>分析师李想指出，水电股超额收益获取一般集中在利率下行阶段，开发长周期的特性使得水电超额收益获取更多由分母（利率）推动。近期刚兑预期部分打破以及增长压力加大，国债收益率有望下行并带动水电股的价值重估。水电公司当前市值和长期价值普遍仍有差距，长期投资价值突出。另外，今年以来来水形势良好，水电利用小时提高值得期待，超预期的来水将为水电企业的业绩表现增添阶段性弹性。安信证券表示，多库联调有望大幅提升水电资产的价值，在优质水电资源开发潜力有限的背景下，存量机组具有稀缺性，建议重点关注水电龙头以及装机有增长，外送通道建设稳步推进的标的。（来源：股师弟777的财富号 2019-06-14 15:11） [点击查看原文]<span id=""show_stock_str"" ></span>",水电板块防御属性受青睐 行业基本面向好
42,06月14日 ,江苏股友,"<span class=""showStock"" id=""stock_sh600674"">川投能源</span><span id=""quote_sh600674""></span>，水力发电龙头之一，分红永世不绝，优质股。两投的两河口300万千瓦、杨房沟150万千瓦电站投产在即，雅江至南昌800千伏直流输电线路已开工建设，输能800万千瓦，以后两投的电站无任何弃水，效益翻倍，对应合理股价为14元左右！以后不会有目前的低股价了，抓紧建仓呀<span id=""show_stock_str"" ></span>",川投能源，水力发电龙头之一，分红永世不绝，优质股
44,06月12日 ,贵州股友,"转发                                                                                                                                                                                ◆                                                  ◆                                                                                                                                                                                                                                                                                                                                                                                                                                                                                    猎鹰寻股                                                                                                            发表于 2019-06-12 15:49:48                                                                                                                                              [财富号评论吧] 东风吹，战鼓擂，满仓炒股谁怕谁？                                                  预测是为了更好的应对，不管对与否先把风险降到最低，特别是对于新股民朋友，在无法判断是涨是跌的时候，不要想着还能赚多少，要看自己本金剩多少！市场方向：稀土、5G和农业，预计短期还有一定的空间，但风险也将逐步加大，猎鹰觉得机构资金已经开始调整方向，资金开始其中围绕网络安全和安防设备，伴随5G的商用，预计网络安全将迎来投资盛宴，相关龙头标的<span class=""showStock"" id=""stock_sz002123"">梦网集团</span><span id=""quote_sz002123""></span>、<span class=""showStock"" id=""stock_sz300333"">兆日科技</span><span id=""quote_sz300333""></span>、<span class=""showStock"" id=""stock_sz300352"">北信源</span><span id=""quote_sz300352""></span>已经开始启动（非荐股）鹰粉战绩：<span class=""showStock"" id=""stock_sz000795"">英洛华</span><span id=""quote_sz000795""></span> 18%<span id=""show_stock_str"" ></span>",转发
45,06月12日 ,陕西股友,"指数涨这么多,菲达这股才相当于1200点!筹码珍贵洗盘就抢!　超跌股最易被踏空机构抢筹. 　浙江国资委整合概念 .　国家十年环保工程　,业绩大订单（见下面附图） , 月线大底 . 绝对几年跌出来的低价筹码　　有大利好时一定要像丰乐种那样快速翻倍向上否则永远受穷!总受穷的庄稼一辈子抬不起头来 ！ 只会磨叽的股票还不如银行钢铁股.　　旧庄主力时间不值钱跌了48个月，欢迎新庄大资金进入　新庄大资金可随便买呀!大好环境不会上涨,青春时光等闲度, 再混一年再穷一年, 　踏空的散户就会越聚越多，霉股，上证50都涨了几年在高位!而中小创是低位,这回跷跷板该中小创涨。都等着买便宜货呢吧! 　反而现在有钱就可以买这种超跌的票。大好环境不会上涨,青春时光等闲度, 　再混一年再穷一年,踏空的散户就会越聚越多这票已跌了48个月　下跌预期很小，指数涨这么多,这股才相当于1200点!　筹码珍贵洗盘就抢!　现在买100万股价格才区区几百万Rmb!　4年前要3052万!跌了这么多年还没跌够么　　上涨预期强烈！ 　指南针公司的市场盈亏无穷指标不会作假!越跌越是抄底的良机，跌吧庄家跌了48个月了，爷怕啥？感谢庄稼哦，爷准备好了资金准备分期分批买了! 这个价位分期分批买 　根本套不住!　茅台万科这么大都几年翻几倍,这股怕啥?　政策扶植板块.业务大单不断!　利空出尽是利好!　　<span class=""showStock"" id=""stock_sh600150"">中国船舶</span><span id=""quote_sh600150""></span>ST时跌幅越大,后面涨幅越大!http://guba.eastmoney.com/news,600526,818858721.html<span id=""show_stock_str"" ></span>",请新硬庄主力们去抄菲达环保大底!最高点错杀下来仅1折筹码
46,06月11日 ,贵州股友,"我的口号是：不吃饭不睡觉，打起精神赚钞票！                                                                                                                                                                                ◆                                                  ◆                                                                                                                                                                                                                                                                                                                                                                                                                                                                                    妙可言zxco80                                                                                                            发表于 2019-06-11 19:20:12                                                                                                                                              [<span class=""showStock"" id=""stock_sh600584"">长电科技</span><span id=""quote_sh600584""></span>吧] 今天大盘一改上周的颓废，直接扭身向上反弹，形成从箱底反弹箱顶的趋势。 这就是市场                                                  今天大盘一改上周的颓废，直接扭身向上反弹，形成从箱底反弹箱顶的趋势。这就是市场，有涨有跌，有失意，也有狂欢。<span id=""show_stock_str"" ></span>",我的口号是：不吃饭不睡觉
47,06月11日 ,安徽股友,"终于爆力放量反弹了经历了节前6连阴的摧残，在昨天缩量热身后，今天接着爆力反弹。连着吃了6天面条，今天总算是让股民朋友吃了根香肠，一改以往的疲软之势，强势震荡走高，一举突破5、13、20日线压力，收出光头光脚大阳线。下一步将有希望向34日线即2950点，也是趋势延伸压力线的位置发起挑战。今天盘面非常的强势，两市个股涨多跌少，3611家个股，仅44家收跌，这样的普涨行情，已经是许久未见。但是对于这样强势的盘面好不好赚钱呢，咱们深入去翻开盘口来看看。今天两市涨停119家（剔除新股实际涨停109家），涨幅在+5%以上的有560家，跌停2家，跌幅-5%近10家。这样的普涨行情，居然还有两个被摁得死死的在地板上摩擦。其余跌幅大的均为ST股，今年提醒过多次，ST股要远离，不要再按过去的思路，炒摘帽炒借壳，总想乌鸡变凤凰，ST爆炒的时代已经成为过去式了。今天两市总成交5652亿，较昨天直线狂增2000亿，这个增量是很可以的。今天两市平均涨幅中位数为+3.63%，涨幅在平均线上的个股仅1492家，只占40%，有60%的个股跑输了平均线。今天能够跑赢平均线的，也就只有500ETF和中证500，以及券商ETF。50、300均没跑过平均线。今天涨幅板居前的主要是酿酒、证券、建材、建筑、软件、通信设备半导体等。资金流入板块主要为证券、酿酒、软件、医药、有色、化工、建材、地产、汽车、元器件。在今天的108家涨停板中，仅25家为昨天的连续板，在这25家中有9家属于一字板或是高开快速封板不具备交易机会。昨天涨停板有70家，但是在昨天的70家涨停板中，今天弱于市场表现的达到了半数。多数冲高回落，反而出现了高位套人的走势。有四家属于涨停板砸开，高开低走的套人大阴走势。今天还出现了一家地天板“<span class=""showStock"" id=""stock_sz300176"">派生科技</span><span id=""quote_sz300176""></span>”，这个股之前因团贷网爆过雷，大股东质押遭到了平仓，一大批搞配资的直接被闷在里头，对于这个股，老铁们仍应避着点为好。虽说团贷网事件后来被政府接管了，但这股的主营也是废材，所以就没必要往这里去博傻了。按说这么生猛的普涨行情，应该很好赚钱才是。可今天整体下来，虽然盘面热点不断，但交易并没有那么顺利，也没获得超预期的收益。如果不是早盘下手果断干脆的，拖到今天午盘才下手的话，多数都是没能吃到肉，搞不好遇上午盘回落还得吐口血。拿我自己今天的持仓来说，虽然几个主要重仓的持仓股今天都大幅跑赢了平均数，可是这几个股在节前的6连阴中，杀跌幅度可是不小的，所以即便今天被灌了根大阳，可股价也没有回到前节的价。要不是做过调仓置换，这波指数这么震一震，指数是又回到了2925点，比节前任何一天的收盘点位都高，但是有多少人帐户净值却是比节前少了。想必帐户净值比节前低的人有很多吧。这就是今年行情的阴险之处，指数涨了你净值没上去，指数跌了，大面一碗一碗的吃个不停。当然也不能用一两天的跑输平均涨幅就泄气，还是要看持久性，有些股虽然在每次的大涨中，都没能跑赢过指数的涨幅，可是在长周期中，却是不显山不露水的大幅领先于指数。像<span class=""showStock"" id=""stock_sh600900"">长江电力</span><span id=""quote_sh600900""></span>，<span class=""showStock"" id=""stock_sh600377"">宁沪高速</span><span id=""quote_sh600377""></span>这些行业龙头，多数时间段内的行情大涨时，都是跑输于指数的。唠了一圈，回到重点，反弹没结束，不要过早被吓出下了车，扶好坐稳抓紧，还能享受几天。前面下跌时提醒你们去配置指数基金的，可以等过冲过2950点后再去考虑减。我是今天先减了指数基金，去配置博个股了。你还想看    人气进入冰点，或是配置良机为什么业绩持续增长，而股价总是不涨缺口已经补了，但恐慌还没结束怎么去测算指数点位是否处于低位金蝉脱壳，又见大股东占用上市公司巨额资金风里雨里，基哥在自留地等你，关注基哥自留地，一起骑牛看风景。顺手点赞，投资大赚。（来源：基哥自留地的财富号 2019-06-11 19:03） [点击查看原文]<span id=""show_stock_str"" ></span>",终于爆力放量反弹了
1,05月30日 ,贵州股友,"<span class=""showStock"" id=""stock_sh600900"">长江电力</span><span id=""quote_sh600900""></span>的突破 （为什么），1，18个月的15.5-16-17元以上的区间横盘，必然突破，技术使然！2，5月28日明成MSCI指数带来外边资金，国际资金偏好稳定的公用事业和清洁能源。3，5月23日174人参加了 股东大会，与公司人员交流透露出业绩或其他方面的重要信息使然。那个是主要的呢？？？请发表观点 或者还有其他原因<span id=""show_stock_str"" ></span>",长江电力的突破 （为什么）， 1
2,05月30日 ,北京股友,"这几天，鬼子持有<span class=""showStock"" id=""stock_sh600900"">长江电力</span><span id=""quote_sh600900""></span>的股份数创出了历史新高，里面到底都是些什么鬼，我想扒一扒。<br>由于沪股通不能穿透最终的持有者，只能看到投行通道的持有数，所以，就有必要猜一猜背后到底是些什么鬼。首先看看汇丰。汇丰的持股比例最大，而且比较稳定。汇丰作为香港人的银行，里面沉淀着大量香港市民的养老金，香港人经历过金融危机的风雨，而且香港存款利率很低，所以香港人很多都把定投蓝筹股收息作为存款增值的渠道，而经营稳健分红有保障的<span class=""showStock"" id=""stock_sh600900"">长江电力</span><span id=""quote_sh600900""></span>，自然也会成为他们定投的一个标的。同时，香港的本地大鳄，如李嘉诚这些，对公共事业情有独钟，也可能通过汇丰通道长期持有<span class=""showStock"" id=""stock_sh600900"">长江电力</span><span id=""quote_sh600900""></span>。另外，就是汇丰自有的投行和保险自营盘，必然也会选择这个通道持有股票。再看看中银国际。这个具有大陆背景的通道，应该是很多大陆人或者私募过去开户买的。这个通道持股很长时间以来持股都很稳定，但是，今年2月前后出现了一次比较明显的减持。而在那个时点，$<span class=""showStock"" id=""stock_sh600011"">华能国际</span><span id=""quote_sh600011""></span>电力股份(00902)$ 却被重阳投资增持。所以，我个人估计，有可能是重阳投资减持了部分<span class=""showStock"" id=""stock_sh600900"">长江电力</span><span id=""quote_sh600900""></span>而买<span class=""showStock"" id=""stock_sh600011"">华能国际</span><span id=""quote_sh600011""></span>H股。而这个通道里面的持股，大部分也应该是重阳投资的。接着看看瑞银。瑞士作为全球有钱人的天堂，很多有钱人，特别是中东的土豪，都会把钱放在这里。所以，瑞银通道的持有者，有很多应该是全球的有钱人或者是中东的土豪。中东土豪长期玩石油，知道资源的重要性，随着石油开采的衰竭，他们在石油赚的钱自然也会寻找下一个能源的王者。<span class=""showStock"" id=""stock_sh600900"">长江电力</span><span id=""quote_sh600900""></span>对于这些中东土豪来说，肯定是很好的配置品。同时，瑞士央行也是全球投资股票的，去年瑞士央行减持了美股，出来的钱必须找替代品，而<span class=""showStock"" id=""stock_sh600900"">长江电力</span><span id=""quote_sh600900""></span>也可能成为他们嘴里的菜。然后看看以摩根斯丹利为首的各美帝投行通道。这些通道持股变化最大，经常大起大落，除了一些MSCI指数基金外，应该有很大仓位是美帝的对冲基金持有。最近，半路杀出个中信里昂，值得思考。有一种说法是由于指数基金要增加配置的原因，但我觉得这个说法不正确。因为，如果是指数基金配置，那么之前就已经有股份了，也肯定会表现在这个通道里面的持股了，为什么偏偏在这个增加比例的时点出现呢？所以，我更偏向于一个新的投资团体的借指数基金增加配置这个时点，掩护进来买。里昂是法国的老牌投行，虽然08年金融危机被中信收编，但是其势力范围依然集中在以法国为中心的欧洲国家。欧洲能够通过这个通道买的，有两个疑凶。一个是法国电力，法国电力玩核电玩到了极致，钱多，但法国目前核电已经到头了，市场潜力不大，手握大钱的法国电力，必然要找新的投资渠道，<span class=""showStock"" id=""stock_sh600900"">长江电力</span><span id=""quote_sh600900""></span>作为全球领先的大水电，必然引起它的关注。另一个疑凶就是葡萄牙电力，葡萄牙电力和三峡集团关系很密切，除了之前在股权转让上有交锋外，两个公司经常互派人员交换学习，说到对<span class=""showStock"" id=""stock_sh600900"">长江电力</span><span id=""quote_sh600900""></span>的深入理解，欧洲公司也只有葡萄牙电力最有资格了，所以，如果有钱，葡萄牙电力一定不会放过这块肥肉。（来源：思未来财富的财富号 2019-05-30 17:27） [点击查看原文]<span id=""show_stock_str"" ></span>",长江电力里面到底都是些什么鬼
