,time,author,comment,header
24,08月21日 ,江西股友,"业绩牛6669万元买进！价值低估，翻倍在望！！<span class=""showStock"" id=""stock_sz000672"">上峰水泥</span><span id=""quote_sz000672""></span>融资融券信息显示，<span class=""showStock"" id=""stock_sz000672"">上峰水泥</span><span id=""quote_sz000672""></span>开通融资融券刚两天！2019年8月20日融资净买入1939.5万元；融资余额6669.87万元，较前一日增加41%。<span class=""showStock"" id=""stock_sz000672"">上峰水泥</span><span id=""quote_sz000672""></span>(000672)预计上半年实现净利9.1-10.1亿元 同比增长80%-100%<span id=""show_stock_str"" ></span>",防守股全出了：业绩牛6669万元买进！价值低估
27,08月20日 ,<a href='/u/3302205894' title='洪兴土鸡'>洪兴土鸡</a>,这股可以买，但不要超过5元。,这股可以买，但不要超过5元
28,08月20日 ,湖北股友,"浙江杭州股友111 --影响力 吧龄 6.2年 --发表于 2019-08-17 17:21:23当心再次我0729日，长电股民给再次悲剧了？-重温一下0729日，长电操作：一．开盘，从长电＝18.55 18.57 18.59 元，一路卖出到最高＝18.95元二．长电最高价出现在＝18.96元；三．当日长电最高价＝18.96元；四．长电18.96元上涨无望，随即在18.93 18.91 18.90 18.90元卖出四笔五．长电从18.96元开始一波下跌行情？-长电股价类似与0729日的条件，应该是正在一点一点具备？正在准备""""引领""""长电股价，至少能满足阶段性的下跌？0729日，当天长电最高价当于就给带出；这次操作质量更高，困难重重？--------------------------------0818日，就实现悲剧长民：持续卖出＝19.10 19.15 19.55 19.60元10笔持续买入卖出＝19.35 19.38 19 40 19.40 19.43 19.45元，共06笔-共交易32笔，8笔*小时*长电",重温：再次我0729日
29,08月20日 ,山西股友,人生没有真正的绝望。树，在秋天放下了落叶，心很疼，可是整个冬天，它让心在平静中积蓄力量。春天一到，芳华依然。只要生命还握在手心，人生就没有绝望。一时的成败得失对于一生来说，不过来了一场小感冒。心若累了，让它休息，灵魂的修复是人生永不干枯的希望。,人生没有真正的绝望
30,08月20日 ,湖北股友,"昨，短线交易好象与0729交易有点象，只是烈度小一点；-浙江杭州股友111--影响力 吧龄 6.2年--发表于 2019-08-19 20:48:18今天，""""追高""""19.07元买入，也是最低买入；最高卖出＝19.60元；标准短线卖出＝19.10 19.15 19.20 19.50 19.55 19.60元；19.65元没有成交密集交易区＝19.35 19.38 19.40 19.40 19.43 19.45元，短线交易共32笔------------------------------------------------------出逃众＝19.10 19.15-------19.55 19.60元共计10笔再加06笔当天的买入．卖出；19.35 19.38 19.40 19.40 19.43 19.45元，菜06笔-考虑买入．卖出的总数没有什么少，0729日主要是单边卖出；所以卖出烈度小一点；",昨，短线交易好象与0729交易有点象
31,08月20日 ,湖北股友,多亏这三个傻瓜提醒，长电被踏空了，有机会补了一点-这三个傻瓜，本想趁机自我消费一下．发泄一下心头的痛；幸灾乐祸长电踏空；三个傻瓜：一．一个傻瓜可能以为踏空？这么大的量？二．一个傻瓜：一边认为没有股票．一边又以为在19.60元左右给踏空三．一个傻瓜＝四维骗子，长电受到折磨，想趁　机发呓一下；四维琮个苦大了：1．从黔源，就被折磨；15.82买入，在20.80 20.88元止盈清亿；看．让他如何吹？2．在上行，又被输死；上行解禁跌停；那也是稳操胜券；--被套一笔，跌停价买入再一笔，第三笔打开赚钱的天地，什么价格都保证盈利3．在长电，一连想在＝10元平仓，又想在高处出错被套；除了苦还是苦？,多亏这三个傻瓜提醒，长电被踏空了
33,08月19日 ,河南股友,"<span class=""showStock"" id=""stock_sh600900"">长江电力</span><span id=""quote_sh600900""></span>,<span class=""showStock"" id=""stock_sh600674"">川投能源</span><span id=""quote_sh600674""></span>,<span class=""showStock"" id=""stock_sh600025"">华能水电</span><span id=""quote_sh600025""></span>为什么有累创新高的走势？中国最后一个即将启动的联网工程值得期待；电网，路网，互联网，高铁网，公路网等等基建民生投资外；国内河流联网以及红旗河等联网运行值得期待，一旦工程启动，受益的岂止这三个公司，真正造福于千秋万载的炎黄子孙。<span id=""show_stock_str"" ></span>","长江电力,川投能源"
34,08月19日 ,黑龙江股友,"引言:  <span class=""showStock"" id=""stock_sh600900"">长江电力</span><span id=""quote_sh600900""></span>在99.99%的投资者心目中就是个债券,但在我眼里他却是高确定性的成长股!这就是大部分投资者不能把握到其上涨机会的原因,我写此文的目的就是要给众人揭示<span class=""showStock"" id=""stock_sh600900"">长江电力</span><span id=""quote_sh600900""></span>今后的成长性何来!  第一次喊出上百的口号是在2017年国庆节(之前的是打新神器,<span class=""showStock"" id=""stock_sh600900"">长江电力</span><span id=""quote_sh600900""></span>!),当时利用假期时间从网上手工摘抄了公司下属各电站的历史流量及水位数据,并结合上游其他水库电站的投产情况作了后期发电预测分析。  作为一家发电企业,近几年最重要的基本面变化就是国家推动的电力市场化改革,所以如果不考虑市场化改革进程对各企业上网电价的影响,是无法正确估值发电企业的,2012~2015年,很多价值投资者云集水电行业,并获利丰厚,但是2015年之后,还在成功坚守的屈指可数,究其原因就是我刚才说的,他们对电力行业技术和市场化发展缺乏跟踪研究和深刻认识,大部分仅是刻舟求剑式的从产能投放节奏和计划体制电价上简单的测算公司效益,进而得到长电就是债券的结论。  在积累了一定基础知识后,我公开在雪球答应广大球友,待股价上涨到20元时,公布上百的逻辑(如按复权算,现在已到)。  时光荏苒,转眼近两年过去了,当时喊的5年也逐渐变成了4年,马上就变3年了。很多人都觉得我空喊口号迟迟不说逻辑是在故弄玄虚。确实,我投入大量时间精力整理数据分析行业发展得到的东西,更愿意和一路持有过来的志同道合的球友们交流。在2017/2018年里我除了喊口号,其实基本已把搜集整理的数据都以简单明了的图表形式分批发在了雪球上,很多有心的球友已经基本理解了大体逻辑,长期跟踪我动态的各位球友们欢迎在我的文后评论证言,并一起记录下四年熊市来持有长电的心路历程。  我后续再喊上百无非是想建立个筛选机制,去除一些不够严肃、个性尖刻没耐心的看客而已。我声明,此文发出后,大家可以畅所欲言,我将不再因此拉黑任何意见不合的人(人身攻击除外)。  下边我将分章节按时间上的变化顺序对公司经营的影响展开论述。为了照顾广大球友的不同知识水平,过程中的细节讨论从简,讨论较多分歧较大的节点我会应大家要求单独开篇另行讨论。  第一击:上游建成,流域联调(2020/2021年)  熟悉水电的朋友都知道,近几年在长江上游各支流,将有一系列大型龙头水库电站建成投产,公司下属4大电站的来水全年流量分配将大为改变!  从上图可以看出,2021年前后,4大电站上游将有近220亿立方米的调节库容陆续投入使用。  以上两图是调节库容的变化对电站全年来水流量的影响,简单说就是部分丰水期来水被转移到枯水期再下泄发电了。向溪现在的丰水期大量弃水将基本消失,三峡电站的年平均发电水位也将提升。另外,公司近几年持续在二级市场上买入其他水电公司股权,并明确提出了全流域联合调度的经营方针。远期的调节库容增加叠加对上游雅砻江乌江等其他电站的全流域联合调度,公司远期年发电量将逐步提升大约300-400亿度的规模(详见公司经营问答)。  第二击:配合三总,全债收购!(2022/2023年)  大家都知道乌白两电站是大股东三总在体外培育的,并承诺建成后注入上市公司。向溪当年的注入方案确实值得研究和借鉴,我自己当年也是在对向溪注入的路径和对价做出预测后才由两投换股买入<span class=""showStock"" id=""stock_sh600900"">长江电力</span><span id=""quote_sh600900""></span>的。  说到收购方案,我本人更喜欢从全体股东角度去考虑问题,大股东三总可以说是具有社会责任感的优秀央企,之前的历次资产注入,基本都是比较公平的。实现了大中小全体股东多赢的局面。  收购资产无外乎两种方式,一种是发新股购买,另一种是借新债购买。通常情况是在自身资产负债率较高或者发债融资利率高企的环境下,公司就会尽量选择发新股融资的,反之则选择发债。表象上看就是初创小公司多发股,稳定大公司多发债!以前,<span class=""showStock"" id=""stock_sh600900"">长江电力</span><span id=""quote_sh600900""></span>自身的资产规模小,银行贷款和发债利率也较高(背景是中国经济高速发展时期),  所以上市公司连续几次大规模注入资产,基本选择了增发新股。大股东拿到了上市公司股权,但是并没有通过上市公司获得多少一次性现金回报。  结合全球经济大趋势看,2021年后,市场利率极可能还将进一步降低!对于优质资产可以说进入了间接融资的甜蜜时期!截止目前,长电的资产负债率只有50%左右,数年后更是会降到40%一线,在上市的各家水电公司里几乎最低,我大胆预测,三总也有利用上市公司收购乌白资产的契机获得大量低成本现金的欲望!  下面说下我对注入方案的理解和分析。  白鹤滩动态总投资上限为1778亿,乌东德滩动态总投资上限约976亿,按20%资本金计算,乌白原股东共投入资本金550亿,向银行贷款2200亿。  乌白由于建设成本较高,每年折旧负担巨大(乌白的单电量造价可能比向溪要高出80%以上),导致了其建成初期报表利润很低,可能最多只有三/四十亿的规模(按向溪现有电价和运营成本估算),处于典型的现金流好,盈利低状态。而长电自身已经度过了这个报表难看的阶段,这个时候,换股注入,其实乌白原股东是很吃亏的(因为增发后每股收益必须增厚才行)。而全债收购,三总手中的股权可以按净资产为基础轻松加到2倍左右(甚至更高)回收现金!(参考其他大型水电资产收购)  <span class=""showStock"" id=""stock_sh600900"">长江电力</span><span id=""quote_sh600900""></span>:  全债收购前资产负债率=1200亿(总负债)/3000亿(总资产)=40%  全债收购后资产负债率=(1200亿 2200亿 550亿*2)/(3000亿 3300)=71%(两倍溢价)  注:从过去的经验看大型水电站结算造价都会小于控制动态造价的,那样负担还会小。  全债收购后,长电貌似资产负债率很高,但其实现金流情况很好,在电价不变的情况下,每年自由现金流大概在500亿左右(考虑以后利率下降因素),按公司承诺的净利润70%分红率计算,支付股息每年在220亿左右(1元/股),折旧200亿加剩余80亿盈利共280亿可以全部用来偿还债务本金,15年左右即可把所有负债还清。这个情况的前提是上网电价维持不涨,或者说是一种较悲观的预期(当然如果注入时股价已炒高了就增发呗,全债只是在股价较低时原股东的选择,三总拿到大笔现金后,完全可以回二级市场里增持换回股权嘛)。  三总短期内就回收了大量现金,资产负债率大幅降低,经营一下灵活了很多,除了增持长电(按30元一股在二级市场增持,三总拿到的现金可以买到36.7亿股,或者上市公司股权的16.7%),还可以继续加杠杆投资其他业务去。作为<span class=""showStock"" id=""stock_sh600900"">长江电力</span><span id=""quote_sh600900""></span>的大股东,乌白今后创造的现金流还可以以上市公司分红的方式继续源源不断拿回。  第三击:电网调峰,电价提升!(2024年之后)  终于说到了最核心的问题了,电价!电价!电价!之前的两击基本就是个推演,算不上是预测,而几年后的上网电价变化趋势才是投资电力股的核心!  直接上结论:我预测长电下属电站上网电价将随电力市场化改革的完成而提升。  水电的短期调解能力类似气电,可以瞬间收放自如。以乌白溪向三葛的体量和位置看,是中国两大电网最佳的调峰支撑点!既有规模,又有通道,还有灵活性。  随着风光等低成本新能源发电形式的大规模入网,叠加城市化升级后晚间用电量的暴增,再坚强的电网也受不了这些不稳定变化趋势的冲击,调峰的需求必然越来越大,而在所有的调峰电源形式里,水电又是成本最低的,<span class=""showStock"" id=""stock_sh600900"">长江电力</span><span id=""quote_sh600900""></span>最终一定会成为全中国的电网调峰大电池。  调峰调频电量如何定价?这是个很艰难的课题。我的估值模型是用水光互补联合发电的远期竞争力(对标燃煤火电)作为参考依据的。有兴趣的朋友可以自己也思考测算下,有了结果我们再深入讨论。我现在直接给出一个全年综合水电电价(参与调峰市场定价后的),0.45元/度。  还有一个非常重要的边界参数,就是融资成本,这个就不展开了,我个人的展望取值是3.5%。  基于0.45元/度的上网电价和3.5%的融资利率,我来重新分析<span class=""showStock"" id=""stock_sh600900"">长江电力</span><span id=""quote_sh600900""></span>注入乌白及之后的财务情况。  一:先说小概率的增发注入。2200亿债务部分肯定还是要承接过来的,三总和云南四川两省乌白股权换得40亿股<span class=""showStock"" id=""stock_sh600900"">长江电力</span><span id=""quote_sh600900""></span>股票,另外再增发20亿股融资600亿现金(增发价30,按之前假设增发收购测算)。收购后的资产负债率是45%。  公司全年权益发电量:三葛1250亿度,向溪1150亿度,乌白1200亿度,其他水电400亿度合计4000亿度。  总收入:1800亿元。  总负债:2800亿元,年付利息100亿。  运营成本:200亿元。  折旧:200亿元。  增值税:160亿元。  所得税:290亿元。  净利润:860亿元。  自由现金流:1060亿元。  分红:600亿元。  总股本:280亿股。  股价:100元/股。  市盈率:33倍。  股息率:2.14%。  二:同等边界条件下全债收购后财务情况如下  总收入:1800亿元。  总负债:4500亿元,年付利息158亿。  运营成本:200亿元。  折旧:200亿元。  增值税:160亿元。  所得税:270亿元。  净利润:810亿元。  自由现金流:1010亿元。  分红:570亿元。  总股本:220亿股。  股价:100元/股。  市盈率:27倍。  股息率:2.59%<span id=""show_stock_str"" ></span>",长江电力未来上涨的逻辑!
36,08月18日 ,山西股友,从今天开始，每天微笑吧，世上除了生死，都是小事。不管遇到了什么烦心事，都不要自己为难自己；无论今天发生多么糟糕的事，都不应该感到悲伤。今天是你往后日子里最年轻的一天了，因为有明天，今天永远只是起跑线。记住一句话：越努力，越幸运。,从今天开始，每天微笑吧，世上除了生死，都是小事
37,08月18日 ,青海股友,即使短期未注入长电，这两个水库带来的巨大蓄水能力，既减轻了三峡水库防洪压力，又带来巨大的多库联调发电效益。预计乌白两库尤其是白鹤滩水库建成后，三峡汛限水位应该会随之上调，相信长电专业人员早已做好各项准备了。乌白水库下闸蓄水之日，应该也是长电员工和各位长期股东们的喜庆之日！,乌白两库下闸蓄水，带来265亿总库容
38,08月18日 ,河南股友,下周准备加仓买入600795已挂单挂单买入价格2.43左右目标价5元股价翻番，预计今年业绩增长200%以上今年1季度净利润已经超过全年全年目前是逢低买入600795的好机会明天准备加仓买入600795挂单买入价格2.43左右如果开盘价在2.43以下集合竞价成交量必须在30万股以上,逢低买入股价很可能大幅上涨的股票
39,08月17日 ,广东股友,"转发                                                                                                                                                                                ◆                                                  ◆                                                                                                                                                                                                                                                                                                                                                                                                                                                                                    第7维度                                                                                                            发表于 2019-08-17 16:21:23                                                                                                                                              [<span class=""showStock"" id=""stock_sz002201"">九鼎新材</span><span id=""quote_sz002201""></span>吧] 九鼎这两连板打得漂亮，能够留在场内的都是高手！<span class=""face-img face-wb-3-13"">[献花]</span><span class=""face-img face-wb-3-13"">[献花]</span><span class=""face-img face-wb-3-13"">[献花]</span>第7维度欣                                                  九鼎这两连板打得漂亮，能够留在场内的都是高手！第7维度欣赏这种顶层思维逻辑！江湖合力！！！<span id=""show_stock_str"" ></span>",转发
40,08月17日 ,湖北股友,面对长电新情况，采用新思路．新操作，到了一个新高度．新境界！长电股价调整的新情况：长电股价下跌到某价格以下，应该短线会回到这价格以上；这价格现出，给长电短线交易机会；应该把握这机会；第一次采用新的短线操作方法；最近，面对长电股价调整最低至＝18.51元下跌调整，调整短线交易操作方法；并且是用融资，在第三步采用融资；当天如卖出全部卖出，不产生融资费用；短线交易新的操作方法：一．第一次买入一笔二．第二次买入二笔三．第三次买入三笔．类推；最后笔数的资金量好吓人，终于过来了？四．最低买入到＝18.55元；五．最受益的价格＝18.60元，一次买入，多次卖出受1．第一次卖出＝18.70元．0.10元差价，净利＝115元2．第二次卖出＝18.75元，0.15元差价，净利＝190元3．第三次卖出＝18.80元，0.20元差价，净利＝265元，小计＝570元，降0.38元持股成本-面对长电股价的上涨：一．昨天，最高卖出在19.08元，其它正在抓紧卖出的进行式；按0.05差价卖出是来不及了？二．昨天，最低买入在＝18.72元，标准买入价18.70元，一看形势不对，18.72元增加买入；三．看看最高卖出价＝19.05元，最低买入价18.72元，死在这价格上，在期待长电下跌？-长电这次梦想价格，体会到什么叫：梦想成真．天随人愿，来的实在太快；长电短线交易，来不及按标准差价＝0.05元卖出踏空；要加紧踏空,面对长电新情况，采用新思路．新操作
41,08月17日 ,广东股友,"转发                                                                                                                                                                                ◆                                                  ◆                                                                                                                                                                                                                                                                                                                                                                                                                                                                                    第7维度                                                                                                            发表于 2019-08-17 11:50:49                                                                                                                                              [<span class=""showStock"" id=""stock_sh603712"">七一二</span><span id=""quote_sh603712""></span>吧] 股海无边浪推浪，芸芸众生逐利殇！群英逐志东风起，一拍即合往上扬！<span class=""face-img face-wb-3-13"">[献花]</span><span class=""face-img face-wb-3-13"">[献花]</span>                                                  股海无边浪推浪，芸芸众生逐利殇！群英逐志东风起，一拍即合往上扬！<span id=""show_stock_str"" ></span>",转发
42,08月16日 ,贵州股友,"长电是水电龙头，公用事业，清洁能源，经济不好利率下行的避险股，兼有天然中高成长性。 业绩折旧双轮驱动，新水注入加上游蓄水，也是四轮驱动。<span class=""showStock"" id=""stock_sh601318"">中国平安</span><span id=""quote_sh601318""></span>是金融保险股龙头。人口老龄化促寿险稳定增长。寿险是保险获利核心。平安保正走向四轮驱动，保险，投资，科技，健康养老。<span id=""show_stock_str"" ></span>",长电是水电龙头，公用事业，清洁能源
43,08月16日 ,吉林股友,"两市少有的散户可买的高收益率债券，<span class=""showStock"" id=""stock_sh600221"">海航控股</span><span id=""quote_sh600221""></span>债券122071，年利率6.2%，100股每天派发1.7元的利息，急跌到89元以下，还有一年零九个月到期，到期后每股有11块多的差价加上11元的利息，总共有22元多的收益。只要两年内海南航空控股股份有限公司不破产清算就可以了。去年2月份也急跌到87元，四月又涨到98元。另外8月8日，发行人<span class=""showStock"" id=""stock_sh600221"">海航控股</span><span id=""quote_sh600221""></span>刚刚入选MSCI大盘股指数成份股。<span id=""show_stock_str"" ></span>",两市少有的散户可买的高收益率债券，海航控股债券122071
44,08月16日 ,湖北股友,长电最难受的价格出现了？-面对长电＝19元的卖出，相当难受：一．在最高价19.04元，想卖出的不会有成交的二．股价不到＝18.80元，以下，又不愿买入；在最高价，差价大一点应该要的；三．长电股价要是在19.04元-18.91元，把我荡秋千了？只好耐心等待机会出现？,长电最难受的价格出现了？
45,08月16日 ,广东股友,7哥是网红打板族，支持7哥                                                                                                                                                                                ◆                                                  ◆                                                                                                                                                                                                                                                                                                                                                                                                                                                                                    第7维度                                                                                                            发表于 2019-08-16 09:55:15                                                                                                                                              [美格智能吧] 云南褚业，k线结构板后支撑信号明显，macd指标正在翻越零轴，如果上攻，应该有一                                                  云南褚业，k线结构板后支撑信号明显，macd指标正在翻越零轴，如果上攻，应该有一波强势行情！,7哥是网红打板族
46,08月16日 ,山西股友,静水流深，智者无言。人生如流水，有的人，活得光明磊落，海纳百川；有的人，活得跌宕起伏，肆意奔流；有的人，活得清静淡雅，如深流之静水，喧嚣尘世间。水深不语，人稳不言，真正聪明的人，心静如水，淡漠无语，是一种智慧，一种胸怀和气度。人生到了一定的年纪，就要懂得沉默，懂得慎言，懂得自律，不再随便的评判别人，不再没有主见的人云亦云，生活终是要有桥渡桥，无桥自渡，谨言慎行。一个人，饱经了沧桑，却依旧不动声色，以不变应万变，以智慧洞察一切，这样的人更具有着强大的内心，有着静水流深的沉稳和从容。人生如水，水静无波，静水流深。,静水流深，智者无言
