,time,author,comment,header
34,05月26日 ,江苏股友,量子通信第三张“国家名片”。5月24日央视：量子通信再迎重大喜讯驻荆州开发区记者刘娟　特约记者罗成：有人说，高铁是中国的第一张“国家名片”，核电技术是第二张“国家名片”，量子通信就是第三张“国家名片”。新华社5月6日报道，国际顶级权威学术杂志《科学》又一次刊登了来自中国量子领域研发的开创性消息，这次又是中科大潘建伟院士团队，中国人在量子科技研发的道路上一路领先而行，全球科学界再次得到来自中国分享的量子通信科学大餐。潘建伟团队拿下美国大奖！这一天中国人等了96年一起当娱记2019-05-17 13:56央视：中国又一量子技术项目立项，潘建伟：所以，我们不敢懈怠用户1914672986 2019-05-24 12:22中国投资咨询网 ：中国成功发射世界首颗量子科学实验卫星“墨子号”后，美国和俄罗斯专家就此表示，量子通信是确保信息安全和防御黑客的最好选择。　　俄罗斯量子中心的“量子通信研究团队”负责人库罗奇金对新华社记者说：“在未来量子计算机时代，只有量子通信能够保证信息安全。”,601111量子通信第三张“国家名片”
35,05月26日 ,河北股友,"最低估不用比，市场正能量回购且全注销龙头，不如现起全仓转买*601666<span class=""showStock"" id=""stock_sh601666"">平煤股份</span><span id=""quote_sh601666""></span>*属稀缺资源国企，一季度业绩巨增，历史高点在60元，忽略日线、周线看月线、季线唯一十年大底的<span class=""showStock"" id=""stock_sh601666"">平煤股份</span><span id=""quote_sh601666""></span>，正能量开启每股5．68元破净资源股，百亿稀缺资源储量，无AH价差和大小非减持压力，最低估不用比不用找了，十个涨停也不多*大股东三亿资金回购注销和价值投资万亿资金目标股。<span id=""show_stock_str"" ></span>",最低估不用比，[爱心]市场正能量回购且全注销龙头
37,05月24日 ,<a href='/u/6919619134' title='用户6919619134'>用户6919619134</a>,国际油价大跌走熊市利好中国航空股走牛市才对！但中国航空股比波音跌得更深得多，？？？？？,国际油价大跌走熊市利好中国航空股走牛市才
38,05月23日 ,<a href='/u/6919619134' title='用户6919619134'>用户6919619134</a>,俄罗斯股市创新高台湾股市也是向上，大A差差等生，什么逻辑？,俄罗斯股市创新高台湾股市也是向上
40,05月22日 ,江苏股友,参考消息网5月22日报道 德媒称，欧盟和中国之间未来将有更多更廉价的航班。欧盟委员会5月20日在布鲁塞尔说，双方已经达成相关协议。据德新社5月20日报道，根据协议，未来所有欧洲航空公司都能在已经与中国签订双边协议的欧盟国家提供航班。迄今为止，根据双边协议只有这些国家或其国民拥有的航空公司才能提供从这些国家飞往中国的航班。负责交通事务的欧盟委员薇奥莱塔布尔茨说：“我们双方都有兴趣让欧洲和亚洲更好地联系起来，并使欧洲和中国之间的货物、服务和人员更容易流动。”布鲁塞尔当局预计，在该协议签署后的前8年里，双方将获得35亿欧元（1欧元约合7.71元人民币――本网注）的经济收益并创造1.1万个就业岗位。从2008年到2017年，中国和欧盟之间的航空旅客数量已经翻了一番，达到每年1000万人次。==========================================================客流量大涨是对国航的最大利好！,中国欧盟签协议增加航班 德媒：创造1.1万个就业岗位
43,05月19日 ,河北股友,"最低估不用再比再找，卖掉所有5元以上股票，有钱不如快下来全仓转买破净回购焦煤稀缺资源正能量龙头，601666<span class=""showStock"" id=""stock_sh601666"">平煤股份</span><span id=""quote_sh601666""></span>，唯一季线年线十年大底，大资金必抢。一季度业绩大幅增长，破净第一，回购注销进行中，每股净资产5．68元，国有股东回购必大赚，帐上百亿现金比市值都高，消灭破净股，蓝筹股破净己不多了，好多蓝筹股己收复净资产，其他垃圾股卖的更贵，无ABH价差，无小非减持压力。将比<span class=""showStock"" id=""stock_sz000723"">美锦能源</span><span id=""quote_sz000723""></span>强5倍，其他股一元净资产卖几元几十元爱唯一十年大底股。买茅台都不如买<span class=""showStock"" id=""stock_sh601666"">平煤股份</span><span id=""quote_sh601666""></span>，百亿稀缺焦煤煤层气储量，五百亿都买不到。近期己成立医疗健康公司和新能源公司。市场各力量必须鼓励正能量回购注销。<span id=""show_stock_str"" ></span>",最低估不用再比再找，[献花]卖掉所有5元以上股票
44,05月18日 ,江苏股友,"业绩牛！凯乐量子保密通讯超级“军工”牛股！翻倍不是梦！<span class=""showStock"" id=""stock_sh600260"">凯乐科技</span><span id=""quote_sh600260""></span>（600260 ）“量子科技”加“军工”。保密通讯是所有军工的制高点！量子通信设备，国内在量子通信设备领域实现产业化的企业，其实没几家。<span class=""showStock"" id=""stock_sh600260"">凯乐科技</span><span id=""quote_sh600260""></span>量子通讯研发中心已经成功申报为建设国家级实验室。2019年将停止毛利低的专网通信后端加工业务，未来毛利会大幅增长！前景不可限量！对比主要业务同样以专网通信为基础的<span class=""showStock"" id=""stock_sh600776""><span class=""showStock"" id=""stock_sz300379"">东方通</span><span id=""quote_sz300379""></span>信</span><span id=""quote_sh600776""></span>，<span class=""showStock"" id=""stock_sh600260"">凯乐科技</span><span id=""quote_sh600260""></span>股价你说是值200还是500呀？<span id=""show_stock_str"" ></span>",601111业绩牛！凯乐量子保密通讯超级“军工”牛股！翻倍不
45,05月17日 ,河北股友,"史无前例！波音4月订单颗粒无收，C919却一片独好，看局座神预言05-17　12:28强国军情从世界各地不断传来波音737 MAX系列客机一波又一波直接停飞、倒伐退订、拒绝收货的消息，挪威航空、美联航、俄罗斯、中国<span class=""showStock"" id=""stock_sh600115"">东方航空</span><span id=""quote_sh600115""></span>等公司也正式明确向波音公司提出了索赔诉求，雪上加霜的波音公司如同过街老鼠一般人人喊着痛打。下月开始的巴黎航展，波音最合理的结局还是两个字“凉凉”。与此同时，在地球的另外一边，中国航空器材集团公司的情景可以说是热火朝天、人声鼎沸，前往参观国产大飞机C919和前来谈判希望早日签订订单的客户，可谓是川流不息，风景一片独好！而据英国广播公司报道，C919售价为5000万美元左右，物超所值仅为波音同类型机型售价的一半，C919目前已经收到全球用户近千架订单。早在今年3月，局座张教授就在评论波音陷入连连摔困境时，神预言中国C919订单肯定会以几何倍数井喷增长。...<span id=""show_stock_str"" ></span>",史无前例！波音4月订单颗粒无收
46,05月17日 ,福建股友,有一件事情要问一下，国航人民币的汇兑损益来自于飞机的租赁和购买。我想问假如用空客呢？是不是用欧元结算？另外对美元贬值了是不是对于欧元也在贬值？所以用空客人也是没办法避险的？还有航司为什么不能做空人民币做对冲呢？,有一件事情要问一下
47,05月17日 ,内蒙古股友,发改委等四部委：加大金融对实体经济的支持力度发改委、工信部、财政部、人民银行发布关于做好2019年降成本重点工作的通知，要求降低增值税税率，落实好将制造业等行业16%的税率降至13%；加大金融对实体经济的支持力度；持续降低制度性交易成本；取消或降低一批公路、铁路、民航、港口收费。(来自爱股票APP),发改委等四部委：加大金融对实体经济的支持力度发改委、工
48,05月17日 ,江苏股友,根据路孚特(Refinitiv)的Eikon船只追踪数据，5月16日一艘违反所谓“美国制裁令”的载有伊朗燃料油的油轮，已在中国舟山附近的储油罐卸货。  石油终端运营商--舟山金润石油转运有限公司的一名代表证实了这艘Marshal Z号油轮卸下将近13万吨伊朗燃料油，结束了四个月的艰苦跋涉。  中国外交部近期曾多次就伊朗原油问题明确表态，反对美方实施单边制裁和“长臂管辖”。====================================================美国号称加征中国石油商品关税、禁了华为，中国还怕什么？有多少伊朗石油就买多少伊朗石油！国际油价即将大跌！,伊朗一油轮在舟山附近卸货（大利好）
50,05月15日 ,内蒙古股友,民航局：将统筹推进民航降低成本今天，民航局发展计划司副巡视员张清在例行新闻发布会上表示，根据新近印发的《关于统筹推进民航降成本工作的实施意见》，将统筹推进民航降低成本。主要措施包括降低和规范民用机场收费标准、降低航空煤油销售价格、明确北京大兴国际机场价格收费政策等方面。（新京报,民航局：将统筹推进民航降低成本今天
52,05月14日 ,内蒙古股友,"4月16日，中证银行指数大涨超4四个点，带动大盘站上3250点。站在当前时点，银行股还能不能买？未来增长空间有多少？<span class=""showStock"" id=""stock_sh600369"">西南证券</span><span id=""quote_sh600369""></span>金融行业首席分析师郎达群先生日前和大家分享了2019年银行板块的投资机会。1.过去10年，银行板块走出独立行情的背景是怎样的？朗达群：过去十年银行板块与大盘走势保持高度一致，充分体现了银行股作为大盘权重的稳定器作用。但历史上也出现过三次银行股相对于市场走出独立行情的阶段。第一次：2008年11月，当时内部环境经济周期下行，消费需求放缓，外部美国次贷危机向全球蔓延。政府出台了积极的财政政策和宽松的货币政策来对冲经济下行压力，信贷扩张助推银行板块走出了一波独立行情。2009年涨幅跑赢上证综指超过20%。第二次：2012年12月到2013年的1月，当时经济预期回暖，货币政策保持宽松，在城镇化建设、棚户区改造带动下，银行整体信贷高增，资产滞胀预期改善，银行股跑赢大盘接近23个百分点。第三次：2017年的5月之后，国家推出供给侧结构性改革，以国有银行为代表的银行板块资产端质量明显改善，盈利能力持续好转，整体不良率进入下行通道。在这种预期带动下，板块指数在2017年5月到2018年1月，跑赢大盘接近20个百分点。总结这三次银行板块相对于大盘指数独立行情，我们认为银行板块的上涨需要三方面的条件：经济预期的拐点、流动性宽松的环境、资产质量相对平稳条件下的银行信贷高增。2.当前银行板块还能布局吗？朗达群：站在当前时点，我们对于银行板块依然坚定看多，主要逻辑有三点。第一经济预期拐点，第二个流动性宽松，第三个是信贷高增。从经济企稳角度看，随着宽货币向宽信用逐步传导，部分高频经济指标已显现出企稳迹象。我们认为未来经济经济底也将临近，压制银行板块的宏观环境因素，也将逐渐得到消化。此外，监管政策有边际趋缓倾向。从信贷投放角度看，一季度在政策要求发展普惠金融的引导下，银行整体信贷投放明显放量，3月披露的社融、信贷数据全面超出市场预期。从业绩基本面角度，一季度金融市场利率维持在低位水平，有助于改善商业银行负债端边际成本，巩固息差空间，我们对于行业一季报业绩维持乐观态度。最后，银行板块作为强周期，目前依然处于价值洼地，年初至今，受宏观经济预期影响，银行整体行情表现滞涨，板块估值处于破净水平，在市场行情回暖的背景下，银行板块的补涨预期非常强烈。总体而言，我们认为2019年银行板块是一个攻守兼备的品种，银行股的补涨行情有望持续下去。3.如何高效布局银行板块？对于普通投资者来说，市场风格多变，很难精准踩中银行股的行情。采用指数化投资形式来规避个股选择风险往往是一个更好的选择。跟踪中证银行指数的华宝银行ETF联接基金（240019），可实现26家大中小上市银行一网打尽，高效把握银行板块整体行情。天天基金APP申购银行ETF联接（240019）可享1折费率优惠，直达链接：http://fund.eastmoney.com/240019.html<span id=""show_stock_str"" ></span>",《以史为鉴
53,05月14日 ,北京股友,"4月16日，中证银行指数大涨超4四个点，带动大盘站上3250点。站在当前时点，银行股还能不能买？未来增长空间有多少？<span class=""showStock"" id=""stock_sh600369"">西南证券</span><span id=""quote_sh600369""></span>金融行业首席分析师郎达群先生日前和大家分享了2019年银行板块的投资机会。1.过去10年，银行板块走出独立行情的背景是怎样的？朗达群：过去十年银行板块与大盘走势保持高度一致，充分体现了银行股作为大盘权重的稳定器作用。但历史上也出现过三次银行股相对于市场走出独立行情的阶段。第一次：2008年11月，当时内部环境经济周期下行，消费需求放缓，外部美国次贷危机向全球蔓延。政府出台了积极的财政政策和宽松的货币政策来对冲经济下行压力，信贷扩张助推银行板块走出了一波独立行情。2009年涨幅跑赢上证综指超过20%。第二次：2012年12月到2013年的1月，当时经济预期回暖，货币政策保持宽松，在城镇化建设、棚户区改造带动下，银行整体信贷高增，资产滞胀预期改善，银行股跑赢大盘接近23个百分点。第三次：2017年的5月之后，国家推出供给侧结构性改革，以国有银行为代表的银行板块资产端质量明显改善，盈利能力持续好转，整体不良率进入下行通道。在这种预期带动下，板块指数在2017年5月到2018年1月，跑赢大盘接近20个百分点。总结这三次银行板块相对于大盘指数独立行情，我们认为银行板块的上涨需要三方面的条件：经济预期的拐点、流动性宽松的环境、资产质量相对平稳条件下的银行信贷高增。2.当前银行板块还能布局吗？朗达群：站在当前时点，我们对于银行板块依然坚定看多，主要逻辑有三点。第一经济预期拐点，第二个流动性宽松，第三个是信贷高增。从经济企稳角度看，随着宽货币向宽信用逐步传导，部分高频经济指标已显现出企稳迹象。我们认为未来经济经济底也将临近，压制银行板块的宏观环境因素，也将逐渐得到消化。此外，监管政策有边际趋缓倾向。从信贷投放角度看，一季度在政策要求发展普惠金融的引导下，银行整体信贷投放明显放量，3月披露的社融、信贷数据全面超出市场预期。从业绩基本面角度，一季度金融市场利率维持在低位水平，有助于改善商业银行负债端边际成本，巩固息差空间，我们对于行业一季报业绩维持乐观态度。最后，银行板块作为强周期，目前依然处于价值洼地，年初至今，受宏观经济预期影响，银行整体行情表现滞涨，板块估值处于破净水平，在市场行情回暖的背景下，银行板块的补涨预期非常强烈。总体而言，我们认为2019年银行板块是一个攻守兼备的品种，银行股的补涨行情有望持续下去。3.如何高效布局银行板块？对于普通投资者来说，市场风格多变，很难精准踩中银行股的行情。采用指数化投资形式来规避个股选择风险往往是一个更好的选择。跟踪中证银行指数的华宝银行ETF联接基金（240019），可实现26家大中小上市银行一网打尽，高效把握银行板块整体行情。天天基金APP申购银行ETF联接（240019）可享1折费率优惠，直达链接：http://fund.eastmoney.com/240019.html<span id=""show_stock_str"" ></span>",《以史为鉴
54,05月13日 ,河北股友,"最低估不用再比再找，不如快下来全仓转买焦炭制氢资源正能量龙头，601666<span class=""showStock"" id=""stock_sh601666"">平煤股份</span><span id=""quote_sh601666""></span>，大资金必抢。一季度业绩大幅增长，破净第一，回购注销进行中，每股净资产5．68元，国有股东回购必大赚，帐上百亿现金比市值都高，牛市先消灭破净股，蓝筹股破净己不多了，好多蓝筹股己收复净资产，其他垃圾股卖的更贵，无ABH价差，无小非减持压力。将比<span class=""showStock"" id=""stock_sz000723"">美锦能源</span><span id=""quote_sz000723""></span>强5倍，其他股一元净资产卖几元几十元爱唯一十年大底股。买茅台都不如买<span class=""showStock"" id=""stock_sh601666"">平煤股份</span><span id=""quote_sh601666""></span>，百亿稀缺焦煤煤层气储量，五百亿都买不到。近期己成立医疗健康公司和新能源公司。市场各力量必须鼓励正能量回购注销。<span id=""show_stock_str"" ></span>",[爱心]最[献花]低估不用再比再找
55,05月13日 ,浙江股友,油，汇双杀？目前33100股，成本9.09，跑？还是留？股吧的大神分析一下，这汇率和油价对国航有多大影响？能再跌到7元以下吗？房子已经出售，目前一分不敢动。你们觉得国航入手时间在什么时候？点位在哪里？在线等！晚上继续关灯吃面！,油，汇双杀？目前33100股，成本9.09
56,05月10日 ,江苏股友,在岸、离岸人民币对美元分别跌破6.83、6.86关口05-09 21:31|上海证券报中国证券网上证报中国证券网讯（记者 张骄）5月9日晚间，离岸人民币对美元汇率日内跌幅扩大至逾500点，失守6.86关口，跌幅仍在进一步扩大；在岸人民币对美元较上一交易日收盘价下挫近600点，跌破6.83关口。截至21点26分，在岸、离岸人民币对美元汇率报6.8300、6.8625。,在岸、离岸人民币对美元分别跌破6.83、6.86关口 05-
57,05月09日 ,江苏股友,国际航协最新报告：全球航空货运需求持续疲软05-09 11:21|上海证券报中国证券网上证报中国证券网讯 据经济日报5月9日消息，国际航空运输协会近日发布的全球航空货运市场报告显示，2019年3月份，以货运吨公里衡量的全球航空货运需求同比仅小幅增长0.1%，显示全球航空货运需求持续疲软。报告指出，全球航空货运需求增长继续面临巨大阻力，其中包括去年全球贸易量下降1%、全球经济活动和消费者信心继续走弱、自去年9月份以来全球出口订单下降等。国际航协总干事兼首席执行官朱尼亚克表示，全球贸易疲软、贸易紧张局势加剧和订单减少等因素，对全球航空货运需求增长带来的不利影响持续存在。在连续4个月收缩之后，今年3月份全球航空货运需求同比增长0.1%，小幅回升至正值，不啻为全球航空货运市场整体疲软下一个令人鼓舞的进展。,国际航协最新报告：全球航空货运需求持续疲软 05-09 11
58,05月09日 ,内蒙古股友,外资机构看中国：上调全年经济增速预期 人民币将保持稳定进入5月份以来，多家外资机构释放出看好中国经济的信号。渣打银行、澳洲联邦银行、摩根大通分别将中国今年全年GDP增速预期上调至6.5%、6.5%和6.4%。摩根大通董事总经理、亚太地区副主席李晶表示，预计今年人民币将整体保持稳定。摩根大通外汇策略团队对2019年底的人民币对美元汇率预测为6.65，CFETS(中国外汇交易中心)人民币篮子指数为95。（中国新闻网）(来自爱股票APP),外资机构看中国：上调全年经济增速预期 人民币将保持稳定
59,05月09日 ,<a href='/u/6919619134' title='用户6919619134'>用户6919619134</a>,"<span class=""showStock"" id=""stock_sh601111"">中国国航</span><span id=""quote_sh601111""></span>中国国强！<span id=""show_stock_str"" ></span>",中国国航中国国强！
0,05月09日 ,<a href='/u/6919619134' title='用户6919619134'>用户6919619134</a>,"<span class=""showStock"" id=""stock_sh601111"">中国国航</span><span id=""quote_sh601111""></span>，中国国强！<span id=""show_stock_str"" ></span>",中国国航
1,05月08日 ,河北股友,"重点：最低估不用比找，[卖掉所有5元以上股票*快全仓转买焦炭制氢资源正能量龙头，601666<span class=""showStock"" id=""stock_sh601666"">平煤股份</span><span id=""quote_sh601666""></span>，大资金下来必抢。一季度业绩大幅增长，破净第一，回购注销进行中，每股净资产5．68元，国有股东回购必大赚，帐上百亿现金比市值都高，牛市先消灭破净股，蓝筹股破净己不多了，好多蓝筹股己收复净资产，其他垃圾股卖的更贵，无ABH价差，无小非减持压力。将比<span class=""showStock"" id=""stock_sz000723"">美锦能源</span><span id=""quote_sz000723""></span>强5倍，其他股一元净资产卖几元几十元爱唯一十年大底股。买茅台都不如买<span class=""showStock"" id=""stock_sh601666"">平煤股份</span><span id=""quote_sh601666""></span>，百亿稀缺焦煤煤层气储量，五百亿都买不到。近期己成立医疗健康公司和新能源公司。市场各力量必须鼓励正能量回购注销。<span id=""show_stock_str"" ></span>",重点：[献花]最低估不用比找
4,05月06日 ,<a href='/u/5545428903' title='用户5545428903'>用户5545428903</a>,跌停，快跌停吧,跌停
9,04月25日 ,河北股友,"万手哥*全仓要快，卖掉所有5元以上股票*买入焦炭制氢燃料资源龙头，601666<span class=""showStock"" id=""stock_sh601666"">平煤股份</span><span id=""quote_sh601666""></span>，破净第一，回购注销进行中，每股净资产5．5元，国有股东回购必大赚，牛市先消灭破净股，蓝筹股破净己不多了，好多煤炭股己收复净资产，其他垃圾股卖的更贵，无ABH价差，无小非减持压力。将比<span class=""showStock"" id=""stock_sz000723"">美锦能源</span><span id=""quote_sz000723""></span>强5倍，其他股一元净资产卖几元几十元爱心]，唯一十年大底股。买茅台都不如买<span class=""showStock"" id=""stock_sh601666"">平煤股份</span><span id=""quote_sh601666""></span><span id=""show_stock_str"" ></span>",[加仓]万手哥*[爱心][献花]全仓要快
11,04月24日 ,青海股友,唱空的人如此之多，原油上涨和人民币贬值是对航空公司有影响，最直接的影响不是大盘回调嘛，三日的回调让多少散户割肉了，这周大盘只要站稳在3200点，国航没多大问题，站不住就割肉了，现在只需要做t，没必要立刻清仓，我亏损6个点。我不唱多也不唱空，一切看这周大盘，提醒韭菜们踏空。,唱空的人如此之多，原油上涨和人民币贬值是对航空公司有影
13,04月23日 ,内蒙古股友,油价涨，人民币继续贬值，想不通的时候留着干嘛，早跑早解脱，现在是庄跑了一半了，剩余一半想办法高价跑，给人一种假象，跌不下去了，接盘就行，其实上当了，不到9.50不进来，今天割肉走了，赔俩个点，操，早盘10.40没走，郁闷。,油价涨，人民币继续贬值，想不通的时候留着干嘛，早跑早解
14,04月23日 ,黑龙江股友,,有道论金：休市多日，恒生指数陷入持续震荡
15,04月23日 ,内蒙古股友,美国白宫22日宣布此前给予部分国家和地区进口伊朗石油的制裁豁免在5月初到期后将不再延续。伊朗外交部发言人穆萨维当天就此回应说，美国制裁是非法的，伊朗政府不承认美国方面所谓延长各国购买伊朗原油的豁免有意义。伊朗将与包括欧洲和周边国家在内的国际伙伴就此问题进行全面磋商，伊朗将对美国此举采取应对措施并及时公布具体方案。,美国白宫22日宣布此前给予部分国家和地区进口伊朗石油的制
18,04月19日 ,<a href='/u/6879653451' title='用户6879653451'>用户6879653451</a>,说国航不行就发不掉了,说国航不行就发不掉了
19,04月19日 ,<a href='/u/6879653451' title='用户6879653451'>用户6879653451</a>,"<span class=""showStock"" id=""stock_sh601111"">中国国航</span><span id=""quote_sh601111""></span>太差劲了<span id=""show_stock_str"" ></span>",中国国航太差劲了
