,time,author,comment,header
15,03月28日 ,<a href='/u/5909225087' title='jjmzhd_71820'>jjmzhd_71820</a>,"<p style=""margin-top:0px;margin-bottom:0px;white-space:normal;padding:0px;font-size:14px;color:rgb(102,102,102);font-family:simsun;background-color:rgb(255,255,255);text-indent:42px;position:static!important;""><strong style=""position:static!important;""><span style=""color:rgb(0,112,192);font-family:宋体;position:static!important;"">首先大家得知道，原油期货是什么，别跟现货弄混了，原油期货咱们国家18年3月<span style=""font-family:TimesNewRoman;position:static!important;"">26</span>号上市的，原油期货是当下最火的投资理财项目，投资小利润大交易自由，T+0的操作模式，买涨买跌双向交易简单灵活，并且风险可控的一个投资项目，刚刚上市一年，现在每天的成交额都在两三千亿，这也是咱们国家准备了近17年才上市的国际化期化产品！！！</span></strong></p><p style=""margin-top:0px;margin-bottom:0px;white-space:normal;padding:0px;font-size:14px;color:rgb(102,102,102);font-family:simsun;background-color:rgb(255,255,255);position:static!important;""><span style=""font-family:宋体;position:static!important;""></span></p><p style=""margin-top:0px;margin-bottom:0px;white-space:normal;padding:0px;font-size:14px;color:rgb(102,102,102);font-family:simsun;background-color:rgb(255,255,255);text-indent:42px;position:static!important;""><strong style=""position:static!important;""><span style=""font-family:宋体;position:static!important;"">这次推出的中国原油期货最大的亮点是以人民币计价，可转换成黄金，也是目前期货产品中唯一对接国际的产品。</span></strong></p><p style=""margin-top:0px;margin-bottom:0px;white-space:normal;padding:0px;font-size:14px;color:rgb(102,102,102);font-family:simsun;background-color:rgb(255,255,255);text-indent:42px;position:static!important;""><strong style=""position:static!important;""><span style=""font-family:宋体;position:static!important;""></span></strong></p><p style=""margin-top:0px;margin-bottom:0px;white-space:normal;padding:0px;font-size:14px;color:rgb(102,102,102);font-family:simsun;background-color:rgb(255,255,255);text-indent:42px;position:static!important;""><strong style=""position:static!important;""><span style=""font-family:宋体;position:static!important;""><span style=""font-size:16px;position:static!important;"">相信大家也知道，一个上新的产品，刚开始时的赚钱效应是很好的，原油期货在</span>2018<span style=""font-size:16px;position:static!important;"">年上市时说希望三年内做到全球第三，现在上市不到一年，已经做到第三，而且马上将超越第二，也充份说明参于投资的人群众多！！</span></span></strong></p><p style=""margin-top:0px;margin-bottom:0px;white-space:normal;padding:0px;font-size:14px;color:rgb(102,102,102);font-family:simsun;background-color:rgb(255,255,255);position:static!important;""><strong style=""position:static!important;""><span style=""font-family:宋体;position:static!important;"">您也可以看一下期货相比股票的优势</span></strong></p><p style=""margin-top:0px;margin-bottom:0px;white-space:normal;padding:0px;font-size:14px;color:rgb(102,102,102);font-family:simsun;background-color:rgb(255,255,255);position:static!important;""><strong style=""position:static!important;""><span style=""font-family:宋体;position:static!important;""></span></strong></p><p style=""margin-top:0px;margin-bottom:0px;white-space:normal;padding:0px;font-size:14px;color:rgb(102,102,102);font-family:simsun;background-color:rgb(255,255,255);text-indent:42px;position:static!important;""><strong style=""position:static!important;""><span style=""font-family:宋体;position:static!important;"">原油期货优点（一）.t+0交易。当天可以买卖。（二）双向交易，可以买涨可以买跌。（三）保证金交易，不用全额付款，订金交易模式。（四）<span style=""font-family:TimesNewRoman;position:static!important;"">.</span>统一报价，全国交易所统一报价。（五）资金安全。资金银行三方托管，实时出入金。（六）价格波动有依据，期货涨跌根据供求关系涨跌，涨跌有依据。</span></strong></p><p style=""margin-top:0px;margin-bottom:0px;white-space:normal;padding:0px;font-size:14px;color:rgb(102,102,102);font-family:simsun;background-color:rgb(255,255,255);text-indent:42px;position:static!important;""><strong style=""position:static!important;""><span style=""font-family:宋体;position:static!important;""><br style=""position:static!important;""/></span></strong></p><p style=""margin-top:0px;margin-bottom:0px;white-space:normal;padding:0px;font-size:14px;color:rgb(102,102,102);font-family:simsun;background-color:rgb(255,255,255);text-indent:28px;position:static!important;""><strong style=""position:static!important;""><span style=""font-family:宋体;position:static!important;""><span style=""font-size:16px;position:static!important;"">如果理更多的人参与原油期货市场，把原油期货市场做大做好，最终咱们国家可以拿到国际原油定价的话语权，也是推动人民币全球化的一个工具，大家有时间也可以上网查看一下原</span><span style=""font-size:16px;position:static!important;"">油期货的上市对咱们国家级层面的重大意义，所以国家是非常重视的，不然也不会准备了长达</span>17<span style=""font-size:16px;position:static!important;"">年的时间，所以为了让更多人参与进来，现在可以说是非常好赚钱的红利时期！！</span></span></strong></p><p style=""margin-top:0px;margin-bottom:0px;white-space:normal;padding:0px;font-size:14px;color:rgb(102,102,102);font-family:simsun;background-color:rgb(255,255,255);text-indent:28px;position:static!important;""><strong style=""position:static!important;""><span style=""font-family:宋体;position:static!important;""><span style=""font-size:16px;position:static!important;""><br style=""position:static!important;""/></span></span></strong></p><p style=""margin-top:0px;margin-bottom:0px;white-space:normal;padding:0px;font-size:14px;color:rgb(102,102,102);font-family:simsun;background-color:rgb(255,255,255);text-indent:28px;position:static!important;""><strong style=""position:static!important;""><span style=""font-family:宋体;position:static!important;""><span style=""font-size:16px;position:static!important;"">做一手原油保证金通过我们公司</span>1:10<span style=""font-size:16px;position:static!important;"">的配资只需要自己</span>4000<span style=""font-size:16px;position:static!important;"">元左右，</span><span style=""font-size:16px;font-family:TimesNewRoman;position:static!important;"">0.3</span><span style=""font-size:16px;position:static!important;"">个点就可以回本，</span><span style=""font-size:16px;font-family:TimesNewRoman;position:static!important;"">1</span><span style=""font-size:16px;position:static!important;"">个点盈利</span><span style=""font-size:16px;font-family:TimesNewRoman;position:static!important;"">1000</span><span style=""font-size:16px;position:static!important;"">元，每天波动在</span><span style=""font-size:16px;font-family:TimesNewRoman;position:static!important;"">10</span><span style=""font-size:16px;position:static!important;"">个点左右！！</span></span></strong></p><p style=""margin-top:0px;margin-bottom:0px;white-space:normal;padding:0px;font-size:14px;color:rgb(102,102,102);font-family:simsun;background-color:rgb(255,255,255);text-indent:28px;position:static!important;""><strong style=""position:static!important;""><span style=""font-family:宋体;position:static!important;""><span style=""font-size:16px;position:static!important;""><br style=""position:static!important;""/></span></span></strong></p><p style=""margin-top:0px;margin-bottom:0px;white-space:normal;padding:0px;font-size:14px;color:rgb(102,102,102);font-family:simsun;background-color:rgb(255,255,255);text-indent:28px;position:static!important;""><strong style=""position:static!important;""><span style=""font-family:宋体;position:static!important;"">如果不想死守在股票市场，换一个市场的话，原油期货可以说是当下最好把握的市场，有想更深入了解的朋友来吧，我跟你们深入的交流，想了解我的可以看我介绍</span></strong></p><p style=""white-space:normal;""><br/></p><p><br/></p>",做股票不如做期货，为什么大家都这样说呢？做了才知道太好
16,03月28日 ,<a href='/u/1461658914' title='大都会王晓春'>大都会王晓春</a>,"<p>看不懂现在行情的朋友，就别出来发言误导大家了！现在好多人都是在盲目炒股，看哪个票涨的好，想都不想就<span class=""face-img face-10"">[买进]</span>，结果买了就跌，卖了就涨！老吴我在股市里奋战了二十余年，偏爱抓强势个股，独家战法主力跟庄与主力控盘，自己的资产也从入市的8万到现在的530万，大家想跟着赚的话大家可以→点击下方简丨介，就能看到我的唯一联系方式了！声明：我会指点大家操作的，我是无偿交流，不收一毛钱的。</p><p><br/></p><p>另外在02月22号买进的<span class=""showStock"" id=""stock_sz300109"">新开源</span><span id=""quote_sz300109""></span>，截止到目前涨幅约有58.12%，在02月22日通过选股绝技买进的<span class=""showStock"" id=""stock_sz002683"">宏大爆破</span><span id=""quote_sz002683""></span>，成本价是9.07元，截止到目前涨幅也有71.81%；在02月18号3.30元买进的<span class=""showStock"" id=""stock_sz300106"">西部牧业</span><span id=""quote_sz300106""></span>，截止到目前涨幅50.66%；这波收获我想跟着我的朋友还满意吧，没能及时跟上这票的朋友也不用太沮丧，近期我又发现两只好的股，主力已经悄然流入，预计下周将会有一波拉升，大家可以→点击下方简丨介，就能看到我的唯一联系方式了!等下把这两只股给大伙揭晓！</p><p><br/></p><p>手中有“<span class=""showStock"" id=""stock_sh601111"">中国国航</span><span id=""quote_sh601111""></span>”这票的要注意了，这只票现在是非常时期！每天我都会在盘中对这股票的趋势与主力，进行盘中分析，买卖一看就懂。想跟着一起赚钱的话，大家可以→点击下方简丨介，就能看到我的唯一联系方式了!如果你想抓住这波福利的话，那就赶紧行动吧，跟上老吴做市场先知先觉者，接下来的行情中绝对能收益为王<span class=""face-img face-wb-3-13"">[鲜花]</span><span class=""face-img face-wb-3-13"">[鲜花]</span><span class=""face-img face-wb-3-13"">[鲜花]</span>不收0费！！</p><span id=""show_stock_str"" ></span>",散户必看！资深牛散老大叔直击中国国航全面解说！买卖已成
17,03月27日 ,<a href='/u/7028709390' title='用户7028709390'>用户7028709390</a>,收益超预期！,收益超预期！
18,03月27日 ,天津股友,"沪指今日震荡上攻，收盘小幅上扬0.85%，重上3000点大关，收报3022.72点。市场成交量大幅萎缩，两市合计成交仅有6647亿元，行业板块涨跌互现。<span class=""showStock"" id=""stock_sh600519"">贵州茅台</span><span id=""quote_sh600519""></span>、<span class=""showStock"" id=""stock_sh601318"">中国平安</span><span id=""quote_sh601318""></span>、<span class=""showStock"" id=""stock_sz000002"">万科A</span><span id=""quote_sz000002""></span>、<span class=""showStock"" id=""stock_sh600048"">保利地产</span><span id=""quote_sh600048""></span>、 <span class=""showStock"" id=""stock_sh600383"">金地集团</span><span id=""quote_sh600383""></span>、招行银行、<span class=""showStock"" id=""stock_sh601111"">中国国航</span><span id=""quote_sh601111""></span>等大盘主流的上涨，港口、铁跌运输等一带一路的走强，对稳定大盘起到了重要的作用。题材股方面高派息指数大幅上涨，<span class=""showStock"" id=""stock_sh603156"">养元饮品</span><span id=""quote_sh603156""></span>、<span class=""showStock"" id=""stock_sz300699"">光威复材</span><span id=""quote_sz300699""></span>、<span class=""showStock"" id=""stock_sz002674"">兴业科技</span><span id=""quote_sz002674""></span>、<span class=""showStock"" id=""stock_sz000661"">长春高新</span><span id=""quote_sz000661""></span>等创新高。在指数波动的情况下，逆势上涨是因为投资价值所在。许多人在猜指数，对于盘中指数的波动心里感到不安，有的人涨的时候看涨，跌的时候看跌。但如果以价值投资为准绳，绩优为投资标的，指数的调整或是低吸机会，而是恐慌杀跌。买前多研判，对上市公司的成长性，尤其是对财务指标中的每股收益、净资产、公积金、未分配利润进行权衡分析，还有一个重要的指标就是现金流，好的上市公司，有着充裕的现金流，保持着每年分红派息，这些优秀的上市公司，才是我们需要重点去关注的。好的公司在行业中有垄断地位，符合国家发展方向，成长性好。大消费、大金融、大科技。围绕这九个字去寻找投资标的。术面K线形态，加基本面公司主营业务收入增长的同时，净利润同比增长如何。一家好的公司：预收货款多、应收货款少、存货少，周转率高，市场份额不断扩大，负债率低，无解禁和融资质押盘压力，毛利率高，净利率也高，净资产收益率也高。选股如选妻，选一个贤慧知性、优雅大方的美丽女孩，相陪一生。好的公司，一定能穿越牛熊，绩优为王，指数波动心不慌。以上观点仅供学习与交流，不构成任何买卖建议，据此操作，风险自负。（来源：国琪论股的财富号 2019-03-27 15:50） [点击查看原文]<span id=""show_stock_str"" ></span>",绩优为王 指数波动心不慌
20,03月26日 ,广西股友,FAA（美国联邦航空管理局）已经初步批准了波音公司软件升级，允许波音更新波音737 MAX-8的培训内容与软件。新的软件升级重点改进飞机的失速传感器及其控制系统MCAS，确保它不会将自己的指令优先级放在飞行员之上，并且不会因为1个传感器（波音737 MAX-8有2个传感器）的错误数据就判断飞机失速，现在只有2个传感器同时汇报失速MCAS才会启动。另外更新的飞行员培训教程也重点增加了这方面的培训，培训将会介绍MCAS会在何时启动，而飞行员如何操作才能关闭它。=============================================飞机的硬件没有任何问题，安全策略改进后就是好飞机！,大概率波音737-MAX飞机即将全球复飞！两个涨停板在不远处
23,03月22日 ,天津股友,中国民航安全巡视组副巡视员周公红， 737杠800说成737减800，这数字够减吗？中国航空被这样一群人管理真是恐怖…　这样的知识水平 决定所有飞机 是否能够飞行？结果吓坏了 美国和全世界的航空公司 造成这几天 航空股票一路下跌,中国民航安全巡视组副巡视员周公红
24,03月22日 ,青海股友,"<span class=""showStock"" id=""stock_sh600221"">海航控股</span><span id=""quote_sh600221""></span>的战投方向我都想好了，由于其资本的特性，可以考虑由国内众多资金如马云的阿里巴巴等牵头，这对国内资本和实体经济都将是多赢：将其打造成国内唯一一家五星级国际航空公司，比肩国航，正式更名为“海航国际”，收购一些小航空公司，用国产大飞机C919飞向全世界，正式回归主业，实现航空公司的强国梦。<span id=""show_stock_str"" ></span>",海航控股的战投方向我都想好了，由于其资本的特性
26,03月21日 ,北京股友,2004年12月，曾被称为“打工皇帝”的陈久霖遭到新加坡警方拘捕，2006年3月新加坡初等法院判处陈久霖入狱四年零三个月。从此他便开始了1035天的牢狱之旅。 1997年，他临危受命，孤身前往新加坡，将中国航油净资产由17.6万美元增至1.5亿美元，缔造了一个商业奇迹，他由一个“农家小子”变成了人们口中的“打工皇帝”。2003年，陈久霖被《世界经济论坛》评选为“亚洲新领袖”（即“全球青年领袖”）。同年，陈久霖还荣膺“北京大学杰出校友”。许多人把陈久霖视为一个赌徒，他曾经说过：“赌可能是人的天性，我经常会赌一赌。”但他没想到的是，这次他赌输了。这个头顶万千光环的打工皇帝陈久霖是谁呢？陈久霖出生于湖北省黄冈市浠水县宝龙村一个普通的农民家庭，他从小勤于学习，有强烈的进取心，且时时充满自信。他很早就意识到，知识是改变命运的关键。1981年，他辞去村里信用社的铁饭碗准备高考，并于1982年考入北京大学东方学系，学习越南语。此后，陈久霖又先后取得中国政法大学国际私法硕士学位、新加坡国立大学企业管理硕士学位和清华大学民商法学博士学位。1982年秋，21岁的陈久霖成为村里有史以来头一个考上北京大学的学生。志气满满的陈久霖提着一个大红的箱子，站在北京火车站川流不息的人群中，而当时他为去学校是转乘“电车”还是“汽车”迷茫了好一阵子。也许就是那时，一定要出人头地的念头在他的心中慢慢滋长。北大毕业之后，陈久霖进入国家民航管理局局长办公室任翻译；后又出任中德合资的北京飞机维修工程有限公司的外国专家助理。1993年，他加盟中国航空油料集团公司，参加了建设香港新机场供油公司的谈判与组建工作。1997年亚洲金融危机期间，他接到了一个艰巨的任务：盘活中国航空油料集团公司旗下一家萎靡不振的子公司――中国航油（新加坡）股份有限公司。中国航油成立于1993年，成立之初便连年亏损，之后又休眠了两年。初到新加坡时，眼前的局面让陈久霖震惊了，这是一家全部家当只有16.8万美元、只有一名助理的船务经纪公司。公司没有业务，没有钱，甚至连办公地点都没有。陈久霖要如何救活这样一个奄奄一息的公司呢？陈久霖决定先从恢复船运经纪业务开始，但不久后，陈久霖发现航油运输的船务经纪做不下去了，于是立刻向集团申请要求涉足航油贸易，但当时正处于金融危机之中，集团不愿冒险，他便亲自返京请求集团同意。最后终于获得中国航空业进口燃油的独家经营权，通过国际招标、批量采购等手段，实现公司扭亏为盈。到后来还一度全面垄断了中国国内航油供应，而公司也从起初的两个人扩大到五十多人。在陈久霖的领导下，中国航油从一家纯粹的石油贸易企业转型为实业、工程与贸易相结合的多元化能源投资公司。2001年12月6日，中国航油成功在新加坡主板上市。到2004年9月，公司的净资产已经超过1.5亿美元，是陈久霖接手时的852倍，市值超过11亿美元，是原始投资的5022倍。中国航油也因出色的业绩而获得多项荣誉，包括被连续两次评为新加坡“最具透明度”的上市公司，公司发展过程被编为案例收入新加坡国立大学的MBA课程，同时也被《求是》杂志作为正面案例探讨中国国有企业的发展方向。2003年，陈久霖被《世界经济论坛》评选为“亚洲新领袖”（即“全球青年领袖”）。同年，陈久霖还荣膺“北京大学杰出校友”。陈久霖彻底地从一个农家小子完成了蜕变。之所以称其为“打工皇帝“，是因为他并未拥有过任何一家属于自己的公司，他也不过是受雇于人，但他在2002年时共得到490万新币报酬，因此获得“打工皇帝”之名。至此，他成为商场上众人皆赞的传奇人物，他似乎走上了神坛，接受着来自各方的膜拜。但是在波谲云诡的商场上，瞬息之间，风云万变。谁也预料不到他会不会在下一刻就从神坛跌落，会遭遇怎样的变故，这变故又会使他置身于怎样的境地。这似乎是商场上的一个魔咒，而陈久霖就是那个被命运选中的人，他即将迎来的究竟是什么？他又该如何面对呢？本期节目就到这里，我们下期为您分解，欢迎关注我们的账号《股事今非》，我们下期再见。（来源：股博视的财富号 2019-03-21 20:14） [点击查看原文],“农家小子”陈久霖逆袭成“打工皇帝”
28,03月20日 ,河北股友,"价高有AH价差出*快不论涨跌下来全仓转买正能量回购破净龙头601666<span class=""showStock"" id=""stock_sh601666"">平煤股份</span><span id=""quote_sh601666""></span>：仅剩价值凹地、低价绩优股*百亿稀缺概念资源做后盾，国有股东在每股净资产5．4元回购兜底。无AHB股价差，十年大底的平煤十分罕见，历史高点在六十元，无大小非减持压力，证金持股、国有股东回购概念，不可错过<span id=""show_stock_str"" ></span>",[爱心][爱心][爱心]价高有AH价差出*快不论涨跌下来全仓
29,03月20日 ,江苏股友,"沪深两市早盘双双低开，个股跌多涨少，板块持续性较差，乙醇、工业大r、煤化工、海工装备等板块领涨。氢能源概念股近期连续涨停的好几个，<span class=""showStock"" id=""stock_sz002307"">北新路桥</span><span id=""quote_sz002307""></span>最近连续一字板啊，西部大开发板块早盘高开。化工板块甲醇个股竞价涨停是多，尤其是<span class=""showStock"" id=""stock_sh600722"">金牛化工</span><span id=""quote_sh600722""></span>和<span class=""showStock"" id=""stock_sz002109"">兴化股份</span><span id=""quote_sz002109""></span>强势封板。<span id=""show_stock_str"" ></span>",好
30,03月19日 ,江苏股友,昨天我还在周末杂谈的帖子里说前高很快将被踩在脚下，没想到今天就来了个翻身仗，但是今天的这个翻身大涨是喜忧参半，喜是今天的大涨被我言重了，“忧”是因为今天的大涨阳线没有量能的配合，老司机都知道牛市里的持续上涨是需要量能配合的，而且是越往上涨量能越大，一旦出现连续的放量滞涨那么就要小心顶部回调了，从今天的缩量上涨看要小心做双头后回踩年线的准备，所以未来两天的走势至关重要，如果能够量价齐升持股无忧，如果缩量刷新高点且伴有长上影线那么回踩年线亦是必然结果，本周的走势应该会给出明确的结果，短线需控制好仓位以防来回坐电梯得不偿失，中长线资金可关注:比如喝酒吃药，航空基建这些大消费板块价值投资的建仓机会，关键时间节点最好不要远离盘面，毕竟牛短熊长！,昨天我还在周末杂谈的帖子里说前高很快将被踩在脚下
32,03月18日 ,河北股友,"价高盘大有AH价差出*所有资金不如现起全仓转买正能量回购龙头<span class=""showStock"" id=""stock_sh601666"">平煤股份</span><span id=""quote_sh601666""></span>：仅剩价值凹地、低价绩优股*百亿稀缺概念资源做后盾，国有股东在每股净资产5．4元回购兜底。无AHB股价差，十年大底的平煤十分罕见，历史高点在六十元，无大小非减持压力，证金持股、国有股东回购概念，不可错过<span id=""show_stock_str"" ></span>",[献花][爱心]价高盘大有AH价差出*所有资金不如现起全仓转
