,time,author,comment,header
0,12月18日 ,黑龙江股友,趋势走坏了才是真的，没有用，调仓换股正当时趋势走坏了才是真的，没有用，调仓换股正当时趋势走坏了才是真的，没有用，调仓换股正当时趋势走坏了才是真的，没有用，调仓换股正当时趋势走坏了才是真的，没有用，调仓换股正当时趋势走坏了才是真的，没有用，调仓换股正当时趋势走坏了才是真的，没有用，调仓换股正当时趋势走坏了才是真的，没有用，调仓换股正当时趋势走坏了才是真的，没有用，调仓换股正当时趋势走坏了才是真的，没有用，调仓换股正当时趋势走坏了才是真的，没有用，调仓换股正当时趋势走坏了才是真的，没有用，调仓换股正当时趋势走坏了才是真的，没有用，调仓换股正当时趋势走坏了才是真的，没有用，调仓换股正当时趋势走坏了才是真的，没有用，调仓换股正当时趋势走坏了才是真的，没有用，调仓换股正当时趋势走坏了才是真的，没有用，调仓换股正当时趋势走坏了才是真的，没有用，调仓换股正当时趋势走坏了才是真的，没有用，调仓换股正当时趋势走坏了才是真的，没有用，调仓换股正当时趋势走坏了才是真的，没有用，调仓换股正当时趋势走坏了才是真的，没有用，调仓换股正当时趋势走坏了才是真的，没有用，调仓换股正当时趋势走坏了才是真的，没有用，调仓换股正当时趋势走坏了才是真的，没有用，调仓换股正当时趋势走坏了才是真的，没有用，调仓换股正当时趋势走坏了才是真的，没有用，调仓换股正当时趋势走坏了才是真的，没有用，调仓换股正当时趋势走坏了才是真的，没有用，调仓换股正当时趋势走坏了才是真的，没有用，调仓换股正当时趋势走坏了才是真的，没有用，调仓换股正当时趋势走坏了才是真的，没有用，调仓换股正当时趋势走坏了才是真的，没有用，调仓换股正当时趋势走坏了才是真的，没有用，调仓换股正当时趋势走坏了才是真的，没有用，调仓换股正当时趋势走坏了才是真的，没有用，调仓换股正当时趋势走坏了才是真的，没有用，调仓换股正当时趋势走坏了才是真的，没有用，调仓换股正当时趋势走坏了才是真的，没有用，调仓换股正当时趋势走坏了才是真的，没有用，调仓换股正当时趋势走坏了才是真的，没有用，调仓换股正当时趋势走坏了才是真的，没有用，调仓换股正当时趋势走坏了才是真的，没有用，调仓换股正当时趋势走坏了才是真的，没有用，调仓换股正当时趋势走坏了才是真的，没有用，调仓换股正当时趋势走坏了才是真的，没有用，调仓换股正当时趋势走坏了才是真的，没有用，调仓换股正当时趋势走坏了才是真的，没有用，调仓换股正当时趋势走坏了才是真的，没有用，调仓换股正当时趋势走坏了才是真的，没有用，调仓换股正当时趋势走坏了才是真的，没有用，调仓换股正当时趋势走坏了才是真的，没有用，调仓换股正当时趋势走坏了才是真的，没有用，调仓换股正当时趋势走坏了才是真的，没有用，调仓换股正当时趋势走坏了才是真的，没有用，调仓换股正当时趋势走坏了才是真的，没有用，调仓换股正当时趋势走坏了才是真的，没有用，调仓换股正当时趋势走坏了才是真的，没有用，调仓换股正当时趋势走坏了才是真的，没有用，调仓换股正当时趋势走坏了才是真的，没有用，调仓换股正当时趋势走坏了才是真的，没有用，调仓换股正当时趋势走坏了才是真的，没有用，调仓换股正当时趋势走坏了才是真的，没有用，调仓换股正当时趋势走坏了才是真的，没有用，调仓换股正当时趋势走坏了才是真的，没有用，调仓换股正当时趋势走坏了才是真的，没有用，调仓换股正当时趋势走坏了才是真的，没有用，调仓换股正当时趋势走坏了才是真的，没有用，调仓换股正当时趋势走坏了才是真的，没有用，调仓换股正当时趋势走坏了才是真的，没有用，调仓换股正当时趋势走坏了才是真的，没有用，调仓换股正当时趋势走坏了才是真的，没有用，调仓换股正当时趋势走坏了才是真的，没有用，调仓换股正当时趋势走坏了才是真的，没有用，调仓换股正当时趋势走坏了才是真的，没有用，调仓换股正当时趋势走坏了才是真的，没有用，调仓换股正当时趋势走坏了才是真的，没有用，调仓换股正当时趋势走坏了才是真的，没有用，调仓换股正当时趋势走坏了才是真的，没有用，调仓换股正当时趋势走坏了才是真的，没有用，调仓换股正当时趋势走坏了才是真的，没有用，调仓换股正当时趋势走坏了才是真的，没有用，调仓换股正当时趋势走坏了才是真的，没有用，调仓换股正当时趋势走坏了才是真的，没有用，调仓换股正当时趋势走坏了才是真的，没有用，调仓换股正当时趋势走坏了才是真的，没有用，调仓换股正当时趋势走坏了才是真的，没有用，调仓换股正当时趋势走坏了才是真的，没有用，调仓换股正当时趋势走坏了才是真的，没有用，调仓换股正当时趋势走坏了才是真的，没有用，调仓换股正当时趋势走坏了才是真的，没有用，调仓换股正当时趋势走坏了才是真的，没有用，调仓换股正当时趋势走坏了才是真的，没有用，调仓换股正当时趋势走坏了才是真的，没有用，调仓换股正当时趋势走坏了才是真的，没有用，调仓换股正当时趋势走坏了才是真的，没有用，调仓换股正当时趋势走坏了才是真的，没有用，调仓换股正当时趋势走坏了才是真的，没有用，调仓换股正当时趋势走坏了才是真的，没有用，调仓换股正当时趋势走坏了才是真的，没有用，调仓换股正当时趋势走坏了才是真的，没有用，调仓换股正当时趋势走坏了才是真的，没有用，调仓换股正当时趋势走坏了才是真的，没有用，调仓换股正当时趋势走坏了才是真的，没有用，调仓换股正当时趋势走坏了才是真的，没有用，调仓换股正当时趋势走坏了才是真的，没有用，调仓换股正当时趋势走坏了才是真的，没有用，调仓换股正当时趋势走坏了才是真的，没有用，调仓换股正当时趋势走坏了才是真的，没有用，调仓换股正当时趋势走坏了才是真的，没有用，调仓换股正当时趋势走坏了才是真的，没有用，调仓换股正当时趋势走坏了才是真的，没有用，调仓换股正当时趋势走坏了才是真的，没有用，调仓换股正当时趋势走坏了才是真的，没有用，调仓换股正当时趋势走坏了才是真的，没有用，调仓换股正当时趋势走坏了才是真的，没有用，调仓换股正当时趋势走坏了才是真的，没有用，调仓换股正当时趋势走坏了才是真的，没有用，调仓换股正当时趋势走坏了才是真的，没有用，调仓换股正当时趋势走坏了才是真的，没有用，调仓换股正当时趋势走坏了才是真的，没有用，调仓换股正当时趋势走坏了才是真的，没有用，调仓换股正当时趋势走坏了才是真的，没有用，调仓换股正当时趋势走坏了才是真的，没有用，调仓换股正当时趋势走坏了才是真的，没有用，调仓换股正当时趋势走坏了才是真的，没有用，调仓换股正当时趋势走坏了才是真的，没有用，调仓换股正当时趋势走坏了才是真的，没有用，调仓换股正当时趋势走坏了才是真的，没有用，调仓换股正当时趋势走坏了才是真的，没有用，调仓换股正当时趋势走坏了才是真的，没有用，调仓换股正当时趋势走坏了才是真的，没有用，调仓换股正当时趋势走坏了才是真的，没有用，调仓换股正当时趋势走坏了才是真的，没有用，调仓换股正当时趋势走坏了才是真的，没有用，调仓换股正当时趋势走坏了才是真的，没有用，调仓换股正当时趋势走坏了才是真的，没有用，调仓换股正当时趋势走坏了才是真的，没有用，调仓换股正当时趋势走坏了才是真的，没有用，调仓换股正当时趋势走坏了才是真的，没有用，调仓换股正当时趋势走坏了才是真的，没有用，调仓换股正当时趋势走坏了才是真的，没有用，调仓换股正当时趋势走坏了才是真的，没有用，调仓换股正当时趋势走坏了才是真的，没有用，调仓换股正当时趋势走坏了才是真的，没有用，调仓换股正当时趋势走坏了才是真的，没有用，调仓换股正当时趋势走坏了才是真的，没有用，调仓换股正当时趋势走坏了才是真的，没有用，调仓换股正当时趋势走坏了才是真的，没有用，调仓换股正当时趋势走坏了才是真的，没有用，调仓换股正当时趋势走坏了才是真的，没有用，调仓换股正当时趋势走坏了才是真的，没有用，调仓换股正当时趋势走坏了才是真的，没有用，调仓换股正当时趋势走坏了才是真的，没有用，调仓换股正当时趋势走坏了才是真的，没有用，调仓换股正当时趋势走坏了才是真的，没有用，调仓换股正当时趋势走坏了才是真的，没有用，调仓换股正当时趋势走坏了才是真的，没有用，调仓换股正当时趋势走坏了才是真的，没有用，调仓换股正当时趋势走坏了才是真的，没有用，调仓换股正当时趋势走坏了才是真的，没有用，调仓换股正当时趋势走坏了才是真的，没有用，调仓换股正当时趋势走坏了才是真的，没有用，调仓换股正当时趋势走坏了才是真的，没有用，调仓换股正当时趋势走坏了才是真的，没有用，调仓换股正当时趋势走坏了才是真的，没有用，调仓换股正当时趋势走坏了才是真的，没有用，调仓换股正当时趋势走坏了才是真的，没有用，调仓换股正当时趋势走坏了才是真的，没有用，调仓换股正当时趋势走坏了才是真的，没有用，调仓换股正当时趋势走坏了才是真的，没有用，调仓换股正当时趋势走坏了才是真的，没有用，调仓换股正当时趋势走坏了才是真的，没有用，调仓换股正当时趋势走坏了才是真的，没有用，调仓换股正当时趋势走坏了才是真的，没有用，调仓换股正当时趋势走坏了才是真的，没有用，调仓换股正当时趋势走坏了才是真的，没有用，调仓换股正当时趋势走坏了才是真的，没有用，调仓换股正当时趋势走坏了才是真的，没有用，调仓换股正当时趋势走坏了才是真的，没有用，调仓换股正当时趋势走坏了才是真的，没有用，调仓换股正当时趋势走坏了才是真的，没有用，调仓换股正当时趋势走坏了才是真的，没有用，调仓换股正当时趋势走坏了才是真的，没有用，调仓换股正当时趋势走坏了才是真的，没有用，调仓换股正当时趋势走坏了才是真的，没有用，调仓换股正当时趋势走坏了才是真的，没有用，调仓换股正当时趋势走坏了才是真的，没有用，调仓换股正当时趋势走坏了才是真的，没有用，调仓换股正当时趋势走坏了才是真的，没有用，调仓换股正当时趋势走坏了才是真的，没有用，调仓换股正当时趋势走坏了才是真的，没有用，调仓换股正当时趋势走坏了才是真的，没有用，调仓换股正当时趋势走坏了才是真的，没有用，调仓换股正当时趋势走坏了才是真的，没有用，调仓换股正当时趋势走坏了才是真的，没有用，调仓换股正当时趋势走坏了才是真的，没有用，调仓换股正当时趋势走坏了才是真的，没有用，调仓换股正当时趋势走坏了才是真的，没有用，调仓换股正当时趋势走坏了才是真的，没有用，调仓换股正当时趋势走坏了才是真的，没有用，调仓换股正当时趋势走坏了才是真的，没有用，调仓换股正当时趋势走坏了才是真的，没有用，调仓换股正当时趋势走坏了才是真的，没有用，调仓换股正当时趋势走坏了才是真的，没有用，调仓换股正当时趋势走坏了才是真的，没有用，调仓换股正当时趋势走坏了才是真的，没有用，调仓换股正当时趋势走坏了才是真的，没有用，调仓换股正当时趋势走坏了才是真的，没有用，调仓换股正当时趋势走坏了才是真的，没有用，调仓换股正当时趋势走坏了才是真的，没有用，调仓换股正当时趋势走坏了才是真的，没有用，调仓换股正当时趋势走坏了才是真的，没有用，调仓换股正当时趋势走坏了才是真的，没有用，调仓换股正当时趋势走坏了才是真的，没有用，调仓换股正当时趋势走坏了才是真的，没有用，调仓换股正当时趋势走坏了才是真的，没有用，调仓换股正当时趋势走坏了才是真的，没有用，调仓换股正当时趋势走坏了才是真的，没有用，调仓换股正当时趋势走坏了才是真的，没有用，调仓换股正当时趋势走坏了才是真的，没有用，调仓换股正当时趋势走坏了才是真的，没有用，调仓换股正当时趋势走坏了才是真的，没有用，调仓换股正当时趋势走坏了才是真的，没有用，调仓换股正当时趋势走坏了才是真的，没有用，调仓换股正当时趋势走坏了才是真的，没有用，调仓换股正当时趋势走坏了才是真的，没有用，调仓换股正当时趋势走坏了才是真的，没有用，调仓换股正当时趋势走坏了才是真的，没有用，调仓换股正当时趋势走坏了才是真的，没有用，调仓换股正当时趋势走坏了才是真的，没有用，调仓换股正当时趋势走坏了才是真的，没有用，调仓换股正当时趋势走坏了才是真的，没有用，调仓换股正当时趋势走坏了才是真的，没有用，调仓换股正当时趋势走坏了才是真的，没有用，调仓换股正当时趋势走坏了才是真的，没有用，调仓换股正当时趋势走坏了才是真的，没有用，调仓换股正当时趋势走坏了才是真的，没有用，调仓换股正当时趋势走坏了才是真的，没有用，调仓换股正当时趋势走坏了才是真的，没有用，调仓换股正当时趋势走坏了才是真的，没有用，调仓换股正当时趋势走坏了才是真的，没有用，调仓换股正当时趋势走坏了才是真的，没有用，调仓换股正当时趋势走坏了才是真的，没有用，调仓换股正当时趋势走坏了才是真的，没有用，调仓换股正当时趋势走坏了才是真的，没有用，调仓换股正当时趋势走坏了才是真的，没有用，调仓换股正当时趋势走坏了才是真的，没有用，调仓换股正当时趋势走坏了才是真的，没有用，调仓换股正当时趋势走坏了才是真的，没有用，调仓换股正当时趋势走坏了才是真的，没有用，调仓换股正当时趋势走坏了才是真的，没有用，调仓换股正当时趋势走坏了才是真的，没有用，调仓换股正当时趋势走坏了才是真的，没有用，调仓换股正当时趋势走坏了才是真的，没有用，调仓换股正当时趋势走坏了才是真的，没有用，调仓换股正当时趋势走坏了才是真的，没有用，调仓换股正当时趋势走坏了才是真的，没有用，调仓换股正当时趋势走坏了才是真的，没有用，调仓换股正当时趋势走坏了才是真的，没有用，调仓换股正当时趋势走坏了才是真的，没有用，调仓换股正当时趋势走坏了才是真的，没有用，调仓换股正当时趋势走坏了才是真的，没有用，调仓换股正当时趋势走坏了才是真的，没有用，调仓换股正当时趋势走坏了才是真的，没有用，调仓换股正当时趋势走坏了才是真的，没有用，调仓换股正当时趋势走坏了才是真的，没有用，调仓换股正当时趋势走坏了才是真的，没有用，调仓换股正当时趋势走坏了才是真的，没有用，调仓换股正当时趋势走坏了才是真的，没有用，调仓换股正当时趋势走坏了才是真的，没有用，调仓换股正当时趋势走坏了才是真的，没有用，调仓换股正当时趋势走坏了才是真的，没有用，调仓换股正当时趋势走坏了才是真的，没有用，调仓换股正当时趋势走坏了才是真的，没有用，调仓换股正当时趋势走坏了才是真的，没有用，调仓换股正当时趋势走坏了才是真的，没有用，调仓换股正当时趋势走坏了才是真的，没有用，调仓换股正当时趋势走坏了才是真的，没有用，调仓换股正当时趋势走坏了才是真的，没有用，调仓换股正当时趋势走坏了才是真的，没有用，调仓换股正当时趋势走坏了才是真的，没有用，调仓换股正当时趋势走坏了才是真的，没有用，调仓换股正当时趋势走坏了才是真的，没有用，调仓换股正当时趋势走坏了才是真的，没有用，调仓换股正当时趋势走坏了才是真的，没有用，调仓换股正当时趋势走坏了才是真的，没有用，调仓换股正当时趋势走坏了才是真的，没有用，调仓换股正当时趋势走坏了才是真的，没有用，调仓换股正当时趋势走坏了才是真的，没有用，调仓换股正当时趋势走坏了才是真的，没有用，调仓换股正当时趋势走坏了才是真的，没有用，调仓换股正当时趋势走坏了才是真的，没有用，调仓换股正当时趋势走坏了才是真的，没有用，调仓换股正当时趋势走坏了才是真的，没有用，调仓换股正当时趋势走坏了才是真的，没有用，调仓换股正当时趋势走坏了才是真的，没有用，调仓换股正当时趋势走坏了才是真的，没有用，调仓换股正当时趋势走坏了才是真的，没有用，调仓换股正当时趋势走坏了才是真的，没有用，调仓换股正当时趋势走坏了才是真的，没有用，调仓换股正当时趋势走坏了才是真的，没有用，调仓换股正当时趋势走坏了才是真的，没有用，调仓换股正当时趋势走坏了才是真的，没有用，调仓换股正当时趋势走坏了才是真的，没有用，调仓换股正当时趋势走坏了才是真的，没有用，调仓换股正当时趋势走坏了才是真的，没有用，调仓换股正当时趋势走坏了才是真的，没有用，调仓换股正当时趋势走坏了才是真的，没有用，调仓换股正当时趋势走坏了才是真的，没有用，调仓换股正当时趋势走坏了才是真的，没有用，调仓换股正当时趋势走坏了才是真的，没有用，调仓换股正当时趋势走坏了才是真的，没有用，调仓换股正当时趋势走坏了才是真的，没有用，调仓换股正当时趋势走坏了才是真的，没有用，调仓换股正当时趋势走坏了才是真的，没有用，调仓换股正当时趋势走坏了才是真的，没有用，调仓换股正当时趋势走坏了才是真的，没有用，调仓换股正当时趋势走坏了才是真的，没有用，调仓换股正当时趋势走坏了才是真的，没有用，调仓换股正当时趋势走坏了才是真的，没有用，调仓换股正当时趋势走坏了才是真的，没有用，调仓换股正当时趋势走坏了才是真的，没有用，调仓换股正当时趋势走坏了才是真的，没有用，调仓换股正当时趋势走坏了才是真的，没有用，调仓换股正当时趋势走坏了才是真的，没有用，调仓换股正当时趋势走坏了才是真的，没有用，调仓换股正当时趋势走坏了才是真的，没有用，调仓换股正当时趋势走坏了才是真的，没有用，调仓换股正当时趋势走坏了才是真的，没有用，调仓换股正当时趋势走坏了才是真的，没有用，调仓换股正当时趋势走坏了才是真的，没有用，调仓换股正当时趋势走坏了才是真的，没有用，调仓换股正当时趋势走坏了才是真的，没有用，调仓换股正当时趋势走坏了才是真的，没有用，调仓换股正当时趋势走坏了才是真的，没有用，调仓换股正当时趋势走坏了才是真的，没有用，调仓换股正当时趋势走坏了才是真的，没有用，调仓换股正当时趋势走坏了才是真的，没有用，调仓换股正当时趋势走坏了才是真的，没有用，调仓换股正当时趋势走坏了才是真的，没有用，调仓换股正当时趋势走坏了才是真的，没有用，调仓换股正当时趋势走坏了才是真的，没有用，调仓换股正当时趋势走坏了才是真的，没有用，调仓换股正当时趋势走坏了才是真的，没有用，调仓换股正当时趋势走坏了才是真的，没有用，调仓换股正当时趋势走坏了才是真的，没有用，调仓换股正当时趋势走坏了才是真的，没有用，调仓换股正当时趋势走坏了才是真的，没有用，调仓换股正当时趋势走坏了才是真的，没有用，调仓换股正当时趋势走坏了才是真的，没有用，调仓换股正当时趋势走坏了才是真的，没有用，调仓换股正当时趋势走坏了才是真的，没有用，调仓换股正当时趋势走坏了才是真的，没有用，调仓换股正当时趋势走坏了才是真的，没有用，调仓换股正当时趋势走坏了才是真的，没有用，调仓换股正当时趋势走坏了才是真的，没有用，调仓换股正当时趋势走坏了才是真的，没有用，调仓换股正当时趋势走坏了才是真的，没有用，调仓换股正当时趋势走坏了才是真的，没有用，调仓换股正当时趋势走坏了才是真的，没有用，调仓换股正当时趋势走坏了才是真的，没有用，调仓换股正当时趋势走坏了才是真的，没有用，调仓换股正当时趋势走坏了才是真的，没有用，调仓换股正当时,趋势走坏了才是真的，没有用
1,12月18日 ,<a href='/u/1574786990' title='覆雨'>覆雨</a>,真够垃圾的,真够垃圾的
2,12月18日 ,吉林股友,12月17日中国国航沪股通持仓数据     收盘价： 8.12 涨跌幅： -1.46%   持股量： 4562.01万股 持股变化： -21.17万股      数据显示，截至12月17日中国国航于沪股通持股量为4562.01万股，占其A股股本比例为0.48%，比上一交易日减少21.17万股。据数据统计，该股近一个月内累计涨幅为-1.22%，沪股通累计加仓485.85万，沪股通持仓累计变化比例为11.92%，近三个月内累计涨幅为14.04%，沪股通累计减仓506.74万，沪股通持仓累计变化比例为-10.00%。  数据来源:,中国国航12月17日获沪股通减仓21.17万
4,12月17日 ,内蒙古股友,转发一位普通小散的炒股心得：我一直不明白：为什么我一个小小散户就可以左右整个股市?每当我一买入它就下跌，一卖出它就上涨，空仓的时候大盘疯涨，满仓的时候大盘狂泻，为什么手握万亿资金的庄家们就死死盯着我这几千块钱不放?这是为毛啊!,转发一位普通小散的炒股心得：我一直不明白：为什么我一个
5,12月17日 ,贵州股友,中国国航公告公布2018年11月主要运营数据，运运力投入(按可用座位公里计)同比上升7.3%，旅客周转量同比上升5.0%；货邮周转量(按收入货运吨公里计)同比继续上升，环比基本持平；货运运力投入(以可用货运吨公里计)同比上升3.1%，货邮周转量同比上升2.1%,主要运营数据公布
6,12月17日 ,重庆股友,运营数据：2018年11月份，公司及所属子公司合计运营680架飞机，载客数约901.6万人次，同比增长4%。货邮运约16.83吨，同比增长-0.3%。客座率79.6%，同比增长-1.8%。今年累计载客约10.07亿人次，同比增长8.2%。载货物及邮件约1738万吨，同比增长3.6%。客座率80.8%，同比增长-0.4%。来源：每日一股TV,中国国航601111：运营数据
8,12月15日 ,天津股友,筛选后估计不到500支股票可买：1、房地产股绝不能买：未来3-5年，房地产死路一条。2、银行股绝不能买：一堆未披露的坏账。3、股权质押率高的股票绝不能买：迟早爆仓。4、券商股绝不能买：上有4.66万亿股权质押盘坏账，下有佣金大幅下降。不死也得脱身皮！5、垃圾股绝不能买：迟早成仙股。6、证金重仓股不能买：“看穿式监控”操作完全借用了辽至清朝一直沿用的“凌迟处死”思维方法。,筛选后估计不到500支股票可买
