,time,author,comment,header
36,08月07日 ,四川股友,"1，<span class=""showStock"" id=""stock_sh601888"">中国国旅</span><span id=""quote_sh601888""></span>上涨至趋势级别的上升通道上轨，受强压力回落，当前呈82.35-90.76的宽幅横盘区间；2，这样的区间性质当前并不好认定，它既可以作为横盘持续，也可以向下跌破形成三重顶；3，昨日股价大幅低开后大幅拉升，可见下边界支撑依然强劲，短时间内保持区间内操作。<span id=""show_stock_str"" ></span>",技术分析 | 中国国旅 601888
38,08月01日 ,吉林股友,明日走势预测，5点以上，不解释，资金怎么走的明天怎么回来！具体原因，补充移远的资金明天会回来 外部行情下午持续萎靡，怕尾盘恐慌盘抛售，不如先下手为强 ，等第二天市场投资氛围较好时入手。为了明天涨停股价不超过100块。。哈哈,明日走势预测，5点以上，不解释
39,08月01日 ,陕西股友,"中金公司发布<span class=""showStock"" id=""stock_sh601888"">中国国旅</span><span id=""quote_sh601888""></span>（601888）的研报指出，公司发布1H19业绩快报，预计实现收入243.44亿元，同比增长15.5%；归母净利润32.79亿元，同比增长70.9%。业绩符合预期。研报指出，业绩拆分显示内生增长强劲；展望下半年，在消费回流趋势和离岛免税限额提升等政策的影响下，国旅在离岛免税和出入境免税板块均有望延续强劲增长。同时，占据核心点位，受益免税行业长期成长。　　研报维持2019/20年归母净利润预测48/52亿元，剔除出售国旅总社带来一次性收益的因素，2020年业绩增速有望达到28%。基于公司体现出更强的业绩增长确定性，我们上调目标价8%至114元人民币(对应43倍2020年P/E和26%的上涨空间)，维持跑赢行业评级。当前股价对应2019/20年37/34倍市盈率。<span id=""show_stock_str"" ></span>",中国国旅目标价114元
40,07月31日 ,安徽股友,国务院常务会议部署旅游消费　　会议确定了促进文化和旅游消费的措施：一是推动消费惠民。鼓励各地实施景区门票减免、淡季免费开放、演出门票打折等政策。以“互联网 ”提高文化旅游消费便利度。二是丰富产品供给。鼓励举办文化旅游消费季等活动，支持邮轮游艇旅游等新业态发展。发展文化和旅游场所夜间餐饮、购物、文化演出等。三是完善市场监管，确保文化和旅游场所、设施运行安全。维护市场秩序，依法打击违法违规行为，对列入黑名单的市场主体和从业人员实施联合惩戒，保护消费者权益。,国务院常务会议部署旅游消费会议确定了促进文化和旅游消费
41,07月31日 ,吉林股友,"理性看待中报，首先，综合近几个月的走势，主力明显想走长牛之路，所以每当涨势过猛的时候都会适当地调整，因此在坎坷中不断向上，这是国旅一直以来的走势。第二，主力机构和北上资金从未放弃国旅，一直在不断加仓你。第三，大盘股，不会暴跌，不会爆涨，总是随着业绩，效能不断上扬。第四，中报出来有两种路可走，一种类似<span class=""showStock"" id=""stock_sz002415"">海康威视</span><span id=""quote_sz002415""></span>，三天基本10个点，一种<span class=""showStock"" id=""stock_sh601628"">中国人寿</span><span id=""quote_sh601628""></span>高开低走。但是我们需要了解的是，高开低走首先是套牢盘比较重。另外，毕竟是大盘股，主要看外部消息。综合评价，国旅底盘较稳，主力较稳，业绩较稳，这一波基本可以看到95元以上。<span id=""show_stock_str"" ></span>",理性看待中报，首先，综合近几个月的走势
42,07月31日 ,<a href='/u/7202585492' title='用户7202585492'>用户7202585492</a>,大半年没看，一看吓一跳，清了清了,大半年没看，一看吓一跳
43,07月31日 ,北京股友,很多人带节奏一句“你该好好学习财会知识”来混淆视听。那些财会高手都进来。我就用最简单的加减来说明欢迎会计高手来驳。18年中报净利润19.19亿，19年中报32.79亿其中一季度转让旅游公司收益13.6亿。32.79-13.6=19.19亿。19年营业净利润19.19和18年持平。18年增长的主要原因是中日免合并报表盈利增长的。总结：19年剔除转让收益和18年持平，国旅今年在免税店上是没有增长的所有公司开始转入重资产经营。换句华国旅今后就是个零售公司慢慢脱离旅游行业，从多种经营走向单一零售业务。,很多人带节奏一句“你该好好学习财会知识”来混淆视听
44,07月31日 ,贵州股友,你管他是怎么来的，总之，增长了，就跟你工作之余干副业，家庭收入增加了，工资降低了，但副业挣到很多，你能说你家里条件更差了吗，这就是本事，别管黑猫白猫，抓住老鼠就是好猫，有些人神经病，降低了不好，增长了也不好，那你炒什么股嘛！,你管他是怎么来的，总之，增长了，就跟你工作之余干副业
45,07月31日 ,安徽股友,"转万得资讯最全中期报表:扣非净利润25亿，同比增长30%<span class=""showStock"" id=""stock_sh601888"">中国国旅</span><span id=""quote_sh601888""></span>(601888.SH)披露2019年半年度业绩快报，报告期内公司实现营业总收入243.44亿元，同比增长15.46%；营业利润49.52亿元，同比增长62.11%；归属于上市公司股东的净利润32.79亿元，同比增长70.87%；归属于上市公司股东的扣除非经常性损益的净利润25.00亿元，同比增长30.86%；基本每股收益1.6795元。报告期内，公司营业利润、归属于上市公司股东的净利润分别较上年同期增长62.11%、70.87%，主要原因是报告期内，公司转让全资子公司中国国际旅行社总社有限公司股权产生大额非经常性收益，且通过整合采购渠道，巩固和优化现有离岛免税业务和机场免税业务，分别带来了营业利润增量18.97亿元、归属于上市公司股东净利润增量13.60亿元。<span id=""show_stock_str"" ></span>",转万得资讯最全中期报表:扣非净利润25亿
46,07月31日 ,北京股友,"公司代码：600305 公司简称：<span class=""showStock"" id=""stock_sh600305"">恒顺醋业</span><span id=""quote_sh600305""></span>江苏<span class=""showStock"" id=""stock_sh600305"">恒顺醋业</span><span id=""quote_sh600305""></span>股份有限公司2018年年度报告二一九年四月......销售模式公司采取以传统渠道 现代渠道“双驱发动”的销售模式做好产品销售。传统渠道以KA、流通、餐饮为主。实施“款到发货”、“保证金”的业务形式，有效保障了公司的现金流安全，保证了公司的正常生产经营性资金需求；......<span id=""show_stock_str"" ></span>",实施“款到发货”、“保证金”的业务形式
47,07月30日 ,山东股友,暑期旅游旺季国旅今天的回调是买入机会吗？技术上缩量回调，只要不有效跌破20日短期生命线则可上车，公司业绩最近几年一直呈上升状态，基本面良好。免责声明:个人看盘感悟，不构成投资建议与推荐，投资有风险，入市需谨慎！,暑期旅游旺季国旅今天的回调是买入机会吗？技术上缩量回调
48,07月28日 ,海南股友,镇江香醋传统酿造遗承入选第三批国家工业遗产认定江苏省拟申报名单　　　发布时间：2019-06-25 14:34　来源：镇江市人民政府国有资产监督管理委员会　 　　近日从省工信厅获悉，第三批国家工业遗产认定，江苏省一共有5家工业遗产拟申报。其中镇江香醋传统酿造遗承入选。 　　镇江香醋传统酿造遗承，遗产核心物项包括传统制醋工具、老厂房大门头、老办公用具等老物件，现已建成国家4A级景区中国醋文化博物馆。 　　镇江恒顺香醋酿制技艺是民族工业的精华。按照恒顺香醋酿制技艺酿制出的香醋，风味独特，营养丰富，色味俱佳，有益于使用者的身体健康。恒顺香醋传统酿制技艺早已融入镇江的地方文化，成为镇江不可缺少的传统特色文化和对外交往的城市名片。 　　此次入选我省拟申报名单的包括镇江香醋传统酿造遗承、洋河老窖池群及酿酒作坊、常州恒源畅厂旧址、常州戚机厂遗址、无锡永泰丝厂旧址。　,入选第三批国家工业遗产
49,07月26日 ,广西股友,"<span class=""showStock"" id=""stock_sh601888"">中国国旅</span><span id=""quote_sh601888""></span>单日资金流入量超过1亿的确实很少见，这次估计是自贸板块给带起来的。我有种预感，国旅这次会站稳90上方，短期在90到100这个区间运行。之前在70到80之间荡了一段时间，在80到90之间荡了一段时间，算算时间差不多了，要在上一个台级运行了。这也符合国旅庄家的思路。<span id=""show_stock_str"" ></span>",中国国旅单日资金流入量超过1亿的确实很少见
50,07月26日 ,北京股友,国旅在7月30日前不发半年预告业绩增长可能下滑根据《上海证券交易所股票上市规则》，对于进行年报时候，上市公司预计全年出现亏损、扭转为盈或者净利润比上一年下降或者上涨50%的情况，应该在本年度结束后的1月31日进行业绩预告。没有上面的三种情况，可以不进行年报的预告披露。半年报和季报没有强制规定,国旅在7月30日前不发半年预告业绩增长可能下滑根据《上海
52,07月25日 ,吉林股友,国旅明日分析，将开启震荡模式，今天不适合震荡，只能说提前跑的兄弟们亏了，我下午已经提示了今天不适合做T，但是我在88.10的时候出了半仓，因为昨天整仓位进了。明天大盘应该顺势而为，国旅应该微幅低开，然后震荡上升，建议大家明天是t，我今天出半仓也是考虑这个，不然明天没有子弹！！需要提醒的是，由于周末消息不明确，不排除，大概率明天下午会低走或者砸盘洗筹！建议大家明天高抛低吸，尾盘留基本仓位。,国旅明日分析，将开启震荡模式，今天不适合震荡
