,time,author,comment,header
2,06月18日 ,湖北股友,"作者 | 董宏海数据支持 | 勾股大数据上个月我跟大家聊过<span class=""showStock"" id=""stock_sh600009"">上海机场</span><span id=""quote_sh600009""></span>，<span class=""showStock"" id=""stock_sh600009"">上海机场</span><span id=""quote_sh600009""></span>凭借自身的地理优势以及免税业务的发展，成为一个名副其实的现金奶牛，我建议大家有空再回顾一下――《持股比例超30%，为何外资如此青睐<span class=""showStock"" id=""stock_sh600009"">上海机场</span><span id=""quote_sh600009""></span>？》，今天笔者再跟大家聊聊国内免税龙头――<span class=""showStock"" id=""stock_sh601888"">中国国旅</span><span id=""quote_sh601888""></span>（601888.SH），目前公司已经占据国内免税市场80%的份额，未来公司并购海免的话，预计市场份额将会达到85%，不过公司的经营并没有大家想的那么轻松，下面笔者借着分析免税行业与公司经营状况说说公司的喜与忧。1中国免税市场潜力巨大通俗的讲，免税行业就是指向出入境旅客销售免税商品的旅游零售行业，此处所免的是关税、消费税、增值税等，免税商品主要有化妆品、香水、箱包、首饰、手表、服装服饰、食品、玩具、烟、酒等，通常为进口商品；免税店具体可细分为机场免税店、机上免税店、边境免税店、外轮供应店、客运站免税店、火车站免税店、外交人员免税店、市内免税店、邮轮免税店等。由于免税商品免除了关税、消费税和增值税，基本上比国内市场价格低20%―50%，所以免税商品有很大的价格优势。中国免税市场规模正处于加速增长期。2015年中国免税市场规模为237亿元，2018年国内免税市场规模增长至395亿元，复合增长率为19%，其中2018年国内免税销售额同比增长27%，较此前呈加速增长趋势，主要是因为消费回流以及机场免税较快发展。中国免税市场潜力巨大。2017年全球免税销售额为686亿美元，约4500亿人民币，2018年约为5000亿元。而2018年大陆居民出境购物消费超过1200亿美元，约8200亿人民币，根据中国出境旅行者调查，我国大陆消费者海外消费约37%发生在免税店，以此测算大陆居民在海外免税店共消费约3000亿元，占全球的60%。随着政策支持以及国内免税市场不断成熟，假设未来50%海外消费回流，就会有1500亿左右的消费回流，相当于当前免税市场规模的3.5倍左右，免税市场开发潜力巨大。2机场免税购物有待改善市内免税市场开发空间广阔机场免税购物有待改善。国内目前有73.2%的免税业务来自于机场、口岸与机上，虽然目前机场免税规模占比较大，但是仍然有很大的改善空间，主要因为目前各大机场免税店的面积相对较小，品牌店数量较少，目前仅萧山机场与<span class=""showStock"" id=""stock_sh600004"">白云机场</span><span id=""quote_sh600004""></span>可以进行线上免税预定，线下机场提货，未来随着机场免税店面积扩大，品牌店数量增加，同时各大机场支持线上预定，那机场免税收入将会大大提升。市内免税市场开发空间广阔。与韩国免税购物渠道相比，中国市内免税市场开发空间较大，主要是因为机场免税店购物时间有限以及购物空间有限，市内店对购物时间没有限制，且空间较大，有利于商品的展示和销售。从韩国免税市场消费结构来看，有50%的免税消费是发生在市内免税店，其次才是机场和离岛，而目前我国免税销售收入中，机场 口岸 机上免税贡献约73.2%，离岛免税约占26.2%，市内免税店占比不到1%，2019年开始，国内正在加紧市内免税店的铺设（2019年海口、青岛、厦门、上海、北京、大连等市内免税店将纷纷开业），未来市内免税店的开发空间非常大。3全牌照优势铸就霸主地位国内目前免税运营商主要包括中免（<span class=""showStock"" id=""stock_sh601888"">中国国旅</span><span id=""quote_sh601888""></span>旗下子公司）、深免、珠免、日上免税行、海免、中出服以及中侨免税店等，其中中免免税牌照最全，范围最广。随着中免集团2017-2018年先后收购日上中国、日上上海，并中标国内多处枢纽机场免税业务，公司在国内免税市场占有率不断提升。2018年中免已经占据国内免税市场约80%的份额，同时公司有望控股海免，到时候中免在国内免税市场中的占有率将会提升至85%左右，成为中国免税市场的霸主。公司核心竞争力：免税全牌照优势。公司拥有经国务院批准唯一可在全国范围开展出入境免税业务牌照 离岛免税业务牌照 唯一的京沪大连厦门青岛的离境市内免税店牌照（针对外国人） 外交人员免税店牌照，免税牌照稀缺优势突出。4全牌照优势铸就霸主地位<span class=""showStock"" id=""stock_sh601888"">中国国旅</span><span id=""quote_sh601888""></span>目前已和海内外1000多家奢侈品品牌建立长期合作关系，在全国已拥有240多家免税零售网点，已发展成为世界上免税店类型最全、单一国家零售网点最多的免税运营商，并建立起全国唯一的免税物流配送体系。随着国内各大机场免税店营业面积的扩大以及市内免税店的集中开业，加之公司有望并购海免，到时候公司的整体销售规模将会大幅提升。虽然目前公司机场免税业务毛利较低（主要是因为机场提点较高，如<span class=""showStock"" id=""stock_sh600009"">上海机场</span><span id=""quote_sh600009""></span>综合提点为42.5%），不过随着公司销售规模提升，有利于提高采购团队的议价能力，到时候公司毛利率每提升1pct，对公司的利润的贡献将非常可观（具体预测可以参考下表）。毕竟2018年中免零售毛利率才53.09%，而全球销量第一的Dufry毛利率高达59%左右，中免的毛利率还有进一步提升的空间。5财报分析2011年至今，公司营业收入持续增长，2017年与2018年更是加速增长，主要是因为公司2017年与2018年分别并购了日上中国51%的股权与日上上海51%的股权，未来并不一定能继续保持这样的业绩增速。同时大家需要注意的是，公司2019年2月剥离了旅游业务，将专注于免税业务，由于2018年旅游业务收入占比达26.36%，所以公司2019年的营业收入增速肯定会受到影响，不过这并不影响公司的正常经营以及2019年的净利润增速，因为公司2018年旅游业务收入虽然高达122.9亿，但对利润的贡献却是负值。净利润持续增长，现金流整体较好。公司净利润持续增长，最近3年净利润增速都高于20%，2019年第一季度净利润增速为98.8%，这主要是因为公司2019年2月出售了旅游业务，给公司带来7.16亿的投资收益，公司实际扣非净利润增速为37%。经营现金流净额整体上略高于净利润，非常健康，说明公司获取现金的能力较强。机场高扣点致使销售费用暴增。公司在2016年之前，三费占比基本保持在12%-13%，比较稳定，在2017年-2019年，公司财务费用大幅增长，致使三费占比提升至29.7%，这主要是因为公司新收购的机场免税业务扣点较高，扣点费用被计入到销售费用，所以才使得公司的销售费用大幅增长，三费占比大幅提升。要注意的是随着公司剥离了旅游业务，2019年公司的三费占比将会进一步提升，但是并不影响到公司的盈利。公司的管理费用基本较为稳定，财务费用一直是负值，说明公司资金较为充裕。关于毛利率我们可以先看公司2016年之前的数据，随着免税业务收入高速增长，公司毛利率稳步提升，销售净利率也稳步提升，2017年―2018年并购日上中国与日上上海后，免税业务大幅增长，收入占比提升，使得公司毛利率快速上升至49.45%，随着旅游业务的剥离，毛利率将会进一步提升，这一部分的提升将会抵消三费占比增加的部分。随着公司的并购以及业务剥离，公司的毛利率与三费占比波动较大，不过大家可以看一下公司的总资产收益率，基本上保持在10%-12%，盈利能力较强且较为稳定。资产周转速度较快，回款周期仅7天。随着公司免税业务占比不断提高，公司存货周转率一路下降，但目前仍然保持在6倍以上，存货周转率较为正常；应收账款周转率一路提升，目前已经提升至48倍，公司应收账款回款周期大约为7天，说明公司回款速度非常快；总资产周转率一直保持在1.3倍以上，2018年已经提升至1.75倍，总资产周转速度较快。公司偿债能力较好，有息负债较少。公司没有长期借款，短期借款也在1-3亿左右，有息负债占比一直在1%以下，说明公司资金较为充裕，不缺钱；公司的资产负债率基本保持在30%以下，负债率较低且较为稳定；公司速冻比率基本保持在2倍以上，偿债能力比较好。小结：公司目前收入快速增长，获取现金能力较强，资产周转较快，有息负债占比极低，偿债能力较强，总资产收益率一直保持在10%以上，可以说公司财务数据整体上非常健康。6对公司经营的两点担忧首先，机场免税业务扣点太高，且保底提成给公司带来很大的经营压力。公司与各大机场合作时，无法占到主动权，所以机场方面在免税业务上扣点比较高，就拿首都机场与<span class=""showStock"" id=""stock_sh600009"">上海机场</span><span id=""quote_sh600009""></span>来说，公司与首都机场合作，T2航站楼与T3航站楼的销售扣点分别为47.50%与43.50%，首年保底提成分别为8.3亿元与22亿元；公司与<span class=""showStock"" id=""stock_sh600009"">上海机场</span><span id=""quote_sh600009""></span>合作，综合销售扣点为42.5%，7年的保底提成为410亿元，公司目前免税业务的毛利率大约为53%左右，一下子就被机场扣去销售额的42.5%-47.5%，扣除管理费等其他费用，公司剩下的利润会非常低，如果销售不达预期，公司可能会有亏损的风险。特别是目前国内经济并不是太景气，一旦消费降价，公司的业绩很可能就不及预期。其次，如果政府增加更多的免税运营商或者海南岛全岛免税，那公司的全牌照优势将会被稀释。公司目前拥有全牌照优势，可以经营国内各个渠道的免税业务，市场占有率高达80%-85%，但如果政府增加更多的免税运营商，那将会使得公司全牌照优势被稀释，市场竞争压力也将变大。2019年3月，海南省财政厅厅长王惠平提到海南将全岛免税，且不限额购买商品，如果真的实现的话，这对公司的冲击还是非常大的，因为公司目前主要利润来源是海南省的免税业务，不过笔者认为，短时间之内，海南很难实现全岛免税，因为首先是操作难度较大，监管不方便，其次对国内有税市场冲击较大，所以可能性较低，但是不能完全排除。7总结公司作为国内免税行业的霸主，市场占有率80%―85%，且拥有全牌照优势，这是国内其他免税运营商不可比拟的。公司目前的经营策略是做大国内免税市场，通过做大销售规模，来提高采购团队的议价能力，从而进一步提升公司的销售毛利率，这个策略也是非常可行的，因为想要降低机场方面的扣点比较难，而通过扩大采购规模来降低进货成本却比较容易，毕竟公司2018年收购日上上海后，免税业务毛利率提升了7个百分点。所以在国家政策的大力支持下，以及行业巨大的开发潜力，公司未来的成长性应该比较好，大家可以长期关注。另一方面，虽然公司成长性较好，但是我们也要关注公司未来新中标机场免税业务的扣点情况，如果扣点进一步提升，或者保底租金要求较高，那将会给公司经营带来很大的压力；同时我们也要注意行业的政策变化，主要是免税额度的提升以及免税运营牌照的发放，不过就目前市场客单价而言，免税额度暂不提升影响不大，而如果国内免税运营牌照放开，或者海南实现全岛免税，将对公司的全牌照优势打击较大。（来源：IPO那点事的财富号 2019-06-18 10:58） [点击查看原文]<span id=""show_stock_str"" ></span>",中国国旅（601888.SH）：免税龙头的喜与忧
3,06月17日 ,山西股友,"<span class=""showStock"" id=""stock_sh601888"">中国国旅</span><span id=""quote_sh601888""></span>近几天风格改变了，每天冲高回落，这是好事。明显的上攻信号。看今给不给力了，如能站稳80上方，后期前途无量。另外近期国旅股价已经超越平安了，这就是一个强势的表现，6，7，8月份，国旅将是上证50中的焦点，前期以<span class=""showStock"" id=""stock_sz000858"">五粮液</span><span id=""quote_sz000858""></span>为首的白酒食品板块将退居幕后，进入低调阶段。国旅7，8月份将维持在80到100之间，如果特别强势，可突破100，成为第一个吧突破100的文化旅游股。<span class=""showStock"" id=""stock_sh601888"">中国国旅</span><span id=""quote_sh601888""></span>中国股市的骄傲，NO1<span id=""show_stock_str"" ></span>",中国国旅近几天风格改变了，每天冲高回落，这是好事
4,06月17日 ,安徽股友,"<span class=""showStock"" id=""stock_sh601888"">中国国旅</span><span id=""quote_sh601888""></span>（601888）：引导国内免税消费，免税龙头将充分受益。<span class=""showStock"" id=""stock_sh601888"">中国国旅</span><span id=""quote_sh601888""></span>由国旅总社和中免公司重组而成，2009年上市，2011年起伴随离岛免税政策东风，免税逐渐成为公司业绩增长核心引擎，强势布局国内外机场、市内免税业务，免税版图持续放大。2017年公司控股日上加码京沪机场免税，2018年末公司拟注入海免51%股权，2019年2月完成国旅总社剥离，免税龙头地位更加稳固。国家“十三五规划”明确提出引导海外消费回流，免税行业将承担吸引国人消费回流之重任。近年来海南离岛免税政策多次放宽、市内免税政策预期渐行渐近，未来政策红利有望持续释放。作为市占率超85%的免税巨头，公司将充分受益。（来源：投资小哼的财富号 2019-06-17 10:49） [点击查看原文]<span id=""show_stock_str"" ></span>",中国国旅（601888）：再创新高
5,06月14日 ,广东股友,"市场综述：沪指报2881点，跌0.99%，深成指报8810点，跌1.58%；创指报1453点，跌1.75%。>>>即将开门迎客的科创板势在必行局面下，反复窄幅震荡或是主基调，前期主线稀土、送转填权等受获利盘出逃亏钱效应加持，短期或得重新休整；耐心等待风险出清。>>>盘面上新支线题材深陷一日游窘境，像昨天的基建以及氢燃料，新攻击的军工也是消息刺激为主，持续性有待商榷。避险与加息预期黄金趋势有加速态势，其外随着科创板的落地在即，理应把目光聚焦在科技股上其估值必然会有重新修复的过程。>>>市场一片迷茫之时，更是新主线展露头角之机，<span class=""showStock"" id=""stock_sh601888"">中国国旅</span><span id=""quote_sh601888""></span>、<span class=""showStock"" id=""stock_sh603027"">千禾味业</span><span id=""quote_sh603027""></span>等消费长跑健将再创新高，市场大资金选择继续抱团A股的核心消费资产的决心坚不可摧，整体来看市场正在新一轮的洗牌，积极跟随好资金调仓换股的步伐。（来源：吴国平的财富号 2019-06-14 17:24） [点击查看原文]<span id=""show_stock_str"" ></span>",6.14收评：又到洗牌时
6,06月14日 ,重庆股友,国金证券研究所消费升级与娱乐研究中心旅游团队投资逻辑国内免税消费的增量来自哪？一看海外消费回流，2018中国海外免税消费约1800亿元体量，其中国人在日韩占据千亿市场；二看香化消费升级，亚太地区香化免税销售占比达52%，香化奢侈品增速持续10%以上；三看出境游出境游持续渗透，目前国内出境渗透和护照拥有率约11% ，未来出境游维持增速10-15%增长，购物客单价保持相对稳定。四看免税渠道优势，中国消费者海外消费约37%发生在免税店，在中国机场免税店消费仅为9%，渠道优势随着场景和品类优化加速渗透。对标韩国免税业的关键词――中国人、市内免税店、香化、代购。韩国免税市场1200亿元中国人占比约7成（840亿元），国人最爱买香化（6成），国际商品的比重（7成）远高于韩国本土产品，在韩国市场中存在因代购而贡献的一部分免税体量，17年萨德导致中国客流腰斩的情况下韩国免税维持20%以上的增长，目前在代购共同作用下免税客单价约为6288元/人。对标来看中国免税市场场景的开放性以及品类品牌的齐全性对于消费者的吸引力较大，进口品在国内外的竞争一方面通过海关从严打击代购，另外一方面靠国内多元化开放和规模效应的释放。市内免税店和机场分流规模测算――目前中免陆续开业北京、厦门、青岛、大连和上海（即将）市内店，目前仅针对外国游客。在市内免税政策开放到国民出境前的情况下，以坪效测算方法，上海预计第一年能够达到10-20亿规模，成熟后能够达到40-50亿元，在未来放开经营面积的情况下能够实现百亿店的规模，以渗透率的角度同样能够得到类似的预测数据。从市内店与机场店分流角度来看若极端假设，在上海机场满足最低保底销售额情况下将免税增量留存至利润率较高的市内店来实现利润最大化，上海单店规模能够实现百亿水平。目前这一时点如何看待国旅的未来发展？国内出境和免税市场仍处在较低渗透阶段，国民出境享受免税政策成为主要免税消费群体。市内免税店的场景开放后，从机场碎片化消费时间到商贸休闲购物的体量升级，将免税与休闲结合，充分挖掘消费者在国内外商品的需求。内生消费升级的需求及外在海外的结构性回流是中国免税行业受到资本关注的重要逻辑，这一逻辑在较长时间内成立。盈利预测及投资建议不考虑海免和剥离旅行社业务以及市内免税店增量情况下19-21E业绩42.6/54/67亿元，增速40%/26%/25%，EPS2.2/2.8/3.4元， PE 36/28/23倍，维持买入评级。风险提示宏观经济影响国人消费受到抑制；市内免税政策开放不及预期；人民币汇率持续贬值。以上内容节选自国金证券已经发布的证券研究报告，具体分析内容（包括风险提示等）请详见完整版报告。若因对报告的摘编产生歧义，应以完整版报告内容为准。<br>（来源：国金研究的财富号 2019-06-14 09:09） [点击查看原文],「国金研究」中国国旅：国内免税消费跨入增量新时代
10,05月31日 ,浙江股友,不懂来这秀智商？国旅的主要利润就是靠免税店！难道还靠旅游？有点常识行不？傻逼太多了！卖酱油的零售海天都尼玛100的股价了！市值2700亿！免税店的纯利润！比酱油至少高一半！才1500亿市值！要不你以为国家和机构傻？垄断行业万金油的道理懂不懂？,不懂来这秀智商？国旅的主要利润就是靠免税店！难道还靠旅
11,05月30日 ,内蒙古股友,2019年5月30日，中国免税品（集团）有限责任公司（以下简称“中免集团”）与澳门博彩股份有限公司（以下简称 “澳博”）在澳门新葡京酒店举行了澳门上葡京免税店签约仪式，中免集团总经理陈国强先生、首席运营官李灿清先生、总经理助理兼中免国际总经理常筑军先生，以及澳博董事局主席何超凤女士、常务董事兼行政总监梁安琪女士等共同出席了签约仪式。有关中国免税品（集团）有限责任公司（中免集团）中免集团是中国免税业的领军企业。经过30余年的急速发展，中免集团现时已经在中国大陆、港澳台及东南亚，拥有200多家零售门市，包括全球最大单体免税店――三亚国际免税城。中免集团与全球逾300家世界顶级奢华品牌，建立了长期的业务合作关系。集团的母公司中国旅游集团有限公司，是中国最大的旅游企业，由香港中旅集团与国旅集团于2016年全面战略重组而成。有关澳门博彩股份有限公司（澳博）澳博是澳门博彩控股有限公司（在香港联合交易所主板上市，股份代号：880）的子公司。澳博植根澳门，是澳门顶级旅游、休闲娱乐及相关业务的领先经营者、拥有者和发展商。澳博旗下的新葡京座落澳门市中心，集得奖食府、华丽客房及多元娱乐休闲设施于一体，设有室内通道接连澳门经典地标葡京酒店。新葡京是澳门唯一拥有七星米其林的酒店，包括荣获米其林三星的8餐厅及天巢法国餐厅，以及荣获米其林一星的大厨餐厅。澳博的另一据点为连接澳门外港客运码头的回力海立方，毗连的回力大楼包含回力酒店、多间中西餐厅，以及美妆潮流亮点回力时尚坊。澳博于澳门内港历史城区建有澳门十六浦度假村，提供五星级法式酒店――澳门十六浦索菲特酒店，以及多元的娱乐休闲设施及环球美食体验。兴建中的上葡京是澳博在澳门路凼的全新综合度假村项目，将提供三个酒店品牌：上葡京酒店、澳门Palazzo Versace 酒店及Karl Lagerfeld酒店，以及会展、购物、餐饮和休闲娱乐设施。,中免集团与澳门博彩股份有限公司正式签署澳门上葡京免税店
12,05月30日 ,青海股友,"技术派，值得小白学习，不喜勿喷                                                                                                                                                                                ◆                                                  ◆                                                                                                                                                                                                                                                                                                                                                                                                                                                                                    第7维度                                                                                                            发表于 2019-05-22 19:46:14                                                                                                                                              [<span class=""showStock"" id=""stock_sh600572"">康恩贝</span><span id=""quote_sh600572""></span>吧] 之前我在推帖中给大家提到过时空论，也提到这是做股票最顶层的思维维度！很多朋友不理                                                  之前我在推帖中给大家提到过时空论，也提到这是做股票最顶层的思维维度！很多朋友不理解这句话，今天我就刻意列举两个图形，一起来通透何为时空论，见评论区！<span id=""show_stock_str"" ></span>",技术派，值得小白学习
13,05月30日 ,青海股友,"技术派，值得小白学习，不喜勿喷                                                                                                                                                                                ◆                                                  ◆                                                                                                                                                                                                                                                                                                                                                                                                                                                                                    第7维度                                                                                                            发表于 2019-05-22 19:46:14                                                                                                                                              [<span class=""showStock"" id=""stock_sh600572"">康恩贝</span><span id=""quote_sh600572""></span>吧] 之前我在推帖中给大家提到过时空论，也提到这是做股票最顶层的思维维度！很多朋友不理                                                  之前我在推帖中给大家提到过时空论，也提到这是做股票最顶层的思维维度！很多朋友不理解这句话，今天我就刻意列举两个图形，一起来通透何为时空论，见评论区！<span id=""show_stock_str"" ></span>",技术派，值得小白学习
