,time,author,comment,header
28,12月19日 ,安徽股友,"今日<span class=""showStock"" id=""stock_sh601933"">永辉超市</span><span id=""quote_sh601933""></span>主力净流入额达761.05万元，净占比4.24%， 其中超大单净流入额286.97万元,净占比1.62%， 大单净流入额474.07万元，净占比2.67%。       <span class=""showStock"" id=""stock_sh601933"">永辉超市</span><span id=""quote_sh601933""></span>资金流向数据    类型 流入(万元) 流出(万元)   超大 1084.08 -797.11   大单 5119.65 -4645.58   中单 6175.36 -6736.39   小单 5372.72 -5572.73      资金解读   <span class=""showStock"" id=""stock_sh601933"">永辉超市</span><span id=""quote_sh601933""></span>收盘涨幅1.09%，  其中，成交最活跃的价格分别为7.38、7.39、7.40，成交密集的手数区间分布于500-700、1000-1500、700-1000手，中单介入居多。   成交活跃统计 9:30-15:00 成交均价 7.37    成交价格 主买累计成交量 主卖累计成交量 主买占比 主卖占比   7.38 2324629 1615165 9.55% 6.63%   7.39 1839642 1667100 7.56% 6.85%   7.40 2631900 336933 10.81% 1.38%   7.41 689907 60590 2.83% 0.25%   7.42 78400 0 0.32% 0.00%     成交手数分布 主买累计成交量 主卖累计成交量 主买估算笔数 主卖估算笔数   500-700 887748 437799 1268  625    1000-1500 605790 262200 404  175    700-1000 343426 190400 343  190    2000-3000 0 236400 0  79    1500-2000 157000 0 79  0      左右拖动表格，可查看剩余表格内容 行业个股资金流    商业百货成分股主力净流入排行   序号 代码 名称 涨幅 主力净流入   1 601933 <span class=""showStock"" id=""stock_sh601933"">永辉超市</span><span id=""quote_sh601933""></span>  1.09% 761.05万   2 600122 <span class=""showStock"" id=""stock_sh600122"">宏图高科</span><span id=""quote_sh600122""></span>  0.73% 520.87万   3 000564 <span class=""showStock"" id=""stock_sz000564"">供销大集</span><span id=""quote_sz000564""></span>  -0.37% 212.71万   4 600415 <span class=""showStock"" id=""stock_sh600415"">小商品城</span><span id=""quote_sh600415""></span>  -0.57% 199.10万   5 603101 <span class=""showStock"" id=""stock_sh603101"">汇嘉时代</span><span id=""quote_sh603101""></span>  1.88% 199.06万     数据来源:<span id=""show_stock_str"" ></span>",永辉超市12月19日资金揭秘
29,12月19日 ,吉林股友,12月18日永辉超市沪股通持仓数据     收盘价： 7.31 涨跌幅： -2.92%   持股量： 9218.65万股 持股变化： 234.49万股      数据显示，截至12月18日永辉超市于沪股通持股量为9218.65万股，占其A股股本比例为1.15%，比上一交易日增加234.49万股。据数据统计，该股近一个月内累计涨幅为0.55%，沪股通累计减仓403.23万，沪股通持仓累计变化比例为-4.19%，近三个月内累计涨幅为-5.92%，沪股通累计减仓1589.79万，沪股通持仓累计变化比例为-14.71%。  数据来源:,永辉超市12月18日获沪股通加仓234.49万
30,12月18日 ,安徽股友,"今日<span class=""showStock"" id=""stock_sh601933"">永辉超市</span><span id=""quote_sh601933""></span>主力净流入额达-902.77万元，净占比-3.13%， 其中超大单净流入额-395.86万元,净占比-1.38%， 大单净流入额-506.91万元，净占比-1.77%。       <span class=""showStock"" id=""stock_sh601933"">永辉超市</span><span id=""quote_sh601933""></span>资金流向数据    类型 流入(万元) 流出(万元)   超大 354.46 -750.32   大单 6531.19 -7038.10   中单 12130.16 -13756.01   小单 9567.53 -7038.92      资金解读   <span class=""showStock"" id=""stock_sh601933"">永辉超市</span><span id=""quote_sh601933""></span>收盘涨幅-2.92%，  其中，成交最活跃的价格分别为7.51、7.52、7.53，成交密集的手数区间分布于300-500、700-1000、500-700手，中单介入居多。   成交活跃统计 9:30-15:00 成交均价 7.34    成交价格 主买累计成交量 主卖累计成交量 主买占比 主卖占比   7.51 298700 304100 0.76% 0.78%   7.52 115900 229400 0.30% 0.59%   7.53 273900 64500 0.70% 0.16%   7.54 48057 14843 0.12% 0.04%   7.55 4600 0 0.01% 0.00%     成交手数分布 主买累计成交量 主卖累计成交量 主买估算笔数 主卖估算笔数   300-500 882248 1224308 1764  2449    700-1000 358660 423600 359  424    500-700 350758 262375 501  375    1000-1500 228500 200000 152  133    2000-3000 229188 0 76  0      左右拖动表格，可查看剩余表格内容 行业个股资金流    商业百货成分股主力净流入排行   序号 代码 名称 涨幅 主力净流入   1 600122 <span class=""showStock"" id=""stock_sh600122"">宏图高科</span><span id=""quote_sh600122""></span>  0.24% 561.69万   2 002264 <span class=""showStock"" id=""stock_sz002264"">新华都</span><span id=""quote_sz002264""></span>  2.48% 554.02万   3 600306 <span class=""showStock"" id=""stock_sh600306"">商业城</span><span id=""quote_sh600306""></span>  6.23% 374.61万   4 603708 <span class=""showStock"" id=""stock_sh603708"">家家悦</span><span id=""quote_sh603708""></span>  -0.82% 237.64万   5 000419 <span class=""showStock"" id=""stock_sz000419"">通程控股</span><span id=""quote_sz000419""></span>  -1.61% 214.88万   77 601933 <span class=""showStock"" id=""stock_sh601933"">永辉超市</span><span id=""quote_sh601933""></span>  -2.92% -902.77万     数据来源:<span id=""show_stock_str"" ></span>",永辉超市12月18日资金揭秘
31,12月18日 ,广东股友,"美股零售股普跌 梅西百货跌近2%来源：<span class=""showStock"" id=""stock_sz300033"">同花顺</span><span id=""quote_sz300033""></span>综合 2018-12-17 22:42:31关键词：梅西百货美股利空意见反馈　　<span class=""showStock"" id=""stock_sz300033"">同花顺</span><span id=""quote_sz300033""></span>财经讯 　 美股零售股普跌，梅西百货(M)跌1.7%，沃尔玛百货(WMT)微跌0.75%，塔吉特(TGT)跌1.76%，亚马逊(AMZN)跌2.63%，百思买(BBY)跌3.4%。股民做黄金，即享T 0特权！<span id=""show_stock_str"" ></span>",谨防跌停2元见！美股零售股普跌 梅西百货跌近2%
32,12月18日 ,吉林股友,12月17日永辉超市沪股通持仓数据     收盘价： 7.53 涨跌幅： -0.92%   持股量： 8984.16万股 持股变化： 98.98万股      数据显示，截至12月17日永辉超市于沪股通持股量为8984.16万股，占其A股股本比例为1.12%，比上一交易日增加98.98万股。据数据统计，该股近一个月内累计涨幅为3.58%，沪股通累计减仓637.73万，沪股通持仓累计变化比例为-6.63%，近三个月内累计涨幅为0.40%，沪股通累计减仓2021.44万，沪股通持仓累计变化比例为-18.37%。  数据来源:,永辉超市12月17日获沪股通加仓98.98万
33,12月17日 ,江苏股友,"导 读在影视作品中，强大角色往往十分低调，苦练内功出师后才敢闯荡江湖。如果能力不行还要高调出场，注定会吞下苦果。如《复联》中向绿巨人叫嚣的洛基，就被无情胖揍。《天龙八部》中秒杀一切的高手，却是深藏功与名的扫地老僧。在消费中，这一点则体现的更加明显，北京最好的涮肉已不是东来顺，天津最棒的包子也难言狗不理。在这个消费愈发理性的时代，名气已不是消费者买单的唯一标准，甭管多大噱头，多深奥理念，品质与服务，才是企业立足市场的根基。拿新零售为例，自从两年前从马云口中诞生，成了风口。含着金手勺的盒马鲜生一出世，就引来不少消费者追捧，坪效一时超过传统商超数倍。只是相比其高调人气，内功似乎差强人意。随着“招聘歧视”、“拒收现金”、“用户体验差”、“产品换标签”等问题的曝光，盒马正在慢慢跌下神坛。新零售再新，也还是零售，顶着互联网光环，号称功力强大改造传统的盒马，似乎就零售业本身而言，还是一个需要好好补课的初等生......作者：厉兵来源：铑财-铑财研究院提起上山下乡，可以说是一代国人的青春记忆。怀揣改造农村世界的澎湃梦想，热情似火的知青，来到农村期待大有作为。只是很快骄傲变成了失落，看似简单的农事农活，承载了几千年的劳动智慧，知青们发现相比改造农村，自己首先要学习的东西更迫切更重要，于是，改造变成了被改造。如今，新零售也遇到了相似境遇。资金充裕的情况下，是提升品质与服务，还是应该加大品牌投放力度。是不少企业面临的难题。在铑财看来，品牌是一面放大镜，如果产品的品质与服务足够好，品牌的投入效果则事半功倍。反之，若没有优质的产品作为支撑，那么品牌知名度则会让企业麻烦不断。就像娱乐圈明星一样，越是知名度高的越危险，一个负面新闻袭来，就可能终结演艺生涯。近期的新零售，着实热闹。这次吸引眼球的，不再是新模式、新概念，变成了产品过期、体验差等负面新闻。引发风向切换的，也是一位大人物――盒马鲜生。盒马鲜生，在新零售领域绝对是一位大明星。作为新零售概念的载体，盒马鲜生自诞生便头顶大佬马云光环，怀揣升级优化传统零售业的雄心，每个动作都引起关注无数。从实际表现来看，盒马的表现也不错，起码开局良好。从2016年1月第一家店开业，短短两年时间内，盒马已在全国建成64家门店，覆盖14座城市。在极速扩张背后是阿里1.5亿美元的加持和马云的名人效应。线上与线下的融合看似也十分融洽，从线下看，传统生鲜超市的坪效约1.5万元，盒马鲜生能做到它们的3 -5倍。从线上看，其线上订单占比超过50%，营业半年以上的成熟店铺更是可以达到70%，而且线上商品转化率高达35%，远高于传统电商。亮眼表现，让阿里包括马云都对盒马鲜生寄予厚望，阿里高层不止一次的表示，盒马是阿里新零售的重要一环。这样的美好表现，终究还是打破了。在盒马的春风得意的背后，快速扩张带来的问题也不断爆发，从招聘歧视到忽视用户体验，再到食品安全问题，都在消耗着用户对盒马的信任。高知名度，则让盒马的问题被无限放大。人们突然发现，原来的业界优等生，似乎也没那么优秀，甚至问题还不少。这样不懂零售、名不配位是盒马种种问题的根源，其近期被曝光的“标签门”，则更能体现出明星体质的盒马，正与其零售之本，以及消费升级趋势渐行渐远。产品问题背后的管理缺失上述质疑，伴随盒马门店连续出现的四起食品安全问题，而到达顶峰。无论是新零售，还是传统零售，从本质上看都是零售行业。在这一行业中，品质与服务永远是第一位的。在此方面，盒马鲜生做的并不到位。此前，多方媒体报道，有市民11月15日在盒马鲜生大宁店挑选蔬菜，看见一旁的工作人员正在更换胡萝卜外包装的日期标签，经查看，被换下的胡萝卜标签日期为11月9日、11月10日、11月11日，被换上的标签日期为11月15日。之后其向静安区市场监管局举报。执法人员当天赶到盒马鲜生大宁店现场检查，门店负责人承认，店员违规操作，更换了“崇明胡萝卜”产品标签。据查证，涉事胡萝卜共180盒。截至11月14日，已累计销售107盒，库存剩余73盒。中国电子商务研究中心特约研究员、上海汉盛律师事务所高级合伙人李F认为，食品安全关系每个人的身体健康和生命安全，盒马的行为不仅违背了承诺，也违反了我国对食品安全的管理制度。图片来自网络盒马鲜生名目张胆的糊弄消费者，难免让人深感“店大欺客”。盒马将上海区总经理就地免职，也未能平息众怒。毕竟外界对盒马鲜生的期待太高，所有人都想看看盒马究竟能创造出什么样的奇迹，但现实是残酷的，盒马的做法让人们失望了。就在“标签门”事件刚过去不足20天，盒马再次被爆出负面新闻。12月1日上午，胡小姐在盒马鲜生上海金桥店购买了5件商品，总价为33.8元。到家后，她发现两听利泰尔椰浆（利乐砖）250ml规格产品的生产日期为2017年4月28日，保质期至今年9月28日。问题还在发酵，同样在这个月，先是上海电视台新闻综合频道，又爆出盒马鲜生上海曹家渡店在出售发霉火龙果，之后市场监管总局又通报盒马鲜生销售的鲫鱼恩诺沙星超标。接连发生的食品问题，说明盒马的产品问题着实不小。身处零售行业，盒马并不生产产品，但对质量的把控是零售行业的基本准则，此方面的缺失，说明了盒马在管理上存在漏洞，而这绝非简单免职一个负责人就可以解决的。只有解决好管理问题，才能彻底解决接踵而来的产品风波。盒马创始人、CEO侯毅也承认了盒马管理方面的缺失，其表示“此事暴露我们在管理上存在漏洞，应当由管理团队而不是一线员工承担责任，取消对当事员工的处罚。”线下管理水平低，是盒马最大的痛点之一，这是依靠新模式、新平台、新技术不能解决的。毕竟打江山难，守江山更难，对于盒马鲜生以及其背后的阿里巴巴来说，短期的盈利绝不是目的，而是实现开创零售新时代的手段。中国电子商务研究中心一组数据显示，4000多家生鲜电商玩家中，4%实现账面持平，88%亏损，且剩下7%是巨额亏损，最终只有1%实现了盈利。盒马自然属于头部的1%。天生自带线上属性的盒马，凭借阿里的扶持，以及马云的站台，可谓打响了第一炮，从各方面来看都碾压了传统零售商超。但若想开创新时代，一味的颠覆是远远不够的，学习传统零售行业值得借鉴的经验也十分重要。毕竟零售行业自古至今便一直存在，其长期以来总结的宝贵经验，对盒马鲜生这个新兵来讲极其珍贵。同时，盒马鲜生模式虽新，但店面人员大多来自传统门店转型，这更需要传统的管理经验。但盒马先生这位初生牛犊，显然没有虚心接受。例如“标签门”的行为，其实完全不必采用欺骗的方式，在传统零售行业中，早已有了解决之道。电子商务研究中心特约研究员、上海亿达律师事务所律师董毅智律师认为，同样是临期或过期商品，并不意味着一定要以欺瞒、蒙骗手段进行处理，相反，由于商品依然可食用以及其低廉的价格，反而能够吸引用户。事实上，现行的超市内专门设立柜台或是角落进行售卖临期产品的也不在少数。但盒马却并未参考这一经验，才因小失大，成为众矢之的。的确，新模式、新技术、高盈利的盒马，有资本否定传统零售管理经验的底气，但盒马的近期出现的问题，暴露出急速扩张的后遗症。线上线下融合，本身就是相互改造补充的双向过程，这也是新零售的初衷和发展逻辑。不管是人员管理、产品品控，还是售后服务、供应链管理，都是盒马需要补充的功课。这些事情是传统零售业的基本功，但在盒马却是急需解决的大功课。因为其看似繁琐，却十分必要，是保证零售商品及服务的重要标准。也是取得消费者信任的基础。不是新模式、新技术可以解决的。用户增长天花板业内人士指出，盒马的高歌猛进，是成功将线上用户倒流到线下体验的结果。从商业模式来看，无疑是打通了线上与线下的壁垒。不难看出阿里线上与线下的结合，重点在于体验二字，无论是便捷的支付方式，还是盒马空中悬挂的物流传送带，实际都是为了增强用户体验。但上述管理上的漏洞，会直接掐断这一线上与线下的结合点。除产品外，服务是体现管理水平的另一标杆，对用户体验来说，服务水平至关重要。在此方面，盒马做的也并不到位。此前，有不少网友对盒马鲜生的“现场烹饪”体验吐槽。在店里享用现场烹制的食物，从挑好到最后上桌基本需要一个小时以上，且用餐区太小，服务员人手也不够。同时，被曝光的拒收现金，也一定程度上影响了消费体验。图片来自网络由于管理经验不足引发的服务问题，与盒马新零售概念中的重视体验，完全背道而驰。对盒马来说，和传统零售相比的优势，便是互联网所带来的巨大流量。而线下体验的作用，是将线上流量进行转化，如果用户体验足够好，那么转化率自然很高。若体验差，不仅会影响转化率，甚至还会导致线上流量流失。对于以流量为核心的盒马鲜生，甚至阿里巴巴来说，必然是不能接受的。针对上述问题，铑财向盒马鲜生发函。截止目前，未收到盒马方面的相关回复。事实上，盒马管理漏洞引发的危机，在业内看来是只是时间问题。其重资产模式的高速扩张，让其无暇顾及传统零售行业重视的精细化管理。激进的重资产盒马此前宣布称：""从9月底到10月初，将向北京、广州、深圳、西安、成都、南京、武汉等全国13个城市新增20店，将业务范围扩大到三线城市。""这意味着，在阿里巴巴投资者大会上交出了""三年服务1000万用户、全国遍布64家门店、单店日营业额超80万、坪效超5万""的成绩单后，盒马将进一步扩张。盒马的扩张，在铑财看来在情理之中，盒马鲜生门店可以覆盖周边5公里，但其目前只有几十家店面。先不说阿里，即使是蚂蚁金服年度活跃用户都超过了7亿，对于盒马来说，流量简直多到用不完，要转化如此庞大量级的线上用户，只有疯狂的扩张这一条路可走。但盒马鲜生的开店成本并不低。盒马鲜生CEO侯毅曾表示，盒马鲜生的单店开店成本在几千万元不等。作为C2C轻资产模式的代表，阿里巴巴打造盒马鲜生这一重资产野兽，可以说进入了全新的领域，这并非阿里巴巴这个互联网公司擅长之事，在细节打磨上也似乎少了应有的耐心沉淀。以人员需求问题为例，不少传统零售面临人工缺口时，都会选择自己招工，例如在店面张贴招工海报等，虽然速度慢一些，但能对每一个员工进行把控。但盒马面对同样需求时，却将工作完全推给了第三方劳务公司，从而有了此前“地域歧视事件”的发生。盒马扩张速度，与其盈利成正比，但与管理水准却成反比。新生事物的出现，必须要用心经营，毕竟盒马鲜生作为行业的头部企业，代表的是整个新零售行业，虽然有新零售带给了人们新消费、新体验的新兴概念，但若不站在用户角度考虑事情，只顾数据，而忽视零售行业应有的问题，则注定只是昙花一现。这种案例在当下并不少见，以当下日薄西山的OFO为例，OFO将自己定义为一家互联网公司，一味的追求亮眼的数据，却没有对车辆进行及时的升级与维护，忽视了用户的出行体验，才有如今的大规模退押金风波，在街上留下的是一片杯盘狼藉。反观定位于物联网的摩拜，在与OFO的烧钱大战中，没有忘记对产品的维护，高于OFO造价5倍的产品，自然更得民心。图片来自网络无论是定位于互联网的OFO，还是定位于物联网的摩拜，其定位行业均已成熟。但盒马所定位的新零售行业，还很年轻，并未有模板可以借鉴。那么，新零售行业应该怎样发展呢?腾讯的出人预料上海森潘企业管理咨询专家黄静表示，虽然盒马披着新零售的新衣，但是传统零售企业存在的哪些经营问题，盒马还是会遇到。零售业其实不必讲求新旧之分，互联网企业对零售企业进行革新，只是对经营效率、管理效能的革新，但并没有改变传统零售的本质，做的依然是传统零售的业务内容。电子商务研究中心主任曹磊也表示，相比外界对新零售业态的高期待，其实盒马商品品质的保障和模式创新关系没那么大，最终还是要看门店的精细化运营。“这是一个管理、人性问题，不是模式创新能解决的。不难看出，虽然盒马对零售行业产生了影响，但本质逻辑上没有质的飞跃。在业内人士看来，即使没有盒马，新零售同样的出现也是必然事件。当传统商超发展到一定规模时，必将升级线上，毕竟我国线上零售潜力巨大。数据显示，我国线上零售总额占社会消费品零售总额比例只有17.5％，美国则不到10％。这种由线下延伸线上的“先有质，后追量”的发展方式才更持久。但盒马却是先吸引足够的流量，再用体验进行转化，线上倒逼线下的模式，虽然快，但并不稳。作为阿里巴巴布局十年后的产品，且不谈盒马能不能在十年后为阿里巴巴创造价值，其在诸多负面新闻影响下，能否生存到十年后，都还是个问题。新零售能够提高零售行业的经营效率，本是一件值得推广的好事。盒马遭受诟病不断，是企业自身的问题。在这一点上，腾讯系的永辉超级物种显然比盒马鲜生聪明的多。12月4日，永辉超市发布《永辉超市股份有限公司与永辉云创科技有限公司关联交易框架协议》公告，通过转让股权，永辉云创被剥离出上市公司的报表合并范围。据了解，永辉云创包括含永辉生活店、超级物种、永辉生活App，主要孵化创新业态，属于新零售风口。永辉将传统零售与新零售分离的举动，在外界看来有些迷茫，但在铑财看来，这是其背后腾讯下的一盘大棋。从商业发展的规律来看，永辉已经早期背靠永辉超市的资金和资源，得到了迅速发展。如今，已经达到了56家超级物种，400家永辉生活，明显不再需要永辉超市的支援。而永辉超市的模式，对云创来说反而会是一种限制。在新零售整体行业并不成熟之时，将新零售板块拿出来，实行传统零售与新零售两步走显然更为稳妥。并且背后的老大腾讯，也能真正的将自身优势赋能云创。用形象比喻，便是腾讯将云创这个脆弱的孩子交给了永辉抚养，等到云创学到了永辉在传统零售行业的经验，并且已经茁壮成长到独当一面的时候，腾讯这位真正的大师再出来传授其真正的武功秘籍。这实在是一个大招。有业内人士认为，这次永辉云创的分离，可能代表腾讯系和阿里系新零售全面直接对抗的开始。图片来自网络反观阿里巴巴，孤注一掷的将全部资源砸向盒马鲜生，但未考虑到其消化能力，导致其出现种种问题。且不说盒马鲜生与超级物种谁胜谁负，阿里巴巴这种只重速度，忽视质量的做法，或许已导致了盒马的先天不足，后天失调。在开始的这一局，似乎已败给了腾讯。在铑财看来，任何新生事物的创造者，都未必是最好的执行者，就像足球源自中国，但今天的中国足球却十分糟糕的道理一样。马云提出新零售的概念，是希望破除线上电商与传统线下商业模式的矛盾，让二者实现真正融合，这与其自身擅长的太极拳阴阳相合的理念殊途同归。但太极拳能将阴阳融合，诀窍在于以慢胜快，拳速越慢，威力越大。从此来看，盒马重资产扩张的发展方式，似乎只学到了拳形，但未领悟到真正的奥义。对于零售业而言，无论新旧，都是一个重模式行业，不但资金重，相关管理、服务、供应链、经验、资源等都很重，都需要时间去打磨沉淀。对于盒马来说，要想在零售行业站稳脚跟，在快速逐利之后，也该放慢脚步，扎扎实实弥补自身不足，这才不枉费阿里巴巴的一番苦心。对此，铑财也将持续关注。本文为铑财原创，如需转载请留言（来源：财子三曰的财富号 2018-12-17 16:48） [点击查看原文]",马云坐不住了！盒马鲜生负面频频恐跌下神坛 腾讯反超？
