,time,author,comment,header
25,03月27日 ,北京股友,"腐败，自人类社会出现生产资料私有化以后就一直存在，任何组织、机构、小团体的产生、兴盛、衰落的过程中都无法回避腐败这个问题，就连新兴、高效、现代的互联网也难以独善其身。中国互联网已经走过二十多年的时光，随着行业的快速发展、商业版图和业务的不断扩张，海量资本涌动，给了消极腐败滋生壮大的空间，企业面临的腐败问题呈现出多元化和复杂化的特点，已经成为威胁企业正常经营管理秩序的重要杀手。近年来，互联网涉腐人员呈现多样化，有总裁、总监以及总经理这样级别的“老虎”，也有“小二”、配送员这个级别的“苍蝇”。有违反公司相关管理规定被扫地出门的人，也不乏腐败事实重大而沦为阶下囚的人。有各种像收受香烟、收费删帖、贪占小便宜等形式的“微腐败”，也有基层员工利用职务之便侵占公司数以万计货款的"" 小官大贪 ""类型的腐败。总之就是各种腐败形式层出不穷，令到很多企业防不胜防，颇为头痛。去年年底以来，各种反腐公告从互联网企业发出，反映了在行业增速下滑、用户红利逐渐消失、企业裁员优化的“互联网寒冬”中，贪腐问题已经成为互联网企业一个非常头痛的问题了。2018年，阿里文娱乐优酷总裁杨伟东涉嫌贪污超过1亿元。大疆科技2018年因内部腐败损失超过10亿元。OFO从高层到基层的贪腐现象都非常严重，那些贪污的人员少则贪几万元，多的甚至贪十几万。这仅仅是冰山一角，隐藏在角落里没被发现的又会是多少呢？可见，互联网腐败已经到达了一个非常严峻的地步了，如果再不采取手段加以治理，势必会危及到各大互联网企业的生存与发展。其实，互联网贪腐无外乎五类。其一，商业贿赂。这主要是互联网企业内部人员收受贿赂、索要好处并违规向供应商提供各种支持和方便。其二就是职务侵占。主要是企业内部人员虚瞒假报、截留私分，利用职务便利侵占企业自身利润以及各种费用，骗取公司提成、补贴款以及商家的推广费等。其三，利益输送。利用公司职务便利开设各种名头将公司的利益输送给自己亲属以及与自己有关联的利益团体。其四，“微腐败”。私自收受企业的供应商、合作商家的礼品、好处费等。其五，吃里扒外。不少互联网企业中的高层管理人员与合作商、供应商、代理商甚至是对手勾结或者有不正当经济关系，侵蚀企业的利益。以上这些都是近几年来互联网企业腐败的主要类型。面对日益严重的内部腐败，各大互联网企业纷纷祭出自己的“反腐组合拳”。从“人”的角度出发，阿里建立廉政合规部，百度成立职业道德委员会，京东建立内控合规部，而腾讯则有反舞弊团队并制定6条“高压线”，一旦触犯，轻则辞退，重则移交司法机关。从“事”角度来看，各大互联网企业也是纷纷重拳出击，把一件件内部严重腐败事件弄成素材，通过内部信、内部通告、公告等方式宣传和警醒，以此来“杀鸡儆猴”。从“调动员工积极性”出发，京东每年设立1000万反腐奖励专项基金来奖励那些举报腐败有效的员工，并建立保密机制，保证举报人的合法权益不受侵害。从“合作”出发，京东联合腾讯、百度、宝洁、美团点评、联想、美的、唯品会、小米、李宁、永辉超市等成立“阳光诚信联盟”，建立企业信息共享机制，对不诚信的员工和商家都拒绝合作。不过，就算各大互联网企业维持高压打压的形势，内部腐败问题也很难根除，因为员工和公司自建立关系后就会出现三对矛盾。首先是信息不对称，企业很难真正知道员工在做什么以及做了什么，就算通过技术检测也很难完全掌握具体情况，过度监测会让员工产生信任危机，不利于公司长远发展，那么，做什么也只有员工自己心里才最清楚。其次，公司和员工的目的存在差距，公司希望的是员工全心全意为公司服务，尽量降低成本，而多数员工希望的是公司提供更好的薪酬福利，工作舒适一点，这两者的目的追求明显存在差距。再者，公司和员工的责任不对等员工工作中出现的重大问题，公司要负责任的，而员工大可拍拍屁股走人。这三对矛盾如果得不到很好的解决，那么员工和公司就会产生利益的冲突，内部腐败会一直存在。从另一个个角度来看，即使建立再完美的反腐机制，做得再天衣无缝都好，没有不折不扣执行这套制度的人，也很难彻底根除内部腐败问题，毕竟人是有主观能动性的，会从有利于自己的角度出发考虑问题，能运用智慧巧妙避开一些限制，在利益面前，人们总是能够找到“漏洞”来钻。而且，你可以监控员工的行为，但却监控不了员工的心理与欲望，即使有再好的规则，员工有再好的自律性，腐败这种问题都是难以根除的。尽管不能根除内部腐败，但公司可以建立一个理想的模型来减少腐败，不能追求完美那就只能追求最优。很多企业之所以难以处理内部腐败问题就在于企业管理者既当运动员又当裁判员，集参与权和裁判权于一身，权力相当大而缺乏外部约束力量。所以我们近两年可以看到，很多互联网企业开始建立一套内外部相互独立、相互制约和监督的防腐败机制，目前虽然不甚完美，但起码有效果，以后也会逐步完善。对于互联网企业来说，当前的环境更加复杂，竞争也更为激烈，盈利本来就不太容易，如果企业内部到处都是“蛀虫”，就算再好再大的企业也难以承受，清除内部的“蛀虫”也就成了一件紧迫的事情。不难预见，互联网反腐将会是一场持久战，不断更新迭代的“虎头铡”“苍蝇拍”将会是互联网反腐领域的常态，相信互联网反腐高压的大势下，互联网生态环境将会更加清明、公平和有希望。你对互联网企业反腐这个问题怎么看呢？（来源：每日财经观的财富号 2019-03-26 23:06） [点击查看原文]",互联网掀反腐热潮：打“老虎”，拍“苍蝇”
26,03月26日 ,陕西股友,"赌一手 根据国家统计局披露的数据，批发和零售行业普遍适用的增值税率为16%，同时我们剔除所得税影响，得到数据显示对于减税前净利率较低的企业来说，减税将明显增厚净利润，其中<span class=""showStock"" id=""stock_sh601933"">永辉超市</span><span id=""quote_sh601933""></span>、<span class=""showStock"" id=""stock_sh601116"">三江购物</span><span id=""quote_sh601116""></span>、<span class=""showStock"" id=""stock_sz000417"">合肥百货</span><span id=""quote_sz000417""></span>净利润增厚幅度最大，<span class=""showStock"" id=""stock_sh603900"">莱绅通灵</span><span id=""quote_sh603900""></span>、<span class=""showStock"" id=""stock_sz002345"">潮宏基</span><span id=""quote_sz002345""></span>、<span class=""showStock"" id=""stock_sh600628"">新世界</span><span id=""quote_sh600628""></span>净利率增幅最大。<span id=""show_stock_str"" ></span>",赌一手[大笑] 根据国家统计局披露的数据
27,03月25日 ,重庆股友,"导读：从“车厘子自由”到“香椿自由”，现在连榴莲和辣椒这些人气<span class=""showStock"" id=""stock_sz000061"">农产品</span><span id=""quote_sz000061""></span>的价格也出现了明显波动！“新中产的焦虑”可谓是从菜市场开始......“你香椿自由了吗？”是的，你没看错，这年头连买香椿都可以拿来“炫富”了。这段时间，因为部分地区香椿价格的走高，甚至达到一两百元一斤，堪比龙虾的价格，“香椿自由”这个新词便横空出世。<span id=""show_stock_str"" ></span>",价格一年涨超80%！下一款“中产焦虑”的是辣椒和榴莲？
28,03月25日 ,<a href='/u/6533330838' title='用户6533330838'>用户6533330838</a>,复权价格差不多七十块咯，好厉害哦，都赚大发咯，就等接盘的脑残啦，哇咔咔,复权价格差不多七十块咯，好厉害哦
29,03月22日 ,天津股友,"来源：易方达渠道服务市场回顾21日上证综指涨10.81点收3101.46点，涨幅0.35%，深综指涨0.77%，沪深300涨0.04%，中小板涨0.64%，300非银涨0.51%，上证50跌0.35%，深100涨0.07%，上证中盘涨0.61%，创业板涨0.95%。成交8859.45亿较上日增1060.44亿。板块涨跌互现，传媒、综合领涨，食品饮料、银行领跌。香港市场走低，H股指数跌0.70%。   国内新闻<br>1、国务院常务会议确定《政府工作报告》责任分工，强调狠抓落实确保完成全年发展目标任务。会议明确增值税减税配套措施，决定延续部分已到期税收优惠政策并对扶贫捐赠和污染防治第三方企业给予税收优惠。会议决定，进一步扩大进项税抵扣范围，将旅客运输服务纳入抵扣；对政策实施后纳税人新增的留抵税额，按有关规定予以退还；相应调整部分货物服务出口退税率、购进<span class=""showStock"" id=""stock_sz000061"">农产品</span><span id=""quote_sz000061""></span>适用的扣除率等。2、财政部公布2019年立法工作安排，未提及房地产税。安排指出，要力争年内完成增值税法、消费税法、印花税法、土地增值税法、关税法、彩票管理条例（修订）的部内起草工作，及时上报国务院。3、国资委主任肖亚庆称：下一步，央企将按照高质量发展的要求，围绕“培育具有全球竞争力的世界一流企业”目标，持续深化企业改革；这一进程中，央企将不断加大与民营企业的合作力度。 4、财政部称：2月末全国地方政府债务余额191420亿元，控制在全国人大批准的限额之内，其中，一般债务114273亿元，专项债务77147亿元；政府债券188269亿元，非政府债券形式存量政府债务3151亿元。5、人力资源社会保障部、财政部称：从2019年1月1日起调整企业和机关事业单位退休人员基本养老金水平。总体上涨水平按照2018年退休人员月人均基本养老金的5%左右确定。6、上海出台《关于进一步深化科技体制机制改革，增强科技创新中心策源能力的意见》，即上海科改“25条”。上海科改“25条”提出了六个方面25项重要改革任务和举措：促进各类创新主体发展，构建完善主体多元、开放协同的科研力量布局和研发体系等。7、国家能源局称：2月份，全社会用电量4891亿千瓦时，同比增长7.2%；1-2月，全社会用电量累计11063亿千瓦时，同比增长4.5%。8、深交所称：今年深交所将对上市公司监管系统、市场监察系统、市场风险监测系统、固定收益系统等进行全面升级，一线监管智能化水平将大幅提升；将坚持市场化法治化方向，立足交易所法定职责，紧紧围绕防风险、促发展，守住监管底线，把握监管重点，着重防范市场发生共振，避免蝴蝶效应。 9、市场监管总局、工信部、公安部三部门要求加强电动自行车国家标准实施监督，新标准实施前对所有电动自行车生产企业开展一次摸排。电动自行车新强制性国家标准将于4月15日起实施。企业动态<br>1、<span class=""showStock"" id=""stock_sz000029"">深深房A</span><span id=""quote_sz000029""></span>公告称，重组标的公司恒大地产已完成房地产业务的内部重组，并取得香港联交所对中国恒大集团控股的恒大地产在A股重组上市的正式分拆批复。恒大地产已完成三轮战略投资者的引入。2、<span class=""showStock"" id=""stock_sh601933"">永辉超市</span><span id=""quote_sh601933""></span>公告称，公司与麦德龙中国有过初步沟通，但未与麦德龙中国就收售事宜进行实质性的商业洽谈，也没有形成任何一致性意见和任何文件。 3、小米董事长雷军称：最近正在全力保障供应，承诺3月底小米9供货会超过一百万台；手机行业会迎来5G爆发点，小米正在为5G做大量准备；今年调整成IOT和手机并重双引擎战略，截至去年年底小米接入设备数已到1.51亿，同比增长193%，这是全IOT设备的。（声明：以上观点仅供参考，不构成投资建议，基金投资需谨慎！）（来源：易方达基金的财富号 2019-03-22 11:34） [点击查看原文]<span id=""show_stock_str"" ></span>",易方达财经晨信-国内版（03月22日)
30,03月22日 ,河南股友,"早视野 来自财经早餐 00:00 08:31 作者：沈三万老沈转载授权朋友们，在你的记忆中，零售业领域，提到“高冷”品牌，你会想到谁？对老沈来说，一定会有它：麦德龙！在很多年前，当老沈还是个头发没秃的青葱少年时，家门口附近开了一家麦德龙。那时的老沈和周围很多人一样，一开始被麦德龙拒之门外，后来非常不容易地办理了公司会员卡，之后每次拿着会员卡进入麦德龙购物的那一瞬间，都有种城乡结合部少有的尊贵感……麦德龙，这个德国最大、欧洲第二、世界第三的德国零售业巨头，就像一头高冷巨兽，以“店大拒客”的独特风格，在中国立足了整整二十四年。然而，凡是过去，皆为序章。3月20日，外媒报道，麦德龙欲出售中国业务，吸引了腾讯、<span class=""showStock"" id=""stock_sh601933"">永辉超市</span><span id=""quote_sh601933""></span>、中信产业投资基金的兴趣。消息一出，相关人士皆对此表示不予置评。值得一提的是，这不是麦德龙第一次传出“被出售”的传闻，近半年来，麦德龙已有四次被传出此类新闻。大众对此的关注不无道理，要知道，麦德龙被称为外资零售商在中国的最后一头“高冷”巨兽。而麦德龙的“被出售”传闻，正预示着外资零售商黄金一代的谢幕！黄金一代！翻开中国零售业四十年历史，各方势力轮番登场，代表人物悉数亮相，这其中，外资零售商就是一股强劲的力量。对中国零售业来说，1995年是一个关键的节点。就在这一年，国家允许外资进入食品及连锁经营领域，就这样，继1992年放开服装和百货后，零售业全面对外资开放。大多数人都不知道的是，麦德龙，正是在1995年第一个进入中国、与上海锦江集团达成合作成为第一家获得中国政府批准在中国建立连锁超市的合资企业！在它之后，同一年，法国零售巨头家乐福抢滩北京；随后，1996年，沃尔玛落脚深圳；1997年，泰国零售业巨头易初莲花攻占上海；1999年，法国欧尚也快马加鞭来到了上海滩。可以说，正是从麦德龙开始，外资零售商在上个世纪90年代上演了一出抢滩中国市场的黄金潮！而世界奇妙之处就在于，二十多年之后，当年集体抢滩中国市场的黄金一代，又一次集体上演了一出剧目：大撤退。乐天玛特彻底退出中国市场，沃尔玛、家乐福加入了腾讯系，欧尚牵手了阿里系。在这一背景下，麦德龙的动向格外引人关注。这个唯一不走寻常路的高冷巨兽，在传出“被出售”的传闻时，比任何迹象都能证明：外资零售商黄金一代落幕了。高冷巨兽麦德龙，因为其特立独行的“店大拒客”作风，在外资零售商中，无疑是最值得“说道说道”的。首先，会员制，是麦德龙的瞩目标志。就在很多年前老沈被麦德龙拒之门外、随后又被通知能办理公司会员卡进入购物的这背后，正是麦德龙从B端到C端的转变。从麦德龙进入中国开始，就严格控制会员数量，只有申请加入并拥有会员证的顾客才能进场消费，且主要针对企业用户及中高端客群。后来，这一举措被证明在中国“水土不服”。C端用户才是消费主力军，麦德龙随后放开了个人会员注册，但此时，它又遇到了一个问题：C端不买账。这和麦德龙独一无二的仓储式超市业态有关。所谓仓储式超市，就是将超市和仓储合二为一了，省掉了传统零售企业独立的仓库和配送中心。也因此，人们提到麦德龙，最直观的印象就一个字：大！麦德龙营业面积一般为1.5万-2万平方米，通常设立在大城市城乡结合部的高速公路或主干道附近。货架之间的距离有两米，和普通超市人挤人的景象形成天壤之别！然而，成也“大”，败也“大”，麦德龙因为运营需要而独特的选址，让众多C端用户不得不开车去高速公路或主干道附近购物，非常不方便，无形中遏制了诸多消费力。其次，中国消费升级力量的崛起，以及新的“狼来了”，令麦德龙措手不及！庞大的品类、优势的价格、新颖的模式，曾经是麦德龙在刚进入中国市场的那几年扶摇直上的原因。其中，品类成为了吸引中国消费者的最大法宝。举例来说，仅食品品类就高达17000种以上，非食品类更是超过30000种以上！拿老沈的体验来说，当年我们那城乡结合部，网购还没有兴起，专卖国外品牌的商超基本没有，唯独只有麦德龙，陈列着全球各地的产品。可以说，这是一个黄金卖方市场，我不选你，根本没有其他选择。但麦德龙没有料到的是，狼，已经来了。更令麦德龙没有想到的是，这群狼，并不是曾经在商超领域从“炮弹战打到肉搏战”的家乐福等一众老对手，而是根本没有想过的：掀起新零售革命的互联网巨头。互联网巨头掀起的新零售革命，将全球商品一夜之间搬到了中国消费者面前。以往你还要开车去麦德龙买国外商品？现在不用了！出门走两步，马云的盒马鲜生就在眼前，或者上个网，任君选择，不仅物美还价廉。曾经，一个人拿着会员卡说“我去麦德龙买到了国外的什么什么……”是一种荣耀，如今，会这样说的人已经很少了。麦德龙的业绩也证明了这一点。2008年，麦德龙营收实现历史最好的655.29亿欧元，2017年，营收已跌至213亿欧元，足足跌去了三分之二。中国业务的疲软，加速了其不理想的生存状态。所谓跨界消灭，就是你战胜了所有对手，却败给了时代。跨界的力量麦德龙，曾经让中国消费者见识到了德国式的谨慎风格。不盲目扩张，不迎合C端消费者，不乱发小广告。2013年，麦德龙才开了63家店，同期的家乐福已达236家，沃尔玛更是超过了400家。至今为止，麦德龙在中国也仅仅只有95家门店。麦德龙的理念是，要认真经营，就要做到极致。所以在麦德龙购物时，从来不会有普通商超那样的推销员拉住你推销产品，也从来不会有传统商超铺天盖地那样的“大促销！疯抢一天！只要9毛9！”的狗皮膏药小广告。可以说，麦德龙的购物体验无疑值得在中国零售史上书写一笔，但世界的残酷就在于，你认真，市场未必会买账。“我消灭你，与你无关。”这就是跨界“打劫”的生存法则。江湖已经不是曾经的那个江湖，中国本土企业经历了懵懂、学习、赶超之后，如今，开始引领新的时代！在“麦德龙们”式微的今天，也许唯一不变的只有那句：凡是过去，皆为序章。全国各地的朋友们，您的购物体验里有对麦德龙的印象吗？（来源：财经早餐的财富号 2019-03-22 06:08） [点击查看原文]<span id=""show_stock_str"" ></span>",它曾经“店大拒客”
