,time,author,comment,header
43,06月26日 ,青海股友,编者注：今年美股IPO的电商概念火热，宠物电商Chewy和轻奢时尚电商Revolve的IPO表现都非常好。继这两家公司之后，奢侈品电商The RealReal将在本周五上市，本文作者Luis Sanchez，为您带来公司的业绩分析和IPO展望。编译：达里奥The RealReal是一个在线奢侈品交易平台，经营模式类似于eBay，但品类仅限包、手表、珠宝和艺术品等高端时尚产品。The RealReal在八年前成立，很早就被私募融资市场视为独角兽。公司将在6月28日上市，预计通过IPO融资2.7亿美元。经营模式：鉴定能力是护城河The RealReal是一家平台型电商，卖家需要先将商品邮寄到公司，由公司进行检查和评估，通过之后再发货给买家，每笔交易平均要抽取35%的佣金。公司的交易平台The RealReal网站字面意思是“真真网”，这个简单粗暴的名字可能就是针对奢侈品交易的核心问题：假货，为此公司聘请将近200名专家来鉴定奢侈品。此前eBay的奢侈品业务就因为假货泛滥，导致购物体验非常差，而亚马逊等大型电商想要在奢侈品方面与The RealReal竞争，也得重新建立类似的专家鉴定团队。所以强大的鉴定能力已经成为The RealReal的护城河，一路推动公司成为美国最大的奢侈品交易平台。资料来源：iTunes，华盛证券近期业绩：在亏损中增长和很多美股独角兽一样，The RealReal业绩保持快速增长，但一直在亏钱。2018年公司销售额同比增长54.9％，今年一季度销售额增长49.1%，出现放缓。但从毛利润来看，2017、2018以及今年的一季度，毛利润同比增长均超过60%。对于一支成长股来说，这种业绩增速吸引力很大。尽管营收大幅增长，但公司每年都在亏损，所以这种模式能否持续也是未来面临的主要问题。现在公司持有大量现金，还将通过IPO募集更多现金，但一段时间之后，市场会更期望看到公司开始赚钱。实际上，美股IPO市场亏损是普遍现象，截止目前，2019年的很多大型IPO都是未盈利的公司，只有Zoom是例外。只要上市公司能在其业务中建立长期价值，盈利与否不会影响IPO的表现。The RealReal的主要问题仍是实现盈利的时间点。而从数据来看，公司平台活跃买家和GMV（成交总额）仍保持快速增长，至少公司服务的市场是非常健康的。IPO展望：电商概念会再出惊喜么？今年美股IPO中，电商概念的成长股都有非常好的表现，宠物电商Chewy上市首日大涨59%，轻奢电商Revolve上市首日大涨近89%，远远超过优步、Lyft等关注度更高的大型IPO。和前两家公司相比，The RealReal的缺点在于它的亏损幅度是三家电商中最高，EBITDA利润率为-29％。The RealReal的主要优势在于，它在一个服务不足的市场提供有价值的服务，并已经建立起值得信任的品牌形象，从而形成对竞争者的优势。目前公司的估值为17亿美元左右，去年收入刚过2亿美元，市销率达到8.5倍，但对于公司50%的营收增速来说可以接受。笔者认为，投资者需要考虑未来几个季度的公司业绩，如果业绩增长减速且未能扭转亏损，表明业务可能陷入困境；如果业绩增长稳定甚至加速，而亏损没有扩大，则说明公司管理层掌握了可靠的盈利途径。本文来源于新浪，如需转载，请注明出处！（来源：华盛通的财富号 2019-06-26 11:16） [点击查看原文],The RealReal：美股电商概念会再出惊喜么？
45,06月25日 ,吉林股友,"本文由“萝卜投研”团队制作并首发主要指数新闻评分走势截至昨日, 创业板新闻评分在四大指数中最高。从趋势上来看各大指数新闻评分均有所上升。行业新闻评分分行业来看, 通信、非银金融、家用电器行业隔夜新闻评分最高, 汽车、休闲服务、轻工制造行业近三月新闻评分最高。个股新闻评分昨日隔夜新闻评分方面, <span class=""showStock"" id=""stock_sh603619"">中曼石油</span><span id=""quote_sh603619""></span>、<span class=""showStock"" id=""stock_sh603183"">建研院</span><span id=""quote_sh603183""></span>、<span class=""showStock"" id=""stock_sz300436"">广生堂</span><span id=""quote_sz300436""></span>新闻评分最高, <span class=""showStock"" id=""stock_sh601933"">永辉超市</span><span id=""quote_sh601933""></span>、<span class=""showStock"" id=""stock_sh601877"">正泰电器</span><span id=""quote_sh601877""></span>、<span class=""showStock"" id=""stock_sz002157"">正邦科技</span><span id=""quote_sz002157""></span>最低。近三个月新闻评分<span class=""showStock"" id=""stock_sh603801"">志邦家居</span><span id=""quote_sh603801""></span>、<span class=""showStock"" id=""stock_sz000759"">中百集团</span><span id=""quote_sz000759""></span>、<span class=""showStock"" id=""stock_sz300607"">拓斯达</span><span id=""quote_sz300607""></span>最高, <span class=""showStock"" id=""stock_sh600816"">安信信托</span><span id=""quote_sh600816""></span>、<span class=""showStock"" id=""stock_sh600748"">上实发展</span><span id=""quote_sh600748""></span>、<span class=""showStock"" id=""stock_sz300709"">精研科技</span><span id=""quote_sz300709""></span>最低。（来源：萝卜投研的财富号 2019-06-25 10:19） [点击查看原文]<span id=""show_stock_str"" ></span>",6.25 舆情线索：今日新闻评分最高和最低的十只股票名单
46,06月24日 ,青海股友,记者 时代财经时代财经 6月24日讯，今日下午，永辉超市发布“关于终止拟对外投资的公告”，公告称，于2018年1月，公司与腾讯就对Carrefour China Holdings NV的或有投资与Carrefour SA 达成股权投资意向书。自筹划本次对外投资事项以来，公司与合作伙伴积极和交易对方就相关事项进行了谈判。根据目前市场环境，综合考虑各方面相关因素，为维护上市公司及全体股东利益，公司决定终止本次对外投资的谈判。公司终止本次对外投资不会对公司财务状况和经营状况产生影响。23日下午，苏宁易购发布公告称，苏宁全资子公司苏宁国际拟出资48亿元收购家乐福中国80%的股份。也就是说，一年多过去，家乐福最终选择倒向了苏宁易购，永辉和腾讯也只好“放手”。今日收盘，永辉超市跌0.67%报10.43元，苏宁易购涨3.29%报11.62元，而家乐福在巴黎涨1.85%。（来源：时代财经TF的财富号 2019-06-24 16:21） [点击查看原文],永辉超市：终止拟投资家乐福中国的谈判
48,06月20日 ,重庆股友,"内容来源：《<span class=""showStock"" id=""stock_sh601933"">永辉超市</span><span id=""quote_sh601933""></span>深度：回归零售本源，重返增长轨道》（首次覆盖）（报告始发于2019年6月10日）<span class=""showStock"" id=""stock_sh600109"">国金证券</span><span id=""quote_sh600109""></span>研究所消费升级与娱乐研究中心新零售团队2018年12月永辉剥离云创，同时以探索Mini社区店的方式宣告其回归超市主业。互联网巨头们线上结合线下的新零售门店虽然一时风头无两，但也面临着如何规模化复制门店以及进一步下沉的难题。也许是时候去认真思考究竟什么才是“新零售”了。（点击查看大图）如需进一步了解，欢迎联系对应销售内容来源：《<span class=""showStock"" id=""stock_sh601933"">永辉超市</span><span id=""quote_sh601933""></span>深度：回归零售本源，重返增长轨道》（首次覆盖）<span class=""showStock"" id=""stock_sh600109"">国金证券</span><span id=""quote_sh600109""></span>2019年度投资策略QDII基金 | 私募基金 | 权益基金 | 固收基金<span class=""showStock"" id=""stock_sz300024"">机器人</span><span id=""quote_sz300024""></span> | 军工 | 机械 | 电子 | 通信 | 医药 | 宏观半导体 | 交运 | 建筑 | 环保 | 旅游 | 食饮 | 固收大化工 | 轻工 | 纺服 | 家电 | 教育 | 光伏 | 策略 传媒与互联网 | 汽车上游 | 电力设备 | 新能源车点一下，“好”观点一起“看”（来源：国金研究的财富号 2019-06-16 09:00） [点击查看原文]<span id=""show_stock_str"" ></span>",国金# 永辉超市 | 公司精要360 | 第36期
51,06月18日 ,重庆股友,"内容来源：《<span class=""showStock"" id=""stock_sh601933"">永辉超市</span><span id=""quote_sh601933""></span>深度：回归零售本源，重返增长轨道》（首次覆盖）（报告始发于2019年6月10日）<span class=""showStock"" id=""stock_sh600109"">国金证券</span><span id=""quote_sh600109""></span>研究所消费升级与娱乐研究中心新零售团队2018年12月永辉剥离云创，同时以探索Mini社区店的方式宣告其回归超市主业。互联网巨头们线上结合线下的新零售门店虽然一时风头无两，但也面临着如何规模化复制门店以及进一步下沉的难题。也许是时候去认真思考究竟什么才是“新零售”了。（点击查看大图）点一下，“好”观点一起“看”（来源：国金研究的财富号 2019-06-16 09:00） [点击查看原文]<span id=""show_stock_str"" ></span>",国金# 永辉超市 | 公司精要360 | 第36期
52,06月18日 ,青海股友,"图片来源：网络，如有侵权请联系删除 剥离了超级物种和永辉生活之后，回归主业的<span class=""showStock"" id=""stock_sh601933"">永辉超市</span><span id=""quote_sh601933""></span>调整还在继续。 日前，<span class=""showStock"" id=""stock_sh601933"">永辉超市</span><span id=""quote_sh601933""></span>发布公告称，因公司发展需要，拟聘任李国为<span class=""showStock"" id=""stock_sh601933"">永辉超市</span><span id=""quote_sh601933""></span>总裁，聘任吴光旺为执行副总裁，聘任吴莉敏、曾凤荣、杨李为公司副总裁。这是<span class=""showStock"" id=""stock_sh601933"">永辉超市</span><span id=""quote_sh601933""></span>半年内第二次人事调整，去年12月永辉创始人张轩松和张轩宁兄弟“分家”，同期，<span class=""showStock"" id=""stock_sh601933"">永辉超市</span><span id=""quote_sh601933""></span>进行一次管理层架构调整，李国被提拔为执行副总裁。 “李国的‘转正’说明<span class=""showStock"" id=""stock_sh601933"">永辉超市</span><span id=""quote_sh601933""></span>运营已进入了较为稳定的职业管理人主导的阶段，永辉将回归主业。同时，也说明永辉mini将是永辉较为重要的战略之一。”资深零售业观察人士、灵兽传媒创始人兼CEO陈岳峰告诉时代财经。 在他看来，由主导永辉mini的李国来执行mini的拓展契合度更高。然而，对于回归主业的<span class=""showStock"" id=""stock_sh601933"">永辉超市</span><span id=""quote_sh601933""></span>而言，无论是对内拓展的小业态mini超市还是对外协同的商超业务，探索期都还很长且充满挑战。 李国“转正”，回归主业 <span class=""showStock"" id=""stock_sh601933"">永辉超市</span><span id=""quote_sh601933""></span>公告显示，李国出生于1978年，2001年8月加入永辉，历任福建<span class=""showStock"" id=""stock_sh601933"">永辉超市</span><span id=""quote_sh601933""></span>黎明店防损部员工、永辉集团黎明店行政办公室主任、重庆<span class=""showStock"" id=""stock_sh601933"">永辉超市</span><span id=""quote_sh601933""></span>总经理、<span class=""showStock"" id=""stock_sh601933"">永辉超市</span><span id=""quote_sh601933""></span>华西大区总经理等职。 2018年11月，<span class=""showStock"" id=""stock_sh601933"">永辉超市</span><span id=""quote_sh601933""></span>进行管理层架构调整，李国被任命为<span class=""showStock"" id=""stock_sh601933"">永辉超市</span><span id=""quote_sh601933""></span>执行副总裁兼云超总裁，云超一、二集群进行合并管理。 随后，在2019年，<span class=""showStock"" id=""stock_sh601933"">永辉超市</span><span id=""quote_sh601933""></span>重启了2018年被搁浅的“千店计划”，其中，李国主导了永辉的新业态mini店，并在福州、成都、重庆等地试点。 仅仅半年后，李国的职位提升为执行总裁。对此，陈岳峰向时代财经分析称，一方面是<span class=""showStock"" id=""stock_sh601933"">永辉超市</span><span id=""quote_sh601933""></span>对李国个人业务能力的认可，另一方面是李国承担着永辉未来业务重点――小型门店业务“mini”的拓展任务。 新零售专家鲍跃忠也表示，“张氏兄弟‘分家’后，张轩松更多的精力放在资本管理上，李国则是业务执行，带领团队实施业务落地。” <span class=""showStock"" id=""stock_sh601933"">永辉超市</span><span id=""quote_sh601933""></span>的管理层变动，也与其近半年的一系列业务调整有关。 2018年12月，<span class=""showStock"" id=""stock_sh601933"">永辉超市</span><span id=""quote_sh601933""></span>公告称，<span class=""showStock"" id=""stock_sh601933"">永辉超市</span><span id=""quote_sh601933""></span>以3.94亿元（人民币，下同）的价格，将其持有的永辉云创20%的股权转让给张轩宁，转让后张轩宁持有永辉云创股权由9.6%增至29.6%，成为永辉云创第一大股东。这意味着，云创业务将不再计入合并报表范围。 对此，<span class=""showStock"" id=""stock_sh601933"">永辉超市</span><span id=""quote_sh601933""></span>解释称，永辉云创原定位于为<span class=""showStock"" id=""stock_sh601933"">永辉超市</span><span id=""quote_sh601933""></span>提供创新探索和服务，但目前永辉云创因独立经营零售业务而产生较大经营亏损，因此有必要调整永辉云创的控制权，既可降低<span class=""showStock"" id=""stock_sh601933"">永辉超市</span><span id=""quote_sh601933""></span>的运营成本与经营风险，又可以对永辉云创的实际控制人及经营团队形成相应激励。 <span class=""showStock"" id=""stock_sz002736"">国信证券</span><span id=""quote_sz002736""></span>报告也称，这有利于短期减少云创业务对<span class=""showStock"" id=""stock_sh601933"">永辉超市</span><span id=""quote_sh601933""></span>业绩的拖累，2018年前三个季度，云超、永辉生活和超级物种分别新开70、222和29家店，云创亏损额达6.12亿元，按照其46.6%股份比例计算，影响公司利润2.85亿元。 <span class=""showStock"" id=""stock_sh601933"">永辉超市</span><span id=""quote_sh601933""></span>剥离云创业务即“超级物种”以及“永辉生活”，被业界认为是“割肉止血”。事实也是如此，剥离了永辉云创后，<span class=""showStock"" id=""stock_sh601933"">永辉超市</span><span id=""quote_sh601933""></span>2019年一季度业绩表现有所回暖。财报显示，在报告期内，<span class=""showStock"" id=""stock_sh601933"">永辉超市</span><span id=""quote_sh601933""></span>营收222.36亿元，同比增长18.48%；净利润11.24亿元，同比增长50.28%。 在云创剥离后，<span class=""showStock"" id=""stock_sh601933"">永辉超市</span><span id=""quote_sh601933""></span>也进行了战略调整，即回归主营大卖场业务，探索小型业态。“2019年<span class=""showStock"" id=""stock_sh601933"">永辉超市</span><span id=""quote_sh601933""></span>将新开150家大卖场，同时探索小型店和mini店，找一些战略协同的业务。”永辉创始人张轩松在2018年底的临时股东大会上表示。在业务调整后，<span class=""showStock"" id=""stock_sh601933"">永辉超市</span><span id=""quote_sh601933""></span>的“老将”李国自然也成为了永辉探索小型店和mini店的主力。 对内拓展，对外协同 在提出“要以更小型化的永辉mini下沉社区”之后，永辉mini几乎是以“1天1店”的速度向外拓展。据<span class=""showStock"" id=""stock_sh601933"">永辉超市</span><span id=""quote_sh601933""></span>2019年第一季度财报显示，一季度<span class=""showStock"" id=""stock_sh601933"">永辉超市</span><span id=""quote_sh601933""></span>进入19个省市市场，新开mini店93家，签约146家，总计239家。永辉方面透露，今年mini店将开至上千家。永辉希望实现1000家大卖场＋1000家Mini店的“一搭一”、大店带小店，点点连成片的战略布局。 而与<span class=""showStock"" id=""stock_sh601933"">永辉超市</span><span id=""quote_sh601933""></span>和超级物种定位于商圈不同，mini店定位在于社区生鲜，门店内水果、散装蔬菜主打，水产活鲜、肉禽蛋，生鲜占比超过50%，散装干货、日杂用品等日常生活共存。 永辉mini店的商品和布局更像是传统大卖场的缩小版。新零售专家鲍跃忠告诉时代财经，永辉mini实际上是<span class=""showStock"" id=""stock_sh601933"">永辉超市</span><span id=""quote_sh601933""></span>的回归。“早前<span class=""showStock"" id=""stock_sh601933"">永辉超市</span><span id=""quote_sh601933""></span>就是以几百平到上千平的生鲜超市为主的。如今永辉mini只是面积变小了，别的没有太多的创新，这种业态能否成功还是未知数。” 从目前的情况来看，永辉Mini店的发展成效还未显现，企业间竞争也颇为激烈。在当前社区生鲜赛道，谊品生鲜、生鲜传奇、钱大妈、地利生鲜等社区生鲜店，或已在区域市场做出规模影响力，或开始全国性复制，或在供应链上创出了价值玩法。永辉mini想要“弯道超车”的几率较小。 除此之外，一些无品牌的个体经营者所开得生鲜超市也早已扎根在社区之中。 廖女士居住在广州天河盈彩美居小区，在小区的外围，至少有3间面积2000平以上的社区生鲜超市，社区内还有钱大妈、谊品生鲜以及多家个体经营小超市，并且这些小超市不仅提供种类繁多的日常用品，而且也提供生鲜与熟食。 “相比于个体经营小超市，永辉mini乃至盒马的新业态超市生鲜品类上和供应链上优势较为明显，但成本也略高。”陈岳峰说。 在成本之外，RET睿意德策略顾问部总经理周雷亚认为，社区生鲜超市首先应做到“知己知彼”。企业首要需了解自身覆盖社区居民的消费特征以及核心需求，从而做好匹配工作；然后再思考“生活场景”。超市的运营不仅是停留在搜集客群的需求特征，更应当结合消费者的生活场景，在业态方面对其进行深化。这点，较早入局的企业更具竞争力。因此，在社区生鲜这条路上，刚刚启动的永辉mini探索期还很长。 值得注意的是，与永辉mini一样，<span class=""showStock"" id=""stock_sh601933"">永辉超市</span><span id=""quote_sh601933""></span>的对外协同业务也才刚刚起步。2018年10月，<span class=""showStock"" id=""stock_sh601933"">永辉超市</span><span id=""quote_sh601933""></span>、屈臣氏集团和腾讯宣布成立合营公司。2019年6月15日，由三方主导的“百佳永辉Bravo”超市落地广州花都区。据百佳永辉董事长兼总经理林立权透露，未来，百佳永辉将专注发展大湾区市场，除原有的80家门店外，计划在2019年内新开13家大店及新业务mini店拓展，将以“百佳永辉Bravo”以及“百佳永辉TASTE”双品牌营运。（来源：时代财经TF的财富号 2019-06-18 16:53） [点击查看原文]<span id=""show_stock_str"" ></span>",永辉超市高层半年两调整的背后：主业回归
54,06月17日 ,吉林股友,"一套高端住宅是人们所追求的品质居所,同时被定义为财富和身份地位的象征。拥有一套属于自己的房子，是大多数人一生为之奋斗的目标。人生最高难度的事莫过于""选择""，毕竟买房是人生大事，选对养三代，选错悔终生。那么，什么样的房子是理想中的归宿呢？你是渴望远离都市，拥抱自然的一隅天地？还是愿在钢筋水泥包围的城市里，贪享都市的繁华？亦或是向往隐于都市，融于山水且繁华与静谧共存的生态美宅？其实选房子，综合实力很重要！交通贯穿市区，通勤更方便随着土地资源越发稀缺，大城市的中心位置土地出让越来越少，水晶中央位于龙岩大道和莲西路的交汇处，占据龙岩城市核心地区，是衔接新城与旧城之间的新门户。交通路线通达全城，贯穿城区南北，汽车站、火车站近在咫尺。扼守繁华地段，周边医教配套齐全如果你想要追求繁华的现代都市生活，水晶中央通通都能满足你。龙岩目前最大最热闹的两个商业广场――万宝广场和万阳<span class=""showStock"" id=""stock_sh600306"">商业城</span><span id=""quote_sh600306""></span>，就在水晶中央的东面和北面，拥有大润发、<span class=""showStock"" id=""stock_sh601933"">永辉超市</span><span id=""quote_sh601933""></span>、美食城、高档百货、KTV、电影院、休闲类等超级商业矩阵，足以满足业主日常娱乐所需，周末闲暇，购物游玩十分方便。如果你考虑到孩子的上学问题，这一点不用担心，水晶中央周边的学校从幼儿园到高中都能满足，师资力量和口碑在新罗区赫赫有名，强大的教育资源，使这片土地欣欣向荣。同时，水晶中央毗邻市政府、行政中心、金融中心和商务板块，可以看到商业中心、学校、医院、公园等配套均围绕水晶中央呈环状分布，区域价值不可限量。极致园林景观，打造人居范本不出小区而获山水之乐，身居闹市而得林泉之趣。水晶中央采用新古典主义风格，将现代的精致简约与古典的尊贵感完美结合在一起，在市中心的钢铁丛林中，水晶中央就像一块宝石散发出独有的风采。其中，水晶中央的园林景观设计，秉承水晶系一贯以人为本的理念，强调置身其中的高品位泛欧式生活态度，并以此为延伸打造了以""雅、文、翠、逸、清""五字为主题的五大主题景观，凸显了居民身份的与众不同与典雅大气。如今，龙岩城市骨架向外延伸的趋势，使主城区的住宅用地日渐稀缺。而水晶中央如同一颗冉冉升起的星光，凝集无限璀璨的城心之作，为峰层人士提供了尊贵奢华的塔尖生活。（来源：置业有方的财富号 2019-06-17 16:17） [点击查看原文]<span id=""show_stock_str"" ></span>",买房是人生大事
55,06月17日 ,青海股友,永辉，为什么现在你们超市里的价格都要比别的超市贵。今日牌冰糖燕窝，8瓶装，你们卖298，沃尔玛卖268，可爱多魔道祖师系列甜筒，你们卖29.9一盒，沃尔玛卖19.9一盒，买两盒还减10元。花王纸尿裤nb装90片的，你们卖110，家乐福卖89。你们很多产品都要比别的超市贵20左右，请问是你们的供应链出问题了吗，采购价比别家贵，还是把消费者当傻子？,永辉，为什么现在你们超市里的价格都要比别的超市贵
